document_id,most_prevalent_topic_id,most_prevalent_topic_probability,text_excerpt,state,school type,grade,year,subject
87,5,0.9470495298522773,"gegenwärtigen Standortes und so die Möglichkeit zu seiner kritischen Überprüfung erkennen. Sie sehen die Bedingtheit menschlicher Existenz und reflektieren Möglichkeiten zur Identifikation mit historischen Personen. Hierbei wächst Ihre Fähigkeit zur Empathie, zum Nachvollzug fremder Perspektiven sowie zur kritischen Distanz. Die Schülerinnen und Schülern gewinnen ein differenziertes Verständnis der politischen Realität sowie ihrer sozialen, rechtlichen und ökonomischen Bedingungen. Von besonderer Motivationskraft sind",MeckPomm,Gym,Sek2,2019.0,Geschichte
88,4,0.5435576758238353,"Denken im strukturierten und kompetenzorientierten Schulfach Geschichte fördert in der Sekundarstufe II ein individuelles, reflektiertes Geschichtsbewusstsein mit seinen sämtlichen Teildimensionen Raum/Zeit, Wirklichkeit, Historizität, Identität, Politik, Ökonomie/Soziales, Moral - und schließt Empathie/ Emotionalität mit ein. Historisches Lernen und Denken umfasst die Mehrdimensionalität von Geschichte mit ihren aktuellen Perspektiven wie z. B. Kultur-, Alltags-, Mentalitäts-, Medien-, Gender- oder Umweltgeschichte ebenso wie Multiperspektivität. Es",Saarland,Gym,Sek2,2023.0,Geschichte
89,4,0.5789350544278618,"im strukturierten und kompetenzorientierten Schulfach Geschichte fördert in der Sekundarstufe II ein individuelles, reflektiertes Geschichtsbewusstsein mit seinen sämtlichen Teildimensionen - Raum/Zeit, Wirklichkeit, Historizität, Identität, Politik, Ökonomie/Soziales, Moral - und schließt Empathie/Emotionalität mit ein. Historisches Lernen und Denken umfasst die Mehrdimensionalität von Geschichte mit ihren aktuellen Perspektiven wie z. B. Kultur-, Alltags-, Mentalitäts-, Medien-, Gender- oder Umweltgeschichte ebenso wie Multiperspektivität. Es führt",Saarland,Gym,Sek2,2016.0,Geschichte
90,1,0.4199881113101447,"einer mittelalterlichen Stadt virtueller Rundgang Bevölkerungsstruktur und Alltag Stadtluft macht frei nach Jahr und Tag. Zunft, Gilde, Minderheiten, Kampf um Stadtherrschaft, Rechte der Stadtbürger Rollenspiel KU, Kl. , LB Sozialkompetenz: Empathie Städtebünde und ihre Bedeutung Handelsbeziehungen früher, Städtepartnerschaften heute digitale Medienangebote nutzen Differenzierung: Hansestadt, Reichsstadt, Freie Stadt Beherrschen der Arbeit mit traditionellen und digitalen Geschichtskarten Methodenkompetenz Q g p Mittelalter Ustd.",Sachsen,Oberschule,,2019.0,Geschichte
91,9,0.9653836181133528,"lösen. Soziale Kompetenzen sind erforderlich, um mit anderen Menschen angemessen umgehen und zusammenarbeiten zu können. Dazu zählen die Fähigkeiten, erfolgreich zu kooperieren, sich in Konflikten konstruktiv zu verhalten sowie Toleranz, Empathie und Respekt gegenüber anderen zu zeigen. Die in der nachfolgenden Tabelle genannten überfachlichen Kompetenzen sind jahrgangsübergreifend zu verstehen, d.h., sie werden anders als die fachlichen Kompetenzen in den Rahmenplänen nicht",Hamburg,,"5,6",2023.0,Bio
92,1,0.9727267903498346,"Konzentrationsbereitschaft. Sozialkompetenz Soziale Wahrnehmungsfähigkeit: Die Lernenden nehmen unterschiedliche Bedürfnisse, Emotionen, Überzeugungen sowie Interpretationen sozialer Realität in Beziehungen Partner, Gruppen, größere Gemeinschaften, Gesellschaften wahr. Sie versetzen sich in die Lage anderer Empathie, Perspektivenübernahme, erfassen und reflektieren den Stellenwert ihres eigenen Handelns. Rücksichtnahme und Solidarität: Die Lernenden respektieren die Meinungen und Verhaltensweisen anderer, sie sind aufmerksam gegenüber ihren Interaktionspartnern, nehmen Anteil an deren",Hessen,Gym,Sek1,2024.0,Bio
93,7,0.924985132649643,"zur Selbst- und Mitbestimmung sowie die Fähigkeit zur Partizipation zugeordnet werden können, leistet der Biologieunterricht einen Beitrag zur Erweiterung der Kommunikationskompetenz, indem er Haltungen fördert, die durch Kooperation, Dialogbereitschaft und Empathie gekennzeichnet sind. Die an Kommunikation gebundene Auseinandersetzung mit der Lebenswirklichkeit zielt hier auf das Erfassen und Vermitteln biologischer Sachverhalte sowie auf die Reflexion von Interessen und Verwendungszusammenhängen und ermöglicht damit",Hessen,Gym,Sek1,2024.0,Bio
94,9,0.9653836181133528,"lösen. Soziale Kompetenzen sind erforderlich, um mit anderen Menschen angemessen umgehen und zusammenarbeiten zu können. Dazu zählen die Fähigkeiten, erfolgreich zu kooperieren, sich in Konflikten konstruktiv zu verhalten sowie Toleranz, Empathie und Respekt gegenüber anderen zu zeigen. Die in der nachfolgenden Tabelle genannten überfachlichen Kompetenzen sind jahrgangsübergreifend zu verstehen, d. h., sie werden anders als die fachlichen Kompetenzen in den Rahmenplänen",Hamburg,Stadtteilschule,5-11,2024.0,Bio
95,9,0.9653836181133528,"lösen. Soziale Kompetenzen sind erforderlich, um mit anderen Menschen angemessen umgehen und zusammenarbeiten zu können. Dazu zählen die Fähigkeiten, erfolgreich zu kooperieren, sich in Konflikten konstruktiv zu verhalten sowie Toleranz, Empathie und Respekt gegenüber anderen zu zeigen. Die in der nachfolgenden Tabelle genannten überfachlichen Kompetenzen sind jahrgangsübergreifend zu verstehen, d. h., sie werden anders als die fachlichen Kompetenzen in den Rahmenplänen",Hamburg,Gym,Sek1,2024.0,Bio
96,7,0.9499961145254942,"ihnen kulturelle und gesellschaftliche Orientierung und ermuntert sie dazu, eigenständig zu denken und vermeintliche Gewissheiten, kulturelle Wertorientierungen und gesellschaftliche Strukturen auch kritisch zu überdenken. Unterricht trägt dazu bei, Bereitschaft zur Empathie zu entwickeln, und fördert die Fähigkeit, die eigenen Überzeugungen und das eigene Weltbild in Frage zu stellen. Er unterstützt die Schülerinnen und Schüler dabei, Unsicherheiten auszuhalten und Selbstvertrauen zu erwerben.",Schleswig-Holstein,,Sek1,2019.0,Bio
97,1,0.9727267903498346,"Konzentrationsbereitschaft. Sozialkompetenz Soziale Wahrnehmungsfähigkeit: Die Lernenden nehmen unterschiedliche Bedürfnisse, Emotionen, Überzeugungen sowie Interpretationen sozialer Realität in Beziehungen Partner, Gruppen, größere Gemeinschaften, Gesellschaften wahr. Sie versetzen sich in die Lage anderer Empathie, Perspektivenübernahme, erfassen und reflektieren den Stellenwert ihres eigenen Handelns. Rücksichtnahme und Solidarität: Die Lernenden respektieren die Meinungen und Verhaltensweisen anderer, sie sind aufmerksam gegenüber ihren Interaktionspartnern, nehmen Anteil an deren",Hessen,Realschule,,2024.0,Bio
98,7,0.924985132649643,"zur Selbst- und Mitbestimmung sowie die Fähigkeit zur Partizipation zugeordnet werden können, leistet der Biologieunterricht einen Beitrag zur Erweiterung der Kommunikationskompetenz, indem er Haltungen fördert, die durch Kooperation, Dialogbereitschaft und Empathie gekennzeichnet sind. Die an Kommunikation gebundene Auseinandersetzung mit der Lebenswirklichkeit zielt hier auf das Erfassen und Vermitteln biologischer Sachverhalte sowie auf die Reflexion von Interessen und Verwendungszusammenhängen und ermöglicht damit",Hessen,Realschule,,2024.0,Bio
99,3,0.9689647202998173,"im interdisziplinären Arbeiten, bereiten sich auf den Umgang mit vielschichtigen und vielgestaltigen Problemen und Themen vor und lernen, mit Phänomenen mehrperspektivisch umzugehen. Interdisziplinarität, Mehrperspektivität Die Schüler entwickeln die Fähigkeit zu Empathie und Perspektivwechsel und lernen, sich für die Rechte und Bedürfnisse anderer einzusetzen. Sie lernen unterschiedliche Positionen und Wertvorstellungen kennen und setzen sich mit ihnen auseinander, um sowohl eigene Positionen einzunehmen",Sachsen,Gym,,2022.0,Bio
100,4,0.9653826125478496,"auseinander, um sowohl eigene Positionen einzunehmen als auch anderen gegenüber Toleranz zu entwickeln. Sie entwickeln interkulturelle Kompetenz, um offen zu sein, sich mit anderen zu verständigen und angemessen zu handeln. Empathie und Perspektivwechsel Die Schüler entwickeln eigene Wertvorstellungen auf der Grundlage der freiheitlichen demokratischen Grundordnung, indem sie Werte im schulischen Alltag erleben, kritisch reflektieren und diskutieren. Dazu gehören insbesondere Erfahrungen der",Sachsen,Gym,,2022.0,Bio
101,7,0.9181641757418301,"Diagnostik autosomal und gonosomal Hybridisierung Genmarker Polymerase-Ketten-Reaktion DNA-Sequenzierung Gelelektrophorese Kennen der Grundlagen der somatischen Gentherapie Transformationsmethoden, Vektoren Stammzellen, Embryonenschutzgesetz Sich positionieren zu Möglichkeiten und Risiken der Gentherapie am Menschen Präimplantationsdiagnostik Empathie und Perspektivwechsel Reflexions- und Diskursfähigkeit Lernbereich : Kommunikation zwischen Zellen Ustd. Anwenden von cytologischen und molekularen Kenntnissen auf die Immunbiologie EF Wechselwirkung, Information Organe des Immunsystems Verantwortungsbereitschaft unspezifische Immunreaktion Infektionsbarrieren,",Sachsen,Gym,,2022.0,Bio
102,7,0.9099969935300679,"Immunreaktion humoral, zellulär Nutzung digitaler Medien zur Visualisierung aktive und passive Immunisierung Infektionskrankheiten, Prophylaxe und Therapie von Infektionskrankheiten, Immungedächtnis, Impfungen Einfluss von Internet und von sozialen Medien auf die Impfbereitschaft Empathie und Perspektivwechsel Verantwortungsbereitschaft Anwenden der Kenntnisse über die Nervenzelle auf neurophysiologische Prozesse EF Struktur und Funktion, Information Nutzung digitaler Medien zur Visualisierung Neuron - Ruhe- und Aktionspotenzial Ionenverteilung, Membranpermeabilität Gk",Sachsen,Gym,,2022.0,Bio
103,7,0.9249832251254165,"Transduktion, Konjugation virale Vermehrungszyklen Transformations- und Transduktionsmethoden transgene Organismen, Vektoren somatische Gentherapie Stammzellenforschung Stammzellen, Embryonenschutzgesetz Sich positionieren zu Möglichkeiten und Risiken der Gentherapie am Menschen Präimplantationsdiagnostik Podiumsdiskussion Reflexions- und Diskursfähigkeit Empathie und Perspektivwechsel Lernbereich : Kommunikation zwischen Zellen Ustd. Anwenden von cytologischen und molekularen Kenntnissen auf die Immunbiologie EF Wechselwirkung, Information Organe des Immunsystems Verantwortungsbereitschaft unspezifische Immunreaktion Infektionsbarrieren, Phagocytose spezifische Immunreaktion",Sachsen,Gym,,2022.0,Bio
104,7,0.9099969935300679,"zellulär Nutzung digitaler Medien zur Visualisierung Infektionskrankheiten Hepatitis, AIDS, Tuberkulose Schutz vor Infektionen, Antibiotikaresistenz aktive und passive Immunisierung Immungedächtnis, Impfungen Einfluss von Internet und von sozialen Medien auf die Impfbereitschaft Empathie und Perspektivwechsel Medienbildung Verantwortungsbereitschaft unerwünschte Immunreaktion bei Transplantationen Gewebeunverträglichkeit ETH, Gk, LBW Anwenden der Kenntnisse über die Nervenzelle auf neurophysiologische Prozesse EF Struktur und Funktion, Information Nutzung digitaler Medien zur",Sachsen,Gym,,2022.0,Bio
105,1,0.9727267903498346,"Konzentrationsbereitschaft. Sozialkompetenz Soziale Wahrnehmungsfähigkeit: Die Lernenden nehmen unterschiedliche Bedürfnisse, Emotionen, Überzeugungen sowie Interpretationen sozialer Realität in Beziehungen Partner, Gruppen, größere Gemeinschaften, Gesellschaften wahr. Sie versetzen sich in die Lage anderer Empathie, Perspektivenübernahme, erfassen und reflektieren den Stellenwert ihres eigenen Handelns. Rücksichtnahme und Solidarität: Die Lernenden respektieren die Meinungen und Verhaltensweisen anderer, sie sind aufmerksam gegenüber ihren Interaktionspartnern, nehmen Anteil an deren",Hessen,Hauptschule,,2024.0,Bio
106,7,0.924985132649643,"zur Selbst- und Mitbestimmung sowie die Fähigkeit zur Partizipation zugeordnet werden können, leistet der Biologieunterricht einen Beitrag zur Erweiterung der Kommunikationskompetenz, indem er Haltungen fördert, die durch Kooperation, Dialogbereitschaft und Empathie gekennzeichnet sind. Die an Kommunikation gebundene Auseinandersetzung mit der Lebenswirklichkeit zielt hier auf das Erfassen und Vermitteln biologischer Sachverhalte sowie auf die Reflexion von Interessen und Verwendungszusammenhängen und ermöglicht damit",Hessen,Hauptschule,,2024.0,Bio
107,8,0.9790688276985161,"unterschiedlichen Sprachniveaus und Zeichensystemen ermöglichen. b Soziale Kompetenzen: sich verständigen und kooperieren; Verantwortung übernehmen und Rücksichtnahme praktizieren; im Team agieren; Konflikte aushalten, austragen und konstruktiv lösen; andere Perspektiven einnehmen; von Empathie geleitet handeln; sich durchsetzen; Toleranz üben; Zivilcourage zeigen: sich einmischen und in zentralen Fragen das Miteinander betreffend Stellung beziehen. Dazu gehören wertbewusste Haltungen: um Kategorien wie Respekt, Gerechtigkeit, Fairness, Kostbarkeit,",Hessen,Gym,Sek2,2024.0,Bio
108,9,0.9653836181133528,"lösen. Soziale Kompetenzen sind erforderlich, um mit anderen Menschen angemessen umgehen und zusammenarbeiten zu können. Dazu zählen die Fähigkeiten, erfolgreich zu kooperieren, sich in Konflikten konstruktiv zu verhalten sowie Toleranz, Empathie und Respekt gegenüber anderen zu zeigen. Die in der nachfolgenden Tabelle genannten überfachlichen Kompetenzen sind jahrgangsübergreifend zu verstehen, d. h., sie werden anders als die fachlichen Kompetenzen in den Rahmenplänen",Hamburg,Gym,Sek2,2022.0,Bio
109,7,0.3940433261985226,"traditioneller Bindungen, Sicht- und Verhaltensweisen haben einen großen Anteil an den Fragen des Schulfaches Psychologie. Als gesellschaftswissenschaftliches Fach trägt es zur Auseinandersetzung mit Ideologien bei, die das Zusammenleben bestimmen, befördert Empathie für Menschen in anderen Lebenslagen und diskutiert Fragen der Intervention und der Wertung von Entwicklungen des Einzelnen oder ganzer Gruppen in unserer Gesellschaft. Psychologie als Unterrichtsfach ist darauf gerichtet, insbesondere",Bremen,Gym,Sek2,2009.0,Psychologie
110,7,0.9526287585632164,"von allen Fächern zu erfüllenden Querschnittsaufgaben tragen insbesondere auch die Fächer des gesellschaftswissenschaftlichen Aufgabenfeldes im Rahmen der Entwicklung von Gestaltungskompetenz zur kritischen Reflexion geschlechter- und kulturstereotyper Zuordnungen, zur Werteerziehung, zur Empathie und Solidarität, zum Aufbau sozialer Verantwortung, zur Gestaltung einer demokratischen Gesellschaft, zur Sicherung der natürlichen Lebensgrundlagen, auch für kommende Generationen im Sinne einer nachhaltigen Entwicklung, und zur kulturellen Mitgestaltung bei.",NRW,Gym,Sek2,2014.0,Psychologie
111,9,0.6368322127549292,"der Versuchspersonen, unterscheiden informativen und normativen sozialen Einfluss mithilfe grundlegender Experimente, unterscheiden prosoziales Verhalten und Altruismus, erklären prosoziales Verhalten mit kognitiven und evolutionstheoretischen Modellen und Sachzusammenhängen, erläutern die Bedeutung der Empathie für altruistisches Verhalten, p g p Qi p analysieren situative Determinanten und kognitive Aspekte von Hilfeleistung anhand von Falldarstellungen und empirischen Untersuchungen, analysieren Feldexperimente kriterienorientiert, erläutern die drei Komponenten der",NRW,Gym,Sek2,2014.0,Psychologie
112,9,0.9653836181133528,"lösen. Soziale Kompetenzen sind erforderlich, um mit anderen Menschen angemessen umgehen und zusammenarbeiten zu können. Dazu zählen die Fähigkeiten, erfolgreich zu kooperieren, sich in Konflikten konstruktiv zu verhalten sowie Toleranz, Empathie und Respekt gegenüber anderen zu zeigen. Die in der nachfolgenden Tabelle genannten überfachlichen Kompetenzen sind jahrgangsübergreifend zu verstehen, d. h., sie werden anders als die fachlichen Kompetenzen in den Rahmenplänen",Hamburg,,Sek2,2024.0,Psychologie
113,7,0.774982002453624,"KVT nach Beck Depression o Teufelskreis der Angst von Margraf und Schneider Angststörung o typische Therapiebausteine z. B. Aktivitätsaufbau, Training sozialer Fertigkeiten, kognitive Umstrukturierung, Selbstmanagementtrainings Gesprächspsychotherapie von Tausch und Tausch Empathie, Wertschätzung, Kongruenz o Kommunikations- und Gesprächstechniken o Empathie-Techniken z. B. Paraphrasierung, VEE, VGW Psychopharmakotherapie z. B. Antidepressiva, Neuroleptika, Benzodiazepine, Nebenwirkungen Konkretisierung fachbezogener und fachübergreifender Anwendungsbezüge Paradigmen der Psychologie: Behaviorismus Kognitivismus",Hamburg,,Sek2,2024.0,Psychologie
114,7,0.7749861148470611,"von Margraf und Schneider Angststörung o typische Therapiebausteine z. B. Aktivitätsaufbau, Training sozialer Fertigkeiten, kognitive Umstrukturierung, Selbstmanagementtrainings Gesprächspsychotherapie von Tausch und Tausch Empathie, Wertschätzung, Kongruenz o Kommunikations- und Gesprächstechniken o Empathie-Techniken z. B. Paraphrasierung, VEE, VGW Psychopharmakotherapie z. B. Antidepressiva, Neuroleptika, Benzodiazepine, Nebenwirkungen Konkretisierung fachbezogener und fachübergreifender Anwendungsbezüge Paradigmen der Psychologie: Behaviorismus Kognitivismus Nur für eA: Tiefenpsychologie, Ganzheitspsychologie Alltagsbezüge: Rolle der",Hamburg,,Sek2,2024.0,Psychologie
115,9,0.9653836181133528,"lösen. Soziale Kompetenzen sind erforderlich, um mit anderen Menschen angemessen umgehen und zusammenarbeiten zu können. Dazu zählen die Fähigkeiten, erfolgreich zu kooperieren, sich in Konflikten konstruktiv zu verhalten sowie Toleranz, Empathie und Respekt gegenüber anderen zu zeigen. Die in der nachfolgenden Tabelle genannten überfachlichen Kompetenzen sind jahrgangsübergreifend zu verstehen, d. h., sie werden anders als die fachlichen Kompetenzen in den Rahmenplänen",Hamburg,,Sek1,2024.0,Psychologie
116,1,0.9727267903498346,"Konzentrationsbereitschaft. Sozialkompetenz Soziale Wahrnehmungsfähigkeit: Die Lernenden nehmen unterschiedliche Bedürfnisse, Emotionen, Überzeugungen sowie Interpretationen sozialer Realität in Beziehungen Partner, Gruppen, größere Gemeinschaften, Gesellschaften wahr. Sie versetzen sich in die Lage anderer Empathie, Perspektivenübernahme, erfassen und reflektieren den Stellenwert ihres eigenen Handelns. Rücksichtnahme und Solidarität: Die Lernenden respektieren die Meinungen und Verhaltensweisen anderer, sie sind aufmerksam gegenüber ihren Interaktionspartnern, nehmen Anteil an deren",Hessen,Hauptschule.pdf,,,Sozialkunde
117,6,0.9526297013420724,"Personen in ihren gesellschaftlichen Rollen analysieren, hinterfragen und schließlich beurteilen können. Das Fach grenzt sich von Positionen ab, die im Gegensatz zum Werte- und Grundkonsens des Grundgesetzes stehen. Dabei nimmt Empathie eine Schlüsselkompetenz ein, denn sie ermöglicht es, unter Wahrung der eigenen Identität Positionen anderer zu verstehen und zu tolerieren. Intelligentes Wissen über gesellschaftlichen Pluralismus und Individualisierung, soziale Strukturen und sozialen",Hessen,Hauptschule.pdf,,,Sozialkunde
118,9,0.9653836181133528,"lösen. Soziale Kompetenzen sind erforderlich, um mit anderen Menschen angemessen umgehen und zusammenarbeiten zu können. Dazu zählen die Fähigkeiten, erfolgreich zu kooperieren, sich in Konflikten konstruktiv zu verhalten sowie Toleranz, Empathie und Respekt gegenüber anderen zu zeigen. Die in der nachfolgenden Tabelle genannten überfachlichen Kompetenzen sind jahrgangsübergreifend zu verstehen, d. h., sie werden anders als die fachlichen Kompetenzen in den Rahmenplänen",Hamburg,Gym,Sek2,2024.0,Sozialkunde
119,9,0.9653836181133528,"lösen. Soziale Kompetenzen sind erforderlich, um mit anderen Menschen angemessen umgehen und zusammenarbeiten zu können. Dazu zählen die Fähigkeiten, erfolgreich zu kooperieren, sich in Konflikten konstruktiv zu verhalten sowie Toleranz, Empathie und Respekt gegenüber anderen zu zeigen. Die in der nachfolgenden Tabelle genannten überfachlichen Kompetenzen sind jahrgangsübergreifend zu verstehen, d. h., sie werden anders als die fachlichen Kompetenzen in den Rahmenplänen",Hamburg,Stadtteilschule,Sek1,2024.0,Sozialkunde
120,1,0.9727267903498346,"Konzentrationsbereitschaft. Sozialkompetenz Soziale Wahrnehmungsfähigkeit: Die Lernenden nehmen unterschiedliche Bedürfnisse, Emotionen, Überzeugungen sowie Interpretationen sozialer Realität in Beziehungen Partner, Gruppen, größere Gemeinschaften, Gesellschaften wahr. Sie versetzen sich in die Lage anderer Empathie, Perspektivenübernahme, erfassen und reflektieren den Stellenwert ihres eigenen Handelns. Rücksichtnahme und Solidarität: Die Lernenden respektieren die Meinungen und Verhaltensweisen anderer, sie sind aufmerksam gegenüber ihren Interaktionspartnern, nehmen Anteil an deren",Hessen,Realschule.pdf,,,Sozialkunde
121,6,0.9526297013420724,"Personen in ihren gesellschaftlichen Rollen analysieren, hinterfragen und schließlich beurteilen können. Das Fach grenzt sich von Positionen ab, die im Gegensatz zum Werte- und Grundkonsens des Grundgesetzes stehen. Dabei nimmt Empathie eine Schlüsselkompetenz ein, denn sie ermöglicht es, unter Wahrung der eigenen Identität Positionen anderer zu verstehen und zu tolerieren. Intelligentes Wissen über gesellschaftlichen Pluralismus und Individualisierung, soziale Strukturen und sozialen",Hessen,Realschule.pdf,,,Sozialkunde
122,8,0.45775030545169765,"Handlungskompetenz nach, indem sie ... mit anderen fair und gewaltfrei umgehen. mithilfe der sozialen Perspektivübernahme egozentrische Positionen überwinden und andere Mitmenschen und Positionen als gleichberechtigt wahrnehmen. sich für andere aus Mitgefühl, Gerechtigkeitsempfinden und sozialer Verantwortung einsetzen. die eigene Meinung sachlich-argumentativ und unter strategischen Überlegungen in Wort und Schrift darlegen. Kompromisse entwickeln und akzeptieren. unterschiedliche Sichtweisen und Lösungsansätze nebeneinander stehen lassen und",Niedersachsen,Oberschule,,2018.0,Sozialkunde
123,8,0.49176363323442496,"weisen im Unterricht ihre Handlungskompetenz nach, indem sie... mit anderen fair und gewaltfrei umgehen. mithilfe der sozialen Perspektivübernahme egozentrische Positionen überwinden und andere als gleichberechtigt wahrnehmen. sich für andere aus Mitgefühl, Gerechtigkeitsempfinden und sozialer Verantwortung einsetzen. die eigene Meinung sachlich-argumentativ und unter strategischen Überlegungen in Wort und Schrift darlegen. Kompromisse entwickeln und akzeptieren. unterschiedliche Sichtweisen und Lösungsansätze nebeneinander stehen lassen und",Niedersachsen,Realschule,,2015.0,Sozialkunde
124,8,0.9790688276985161,"unterschiedlichen Sprachniveaus und Zeichensystemen ermöglichen. b Soziale Kompetenzen: sich verständigen und kooperieren; Verantwortung übernehmen und Rücksichtnahme praktizieren; im Team agieren; Konflikte aushalten, austragen und konstruktiv lösen; andere Perspektiven einnehmen; von Empathie geleitet handeln; sich durchsetzen; Toleranz üben; Zivilcourage zeigen: sich einmischen und in zentralen Fragen das Miteinander betreffend Stellung beziehen. Dazu gehören wertbewusste Haltungen: um Kategorien wie Respekt, Gerechtigkeit, Fairness, Kostbarkeit,",Hessen,Gym,Sek2,2024.0,Sozialkunde
125,8,0.9790688276985161,"unterschiedlichen Sprachniveaus und Zeichensystemen ermöglichen. b Soziale Kompetenzen: sich verständigen und kooperieren; Verantwortung übernehmen und Rücksichtnahme praktizieren; im Team agieren; Konflikte aushalten, austragen und konstruktiv lösen; andere Perspektiven einnehmen; von Empathie geleitet handeln; sich durchsetzen; Toleranz üben; Zivilcourage zeigen: sich einmischen und in zentralen Fragen das Miteinander betreffend Stellung beziehen. Dazu gehören wertbewusste Haltungen: um Kategorien wie Respekt, Gerechtigkeit, Fairness, Kostbarkeit,",Hessen,Gym,Sek2,2024.0,Sozialkunde
126,8,0.49176363323442496,"weisen im Unterricht ihre Handlungskompetenz nach, indem sie... mit anderen fair und gewaltfrei umgehen. mithilfe der sozialen Perspektivübernahme egozentrische Positionen überwinden und andere als gleichberechtigt wahrnehmen. sich für andere aus Mitgefühl, Gerechtigkeitsempfinden und sozialer Verantwortung einsetzen. die eigene Meinung sachlich-argumentativ und unter strategischen Überlegungen in Wort und Schrift darlegen. Kompromisse entwickeln und akzeptieren. unterschiedliche Sichtweisen und Lösungsansätze nebeneinander stehen lassen und",Niedersachsen,Hauptschule,,2015.0,Sozialkunde
127,9,0.9653836181133528,"lösen. Soziale Kompetenzen sind erforderlich, um mit anderen Menschen angemessen umgehen und zusammenarbeiten zu können. Dazu zählen die Fähigkeiten, erfolgreich zu kooperieren, sich in Konflikten konstruktiv zu verhalten sowie Toleranz, Empathie und Respekt gegenüber anderen zu zeigen. Die in der nachfolgenden Tabelle genannten überfachlichen Kompetenzen sind jahrgangsübergreifend zu verstehen, d. h., sie werden anders als die fachlichen Kompetenzen in den Rahmenplänen",Hamburg,Gym,Sek2,2024.0,Sozialkunde
128,7,0.849983913564189,"der Region auswerten, - das Thema Partnerschaft durch Kreativität fördernde Methoden gestalten, z. B. Collage, Standbild. Selbst- und Sozialkompetenz Der Schüler kann - seine Eignung für eine Partnerschaft einschätzen, - Empathie für die Gefühle Anderer entwickeln. Elternschaft Dem Schüler wird bewusst, dass Elternschaft eine hohe Verantwortung bedeutet. Er reflektiert Faktoren und deren Auswirkungen auf die demographische Entwicklung in Deutschland, die die",Thüringen,Regelschule,,2012.0,Sozialkunde
