document_id,most_prevalent_topic_id,most_prevalent_topic_probability,text_excerpt,state,school type,grade,year,subject
129,7,0.9526287585632164,"von allen Fächern zu erfüllenden Querschnittsaufgaben tragen insbesondere auch die Fächer des gesellschaftswissenschaftlichen Aufgabenfeldes im Rahmen der Entwicklung von Gestaltungskompetenz zur kritischen Reflexion geschlechter- und kulturstereotyper Zuordnungen, zur Werteerziehung, zur Empathie und Solidarität, zum Aufbau sozialer Verantwortung, zur Gestaltung einer demokratischen Gesellschaft, zur Sicherung der natürlichen Lebensgrundlagen, auch für kommende Generationen im Sinne einer nachhaltigen Entwicklung, und zur kulturellen Mitgestaltung bei.",NRW,Gym,Sek2,2014.0,Sozialkunde
130,1,0.9181715959093809,"kennen und beachten lernen sowie die Bereitschaft entwickeln, Kritik aufzunehmen und zu verarbeiten. Die Thematisierung unterschiedlicher Lebensformen und Vorstellungen sowie der immer wieder zu leistende Perspektivenwechsel tragen zur Herausbildung von Empathie und Toleranz auf der Basis eines gesicherten Wertefundaments bei. Dem Bezug zur Lebenswelt der Schülerinnen und Schüler kommt im Fach Politik und Gesellschaft eine ganz besondere Bedeutung zu. Im Unterricht",Bayern,Gym,,,Sozialkunde
131,9,0.954996051159137,"Verantwortung für sich und andere zu übernehmen und v. a. bei der Lösung von Problemen zu kooperieren. Sie erwerben Fähigkeiten zu konstruktiver Konfliktlösung und üben sich in Toleranz, Respekt und Empathie, wenn es gilt, Meinungen und Überzeugungen anderer nachzuvollziehen und ggf. zu akzeptieren. Der gymnasiale Unterricht im Fach Politik und Gesellschaft trägt in hohem Maße zur Persönlichkeitsbildung bei und fördert das",Bayern,Gym,,,Sozialkunde
132,7,0.7018780477350915,Wirtschaftslehre leistet einen bedeutenden Beitrag zur Ausprägung der anderen Schlüsselkompetenzen: Schlüsselkompetenz Beitrag des Faches Wirtschaftslehre Sprachkompetenz fachsprachliche Terminologie und Kommunikation Lernkompetenz Rollen- und Perspektivenübernahme Medienkompetenz mediengestützte Präsentationen von Arbeitsergebnissen Sozialkompetenz Empathie und soziales Lernen Demokratiekompetenz demokratische Verfahren in Aushandlungsprozessen kulturelle Kompetenz unter den Bedingungen der Marktwirtschaft rational handeln mathematische Kompetenz gesammelte Daten selbst adäquat darstellen; mathematische Verfahren der Kalkulation usw. anwenden,Sachsen-Anhalt,Gym,,2017.0,Sozialkunde
133,1,0.794511365314918,"entwickeln dabei die Bereitschaft, konstruktive Kritik zu äußern und anzunehmen sowie Kompromisse einzugehen. Die Thematisierung unterschiedlicher Lebensformen und Vorstellungen sowie der immer wieder zu leistende Perspektivenwechsel tragen zur Herausbildung von Empathie und Toleranz bei. Kompetenzorientierung im Fach Politik und Gesellschaft Kompetenzstrukturmodell Die Schülerinnen und Schüler lernen zwischen Fakten und Meinungen zu unterscheiden und werden auf ihrem Weg zum mündigen, rational handelnden",Bayern,Realschule,10,2023.0,Sozialkunde
134,9,0.954996051159137,"Verantwortung für sich und andere zu übernehmen und v. a. bei der Lösung von Problemen zu kooperieren. Sie erwerben Fähigkeiten zu konstruktiver Konfliktlösung und üben sich in Toleranz, Respekt und Empathie, wenn es gilt, Meinungen und Überzeugungen anderer zu akzeptieren. Der Unterricht im Fach Politik und Gesellschaft trägt zur Persönlichkeitsbildung bei und fördert das Sozialverhalten der Jugendlichen. Sie verinnerlichen so das",Bayern,Realschule,10,2023.0,Sozialkunde
135,1,0.9727267903498346,"Konzentrationsbereitschaft. Sozialkompetenz Soziale Wahrnehmungsfähigkeit: Die Lernenden nehmen unterschiedliche Bedürfnisse, Emotionen, Überzeugungen sowie Interpretationen sozialer Realität in Beziehungen Partner, Gruppen, größere Gemeinschaften, Gesellschaften wahr. Sie versetzen sich in die Lage anderer Empathie, Perspektivenübernahme, erfassen und reflektieren den Stellenwert ihres eigenen Handelns. Rücksichtnahme und Solidarität: Die Lernenden respektieren die Meinungen und Verhaltensweisen anderer, sie sind aufmerksam gegenüber ihren Interaktionspartnern, nehmen Anteil an deren",Hessen,Gym,Sek1,,Sozialkunde
136,6,0.9526297013420724,"Personen in ihren gesellschaftlichen Rollen analysieren, hinterfragen und schließlich beurteilen können. Das Fach grenzt sich von Positionen ab, die im Gegensatz zum Werte- und Grundkonsens des Grundgesetzes stehen. Dabei nimmt Empathie eine Schlüsselkompetenz ein, denn sie ermöglicht es, unter Wahrung der eigenen Identität Positionen anderer zu verstehen und zu tolerieren. Intelligentes Wissen über gesellschaftlichen Pluralismus und Individualisierung, soziale Strukturen und sozialen",Hessen,Gym,Sek1,,Sozialkunde
137,6,0.9357103948009139,"erhält auch die Sprachbildung im Politikunterricht eine zentrale Bedeutung: Fehlende Sprachkompetenz behindert die Ausbildung politischer Mündigkeit und verwehrt gesellschaftliche Teilhabemöglichkeiten. Handlungskompetenz zeichnet sich auch durch demokratische Grundqualifikationen wie Konflikt-, Kompromissfähigkeit, Empathie und Perspektivenübernahme aus. Diese sind in einer pluralistischen und Diversität anerkennenden Gesellschaft zentrale Qualifikationen, um gemeinsam Entscheidungen in einer Demokratie zu treffen, umzusetzen und andere politische Urteile verstehen und tolerieren",Berlin,,7-10,,Sozialkunde
138,9,0.9653836181133528,"lösen. Soziale Kompetenzen sind erforderlich, um mit anderen Menschen angemessen umgehen und zusammenarbeiten zu können. Dazu zählen die Fähigkeiten, erfolgreich zu kooperieren, sich in Konflikten konstruktiv zu verhalten sowie Toleranz, Empathie und Respekt gegenüber anderen zu zeigen. Die in der nachfolgenden Tabelle genannten überfachlichen Kompetenzen sind jahrgangsübergreifend zu verstehen, d. h., sie werden anders als die fachlichen Kompetenzen in den Rahmenplänen",Hamburg,Gym,Sek1,2024.0,Sozialkunde
139,9,0.9653836181133528,"lösen. Soziale Kompetenzen sind erforderlich, um mit anderen Menschen angemessen umgehen und zusammenarbeiten zu können. Dazu zählen die Fähigkeiten, erfolgreich zu kooperieren, sich in Konflikten konstruktiv zu verhalten sowie Toleranz, Empathie und Respekt gegenüber anderen zu zeigen. Die in der nachfolgenden Tabelle genannten überfachlichen Kompetenzen sind jahrgangsübergreifend zu verstehen, d. h., sie werden anders als die fachlichen Kompetenzen in den Rahmenplänen",Hamburg,Gym,Sek1,2024.0,Sozialkunde
140,3,0.9689647202998173,"im interdisziplinären Arbeiten, bereiten sich auf den Umgang mit vielschichtigen und vielgestaltigen Problemen und Themen vor und lernen, mit Phänomenen mehrperspektivisch umzugehen. Interdisziplinarität, Mehrperspektivität Die Schüler entwickeln die Fähigkeit zu Empathie und Perspektivwechsel und lernen, sich für die Rechte und Bedürfnisse anderer einzusetzen. Sie lernen unterschiedliche Positionen und Wertvorstellungen kennen und setzen sich mit ihnen auseinander, um sowohl eigene Positionen einzunehmen",Sachsen,Gym,,2019.0,Sozialkunde
141,4,0.9653826125478496,"auseinander, um sowohl eigene Positionen einzunehmen als auch anderen gegenüber Toleranz zu entwickeln. Sie entwickeln interkulturelle Kompetenz, um offen zu sein, sich mit anderen zu verständigen und angemessen zu handeln. Empathie und Perspektivwechsel Die Schüler entwickeln eigene Wertvorstellungen auf der Grundlage der freiheitlichen demokratischen Grundordnung, indem sie Werte im schulischen Alltag erleben, kritisch reflektieren und diskutieren. Dazu gehören insbesondere Erfahrungen der",Sachsen,Gym,,2019.0,Sozialkunde
142,6,0.9399968669369557,"ein Spektrum von Wert- und Normvorstellungen der freiheitlichen demokratischen Grundordnung und grenzt sich deutlich von jenen Positionen ab, die im Widerspruch zu diesem Wertekanon mit dem Fundament der Menschenwürde stehen. Empathie und Perspektivwechsel ermöglichen grundsätzlich, dass unter Wahrung und Herausbildung der eigenen Identität und des Selbstwertgefühls auch die Positionen und Standpunkte anderer verstanden und als legitim toleriert werden. Diese Prämissen gelten",Sachsen,Gym,,2019.0,Sozialkunde
143,4,0.9590872965269374,"von Entscheidungsprozessen betrachten. Entwickeln der Fähigkeit zur Toleranz im Rahmen der freiheitlichen demokratischen Grundordnung Die Schüler entwickeln Toleranz, indem sie sich mit unterschiedlichen Positionen zu politischen Fragestellungen auseinandersetzen sowie zu Empathie und Perspektivwechsel befähigt werden, alternative Lebensstile und divergierende Wertvorstellungen auf dem Boden der freiheitlichen demokratischen Grundordnung als gleichwertig begreifen. Entwickeln der Fähigkeit und Bereitschaft, sich vor dem Hintergrund demokratischer Handlungsoptionen",Sachsen,Gym,,2019.0,Sozialkunde
144,7,0.9470572843906069,"gesellschafts- oder wirtschaftspolitischen Kontroverse Sozialversicherungssysteme, Armut, Generationenkonflikt RE/k, Kl. , LB GE, Lk , LB g Beurteilen der Rolle digitaler Medien in einem aktuellen internationalen Konflikt soziale Netzwerke, Kommunikationsformen Fallbeispiel Empathie und Perspektivwechsel Problemlösestrategien Wahlbereich : Digitale Medien im Wahlkampf Sich positionieren zum Einfluss von digitalen Medien in einem aktuellen Wahlkampf Bundestagswahl, Landtagswahl, Europawahl, Kommunalwahl, Wahlen in anderen Ländern Verantwortungsbereitschaft Wahlbereich",Sachsen,Gym,,2019.0,Sozialkunde
145,7,0.9181742162150518,"Währungskrise aktuelle Herausforderungen der Wirtschaftsund Währungsunion unterschiedliche Leistungsfähigkeit europäischer Volkswirtschaften Sich positionieren zur Idee einer Wirtschaft ohne Wachstum Club of Rome, Postwachstumsökonomie N. Paech Grenzen des Wachstums, Nachhaltigkeit Regionalökonomie, Prosumenten-Netzwerke Empathie und Perspektivwechsel Bildung für nachhaltige Entwicklung Lernbereich : Legitimität einer politischen Ordnung Ustd. Beurteilen des Verhältnisses von Legalität und Legitimität politischer Herrschaft Macht, Herrschaft Typologie legitimer Herrschaft nach M. Weber",Sachsen,Gym,,2019.0,Sozialkunde
146,7,0.9181781311800521,"innereuropäisches Hegemonialstreben versus Gleichberechtigung europäische Einflüsse auf die Ausbildung von Identität Idee einer gemeinsamen europäischen Arme Wirtschaftsverband oder politische Einheit gemeinsame Sicherheits- und Außenpolitik der Europäischen Union G/R/W, Kl. Projektunterricht Empathie Verantwortungsbereitschaft Beurteilen globaler politischer Strukturen und Prozesse Begriff der Globalisierung, Globalisierungsgegner und -befürworter Dimensionen der Globalisierung politische Gestaltung der globalen Welt global governance internationale und supranationale Organisationen GE, Gk /,",Sachsen,Gym,,2019.0,Sozialkunde
147,7,0.6863108742002046,"Risiken, unbeabsichtigte Folgen rationaler Entscheidungen Konferenzsimulation GE, Lk , LB Beurteilen der Qualität von Wirtschaftsstandorten in Europa vor dem Hintergrund von Globalisierungsprozessen Standortanalyse: Arbeitskosten, Umwelt, Humankapital Standortvergleich Experteninterview, Unternehmensbesuch Methodenbewusstsein Empathie und Perspektivwechsel Sich positionieren zu politischen und ökonomischen Ordnungsvorstellungen bezüglich der Internationalisierung der Wirtschaft Wandel der Sozialen Marktwirtschaft, Konzepte einer internationalen sozialen Marktwirtschaft, marktkritische Ordnungsvorstellungen Rolle von Institutionen, Nicht-Regierungsorganisationen, Weltgesellschaft",Sachsen,Gym,,2019.0,Sozialkunde
148,7,0.9099944377105691,"ökonomischen Ordnungsvorstellungen bezüglich der Internationalisierung der Wirtschaft Wandel der Sozialen Marktwirtschaft, Konzepte einer internationalen sozialen Marktwirtschaft, marktkritische Ordnungsvorstellungen Rolle von Institutionen, Nicht-Regierungsorganisationen, Weltgesellschaft GEO, Gk , LB ETH, Gk, LB Empathie und Perspektivwechsel Wahlbereich : Ökonomie und Gewalt Beurteilen der Wechselbeziehung zwischen Ökonomie und gewalttätigen Konflikten Rüstungsindustrie, Konfliktbewältigung Rüstungsetat im Staatshaushalt Ökonomie der neuen Kriege Wahlbereich : Ökonomie und Ökologie Beurteilen",Sachsen,Gym,,2019.0,Sozialkunde
149,9,0.9653836181133528,"lösen. Soziale Kompetenzen sind erforderlich, um mit anderen Menschen angemessen umgehen und zusammenarbeiten zu können. Dazu zählen die Fähigkeiten, erfolgreich zu kooperieren, sich in Konflikten konstruktiv zu verhalten sowie Toleranz, Empathie und Respekt gegenüber anderen zu zeigen. Die in der nachfolgenden Tabelle genannten überfachlichen Kompetenzen sind jahrgangsübergreifend zu verstehen, d. h., sie werden anders als die fachlichen Kompetenzen in den Rahmenplänen",Hamburg,Stadtteilschule,5-11,2024.0,Sozialkunde
150,7,0.9499961145254942,"ihnen kulturelle und gesellschaftliche Orientierung und ermuntert sie dazu, eigenständig zu denken und vermeintliche Gewissheiten, kulturelle Wertorientierungen und gesellschaftliche Strukturen auch kritisch zu überdenken. Unterricht trägt dazu bei, Bereitschaft zur Empathie zu entwickeln, und fördert die Fähigkeit, die eigenen Überzeugungen und das eigene Weltbild in Frage zu stellen. Er unterstützt die Schülerinnen und Schüler dabei, Unsicherheiten auszuhalten und Selbstvertrauen zu erwerben.",Schleswig-Holstein,,Sekundarstufe,2016.0,Sozialkunde
151,9,0.9653836181133528,"lösen. Soziale Kompetenzen sind erforderlich, um mit anderen Menschen angemessen umgehen und zusammenarbeiten zu können. Dazu zählen die Fähigkeiten, erfolgreich zu kooperieren, sich in Konflikten konstruktiv zu verhalten sowie Toleranz, Empathie und Respekt gegenüber anderen zu zeigen. Die in der nachfolgenden Tabelle genannten überfachlichen Kompetenzen sind jahrgangsübergreifend zu verstehen, d. h., sie werden anders als die fachlichen Kompetenzen in den Rahmenplänen",Hamburg,Stadtteilschule,5-11,2024.0,Sozialkunde
