document_id,most_prevalent_topic_id,most_prevalent_topic_probability,text_excerpt,state,school type,grade,year,subject
484,5,0.6652470444287073,interspezifische Beziehungen Leitbild Nachhaltigkeit Nachhaltigkeitsdreieck Naturschutz: Erhalt der Biodiversität SR - Ebene der Organismen Steuerung von Körperfunktionen Interaktion mit der Umwelt Hormondrüsen Regelung der Körpertemperatur steuernde Faktoren der Embryonalentwicklung durch Homöobox-Gene Homöostase Embryonalentwicklung bei Wirbeltieren epigenetische Mechanismen SR - Zelluläre Ebene Struktur der Nervenzelle Wirkung von Hormonen Immunsystem Antigen-Antikörper-Reaktion Infektionskrankheiten Immunisierung osmotische Vorgänge Transportmechanismen an Biomembranen Genregulation Mitosephasen Zellzyklus Komponenten der,Schleswig-Holstein,,Sek1,2019.0,Bio
485,5,0.556308875995228,"autosomal-gonosomal Epigenetik GV - Zelluläre Ebene keine Fachinhalte Entstehung der Prokaryoten und der Eukaryoten Endosymbiontentheorie Entstehung der Vielzeller GV - Molekulare Ebene keine Fachinhalte biologische Makromoleküle genetischer Code Stoffwechselprozesse DNA-Sequenzvergleiche Homöobox-Gene molekulare Uhr chemische Evolution evolutive Entwicklung von Stoffwechselprozessen Tabelle III Evolutionsbiologische und ökologische Fachinhalte für die Einführungsphase Basiskonzepte Verbindliche Fachinhalte in der Einführungsphase In der Einführungsphase mögliche Fachinhalte, in der",Schleswig-Holstein,,Sek1,2019.0,Bio
486,7,0.6993808166808544,"Gens Genom als die Gesamtheit der Erbanlagen eines Individuums Variabilität im Phänotyp hat genetische Ursachen und ermöglicht Selektionsprozesse Sek. I - VA Modifikationen sind individuelle Anpassungen eines Organismus innerhalb einer genetisch festgelegten Variationsbreite. beschreiben individuelle Anpassungen eines Organismus an die Umwelt als Modifikationen. Modifikationen Sek. I - VA Die genetische Variabilität von Nachkommen wird durch Mutationen und Rekombinationsprozesse ermöglicht. erklären, dass",Schleswig-Holstein,,Sek1,2019.0,Bio
487,7,0.8903001096778522,"Möglichkeiten der Geschlechtsbestimmung. genotypisch durch andere Faktoren beschreiben und erklären den Vorteil der genetischen Rekombination bei einer instabilen Umwelt. Erhöhung der Variabilität durch genetische Rekombination beschreiben und erklären den Vorteil genetisch identischer Nachkommen bei einer stabilen Umwelt. Mitosephasen asexuelle Fortpflanzung Klone als künstlich erzeugte, erbgleiche Individuen beschreiben und erklären die Vermehrung von Bakterien. Bau- von Bakterien Parasexualität bei Bakterien: Transformation Konjugation",Schleswig-Holstein,,Sek1,2019.0,Bio
488,6,0.6319294506869966,"Umwelt. beschreiben Biodiversität als Folge der Angepasstheit der Arten an ihre Umwelt. Artenkenntnis in heimischer Umgebung: Blütenpflanzen Wirbeltiere Ansprüche heimischer Organismen an ihre Umwelt Jahrgangsstufen - Sek. I - VA Genetische Variabilität ist Ergebnis und Grundlage von evolutiven Prozessen. beschreiben und erklären, dass die genetische Variabilität die Grundlage von evolutiven Prozessen ist. Phänotyp und Genotyp Gen als Erbanlage Allel als Ausprägungsform",Schleswig-Holstein,,Sek1,2019.0,Bio
489,6,0.8230697335521104,"heimischer Umgebung: Blütenpflanzen Wirbeltiere Ansprüche heimischer Organismen an ihre Umwelt Jahrgangsstufen - Sek. I - VA Genetische Variabilität ist Ergebnis und Grundlage von evolutiven Prozessen. beschreiben und erklären, dass die genetische Variabilität die Grundlage von evolutiven Prozessen ist. Phänotyp und Genotyp Gen als Erbanlage Allel als Ausprägungsform eines Gens Genom als die Gesamtheit der Erbanlagen eines Individuums Variabilität im Phänotyp hat",Schleswig-Holstein,,Sek1,2019.0,Bio
490,7,0.4976880548932401,Variabilität die Grundlage von evolutiven Prozessen ist. Phänotyp und Genotyp Gen als Erbanlage Allel als Ausprägungsform eines Gens Genom als die Gesamtheit der Erbanlagen eines Individuums Variabilität im Phänotyp hat genetische Ursachen und ermöglicht Selektionsprozesse Sek. I - VA Modifikationen sind individuelle Anpassungen eines Organismus innerhalb einer genetisch festgelegten Variationsbreite. beschreiben individuelle Anpassungen eines Organismus an die Umwelt als Modifikationen. Modifikationen,Schleswig-Holstein,,Sek1,2019.0,Bio
491,7,0.9669459581371019,"I - VA Modifikationen sind individuelle Anpassungen eines Organismus innerhalb einer genetisch festgelegten Variationsbreite. beschreiben individuelle Anpassungen eines Organismus an die Umwelt als Modifikationen. Modifikationen Sek. I - VA Die genetische Variabilität von Nachkommen wird durch Mutationen und Rekombinationsprozesse ermöglicht. erklären, dass die genetische Variabilität auf Individualebene durch Mutationen und Rekombinationsprozesse bestimmt wird. Rekombination Mutation Sek. I - VA Angepasstheit ist",Schleswig-Holstein,,Sek1,2019.0,Bio
492,7,0.905264023601623,"Variationsbreite. beschreiben individuelle Anpassungen eines Organismus an die Umwelt als Modifikationen. Modifikationen Sek. I - VA Die genetische Variabilität von Nachkommen wird durch Mutationen und Rekombinationsprozesse ermöglicht. erklären, dass die genetische Variabilität auf Individualebene durch Mutationen und Rekombinationsprozesse bestimmt wird. Rekombination Mutation Sek. I - VA Angepasstheit ist eine Folge der Selektion. erklären den Fortpflanzungserfolg unterschiedlich angepasster Individuen durch Selektion. abiotische",Schleswig-Holstein,,Sek1,2019.0,Bio
493,7,0.9060314691163117,"Spermien beim Menschen beschreiben und erklären unterschiedliche Möglichkeiten der Geschlechtsbestimmung. genotypisch durch andere Faktoren beschreiben und erklären den Vorteil der genetischen Rekombination bei einer instabilen Umwelt. Erhöhung der Variabilität durch genetische Rekombination beschreiben und erklären den Vorteil genetisch identischer Nachkommen bei einer stabilen Umwelt. Mitosephasen asexuelle Fortpflanzung Klone als künstlich erzeugte, erbgleiche Individuen beschreiben und erklären die Vermehrung von Bakterien. Bau-",Schleswig-Holstein,,Sek1,2019.0,Bio
494,5,0.37470214050340234,und Schüler ... Verbindliche Fachinhalte OS - VA Variabilität gibt es auf molekularer und zellulärer Ebene sowie auf der Ebene von Organen und Organismen. beschreiben und erklären die Ursachen für genetische Variabilität. Mutagene Mutationsarten Rekombination von Allelen durch: Meiose Zygotenbildung Gentechnik beschreiben und erklären die Koevolution von Populationen als ständigen Anpassungsprozess. Koevolution OS - VA Der Genotyp bestimmt den Phänotyp durch,Schleswig-Holstein,,Sek1,2019.0,Bio
495,7,0.9723210543545742,als ein Maß für die Angepasstheit eines Individuums. reproduktive Fitness OS - VA Evolutionsfaktoren beeinflussen die Variabilität des Genpools einer Population. beschreiben und erklären den Einfluss von Evolutionsfaktoren auf die genetische Variabilität eines Genpools. Genpool Mutation Rekombination Selektion Isolation Migration Gendrift Flaschenhalseffekt Grundlegende Zusammenhänge des Basiskonzepts Inhaltsbezogene Kompetenzen Die Schülerinnen und Schüler ... Verbindliche Fachinhalte OS - VA Evolution findet auf,Schleswig-Holstein,,Sek1,2019.0,Bio
496,7,0.8857557813806746,Selektion Isolation Migration Gendrift Flaschenhalseffekt Grundlegende Zusammenhänge des Basiskonzepts Inhaltsbezogene Kompetenzen Die Schülerinnen und Schüler ... Verbindliche Fachinhalte OS - VA Evolution findet auf der Populationsebene statt. beschreiben und erklären genetische Veränderung in einer Population und ihre Folgen. Selektionstypen OS - VA Die Entstehung von Arten beruht auf der Isolation von Teilpopulationen. beschreiben und erklären die Entstehung von Arten mit der,Schleswig-Holstein,,Sek1,2019.0,Bio
497,5,0.5158454824886535,Fotosynthese Glykolyse Gärung Atmung F tfüh d T b ll Basiskonzepte Fachinhalte Sekundarstufe I Fachinhalte Oberstufe Reproduktion R R - Populationsebene Genom des Menschen asexuelle Fortpflanzung Erhöhung der Variabilität durch genetische Rekombination r- und K-Strategen Partnerfindung sexuelle Selektion Paarungssysteme Unterschiede im weiblichen / männlichen Investment Altruismus klassische Tier- und Pflanzenzucht gentechnische Verfahren der Tier- und Pflanzenzucht R - Ebene der Organismen,Schleswig-Holstein,,Sek1,2019.0,Bio
498,7,0.4992786012278066,"Fachinhalte in der Einführungsphase In der Einführungsphase mögliche Fachinhalte, in der Qualifikationsphase verbindliche Fachinhalte Struktur und Funktion SF Homologie und Analogie Einnischung Reproduktion R reproduktive Fitness Erhöhung der Variabilität durch genetische Rekombination r- und K-Strategen Kompartimentierung K Biosphäre, Ökosystem, Population, Organismus spezifische räumliche Strukturen am Beispiel eines Ökosystems Steuerung und Regelung SR intra- und interspezifische Beziehungen dichte- und dichteunabhängige Faktoren Lotka-Volterra",Schleswig-Holstein,,Sek1,2019.0,Bio
499,7,0.8432449307889779,"des Basiskonzepts Inhaltsbezogene Kompetenzen Die Schülerinnen und Schüler ... Verbindliche Fachinhalte OS - R Umweltbedingungen haben Einfluss auf das Auftreten asexueller und sexueller Fortpflanzung. beschreiben sexuelle Fortpflanzung als Rekombination des genetischen Materials durch Gameten. Gametenbildung: Meiosephasen intra- und interchromosomale Rekombination Zygotenbildung beschreiben den Unterschied von weiblichen und männlichen Keimzellen und deren Entstehung. Bau, Funktion und Entstehung von Eizellen und Spermien beim",Schleswig-Holstein,,Sek1,2019.0,Bio
500,7,0.8639496415712877,"und deren Entstehung. Bau, Funktion und Entstehung von Eizellen und Spermien beim Menschen beschreiben und erklären unterschiedliche Möglichkeiten der Geschlechtsbestimmung. genotypisch durch andere Faktoren beschreiben und erklären den Vorteil der genetischen Rekombination bei einer instabilen Umwelt. Erhöhung der Variabilität durch genetische Rekombination beschreiben und erklären den Vorteil genetisch identischer Nachkommen bei einer stabilen Umwelt. Mitosephasen asexuelle Fortpflanzung Klone als künstlich erzeugte,",Schleswig-Holstein,,Sek1,2019.0,Bio
501,7,0.8388202619143026,bei sexuell reproduktiven Organismen. zum Beispiel Parthenogenese Fortführung der Tabelle Grundlegende Zusammenhänge des Basiskonzepts Inhaltsbezogene Kompetenzen Die Schülerinnen und Schüler ... Verbindliche Fachinhalte OS - R Die Partnerwahl basiert auf genetischer Disposition. beschreiben und erklären artspezifisches Verhalten bei der Partnerfindung und beim Paarungsverhalten. Partnerfindung durch: Lockstoffe akustische Verfahren Balz sexuelle Selektion Paarungssysteme MHC-System beschreiben und erklären die unterschiedlichen Fortpflanzungsstrategien im weiblichen,Schleswig-Holstein,,Sek1,2019.0,Bio
502,5,0.6798881662192139,Mimikry Mimese OS - IK Kommunikationsprozesse finden nicht nur zwischen Organismen sondern auch auf molekularer und zellulärer Ebene statt. beschreiben und erklären die Proteinbiosynthese als einen Kommunikationsprozess auf molekularer Ebene. genetischer Code Transkription Translation beschreiben und erklären Kommunikationsprozesse auf zellulärer Ebene. Reizleitung an Nervenzellen Funktion von Synapsen OS - IK Hochentwickelte Kommunikationssysteme dienen in Sozialverbänden der Verständigung. beschreiben und erklären die,Schleswig-Holstein,,Sek1,2019.0,Bio
503,7,0.8045400145334974,Zusammenhänge des Basiskonzepts Inhaltsbezogene Kompetenzen Die Schülerinnen und Schüler ... Verbindliche Fachinhalte OS - GV Alle heute lebenden Organismen haben gemeinsame Eigenschaften. beschreiben die gemeinsamen Eigenschaften von Lebewesen. biologische Makromoleküle genetischer Code Stoffwechselprozesse Homöobox-Gene OS - GV Die Entstehung des Lebens lässt sich evolutiv erklären. beschreiben Hypothesen zur Entstehung von Biomolekülen und Zellen. Hypothesen zur Entstehung des Lebens chemische Evolution OS,Schleswig-Holstein,,Sek1,2019.0,Bio
504,5,0.45754586105819617,Aggression Fortführung der Tabelle Basiskonzepte Fachinhalte Sekundarstufe I Fachinhalte Oberstufe IK - Zelluläre Ebene Kommunikation auf zelluläre Ebene Reizleitung an Nervenzellen Funktion von Synapsen IK - Molekulare Ebene keine Fachinhalte genetischer Code Transkription Translation Variabilität und Angepasstheit VA VA - Populationsebene Variabilität als Grundlage für Selektionsprozesse abiotische und biotische Faktoren ökologische Nische Polymorphismus biotische und abiotische Umweltfaktoren als Evolutionsfaktoren Variationsbreite Konkurrenz,Schleswig-Holstein,,Sek1,2019.0,Bio
505,5,0.509320625471305,"Variabilität Erbgänge: dominant-rezessiv, intermediär, autosomal-gonosomal Epigenetik GV - Zelluläre Ebene keine Fachinhalte Entstehung der Prokaryoten und der Eukaryoten Endosymbiontentheorie Entstehung der Vielzeller GV - Molekulare Ebene keine Fachinhalte biologische Makromoleküle genetischer Code Stoffwechselprozesse DNA-Sequenzvergleiche Homöobox-Gene molekulare Uhr chemische Evolution evolutive Entwicklung von Stoffwechselprozessen Tabelle III Evolutionsbiologische und ökologische Fachinhalte für die Einführungsphase Basiskonzepte Verbindliche Fachinhalte in der Einführungsphase In der Einführungsphase",Schleswig-Holstein,,Sek1,2019.0,Bio
506,5,0.9739463835709284,von Handlungsfolgen Nutzung fachlicher Konzepte Vernetzung zum Basiskonzept Struktur und Funktion Entwicklungsvorgänge werden bei verschiedenen Organismen betrachtet. Fortpflanzung Organismen sind eng mit Erblichkeit verbunden. Die Ausprägung von Merkmalen wird klassischen Genetik ersichtlich. und Keimzellenbildung werden zur Erklärung von Wachstum und Fortpflanzung heranbeschreiben die Vorgänge auf zellulärer Ebene. r genetischen Information dient der Erklärung der Vielfalt der Organismen. d auch bei Bakterien,Hessen,Realschule,,2024.0,Bio
507,6,0.5917858122487987,und Entwicklung kenntnisgewinnung chreiben Ähnlichkeiten und Unterede der Entwicklung von Lebewemmunikation bachten und Beschreiben von idepischen Bildern zur Fortpflanzung Entwicklung von Organismen Grundlagen der Vererbung: - Zellteilung und Keimzellbildung - Genetische Information in Keimzellen und Körperzellen - Veränderung genetischer Information - Ausprägung von Merkmalen - Entstehung der Vielfalt von Organismen Vermehrung bei Bakterien und Viren Erkenntnisgewinnung Anwendung des Chromosomenmodells und eines,Hessen,Realschule,,2024.0,Bio
508,5,0.8356640390961912,"Strukturen von Lebewesen und den chen Funktionen ist auf makroskopischer Ebene an Organe, Organsysteme und Körperf mikroskopischer Ebene wird der Zusammenhang auf Zellen einschließlich des Imausgewählte Organellen erweitert. undlagen der genetischen Information werden auf Basis der Chromosomen und eines Modells ersichtlich. Stellvertretend für zahlreiche Grundprinzipien stehen das SchlüsselPrinzip der Oberflächenvergrößerung und das Gegenspielerprinzip. Erkenntnisgewinnung Arbeiten mit Struktur- und Funktionsmodellen Mikroskopieren und",Hessen,Realschule,,2024.0,Bio
509,5,0.6510048656475661,Organismen sind eng mit Erblichkeit verbunden. Die Ausprägung von Merkmalen wird klassischen Genetik ersichtlich. und Keimzellenbildung werden zur Erklärung von Wachstum und Fortpflanzung heranbeschreiben die Vorgänge auf zellulärer Ebene. r genetischen Information dient der Erklärung der Vielfalt der Organismen. d auch bei Bakterien und Viren betrachtet. Erkenntnisgewinnung Arbeit auch mit einem vereinfachten DNA-Modell Kommunikation Interpretation idealtypischer Bilder Verwendung von Fach- und,Hessen,Realschule,,2024.0,Bio
510,5,0.5052827854327732,"Zusammenhang zwien Form und Funktion biologischer ukturen gleich von Organismen bzw. bioscher Strukturen anhand selbst wählter oder gegebener Kriterien mmunikation äuterung von Organen und Organemen anhand von schematischen bildungen Weitergabe genetischer Informationen Grundlegender Zusammenhang zwischen biologischen Strukturen und deren Funktionen: auf makroskopischer Ebene: Organe, Organsysteme. auf mikroskopischer Ebene: Zellaufbau ausgewählter Zellen. Grundlegende Prinzipien: Schlüssel-Schloss-Prinzip, Prinzip der Oberflächenvergrößerung, Gegenspielerprinzip Erkenntnisgewinnung Arbeit mit",Hessen,Realschule,,2024.0,Bio
511,6,0.6071755567854307,Entwicklung von Lebewemmunikation bachten und Beschreiben von idepischen Bildern zur Fortpflanzung Entwicklung von Organismen Grundlagen der Vererbung: - Zellteilung und Keimzellbildung - Genetische Information in Keimzellen und Körperzellen - Veränderung genetischer Information - Ausprägung von Merkmalen - Entstehung der Vielfalt von Organismen Vermehrung bei Bakterien und Viren Erkenntnisgewinnung Anwendung des Chromosomenmodells und eines vereinfachten DNA-Modells zur Veranschaulichung der Vererbung Kommunikation Interpretation,Hessen,Realschule,,2024.0,Bio
512,2,0.6330068437298638,"Schwerpunkte Vorschläge für mögliche Kontexte Klassische Genetik Molekulargenetik Veränderungen des Erbgutes Vererbung Produkte aus dem Genlabor Basiskonzept System Chromosomenverteilung in der Meiose Basiskonzept Struktur und Funktion Mendelsche Regeln, Erbgänge, DNA, Gen, Allel, Chromosomen, vom Gen zum Protein Basiskonzept Entwicklung Familienstammbäume, Mutation Umgang mit Fachwissen Die Schülerinnen und Schüler können ... den Aufbau der DNA beschreiben und deren Funktion erläutern. UF die",NRW,Gesamtschule,Sek1,2011.0,Bio
513,2,0.6142758676261241,"Kontexte Klassische Genetik Molekulargenetik Veränderungen des Erbgutes Vererbung Produkte aus dem Genlabor Basiskonzept System Chromosomenverteilung in der Meiose Basiskonzept Struktur und Funktion Mendelsche Regeln, Erbgänge, DNA, Gen, Allel, Chromosomen, vom Gen zum Protein Basiskonzept Entwicklung Familienstammbäume, Mutation Umgang mit Fachwissen Die Schülerinnen und Schüler können ... den Aufbau der DNA beschreiben und deren Funktion erläutern. UF die Bedeutung der Begriffe Gen,",NRW,Gesamtschule,Sek1,2011.0,Bio
514,2,0.7284540183417396,"Gen zum Protein Basiskonzept Entwicklung Familienstammbäume, Mutation Umgang mit Fachwissen Die Schülerinnen und Schüler können ... den Aufbau der DNA beschreiben und deren Funktion erläutern. UF die Bedeutung der Begriffe Gen, Allel und Chromosom beschreiben und diese Begriffe voneinander abgrenzen. UF dominante und rezessive Erbgänge sowie die freie Kombinierbarkeit von Allelen auf Beispiele aus der Tier- oder Pflanzenwelt begründet anwenden. UF,",NRW,Gesamtschule,Sek1,2011.0,Bio
515,2,0.5906851882125651,"Evolutionstheorien, Artbildung, Fitness, Stammbäume Gene und Vererbung Klassische Genetik Molekulargenetik Veränderungen des Erbgutes Vererbung - Planung oder Zufall Produkte aus dem Genlabor Chromosomenverteilung in der Meiose Mendelsche Regeln, Erbgänge, DNA, Gen, Allel, Chromosomen, vom Gen zum Protein Familienstammbäume, Mutation Stationen eines Lebens Embryonen und Embryonenschutz Gesundheitsvorsorge Organtransplantationen Verantwortung für das eigene Leben Organspender werden Chromosomenverteilung in der Mitose Embryo, künstliche Befruchtung,",NRW,Gesamtschule,Sek1,2011.0,Bio
516,2,0.6133201090584854,"Gene und Vererbung Klassische Genetik Molekulargenetik Veränderungen des Erbgutes Vererbung - Planung oder Zufall Produkte aus dem Genlabor Chromosomenverteilung in der Meiose Mendelsche Regeln, Erbgänge, DNA, Gen, Allel, Chromosomen, vom Gen zum Protein Familienstammbäume, Mutation Stationen eines Lebens Embryonen und Embryonenschutz Gesundheitsvorsorge Organtransplantationen Verantwortung für das eigene Leben Organspender werden Chromosomenverteilung in der Mitose Embryo, künstliche Befruchtung, Transplantation Stammzellen, Tod Information",NRW,Gesamtschule,Sek1,2011.0,Bio
517,3,0.49969037199160676,"Ökosysteme und Ressourcen Optische Instrumente Evolutionäre Entwicklung Erde und Weltall Entwicklung der Erde und des Lebens Stromkreise Elektrizität im Stromkreis Bewegungen und ihre Ursachen Bewegung in Natur und Technik Sexualerziehung Gene und Vererbung Elemente und ihre Ordnung Energie, Leistung, Wirkungsgrad Stationen eines Lebens Elektrische Energie aus chemischen Reaktionen Elektrische Energieversorgung Information und Regulation Säuren und Basen Radioaktivität und Kernenergie Stoffe als",NRW,Gesamtschule,Sek1,2011.0,Bio
518,3,0.4551366411264403,"und ihre Veränderungen Luft und Wasser Ökosysteme und Ressourcen Evolutionäre Entwicklung Elemente und ihre Ordnung Aufbau der Erde und Entwicklung des Lebens Elektrische Energie aus chemischen Reaktionen Elektrochemische Spannungsquellen Sexualerziehung Gene und Vererbung Säuren und Basen Optische Instrumente Erde und Weltall Stationen eines Lebens Stoffe als Energieträger Stromkreise Information und Regulation Produkte der Chemie Bewegungen und ihre Ursachen Energie, Leistung, Wirkungsgrad",NRW,Gesamtschule,Sek1,2011.0,Bio
519,3,0.971383542205954,"anhaltender Prozess, der zu einer Angepasstheit von Lebewesen an vorhandene Lebensräume und auch zur Vielfalt der Lebewesen führt. Artenvielfalt bedeutet genetische Vielfalt und stellt eine Ressource für die Zukunft dar. Gene und Vererbung Wissen über Grundlagen der Genetik ist Voraussetzung für eine kritische Auseinandersetzung mit gesellschaftlichen Fragestellungen im Hinblick auf die Entwicklung der Gentechnik und ihre Einsatzmöglichkeiten. Ein Verständnis der Gesetzmäßigkeiten",NRW,Gesamtschule,Sek1,2011.0,Bio
520,6,0.41511338594072167,"der Altersbestimmung an Schaubildern erklären. K, E Bewertung Die Schülerinnen und Schüler können ... die naturwissenschaftliche Position der Evolutionstheorie von nicht naturwissenschaftlichen Vorstellungen zur Entwicklung von Lebewesen abgrenzen. B Inhaltsfeld Gene und Vererbung Inhaltliche Schwerpunkte Vorschläge für mögliche Kontexte Klassische Genetik Molekulargenetik Veränderungen des Erbgutes Vererbung Produkte aus dem Genlabor Basiskonzept System Chromosomenverteilung in der Meiose Basiskonzept Struktur und Funktion Mendelsche",NRW,Gesamtschule,Sek1,2011.0,Bio
521,6,0.3967003411249364,"Stammesentwicklung der Wirbeltiere und des Menschen Lebewesen und Lebensräume - in ständiger Veränderung Ab wann war der Mensch ein Mensch Artenvielfalt, Mutation, Selektion, Separation Wirbeltierskelette Fossilien, Evolutionstheorien, Artbildung, Fitness, Stammbäume Gene und Vererbung Klassische Genetik Molekulargenetik Veränderungen des Erbgutes Vererbung - Planung oder Zufall Produkte aus dem Genlabor Chromosomenverteilung in der Meiose Mendelsche Regeln, Erbgänge, DNA, Gen, Allel, Chromosomen, vom Gen",NRW,Gesamtschule,Sek1,2011.0,Bio
522,3,0.9703848413659132,Lebewesen an vorhandene Lebensräume und auch zur Vielfalt der Lebewesen führt. Artenvielfalt bedeutet genetische Vielfalt und stellt eine Ressource für die Zukunft dar. Gene und Vererbung Wissen über Grundlagen der Genetik ist Voraussetzung für eine kritische Auseinandersetzung mit gesellschaftlichen Fragestellungen im Hinblick auf die Entwicklung der Gentechnik und ihre Einsatzmöglichkeiten. Ein Verständnis der Gesetzmäßigkeiten bei der Vererbung von Merkmalen als auch,NRW,Gesamtschule,Sek1,2011.0,Bio
523,6,0.43606309413918004,"und Schüler können ... die naturwissenschaftliche Position der Evolutionstheorie von nicht naturwissenschaftlichen Vorstellungen zur Entwicklung von Lebewesen abgrenzen. B Inhaltsfeld Gene und Vererbung Inhaltliche Schwerpunkte Vorschläge für mögliche Kontexte Klassische Genetik Molekulargenetik Veränderungen des Erbgutes Vererbung Produkte aus dem Genlabor Basiskonzept System Chromosomenverteilung in der Meiose Basiskonzept Struktur und Funktion Mendelsche Regeln, Erbgänge, DNA, Gen, Allel, Chromosomen, vom Gen zum Protein",NRW,Gesamtschule,Sek1,2011.0,Bio
524,2,0.4099930617391797,"des Menschen Lebewesen und Lebensräume - in ständiger Veränderung Ab wann war der Mensch ein Mensch Artenvielfalt, Mutation, Selektion, Separation Wirbeltierskelette Fossilien, Evolutionstheorien, Artbildung, Fitness, Stammbäume Gene und Vererbung Klassische Genetik Molekulargenetik Veränderungen des Erbgutes Vererbung - Planung oder Zufall Produkte aus dem Genlabor Chromosomenverteilung in der Meiose Mendelsche Regeln, Erbgänge, DNA, Gen, Allel, Chromosomen, vom Gen zum Protein Familienstammbäume, Mutation",NRW,Gesamtschule,Sek1,2011.0,Bio
525,6,0.3162062544569875,auf die Entwicklung der Gentechnik und ihre Einsatzmöglichkeiten. Ein Verständnis der Gesetzmäßigkeiten bei der Vererbung von Merkmalen als auch wesentlicher molekularbiologischer Vorgänge bildet hierfür die notwendige Grundlage. Die Entstehung von genetisch bedingten Krankheiten lässt sich mit dem Vorhan densein von Mutagenen und der Veränderung von Genen verstehen und erklären. Stationen eines Lebens Die Entwicklung eines Menschen von der befruchteten Eizelle bis,NRW,Gesamtschule,Sek1,2011.0,Bio
526,2,0.5411634238079183,"Organspende Basiskonzept System Chromosomenverteilung in der Mitose Basiskonzept Struktur und Funktion Embryo, künstliche Befruchtung, Transplantation Basiskonzept Entwicklung Stammzellen, Tod Umgang mit Fachwissen Die Schülerinnen und Schüler können ... die Entstehung genetisch identischer Zellen als Ergebnis des Mitosevorgangs erklären. UF auf der Basis genetischer Erkenntnisse den Einsatz und die Bedeutung von Stammzellen in der Forschung darstellen. UF Aufbau, Funktion und Bedeutung der",NRW,Gesamtschule,Sek1,2011.0,Bio
