document_id,most_prevalent_topic_id,most_prevalent_topic_probability,text_excerpt,state,school type,grade,year,subject
696,5,0.7443445438319178,Struktur- und Funktionszusammenhänge in verschiedenen Systemebenen des Menschen ableiten - Vom Reiz zur Reaktion - Prozesse der Informationsverarbeitung erklären - Von der DNA zum Merkmal - Konstanz und Variabilität der genetischen Information interpretieren - Von der Zelle zum Organismus II - Struktur- und Funktionszusammenhänge in verschiedenen Systemebenen der Pflanze ableiten - Vom Umweltfaktor zum Ökosystem - Variabilität und Angepasstheit von Organismen,Sachsen-Anhalt,Gym,,2022.0,Bio
697,5,0.5784010688252735,/ Qualifikationsphase zweistündiges Wahlpflichtfach - Vom Reiz zur Reaktion - Prozesse der Informationsverarbeitung auf zellulärer und physiologischer Grundlage erklären - Von der DNA zum Merkmal - Konstanz und Variabilität der genetischen Information interpretieren - Vom Umweltfaktor zum Ökosystem - Variabilität und Angepasstheit von Organismen begründen - Von der Entstehung des Lebens zur Biodiversität - Geschichte und Verwandtschaft von Organismen erläutern Alle,Sachsen-Anhalt,Gym,,2022.0,Bio
698,6,0.5368911341112321,"Alltagsvorstellungen zu Vorgängen der Vererbung in digitalen Medien recherchieren und mit Fachkenntnissen prüfen Bewertungskompetenz - Materialien zur Gentechnik hinsichtlich deskriptiver und normativer Aussagen analysieren - Umwelteinflüsse unter dem Aspekt der genetischen Risiken bewerten - Anwendungen genetischer Forschungsergebnisse unter ethischen Gesichtspunkten reflektieren und dabei Werte identifizieren, die normativen Aussagen zugrunde liegen - Möglichkeiten und Grenzen der humangenetischen Beratung sowie der genetischen Forschung",Sachsen-Anhalt,Gym,,2022.0,Bio
699,6,0.3588102138176833,"der genetischen Risiken bewerten - Anwendungen genetischer Forschungsergebnisse unter ethischen Gesichtspunkten reflektieren und dabei Werte identifizieren, die normativen Aussagen zugrunde liegen - Möglichkeiten und Grenzen der humangenetischen Beratung sowie der genetischen Forschung zur Lösung von Menschheitsproblemen und Zukunftsfragen bewerten z. B. Gentherapie Grundlegende Wissensbestände - Grundlagen der Vererbung: Struktur und Funktion der DNA Doppelhelix, Nukleotide, komplementäre Basenpaarung, Replikation Reißverschlussmodell, Chromosomen, Mitose,",Sachsen-Anhalt,Gym,,2022.0,Bio
700,3,0.586465126732171,"gemäß Grundsatzband Kap. Gesundheit und Wohlergehen Deutsch, Englisch, Spanisch, Russisch, Chemie, Geschichte, Sozialkunde, Katholischer Religionsunterricht, Evangelischer Religionsunterricht, Geographie, Informatik Kompetenzschwerpunkt: Von der DNA zum Merkmal - Konstanz und Variabilität der genetischen Information interpretieren Sachkompetenz - genetische und modifikatorische Variabilität unter den Aspekten von Biodiversität und Evolutionsprozessen vergleichen - Chromosomen und ihre Veränderung im Zellzyklus beschreiben - Struktur der DNA auf der",Sachsen-Anhalt,Gym,,2022.0,Bio
701,1,0.8390350289226072,- Chromosomen und ihre Veränderung im Zellzyklus beschreiben - Struktur der DNA auf der Grundlage des Watson-Crick-Modells erläutern sowie deren identische Replikation erklären - Proteinbiosynthese als Prozess zur Realisierung der genetischen Informationen auf molekularer Ebene beschreiben - Veränderungen des genetischen Materials durch Mutagene und Gentherapie erläutern sowie die Bedeutung für das Individuum und den evolutionären Prozess ableiten - Regulation der Genaktivität,Sachsen-Anhalt,Gym,,2022.0,Bio
702,1,0.8533490330888227,Struktur der DNA auf der Grundlage des Watson-Crick-Modells erläutern sowie deren identische Replikation erklären - Proteinbiosynthese als Prozess zur Realisierung der genetischen Informationen auf molekularer Ebene beschreiben - Veränderungen des genetischen Materials durch Mutagene und Gentherapie erläutern sowie die Bedeutung für das Individuum und den evolutionären Prozess ableiten - Regulation der Genaktivität bei Eukaryoten auf der Grundlage der Methylierung der DNA,Sachsen-Anhalt,Gym,,2022.0,Bio
703,3,0.7485482888704461,"Zusammenhang mit menschlichen Erkrankungen mithilfe von Material beschreiben Erkenntnisgewinnungskompetenz Modellierungen zur DNA-Struktur auf der Grundlage des Watson-CrickModells planen und durchführen sowie Möglichkeiten und Grenzen von Modellen diskutieren - Fragestellungen zur genetischen Rekombination entwickeln sowie zur Entstehung genetischer Erkrankungen aus dem Verlauf der Meiose ableiten in recherchierten Daten zu klassischen Versuchen zur Vererbung Strukturen, Beziehungen und Trends finden und Schlussfolgerungen ziehen -",Sachsen-Anhalt,Gym,,2022.0,Bio
704,6,0.42925859735758987,"und protokollieren Kommunikationskompetenz geeignete Darstellungsformen für molekulargenetische Zusammenhänge nutzen - zu humangenetischen Fragestellungen selbstständig im Internet recherchieren, Relevanz und Zuverlässigkeit der Informationen einschätzen und die Ergebnisse adressatengerecht präsentieren - bei genetischen Sachverhalten zwischen Alltags- und Fachsprache unterscheiden Bewertungskompetenz - anhand relevanter Bewertungskriterien Handlungsoptionen in gesellschaftlich- oder alltagsrelevanten Entscheidungssituationen in Bezug auf den Einsatz von Stammzellen, gentechnisch veränderten Organismen sowie biotechnologischen Prozessen",Sachsen-Anhalt,Gym,,2022.0,Bio
705,1,0.517723770930535,"gesellschaftlicher und ethischer Perspektive reflektieren Grundlegende Wissensbestände - Zellzyklus, Rekombination, Karyogramm - Struktur der Nukleinsäuren DNA, RNA, identische Replikation der DNA kontinuierlich und diskontinuierlich - Realisierung der Erbinformation: Prinzip des genetischen Codes, Proteinbiosynthese, EinGen-Ein-Polypeptid-Hypothese, Zusammenhang zwischen Gen, Genprodukt und Merkmal z. B. Polygenie, Polyphänie - Mutation, Mutagene, Genmutation - Anwendung Mendelscher Regeln: Dominanz, Rezessivität, Codominanz von Allelen, Familienstammbäume - Regulation der",Sachsen-Anhalt,Gym,,2022.0,Bio
706,5,0.4090453444425508,"neuronalen Plastizität, Langzeitpotenzierung - Bedeutung neurophysiologischer Verfahren Verbindliche Schülerexperimente - ein Experiment zum Sehvorgang Adaptation, Akkommodation, Farb- und Kontrastwahrnehmung Kompetenzschwerpunkt: Von der DNA zum Merkmal - Konstanz und Variabilität der genetischen Information interpretieren Sachkompetenz - genetische und modifikatorische Variabilität unter den Aspekten von Biodiversität und Evolutionsprozessen vergleichen - Chromosomen und ihre Veränderung im Zellzyklus beschreiben - Funktion und Veränderung der Telomere",Sachsen-Anhalt,Gym,,2022.0,Bio
707,1,0.8292367334499241,Telomere und die Bedeutung für Alterungsprozesse darstellen - Struktur der DNA auf der Grundlage des Watson-Crick-Modells erläutern sowie deren identische Replikation materialgestützt erklären - Proteinbiosynthese als Prozess zur Realisierung der genetischen Informationen auf molekularer Ebene beschreiben - Veränderungen des genetischen Materials durch Mutagene erörtern sowie die Bedeutung für das Individuum und den evolutionären Prozess ableiten - Regulation der Genaktivität bei Eukaryoten,Sachsen-Anhalt,Gym,,2022.0,Bio
708,1,0.8415445661078741,der DNA auf der Grundlage des Watson-Crick-Modells erläutern sowie deren identische Replikation materialgestützt erklären - Proteinbiosynthese als Prozess zur Realisierung der genetischen Informationen auf molekularer Ebene beschreiben - Veränderungen des genetischen Materials durch Mutagene erörtern sowie die Bedeutung für das Individuum und den evolutionären Prozess ableiten - Regulation der Genaktivität bei Eukaryoten auf der Grundlage epigenetischer Modelle Methylierung und Acetylierung erklären,Sachsen-Anhalt,Gym,,2022.0,Bio
709,3,0.5098735301046818,Nutzung von CRISPR/Cas und anderer molekulargenetischer Werkzeuge materialgestützt erläutern - Kenntnisse zu Bau und Vermehrung von Bakterien und Viren hinsichtlich gentechnischer Verfahren anwenden - Verknüpfung gentechnischer Verfahren zur Erzeugung des genetischen Fingerabdrucks mithilfe von Material beschreiben - gentherapeutische Verfahren exemplarisch erläutern Erkenntnisgewinnungskompetenz - Modellierungen zur DNA-Struktur auf der Grundlage des Watson-CrickModells planen und durchführen sowie Möglichkeiten und Grenzen von Modellen diskutieren,Sachsen-Anhalt,Gym,,2022.0,Bio
710,3,0.8033222234933183,"Material beschreiben - gentherapeutische Verfahren exemplarisch erläutern Erkenntnisgewinnungskompetenz - Modellierungen zur DNA-Struktur auf der Grundlage des Watson-CrickModells planen und durchführen sowie Möglichkeiten und Grenzen von Modellen diskutieren - Fragestellungen zur genetischen Rekombination entwickeln sowie die Entstehung genetischer Erkrankungen aus dem Verlauf der Meiose ableiten - in recherchierten Daten zu klassischen Versuchen zur Vererbung Strukturen, Beziehungen und Trends finden und Schlussfolgerungen ziehen",Sachsen-Anhalt,Gym,,2022.0,Bio
711,6,0.49329805814252486,"Informationen einschätzen und die Ergebnisse adressatengerecht präsentieren - Daten zu Ursachen und Häufigkeit von Krebserkrankungen aus digitalen Medien auswählen und zu diesen kriterien- und evidenzbasiert sowie situationsgerecht argumentieren - bei genetischen Sachverhalten zwischen Alltags- und Fachsprache unterscheiden Bewertungskompetenz - anhand relevanter Bewertungskriterien Handlungsoptionen in gesellschaftlich- oder alltagsrelevanten Entscheidungssituationen in Bezug auf den Einsatz von Stammzellen, gentechnisch veränderten Organismen sowie biotechnologischen Prozessen",Sachsen-Anhalt,Gym,,2022.0,Bio
712,1,0.5797642598074119,"gesellschaftlicher und ethischer Perspektive reflektieren Grundlegende Wissensbestände - Zellzyklus, Rekombination, Karyogramm - Struktur der Nukleinsäuren DNA, RNA, identische Replikation der DNA kontinuierlich und diskontinuierlich - Realisierung der Erbinformation: Prinzip des genetischen Codes, Proteinbiosynthese, EinGen-Ein-Polypeptid-Hypothese, Zusammenhang zwischen Gen, Genprodukt und Merkmal z. B. Polygenie, Polyphänie - Mutation, Mutagene, Mutationstypen Genom-, Chromosomen-, Genmutation - Krebs: Krebszellen, Onkogene, Anti-Onkogene - Modifikation - Anwendung Mendelscher",Sachsen-Anhalt,Gym,,2022.0,Bio
713,3,0.586465126732171,"gemäß Grundsatzband Kap. Gesundheit und Wohlergehen Deutsch, Englisch, Spanisch, Russisch, Chemie, Geschichte, Sozialkunde, Katholischer Religionsunterricht, Evangelischer Religionsunterricht, Geographie, Informatik Kompetenzschwerpunkt: Von der DNA zum Merkmal - Konstanz und Variabilität der genetischen Information interpretieren Sachkompetenz - genetische und modifikatorische Variabilität unter den Aspekten von Biodiversität und Evolutionsprozessen vergleichen - Chromosomen und ihre Veränderung im Zellzyklus beschreiben - Struktur der DNA auf der",Sachsen-Anhalt,Gym,,2022.0,Bio
714,1,0.8867272626669898,- Chromosomen und ihre Veränderung im Zellzyklus beschreiben - Struktur der DNA auf der Grundlage des Watson-Crick-Modells erläutern sowie deren identische Replikation erklären - Proteinbiosynthese als Prozess zur Realisierung der genetischen Informationen auf molekularer Ebene beschreiben - Veränderungen des genetischen Materials durch Mutagene erläutern sowie die Bedeutung für das Individuum ableiten - Regulation der Genaktivität bei Eukaryoten auf der Grundlage der,Sachsen-Anhalt,Gym,,2022.0,Bio
715,1,0.9006356326278236,Struktur der DNA auf der Grundlage des Watson-Crick-Modells erläutern sowie deren identische Replikation erklären - Proteinbiosynthese als Prozess zur Realisierung der genetischen Informationen auf molekularer Ebene beschreiben - Veränderungen des genetischen Materials durch Mutagene erläutern sowie die Bedeutung für das Individuum ableiten - Regulation der Genaktivität bei Eukaryoten auf der Grundlage der Methylierung der DNA erklären - Bedeutung von embryonalen Stammzellen,Sachsen-Anhalt,Gym,,2022.0,Bio
716,3,0.4905423533346149,"und protokollieren Kommunikationskompetenz geeignete Darstellungsformen für molekulargenetische Zusammenhänge nutzen - zu humangenetischen Fragestellungen selbstständig im Internet recherchieren, Relevanz und Zuverlässigkeit der Informationen einschätzen und die Ergebnisse adressatengerecht präsentieren - bei genetischen Sachverhalten zwischen Alltags- und Fachsprache unterscheiden Bewertungskompetenz - anhand relevanter Bewertungskriterien Handlungsoptionen in gesellschaftlich- oder alltagsrelevanten Entscheidungssituationen in Bezug auf den Einsatz von Stammzellen abwägen - Möglichkeiten und Grenzen humangenetischer",Sachsen-Anhalt,Gym,,2022.0,Bio
717,1,0.5550781076272798,"von Gentechnologie aus persönlicher Perspektive reflektieren Grundlegende Wissensbestände - Zellzyklus, Rekombination - Struktur der Nukleinsäuren DNA, RNA, identische Replikation der DNA kontinuierlich und diskontinuierlich - Realisierung der Erbinformation: Prinzip des genetischen Codes, Proteinbiosynthese, EinGen-Ein-Polypeptid-Hypothese, Zusammenhang zwischen Gen, Genprodukt und Merkmal z. B. Polygenie, Polyphänie - Mutation, Mutagene, Genmutation - Anwendung Mendelscher Regeln: Dominanz, Rezessivität, autosomale Familienstammbäume - Regulation der Genaktivität bei",Sachsen-Anhalt,Gym,,2022.0,Bio
718,7,0.9723338750279268,"im Zusammenhang mit Umwelteinflüssen verändern. Die individuelle Entwicklung von Lebewesen und die Weitergabe ihrer genetischen Information durch Fortpflanzung sind die Grundlage für evolutive Entwicklung. Sexuelle Fortpflanzung führt zur Rekombination von genetischem Material und erhöht die genetische Variation. Zusammen mit Selektion ist genetische Variation eine wichtige Ursache für Artwandel. Innerhalb dieses Basiskonzeptes gibt es wesentliche Prinzipien, z. B. Zelldifferenzierung, Reproduktion, Selektion. Im",Sachsen-Anhalt,Gym,,2022.0,Bio
719,6,0.5038360590015443,zur Proteinbiosynthese den Weg vom Gen zum Merkmal erläutern - Mutation als Veränderung der Erbinformation erklären - Zusammenhänge zwischen Erbkrankheiten und Mutationen darstellen - Modifikationen als Anpassungserscheinung von Organismen innerhalb genetischer Grenzen erläutern - Zellteilung als biologische Grundlage für Krebserkrankungen ableiten - Verfahren der klassischen Züchtung sowie zur Erzeugung gentechnisch veränderter Organismen anhand einfacher Schemata beschreiben und die Anwendung genetischer Erkenntnisse,Sachsen-Anhalt,Gym,,2022.0,Bio
720,6,0.5012465393349318,innerhalb genetischer Grenzen erläutern - Zellteilung als biologische Grundlage für Krebserkrankungen ableiten - Verfahren der klassischen Züchtung sowie zur Erzeugung gentechnisch veränderter Organismen anhand einfacher Schemata beschreiben und die Anwendung genetischer Erkenntnisse nachweisen Erkenntnisgewinnungskompetenz - geeignete Modelle zur Veranschaulichung von Struktur- und Funktionszusammenhängen der DNA nutzen MIK Chromosomen und Zellteilungsstadien mikroskopieren SE Modellexperiment zur interchromosomalen Rekombination durchführen und auswerten - Mendelsche,Sachsen-Anhalt,Gym,,2022.0,Bio
721,6,0.500309509288243,"Züchtung und zu gentechnisch veränderten Organismen auswählen, vergleichen und auswerten - Individualität im Zusammenhang mit Organtransplantation diskutieren - Messwerte zur Modifikation erfassen, grafisch darstellen und auswerten - Zusammenhang zwischen Umwelt, genetischer Prädisposition und Krebserkrankung diskutieren - Chancen und Risiken der Anwendung von Forschungsergebnissen der Genetik auch in Bezug auf den Erhalt der Biodiversität diskutieren - Alltagsvorstellungen zu Vorgängen der Vererbung in",Sachsen-Anhalt,Gym,,2022.0,Bio
722,6,0.543669118871907,"in digitalen Medien recherchieren und mit Fachkenntnissen prüfen Bewertungskompetenz - Materialien zur Gentechnik hinsichtlich deskriptiver und normativer Aussagen analysieren - Umwelteinflüsse unter dem Aspekt der genetischen Risiken bewerten - Anwendungen genetischer Forschungsergebnisse unter ethischen Gesichtspunkten reflektieren und dabei Werte identifizieren, die normativen Aussagen zugrunde liegen - Möglichkeiten und Grenzen der humangenetischen Beratung sowie der genetischen Forschung zur Lösung von Menschheitsproblemen und",Sachsen-Anhalt,Gym,,2022.0,Bio
723,5,0.41749266891873243,"anwenden - biologische Phänomene auf ultimater und proximater Ebene analysieren - strukturelle und funktionelle Gemeinsamkeiten und Unterschiede von Organismen als Ergebnis des Variations-Selektionsmechanismus deuten - Menschenaffe und Mensch hinsichtlich anatomischer, genetischer und verhaltensbiologischer Merkmale vergleichen und verwandtschaftliche Beziehungen ableiten - Variabilität als Folge von Rekombination, Mutation bzw. Modifikation sowie deren Bedeutung für die Evolution an Beispielen beschreiben und erklären - Fossilien,",Sachsen-Anhalt,Gym,,2022.0,Bio
724,3,0.7652956758966263,"Material beschreiben Erkenntnisgewinnungskompetenz Modellierungen zur DNA-Struktur auf der Grundlage des Watson-CrickModells planen und durchführen sowie Möglichkeiten und Grenzen von Modellen diskutieren - Fragestellungen zur genetischen Rekombination entwickeln sowie zur Entstehung genetischer Erkrankungen aus dem Verlauf der Meiose ableiten in recherchierten Daten zu klassischen Versuchen zur Vererbung Strukturen, Beziehungen und Trends finden und Schlussfolgerungen ziehen - Vererbung von Merkmalen anhand von Familienstammbäumen",Sachsen-Anhalt,Gym,,2022.0,Bio
725,3,0.7773686490336064,"erläutern Erkenntnisgewinnungskompetenz - Modellierungen zur DNA-Struktur auf der Grundlage des Watson-CrickModells planen und durchführen sowie Möglichkeiten und Grenzen von Modellen diskutieren - Fragestellungen zur genetischen Rekombination entwickeln sowie die Entstehung genetischer Erkrankungen aus dem Verlauf der Meiose ableiten - in recherchierten Daten zu klassischen Versuchen zur Vererbung Strukturen, Beziehungen und Trends finden und Schlussfolgerungen ziehen - Vererbung von Merkmalen anhand von",Sachsen-Anhalt,Gym,,2022.0,Bio
726,5,0.5043594332309361,"adulte Stammzelle, differenzierte Zelle - Bau und Vermehrung von Bakterien und Viren - Werkzeuge der Gentechnik: Restriktionsenzyme, Vektoren, Ligasen, Selektionsmarker - Verfahrensschritte zur Erzeugung von gentechnisch veränderten Organismen - Anwendung genetischer Erkenntnisse: PCR, Gelelektrophorese, genetischer Fingerabdruck, gentherapeutische Verfahren somatisch, Keimbahn Bezüge zu den fächerübergreifenden Themen gemäß Grundsatzband Kap. Innovation, Infrastruktur und Digitalität Deutsch, Englisch, Französisch, Italienisch, Chemie, Physik, Geschichte, Sozialkunde, Ethikunterricht,",Sachsen-Anhalt,Gym,,2022.0,Bio
727,3,0.5192670007137874,"- Bau und Vermehrung von Bakterien und Viren - Werkzeuge der Gentechnik: Restriktionsenzyme, Vektoren, Ligasen, Selektionsmarker - Verfahrensschritte zur Erzeugung von gentechnisch veränderten Organismen - Anwendung genetischer Erkenntnisse: PCR, Gelelektrophorese, genetischer Fingerabdruck, gentherapeutische Verfahren somatisch, Keimbahn Bezüge zu den fächerübergreifenden Themen gemäß Grundsatzband Kap. Innovation, Infrastruktur und Digitalität Deutsch, Englisch, Französisch, Italienisch, Chemie, Physik, Geschichte, Sozialkunde, Ethikunterricht, Evangelischer Religionsunterricht, Geographie, Informatik",Sachsen-Anhalt,Gym,,2022.0,Bio
728,5,0.8345573035009873,einem Beispiel materialgestützt erläutern - Zusammenhang zwischen Vorkommen bzw. Entwicklung von Organismen und dem Wirkungsgefüge der Umweltfaktoren erläutern sowie die daraus resultierende Angepasstheit erklären - ökologische Phänomene auf physiologischer und genetischer Grundlage erklären - Kohlenstoff- und Stickstoffkreislauf materialgestützt darstellen und die Bedeutung des Stickstoffs für den Organismus ableiten - Folgen des anthropogen bedingten Treibhauseffekts ableiten - intra- und interspezifische Beziehungen exemplarisch,Sachsen-Anhalt,Gym,,2022.0,Bio
729,3,0.350563761336325,"Bezug zum Menschen anhand von Materialien erläutern - Gesamtfitness der Individuen im Zusammenhang mit der Individualselektion und Verwandtenselektion erläutern ultimate Betrachtungsebene - Evolutionstendenzen an Beispielen erläutern - Klimaregeln aus evolutionsbiologischer, genetischer und physiologischer Sicht darstellen und anwenden Erkenntnisgewinnungskompetenz - Stammbäume auch mit Bezug auf ursprüngliche und abgeleitete Merkmale materialgestützt analysieren CS Evolutionsprozesse und Verhaltensstrategien z. B. Falke-TaubeModell mithilfe von Simulationen analysieren",Sachsen-Anhalt,Gym,,2022.0,Bio
730,6,0.628489201393762,"weitergegeben werden, geben an, dass Geschlechtszellen Gameten einen einfachen und Körperzellen einen doppelten Chromosomensatz besitzen, begründen anhand eines Karyogramms die Notwendigkeit der Reduktion des Chromosomensatzes in Geschlechtszellen, erklären die Begriffe Gen und Allel, geben an, dass eine Art eine Gruppe von Individuen ist, die untereinander fortpflanzungsfähig sind und fruchtbare Nachkommen haben können, geben an, dass eine Art Rassen Tiere bzw. Sorten",Saarland,Gym,9,2014.0,Bio
731,6,0.9570717159619307,"Schüler geben an, dass die Chromosomen die Träger der Erbinformation sind und sich im Zellkern befinden, beschreiben anhand eines Karyogramms den Chromosomensatz einer Körperzelle des Menschen, geben an, dass die Gene der Eltern durch Verschmelzung von Ei- und Spermienzelle an die Nachkommen weitergegeben werden, geben an, dass Geschlechtszellen Gameten einen einfachen und Körperzellen einen doppelten Chromosomensatz besitzen, begründen anhand eines Karyogramms",Saarland,Gym,9,2014.0,Bio
732,6,0.579084033190708,"Prozesse zu betrachten. - Folgende Symbole müssen verwendet werden: P, K, F, F, Rechtecke für Körperzellen, Kreise für Keimzellen, Großbuchstaben für dominante, Kleinbuchstaben für rezessive Allele, gleiche Buchstaben für gleiche Gene beim dominant-rezessiven Erbgang. - Einführung des Kombinationsquadrates - Es sind nur autosomal vererbte Merkmale zu betrachten, heterosomale Erbgänge folgen in Klassenstufe Weiterführende Inhalte - Vererbung des Rhesusfaktors",Saarland,Gym,9,2014.0,Bio
733,6,0.7887895126605678,Laufe der Jahre haben die Schülerinnen und Schüler damit alle bedeutenden Organsysteme des Menschen kennen gelernt und erreichen am Ende der Klassenstufe ein umfassendes Verständnis ihres Körpers. Das Themenfeld Klassische Genetik I wird in der Klassenstufe mit der Klassischen Genetik II und im G-Kurs mit der Klassischen Genetik III fortgesetzt. Im Themenfeld Immunsystem des Menschen und virale Erkrankungen wird zunächst die,Saarland,Gym,9,2014.0,Bio
734,6,0.7707873729056541,alle bedeutenden Organsysteme des Menschen kennen gelernt und erreichen am Ende der Klassenstufe ein umfassendes Verständnis ihres Körpers. Das Themenfeld Klassische Genetik I wird in der Klassenstufe mit der Klassischen Genetik II und im G-Kurs mit der Klassischen Genetik III fortgesetzt. Im Themenfeld Immunsystem des Menschen und virale Erkrankungen wird zunächst die menschliche Immunabwehr erarbeitet. Die Begriffe Antigen und Antikörper werden,Saarland,Gym,9,2014.0,Bio
735,6,0.6929655200974377,"erreichen am Ende der Klassenstufe ein umfassendes Verständnis ihres Körpers. Das Themenfeld Klassische Genetik I wird in der Klassenstufe mit der Klassischen Genetik II und im G-Kurs mit der Klassischen Genetik III fortgesetzt. Im Themenfeld Immunsystem des Menschen und virale Erkrankungen wird zunächst die menschliche Immunabwehr erarbeitet. Die Begriffe Antigen und Antikörper werden in diesem Zusammenhang eingeführt, ebenso die Antigen-Antikörper-Reaktion und",Saarland,Gym,9,2014.0,Bio
736,6,0.6010386199913174,hierzu in Beziehung zu setzen Kompetenzbereich Kommunikation. Sie bewerten darüber hinaus die Folgen einer Sucht und recherchieren Präventionsmaßnahmen Kompetenzbereich Bewertung. Erste Merkmale und Gesetzmäßigkeiten der Vererbung werden im Themenfeld Klassische Genetik I eingeführt Basiskonzept Entwicklung. In der Klassenstufe beschränken sie sich auf die Erläuterung von mono- und dihybriden Erbgängen sowie Stammbäumen mit autosomaler Vererbung. Die Mechanismen der Mitose und Meiose werden,Saarland,Gym,9,2014.0,Bio
737,6,0.7481812866166566,"und Organspende Der Mensch als System: Blut und Blutgruppen Zusammensetzung des Blutes Blutgruppen des Menschen Der Mensch als System: Sinnesorgane, Nervensystem, Suchtmittel und Süchte Sinnesorgane Nervensystem Suchtmittel und Süchte Klassische Genetik I Mono- und dihybride Erbgänge Der Mensch als System: Immunsystem und virale Erkrankungen Biologie Der Themenkreis Der Mensch als System wurde bereits in den Klassenstufen , und unterrichtet und wird",Saarland,Gym,9,2014.0,Bio
738,6,0.7333126655448584,"wurde bereits in den Klassenstufen , und unterrichtet und wird in der Klassenstufe mit den Themenfeldern Immunsystem und virale Erkrankungen, Blut und Blutgruppen, Sinnesorgane, Nervensystem, Suchtmittel und Süchte und Klassische Genetik I fortgesetzt. Im Themenfeld Immunsystem und virale Erkrankungen wird auch das Thema Gewebe- und Organspende berücksichtigt. Bei der Unterrichtseinheit Immunsystem des Menschen kann auf das Vorwissen aus den Klassenstufen Bestandteile",Saarland,Gym,9,2014.0,Bio
739,6,0.4186651719581806,"Beratungsstellen vgl. http://www.saarland.de/.htm Weiterführende Inhalte - Vorgänge an der Synapse - Gedächtnismodelle - Lernen und Gedächtnis Kooperation mit anderen Fächern - Lehrplan Physik, Klassenstufe : Optische Abbildungen und Farben Klassische Genetik I Biologie Das Themenfeld Klassische Genetik I beinhaltet eine Einführung in die Vererbungslehre. Die Schülerinnen und Schüler betrachten mono- und dihybride Erbgänge sowie deren Gesetzmäßigkeiten Basiskonzept Entwicklung. Der erste Schwerpunkt",Saarland,Gym,9,2014.0,Bio
