document_id,most_prevalent_topic_id,most_prevalent_topic_probability,text_excerpt,state,school type,grade,year,subject
1011,11,0.7280029155071596,"Regelungen und Entscheidungen aus den Bereichen des öffentlichen und privaten Rechts im Hinblick auf die Erfüllung wesentlicher Funktionen des Rechts und rechtsstaatlicher Prinzipien. Dabei reflektieren sie, inwiefern das Recht einen gerechten Interessenausgleich schafft. analysieren anhand konkreter Beispiele Inhalt und Grenzen des Eigentums vor dem Hintergrund seiner Funktion als institutionelles Element der Sozialen Marktwirtschaft. Dabei beziehen sie grundlegende Wertvorstellungen der Eigentumsordnung im",Bayern,Gym,11,2023.0,Sozialkunde
1012,1,0.4007691836316419,"beim Kauf ca. Std. Kompetenzerwartungen Die Schülerinnen und Schüler ... vollziehen anhand konkreter Fälle die grundlegende Systematik des Rechts der Leistungsstörungen nach. Dabei ist ihnen die Intention des Gesetzgebers, einen gerechten Interessenausgleich herbeizuführen, bewusst. begründen in konkreten Fällen den Anspruch auf Schadensersatz neben der Leistung bei einer Nebenpflichtverletzung beim Kauf. Dabei greifen sie auf ihre rechtstechnischen Kompetenzen zurück und formulieren Texte",Bayern,Gym,13,2023.0,Sozialkunde
1013,5,0.3952291783180865,"Recht werden Regelungen des öffentlichen Rechts und des Zivilrechts sowie konkrete Sachverhalte bzw. Rechtsfälle insbesondere mit Blick auf grundlegende Funktionen des Rechts analysiert und vor dem Hintergrund allgemeiner Prinzipien der Gerechtigkeit beurteilt. Zudem erwerben die Schülerinnen und Schüler auch Kompetenzen, die sie zur juristisch fundierten Durchsetzung eigener Ansprüche befähigen. Wirtschaft und Recht in Jahrgangstufe und erhöhtes Anforderungsniveau In den Jahrgangsstufen und",Bayern,Gym,,,Sozialkunde
1014,5,0.3508973261014499,"Recht werden Regelungen des öffentlichen Rechts und des Zivilrechts sowie konkrete Sachverhalte bzw. Rechtsfälle insbesondere mit Blick auf grundlegende Funktionen des Rechts analysiert und vor dem Hintergrund allgemeiner Prinzipien der Gerechtigkeit beurteilt. Zudem erwerben die Schülerinnen und Schüler auch Kompetenzen, die sie zur juristisch fundierten Durchsetzung eigener Ansprüche befähigen. Die juristische Arbeits- und Denkweise wird im erhöhten Anforderungsniveau aufgrund einer inhaltlich",Bayern,Gym,,,Sozialkunde
1015,10,0.23863914952290652,"gesamtwirtschaftliche Sichtweise sowie in Mathematik Diagramme und Grafiken sowie statistische Methoden, Elemente der Funktionenlehre, Geschichte Entwicklung von Wirtschaftssystemen und ihre Hintergründe, Geographie Globalisierung, Nachhaltigkeit, Religionslehre und Ethik Konsum, Recht und Gerechtigkeit sowie Politik und Gesellschaft Sozialstaat. Zusätzlich besteht die Möglichkeit, im zweisprachigen Fachunterricht die Gegebenheiten des eigenen Wirtschafts- und Rechtssystems mit anderen Wirtschaftsräumen zu vergleichen und gleichzeitig eine erhöhte fachsprachliche Kommunikationskompetenz",Bayern,Gym,,,Sozialkunde
1016,5,0.3458026746329612,"diskutieren sie auch ethische Aspekte bei der Beeinflussung von Verhalten durch verhaltensökonomische Maßnahmen. In Jahrgangsstufe wird das Fach Wirtschaft und Recht seiner Leitfachfunktion für die Politische Bildung im besonderen Maße gerecht. Es weitet sich der Blick auf gesamtwirtschaftliche Zusammenhänge in Deutschland, Europa und der Welt. Die Schülerinnen und Schüler nehmen verstärkt die Rolle des Staatsbürgers ein und analysieren, diskutieren und beurteilen",Bayern,Gym,,,Sozialkunde
1017,5,0.41591461547553626,"Rahmen einer Projektarbeit ein eigenes Geschäftsmodell und vollziehen unternehmerisches Denken und Entscheiden nach. In Jahrgangsstufe wird das Fach Wirtschaft und Recht seiner Leitfachfunktion für die politische Bildung im besonderen Maße gerecht. Es weitet sich der Blick auf gesamtwirtschaftliche Zusammenhänge in Deutschland, Europa und der Welt. Die Schülerinnen und Schüler nehmen verstärkt die Rolle des Staatsbürgers ein und analysieren, diskutieren und beurteilen",Bayern,Gym,,,Sozialkunde
1018,5,0.39672358089970117,"die Urteils- und Orientierungskompetenz von grundlegender Bedeutung ist. Als Schlüsselbegriffe und -konzepte wären vor allem zu nennen: Macht, Interesse, Konflikt, Öffentlichkeit, Entscheidung, Ideologie, Geschichtlichkeit, Menschenwürde und Menschenrechte, Toleranz, Markt, Preis, Recht/Gerechtigkeit, Nachhaltigkeit; als Schlüsselprobleme bedeutende politische, ökonomische und gesellschaftliche Konfliktfelder, wie z.B. Umweltschutz versus Arbeitslosigkeit, Handelsöffnung für Produkte aus ärmeren Ländern versus Protektion heimischer Wirtschaftszweige. In jedem Fall ist die Doppelperspektive",Berlin,Gym,Sek2,,Sozialkunde
1019,5,0.45518235065550783,"Bestimmung staatlichen Handelns an Fähigkeit zum sozialwissenschaftlichen Analysieren. B Wirtschaftspolitik Inhalte Ordnungspolitik Geldpolitik Fiskalpolitik Steuersystem, vor allem Einkommensteuertarif Beschäftigungs- und Wachstumspolitik Konjunkturverlauf, Stabilitätsgesetz, Angebotsund Nachfrageorientierung, Arbeitsmarktpolitik Sozialpolitik Umweltpolitik Wirtschaft und Gerechtigkeit Kompetenzerwerb im Themenfeld Die Schülerinnen und Schüler erkennen die negativen Auswirkungen eines fehlenden Wettbewerbs und damit die konstitutive Bedeutung einer Wettbewerbsbehörde z.B. Bundeskartellamt für eine marktwirtschaftliche Ordnung politische Urteilsfähigkeit. Die",Berlin,Gym,Sek2,,Sozialkunde
1020,5,0.6368733614812092,"Schülerinnen und Schüler die Möglichkeiten zur Steuerung der Geldmenge und Inflation Fähigkeit zum sozialwissenschaftlichen Analysieren. Durch die Diskussion unterschiedlicher wachstums-, umwelt- und beschäftigungspolitischer Instrumente - auch unter dem Postulat der Gerechtigkeit - verbessern die Schülerinnen und Schüler alle zentralen sozialwissenschaftlichen Kompetenzen. Recht, Staat und Politik in Deutschland und Europa A Rechtsordnung der Bundesrepublik Deutschland Inhalte Steuerung durch Recht Norm, Wirklichkeit, Moral;",Berlin,Gym,Sek2,,Sozialkunde
1021,5,0.6048588959338058,"Planwirtschaft, Soziale Marktwirtschaft negative externe Effekte sowie positive externe Effekte und öffentliche Güter B Wirtschaftspolitik Geldpolitik Fiskalpolitik v. a. Einkommensteuertarif Beschäftigungs- und Wachstumspolitik Konjunkturverlauf, Angebots- und Nachfrageorientierung Sozialpolitik Wirtschaft und Gerechtigkeit Mögliche Kontexte Einkommensteuererklärung Unterrichtsbesuche von Vertretern von Parteien und Verbänden Kurshalbjahr sw-: Recht, Staat und Politik in Deutschland und Europa A Rechtsordnung der Bundesrepublik Deutschland Steuerung durch Recht Norm, Wirklichkeit,",Berlin,Gym,Sek2,,Sozialkunde
1022,5,0.5623011097769024,"externe Effekte sowie positive externe Effekte und öffentliche Güter B Wirtschaftspolitik Ordnungspolitik Geldpolitik Fiskalpolitik Steuersystem, vor allem Einkommensteuertarif Beschäftigungs- und Wachstumspolitik Konjunkturverlauf, Stabilitätsgesetz, Angebotsund Nachfrageorientierung, Arbeitsmarktpolitik Sozialpolitik Umweltpolitik Wirtschaft und Gerechtigkeit Mögliche Kontexte Einkommensteuererklärung Kontakte zu Vertretern von Parteien und Verbänden Kurshalbjahr SW-: Recht, Staat und Politik in Deutschland und Europa A Rechtsordnung der Bundesrepublik Deutschland Steuerung durch Recht Norm, Wirklichkeit,",Berlin,Gym,Sek2,,Sozialkunde
1023,11,0.3717370181687734,"sozialer Verantwortung erfolgreich selbstständig zu handeln und für ihre und die Zukunft der Gesellschaft Verantwortung zu übernehmen. Das Fach Sozialwissenschaften wird dem wissenschaftspropädeutischen Anliegen der gymnasialen Oberstufe in besonderer Weise gerecht. Da alle Wissenschaft nur als perspektivische Konstruktion von Wirklichkeit verstanden werden kann, wird den Schülerinnen und Schülern im multiperspektivischen Ansatz des Faches besonders deutlich, dass die wachsende Komplexität der Welt",Berlin,Gym,Sek2,,Sozialkunde
1024,2,0.3810477288624773,"der Krisenbewältigung SK. Didaktische Hinweise Wiederholung: Kartenarbeit zur Ausbreitung der Pest: Topographie Deutschlands Klassenstufe und Topographie des Mittelmeerraumes Klassenstufe gekoppelt an die Ausbreitung der Pest Kategorien zur Konsenssuche und Konfliktregulierung: Gerechtigkeit, Toleranz, Gewaltfreiheit Möglicher Einstieg und Motivation unterrichtliche Umsetzung folgt dem Aktualitätsprinzip Gegenwartsbezug Einstieg in selbstständiges Recherchieren über Webquest-Methode. Infos zur WebquestMethode unter www.webquests.de historische Naturkatastrophen: Pompeji Ausbruch des Vesuvs am",Saarland,Gemeinschaftsschule,"7,8",2014.0,Sozialkunde
1025,11,0.600523738639676,"Umweltpolitik und begründen die Notwendigkeit staatlicher Ordnungspolitik im Bereich des Umweltschutzes SK, BK, Industrialisierung und Sozialen Frage Soziale Frage und Lösungsversuche Arbeiterverein, Streik, Gewerkschaft benennen und beurteilen Probleme der sozialen Gerechtigkeit am Beispiel der Sozialen Frage und stellen Lösungsansätze exemplarisch dar SK, BK, erläutern Bismarcks Sozialgesetzgebung SK, BK, Marktwirtschaftliche Ordnungen begründen den Wandel der freien Marktwirtschaft zur sozialen und ökologischen Marktwirtschaft",Saarland,Gemeinschaftsschule,"7,8",2014.0,Sozialkunde
1026,11,0.38956930899282927,"Nachhaltigkeit BK, Jugendliche engagieren sich Eine Welt nennen Möglichkeiten der Entwicklungszusammenarbeit und entwickeln Ideen im Sinne des Nachhaltigkeitsdreiecks BK, MK, HK, engagieren sich für den Erhalt des Friedens und internationale Gerechtigkeit HK. organisieren eine eigene Aktion zur Entwicklungszusammenarbeit HK. Imperialismus und Entwicklungspolitik Gesellschaftswissenschaften Didaktische Hinweise Analyse historischer Gemälde zur Reichsgründung: Kaiserproklamation Wilhelms I. in Versailles Anton von Werner, und Vergleich mit",Saarland,Gemeinschaftsschule,"7,8",2014.0,Sozialkunde
1027,4,0.6946574458384119,"Regeln Beteiligung Mediale Darstellung Lösungsansät Schuljahrgänge / Was ist Politik Menschenwürde, Freiheit, Gleichheit und Solidarität Verschiedene Interessengruppen Gesetze und Regeln des Zusammenlebens Vielfältige Beteiligungsmöglichkeiten Politik in der medialen Darstellung Interessenausgleich Gerechtigkeit für alle Rechtstaatlichkeit, Schutz vor Willkür, Menschenrechte und Schutz der Menschenwürde Konfliktgegner Rechte und Pflichten Rechtsweggarantie Informationspflicht oder Skandalisierung Gesetze und un hängige Gericht Konfliktregulieru Machen Medien Meinungen Pressefreiheit und",Niedersachsen,Realschule,,2015.0,Sozialkunde
1028,4,0.5630613944618139,aus den Medien zu entnehmen sind. Lösungsansätze Eine Problemlösung ist durch Interessenausgleich möglich. benennen Kompromiss und Konsens als Lösungsmöglichkeiten für Interessenskonflikte. erörtern die Auswirkungen eines Kompromisses oder Konsenses. Themenfeld : Gerechtigkeit für alle Themenbezüge zu Werte und Normen sowie Geschichte Orientierungswissen unter den Aspekten des Politikzyklus Analysekompetenz Urteilskompetenz Die Schülerinnen und Schüler ... Normative Grundlagen Grundlage bildet die Rechtstaatlichkeit: Schutz vor,Niedersachsen,Realschule,,2015.0,Sozialkunde
1029,3,0.4174729850554849,"Politik ist es, die Schülerinnen und Schüler zu befähigen, sich aktiv in politische Willensbildungsprozesse einzubringen. Dazu braucht man ein Grundverständnis für Politik und Einsichten in politische Zusammenhänge. Um diesem Bildungsauftrag gerecht zu werden, muss besonders das Fach Politik ein Lernen auch über Medien ermöglichen, denn politische Prozesse werden fast ausschließlich über Medien wahrgenommen. Medien liefern Material für die Konstruktion von Leitbildern",Niedersachsen,Realschule,,2015.0,Sozialkunde
1030,11,0.2984807385211521,"Beteiligung Transparenz Erfolgt der Entscheidungsprozess transparent Demokratie Werden demokratische Kriterien bzw. Grundsätze verletzt/eingehalten Sicherheit Wird die Sicherheit erhöht/gesenkt Frieden Wird das friedliche Zusammenleben gefährdet/ gefördert Freiheit Wird die Freiheit gestärkt/geschwächt Gerechtigkeit/ Solidarität Wie un-gerecht ist die Entscheidung in Bezug auf Leistungs-, Bedarfs- oder Chancengerechtigkeit Nachhaltigkeit Ist die Entscheidung sozial, ökologisch und/oder ökonomisch nachhaltig Kompetenzentwicklung in den Schuljahrgängen Übersicht Schuljahrgänge Kompetenzschwerpunkte Schuljahrgang",Sachsen-Anhalt,Gym,,2022.0,Sozialkunde
1031,11,0.41016505353354865,beurteilen - die Verantwortung verschiedener Sozialisationsinstanzen sowie des Einzelnen für das Einhalten rechtlicher Bestimmungen beurteilen Urteilskompetenz - die Angemessenheit von Sanktionsmöglichkeiten bei Rechtsverstößen unter Einbeziehung des Unterschieds von Recht und Gerechtigkeit diskutieren Handlungskompetenz - in einem Kontroversverfahren oder einem Rollenspiel unterschiedliche Perspektiven zu Sanktionsmöglichkeiten bei Rechtsverstößen veranschaulichen Grundlegende Wissensbestände - Schritte und Kategorien der angewandten analytischen Methode - Rechtsvorschriften für das,Sachsen-Anhalt,Gym,,2022.0,Sozialkunde
1032,4,0.481290036991849,"B. Jugendstrafe, Zuchtmittel, Erziehungsmaßnahmen - Sozialisationsinstanzen und ihre Verantwortung für rechtliches Handeln - das Verhältnis von kollektiv verbindlichem Recht und subjektivem Gerechtigkeitsempfinden, der Umgang mit dem Spannungsverhältnis von Recht und Gerechtigkeit - Handeln im Netz, z. B. Netiquette, Persönlichkeitsrechte, Privatsphäre, Datenschutz Möglichkeiten zur Abstimmung in den Schuljahrgängen - Ethikunterricht: Strafgerechtigkeit diskutieren Funktionen des Rechts, Verhältnismäßigkeit von Schuld und Strafe, Resozialisierung, Abschreckung",Sachsen-Anhalt,Gym,,2022.0,Sozialkunde
1033,5,0.40623769567544304,"und Entscheidungsprozesse der Akteure einbeziehen Grundlegende Wissensbestände - Schritte und Kategorien der angewandten analytischen oder simulativen Methode - Konzeption der sozialen Marktwirtschaft: Verbindung von Marktwirtschaft, Freiheit, sozialem Ausgleich und sozialer Gerechtigkeit, Unterschiede zu freier Marktwirtschaft und Planwirtschaft - Aufgaben und Ziele des Staates, z. B. Sicherung von Wettbewerb, freier Preisbildung und dauerhaftem, inklusivem und nachhaltigem Wirtschaftswachstum, Minderung sozial unerwünschter Auswirkungen der",Sachsen-Anhalt,Gym,,2022.0,Sozialkunde
1034,14,0.20174117049779042,"Inflation oder Deflation, Ungleichheit, Regulierung von Marktversagen u. a. Gewährleistung inklusiver, gerechter und hochwertiger Bildungspolitik - wirtschafts- und sozialpolitische Aufgaben und Handlungsmöglichkeiten von Parteien und Interessenverbänden - unterschiedliche Dimensionen sozialer Gerechtigkeit als ideologische Konzepte, z. B. Chancen-, Leistungs-, Bedarfs-, Generationengerechtigkeit Bezüge zu den fächerübergreifenden Themen gemäß Grundsatzband Kap. Keine Armut und kein Hunger Latein, Griechisch, Biologie, Chemie, Katholischer Religionsunterricht, Geographie Bildung,",Sachsen-Anhalt,Gym,,2022.0,Sozialkunde
1035,15,0.4367109853989141,- den Wert der angewandten sozialwissenschaftlichen Methode für das Gewinnen von Erkenntnissen und das Einschätzen politischer oder gesellschaftlicher Prozesse bewerten - kontroverse wissenschaftliche Lösungsansätze vor dem Hintergrund unterschiedlicher Vorstellungen sozialer Gerechtigkeit bewerten Handlungskompetenz - die durch eigene Anwendung sozialwissenschaftlicher Methoden gewonnenen Erkenntnisse mithilfe digitaler Medien und Endgeräte adressatengerecht sprachlich und fachsprachlich präsentieren und den Umgang mit der gewählten Methode reflektieren -,Sachsen-Anhalt,Gym,,2022.0,Sozialkunde
1036,11,0.35109650984876833,"Wissensbestände - Ziele, Anforderungen und Schritte einer sozialwissenschaftlichen Methode - Aussagekraft sozialwissenschaftlicher Methoden, z. B. Befragung, teilnehmende Beobachtung, Interview, Experiment, Gruppendiskussion, Expertengespräch, SzenarioTechnik - Erscheinungsformen sozialer Ungleichheit und Vorstellungen sozialer Gerechtigkeit, z. B. Armut, fehlende Bildungschancen, Arbeitsbedingungen - kontroverse sozialpolitische Konzepte und Lösungsansätze, z. B., bedingungsloses Grundeinkommen, Gleichstellung der Geschlechter, Veränderung von Bildungsmöglichkeiten und Arbeitsbedingungen, Inklusion Bezüge zu den fächerübergreifenden Themen",Sachsen-Anhalt,Gym,,2022.0,Sozialkunde
1037,11,0.35971424767113575,"der Entscheidungsprozess transparent Demokratie Werden demokratische Kriterien bzw. Grundsätze verletzt/eingehalten Sicherheit Wird die Sicherheit erhöht/gesenkt Frieden Wird das friedliche Zusammenleben gefährdet/ gefördert Freiheit Wird die Freiheit gestärkt/geschwächt Gerechtigkeit/ Solidarität Wie un-gerecht ist die Entscheidung in Bezug auf Leistungs-, Bedarfs- oder Chancengerechtigkeit Nachhaltigkeit Ist die Entscheidung sozial, ökologisch und/oder ökonomisch nachhaltig Kompetenzentwicklung in den Schuljahrgängen Übersicht Schuljahrgänge Kompetenzschwerpunkte Schuljahrgang - Demokratische Mitwirkungsmöglichkeiten",Sachsen-Anhalt,Gym,,2022.0,Sozialkunde
1038,5,0.38413580130147623,"Ausgleich wirtschaftlicher Interessen zwischen armen und reichen Ländern, Verflechtung nationaler und internationaler Märkte, Sicherung des Wohlfahrtsstaates, abnehmende Macht der Arbeitnehmer, zunehmende Macht internationaler Konzerne, Absicherung eines fairen und nachhaltigen Handels, gerechte und nachhaltige Gütererzeugung und Entsorgung, Umweltschutz, Erderwärmung - wirtschaftspolitische Konzepte in einer globalisierten und digitalen Welt, z. B. Nachfrage- und Angebotsorientierung, Konzept der Nachhaltigkeit, Global Economic Governance - mögliche Erklärungsansätze,",Sachsen-Anhalt,Gym,,2022.0,Sozialkunde
1039,5,0.35614182782987863,"Preisbildung und dauerhaftem, inklusivem und nachhaltigem Wirtschaftswachstum, Minderung sozial unerwünschter Auswirkungen der Marktwirtschaft u. a. Maßnahmen gegen Arbeitslosigkeit, Armut, Inflation oder Deflation, Ungleichheit, Regulierung von Marktversagen u. a. Gewährleistung inklusiver, gerechter und hochwertiger Bildungspolitik - wirtschafts- und sozialpolitische Aufgaben und Handlungsmöglichkeiten von Parteien und Interessenverbänden - unterschiedliche Dimensionen sozialer Gerechtigkeit als ideologische Konzepte, z. B. Chancen-, Leistungs-, Bedarfs-, Generationengerechtigkeit Bezüge zu",Sachsen-Anhalt,Gym,,2022.0,Sozialkunde
1040,14,0.9772357528194301,"einnehmen; von Empathie geleitet handeln; sich durchsetzen; Toleranz üben; Zivilcourage zeigen: sich einmischen und in zentralen Fragen das Miteinander betreffend Stellung beziehen. Dazu gehören wertbewusste Haltungen: um Kategorien wie Respekt, Gerechtigkeit, Fairness, Kostbarkeit, Eigentum und deren Stellenwert für das Miteinander wissen; ökologisch nachhaltig handeln; mit friedlicher Gesinnung im Geiste der Völkerverständigung handeln, ethische Normen sowie kulturelle und religiöse Werte kennen, reflektieren",Hessen,Gym,Sek2,2024.0,Sozialkunde
1041,11,0.5946639470752866,"zu begegnen. Die Lernenden entwickeln Handlungsmöglichkeiten, gegebenenfalls alternative Konzepte, und reflektieren diese. Sie setzen dabei ihr Handeln gemäß eigener Ziele, Interessen und Werte in Beziehung zu unterschiedlichen Vorstellungen von Gemeinwohl, Gerechtigkeit und Nachhaltigkeit im Rahmen rechtstaatlicher Demokratie. Verantwortungsvolles Handeln schließt die Fähigkeit und Bereitschaft zu Kontroversität, Konsens und Toleranz mit ein. Die Lernenden kennen entsprechende Institutionen, Wege und Verfahren zur Realisierung",Hessen,Gym,Sek2,2024.0,Sozialkunde
1042,11,0.3322323712271237,"unterschiedliche Perspektiven politischer Analyse und Theoriebildung akzentuieren: - gouvernementale staatszentrierte: Führung, Macht, Herrschaft, Hierarchie versus emanzipatorische staatskritische: Teilhabe, Partizipation, Gleichheit, Demokratisierung, - normative wertbezogene: Kampf um gute Ordnung, Freiheit, Friede, Gerechtigkeit versus deskriptive beschreibende: verbindliche Konfliktregelung mittels Gesetzen und Verfahren, - konfliktorientierte Interessensgegensätze, Klassenkampf, Krieg versus konsensbezogene Gemeinwohl, Ausgleich. Das Spektrum unterschiedlicher Grundverständnisse und Betrachtungsweisen von Politik findet sich im Unterricht",Hessen,Gym,Sek2,2024.0,Sozialkunde
1043,5,0.4020850809361225,"Ungleichzeitigkeiten in der politischen, wirtschaftlichen und gesellschaftlichen Entwicklung von Staaten und Regionen. Der Unterricht vergegenwärtigt gegenüber einer bloß analytischen Betrachtung von Politik daher die Bedeutung lebendiger Demokratie, materieller Rechtsstaatlichkeit, sozialer Gerechtigkeit, des Schutzes vor Diskriminierung und ökologischer Nachhaltigkeit als Voraussetzungen würdevollen und selbst bestimmten Lebens. Ein erstes Grundproblem der Domäne Wirtschaft ist die Interaktion unterschiedlicher wirtschaftlicher Akteure zur Ermöglichung wechselseitig vorteilhafter",Hessen,Gym,Sek2,2024.0,Sozialkunde
1044,11,0.3488659898194061,"die deskriptive, analytische und normative Bedeutung jeweiliger Politikbegriffe im Untersuchungszusammenhang reflektiert. Das Fach Politik und Wirtschaft reflektiert als Fach der politischen Bildung die Bedeutung der Werte Frieden, Freiheit, Sicherheit und gerecht verteilter Wohlstand gerade angesichts der bestehenden Ungleichzeitigkeiten in der politischen, wirtschaftlichen und gesellschaftlichen Entwicklung von Staaten und Regionen. Der Unterricht vergegenwärtigt gegenüber einer bloß analytischen Betrachtung von Politik daher die",Hessen,Gym,Sek2,2024.0,Sozialkunde
1045,5,0.48980248326790093,"des Jahrhunderts. Zukünftige Lebensbedingungen, berufliche Anforderungen sowie politische Partizipationsmöglichkeiten der Lernenden verändern sich durch diesen langfristigen Wandel erheblich. Das Kurshalbjahr thematisiert insbesondere Herausforderungen, die mit den Zielen Frieden, Sicherheit, Freiheit, gerecht verteilter Wohlstand und nachhaltige Entwicklung verbunden und für die Lebensqualität der Lernenden fundamental bedeutsam sind. Die Vermeidung von Unsicherheit und Gewalt in Form von zwischenstaatlichen Kriegen und Bedrohungsszenarien, Flucht und",Hessen,Gym,Sek2,2024.0,Sozialkunde
1046,14,0.3886510472344614,"sowie Schule insgesamt ist es daher, dass Lernende den europäischen Integrationsprozess begreifen und reflektieren. Die Integrationsthematik betrifft die Lernenden in unterschiedlichen Lebensbereichen unmittelbar, weil die Möglichkeiten, Frieden, Sicherheit, Freiheit sowie gerecht verteilten Wohlstand zu realisieren, erheblich von der europäischen Ebene beeinflusst werden. Die Lernenden untersuchen Fragen hinsichtlich der Ziele und Wege einer weiteren Europäischen Integration, wozu zwei Aspekte des Integrationsprozesses analysiert",Hessen,Gym,Sek2,2024.0,Sozialkunde
1047,5,0.42937694132621623,"Konjunkturpolitik - Herausforderungen prozessorientierter Wirtschaftspolitik Q. Nachhaltiges Wachstum und fairer Wettbewerb - Herausforderungen wirtschaftlicher Ordnungspolitik Q. Sicherung der Preisniveaustabilität in der Europäischen Währungsunion Q. Arbeitsmarkt- und Tarifpolitik Q. Kontroversen um gerechte Sozialpolitik und Probleme der Staatsfinanzierung verbindlich: Themenfelder und sowie in zwei der drei Kurshalbjahre Q- ein weiteres Themenfeld aus den Themenfeldern -, durch Erlass festgelegt; innerhalb dieser Themenfelder können durch",Hessen,Gym,Sek2,2024.0,Sozialkunde
1048,5,0.43998524160444796,"Bedarfs- und Leistungsgerechtigkeit, Chancengleichheit, Diskriminierungsprobleme - Bestimmungsgründe für das Angebot und die Nachfrage von Arbeitskräften und deren politische Steuerung - Auswirkungen des Strukturwandels auf Arbeitsmärkte und Strukturpolitik Q. Kontroversen um gerechte Sozialpolitik und Probleme der Staatsfinanzierung grundlegendes Niveau Grundkurs und Leistungskurs - Entwicklung sozialpolitischer Forderungen und sozialstaatlicher Leistungen - Möglichkeiten und Grenzen steuerfinanzierter Sozialpolitik - Analyse der Struktur der Einnahmen und",Hessen,Gym,Sek2,2024.0,Sozialkunde
1049,14,0.9772357528194301,"einnehmen; von Empathie geleitet handeln; sich durchsetzen; Toleranz üben; Zivilcourage zeigen: sich einmischen und in zentralen Fragen das Miteinander betreffend Stellung beziehen. Dazu gehören wertbewusste Haltungen: um Kategorien wie Respekt, Gerechtigkeit, Fairness, Kostbarkeit, Eigentum und deren Stellenwert für das Miteinander wissen; ökologisch nachhaltig handeln; mit friedlicher Gesinnung im Geiste der Völkerverständigung handeln, ethische Normen sowie kulturelle und religiöse Werte kennen, reflektieren",Hessen,Gym,Sek2,2024.0,Sozialkunde
1050,11,0.6121467205627912,"zu begegnen. Die Lernenden entwickeln Handlungsmöglichkeiten, gegebenenfalls alternative Konzepte, und reflektieren diese. Sie setzen dabei ihr Handeln gemäß eigener Ziele, Interessen und Werte in Beziehung zu unterschiedlichen Vorstellungen von Gemeinwohl, Gerechtigkeit und Nachhaltigkeit im Rahmen rechtsstaatlicher Demokratie. Verantwortungsvolles Handeln schließt die Fähigkeit und Bereitschaft zu Kontroversität, Konsens und Toleranz mit ein. Die Lernenden kennen entsprechende Institutionen, Wege und Verfahren zur Realisierung",Hessen,Gym,Sek2,2024.0,Sozialkunde
