document_id,most_prevalent_topic_id,most_prevalent_topic_probability,text_excerpt,state,school type,grade,year,subject
704,11,0.4105217109038125,"ein sensibler Umgang mit Vielfalt und der Erwerb moralischer Urteilsfähigkeit, verstanden als Fähigkeit, gesellschaftlich vermittelte Probleme und Herausforderungen wahrzunehmen und in einer gegebenen Situation nach angemessenem Verhalten und einer jeweils gerechten, solidarischen und demokratisch fundierten Lösung zu suchen. Beitrag zur Leitperspektive BNE: Folgen gruppenbezogener Menschenfeindlichkeit werden vor dem Hintergrund möglicher kultureller Hürden diskutiert. Die Auffassung, dass Menschengruppen als unterschiedslos und gleichartig",Hamburg,,Studienstufe,2022.0,"Ethik, Philo"
705,11,0.3589601466665386,"Mensch und Natur. Grundlegendes Ziel ist der Erwerb moralischer Urteilsfähigkeit, verstanden als Fähigkeit, gesellschaftlich vermittelte Probleme und Herausforderungen wahrzunehmen und in einer gegebenen Situation nach angemessenem Verhalten und einer jeweils gerechten Lösung zu suchen. Beitrag zur Leitperspektive BNE: Es werden die existenziellen, ökologischen und ökonomischen Herausforderungen, die eine Transformation unserer Lebensweise notwendig machen, fokussiert. Die Schülerinnen und Schüler reflektieren Gewohnheiten und",Hamburg,,Studienstufe,2022.0,"Ethik, Philo"
706,11,0.410719707230999,und urteilen Sich im Dialog verständigen Themen und Inhalte Wer bin ich - Identität und Rolle Wie frei bin ich - Freiheit und Verantwortung Was ist gerecht - Recht und Gerechtigkeit Was ist der Mensch - Mensch und Gemeinschaft Was soll ich tun - Handeln und Moral Worauf kann ich vertrauen - Wissen und Glauben Unterricht im Wahlpflichtfach Ethik Kompetenzentwicklung im,Berlin,,7-10,2015.0,"Ethik, Philo"
707,1,0.7042072332748772,"Erklärung der Weltreligionen Medienethik Tierethik z. B. P. Singer Umweltethik z. B. der Begriff der Natur in den Naturund Weltreligionen, in der Wissenschaft heute Was ist gerecht - Recht und Gerechtigkeit Schülerinnen und Schüler erleben in ihrem Alltag immer wieder Situationen, die sie als ungerecht empfinden. Doch was ist gerecht Gerechtes Handeln kann sowohl gleiche Behandlung als auch ungleiche Behandlung erfordern,",Berlin,,7-10,2015.0,"Ethik, Philo"
708,1,0.47209007483062315,"Doch was ist gerecht Gerechtes Handeln kann sowohl gleiche Behandlung als auch ungleiche Behandlung erfordern, je nachdem, in welchem Kontext es stattfindet. Hieraus ergibt sich die Notwendigkeit zu klären, was Gerechtigkeit in verschiedenen Situationen eigentlich bedeutet und welche Prinzipien es gibt, nach denen z. B. Güter gerecht verteilt oder Verfahren gerecht vollzogen werden können. Wer Regeln und Gesetze nicht einhält oder",Berlin,,7-10,2015.0,"Ethik, Philo"
709,11,0.6152835098390342,"Einzelnen widersprechen. Anhand solcher Fälle gilt es beispielhaft zu prüfen, wann der Mensch das Recht oder sogar die moralische Pflicht hat, sich geltendem Recht zu widersetzen. Schülerinnen und Schüler verbinden Gerechtigkeit oft mit Gleichheit. Daher gilt es kritisch zu hinterfragen, in welchem Verhältnis diese Begriffe stehen und wie sie beispielsweise im Grundgesetz in Verbindung mit dem Begriff der Würde auftreten. Inhalte",Berlin,,7-10,2015.0,"Ethik, Philo"
710,1,0.5410249630237981,"hinterfragen, in welchem Verhältnis diese Begriffe stehen und wie sie beispielsweise im Grundgesetz in Verbindung mit dem Begriff der Würde auftreten. Inhalte Vertiefungsmöglichkeiten/mögliche Konkretisierungen Individuelle Perspektive Gesellschaftliche Perspektive Ideengeschichtliche Perspektive Gerechtigkeit in verschiedenen Sphären Was empfinde ich als gerecht bzw. ungerecht Wann fühle ich mich gerecht bzw. ungerecht behandelt Wie sieht für mich eine gerechte Schule aus Muss ich ungerechte Gesetze",Berlin,,7-10,2015.0,"Ethik, Philo"
711,3,0.3070364248380793,"sind Regeln oder Gesetze ungerecht Haben alle Kinder in unserer Gesellschaft die gleichen Chancen Sollte es ein Weltgericht geben Müssen wir uns gegen Ungerechtigkeit in anderen Ländern einsetzen Allegorien der Gerechtigkeit Recht und Moral Rechtspositivismus und Naturrecht UNBehindertenrechtskonvention Widerstandsrecht Gerechtes Verteilen Muss ich Almosen geben Was bedeutet für mich gerechte Notengebung Ist es ungerecht, dass es Arme und Reiche gibt gesellschaftliche",Berlin,,7-10,2015.0,"Ethik, Philo"
712,11,0.23859141490407515,Studienplätze oder Gewinn in einem Unternehmen gerecht verteilt werden Gerechtigkeitsprinzipien Gerechtigkeitstheorien Prinzipien der sozialen Marktwirtschaft Gerechtigkeitsvorstellungen in den Weltreligionen Inhalte Vertiefungsmöglichkeiten/mögliche Konkretisierungen Individuelle Perspektive Gesellschaftliche Perspektive Ideengeschichtliche Perspektive Recht und Gerechtigkeit Welche Rechte habe ich als Kind bzw. Jugendlicher Welche Rolle spielen die Achtung und der Schutz der Menschenund Kinderrechte im gesellschaftlichen Zusammenleben und weltweit Entstehung der Menschenrechte und deren Begründung,Berlin,,7-10,2015.0,"Ethik, Philo"
713,11,0.35148874043019085,"spielen die Achtung und der Schutz der Menschenund Kinderrechte im gesellschaftlichen Zusammenleben und weltweit Entstehung der Menschenrechte und deren Begründung Menschenwürde und deren philosophische, religiöse bzw. weltanschauliche Deutungen und Begründungen Gerechtigkeit und Strafe Welche Strafen kenne ich aus eigener Erfahrung Welche Strafe habe ich als gerecht, welche als ungerecht empfunden Sind Strafen notwendig Wie sollen Regelverletzungen sanktioniert werden Wie lassen sich",Berlin,,7-10,2015.0,"Ethik, Philo"
714,11,0.4041290057394513,deuten Perspektiven einnehmen Argumentieren und urteilen Sich im Dialog verständigen Themen und Inhalte Wer bin ich - Identität und Rolle Wie frei bin ich - Freiheit und Verantwortung Was ist gerecht - Recht und Gerechtigkeit Was ist der Mensch - Mensch und Gemeinschaft Was soll ich tun - Handeln und Moral Worauf kann ich vertrauen - Wissen und Glauben Unterricht im,Berlin,,7-10,2015.0,"Ethik, Philo"
715,1,0.5633025248943817,"H. Jonas Projekt Weltethos Erklärung der Weltreligionen Medienethik Tierethik z. B. P. Singer Umweltethik z. B. der Begriff der Natur in den Naturund Weltreligionen, in der Wissenschaft heute Was ist gerecht - Recht und Gerechtigkeit Schülerinnen und Schüler erleben in ihrem Alltag immer wieder Situationen, die sie als ungerecht empfinden. Doch was ist gerecht Gerechtes Handeln kann sowohl gleiche Behandlung als",Berlin,,7-10,2015.0,"Ethik, Philo"
716,1,0.7630612817306162,"Weltreligionen, in der Wissenschaft heute Was ist gerecht - Recht und Gerechtigkeit Schülerinnen und Schüler erleben in ihrem Alltag immer wieder Situationen, die sie als ungerecht empfinden. Doch was ist gerecht Gerechtes Handeln kann sowohl gleiche Behandlung als auch ungleiche Behandlung erfordern, je nachdem, in welchem Kontext es stattfindet. Hieraus ergibt sich die Notwendigkeit zu klären, was Gerechtigkeit in verschiedenen Situationen",Berlin,,7-10,2015.0,"Ethik, Philo"
717,1,0.414257891482841,"nachdem, in welchem Kontext es stattfindet. Hieraus ergibt sich die Notwendigkeit zu klären, was Gerechtigkeit in verschiedenen Situationen eigentlich bedeutet und welche Prinzipien es gibt, nach denen z. B. Güter gerecht verteilt oder Verfahren gerecht vollzogen werden können. Wer Regeln und Gesetze nicht einhält oder verletzt, dem droht eine Strafe. Doch was ist eine gerechte Strafe Und welche Strafen sind angemessen",Berlin,,7-10,2015.0,"Ethik, Philo"
718,1,0.35880812775843574,"es stattfindet. Hieraus ergibt sich die Notwendigkeit zu klären, was Gerechtigkeit in verschiedenen Situationen eigentlich bedeutet und welche Prinzipien es gibt, nach denen z. B. Güter gerecht verteilt oder Verfahren gerecht vollzogen werden können. Wer Regeln und Gesetze nicht einhält oder verletzt, dem droht eine Strafe. Doch was ist eine gerechte Strafe Und welche Strafen sind angemessen Um diese Fragen beantworten",Berlin,,7-10,2015.0,"Ethik, Philo"
719,1,0.5626660122703064,wie sie beispielsweise im Grundgesetz in Verbindung mit dem Begriff der Würde auftreten. Inhalte Vertiefungsmöglichkeiten/mögliche Konkretisierungen Individuelle Perspektive Gesellschaftliche Perspektive Ideengeschichtliche Perspektive Gerechtigkeit in verschiedenen Sphären Was empfinde ich als gerecht bzw. ungerecht Wann fühle ich mich gerecht bzw. ungerecht behandelt Wie sieht für mich eine gerechte Schule aus Muss ich ungerechte Gesetze befolgen Wann sind Regeln oder Gesetze ungerecht Haben,Berlin,,7-10,2015.0,"Ethik, Philo"
720,1,0.5841886310967949,mit dem Begriff der Würde auftreten. Inhalte Vertiefungsmöglichkeiten/mögliche Konkretisierungen Individuelle Perspektive Gesellschaftliche Perspektive Ideengeschichtliche Perspektive Gerechtigkeit in verschiedenen Sphären Was empfinde ich als gerecht bzw. ungerecht Wann fühle ich mich gerecht bzw. ungerecht behandelt Wie sieht für mich eine gerechte Schule aus Muss ich ungerechte Gesetze befolgen Wann sind Regeln oder Gesetze ungerecht Haben alle Kinder in unserer Gesellschaft die gleichen,Berlin,,7-10,2015.0,"Ethik, Philo"
721,8,0.39300752612246564,"Ist es ungerecht, dass es Arme und Reiche gibt gesellschaftliche Verteilungsprinzipien Gibt es eine moralische Pflicht zu spenden Wie können begrenzte Güter z. B. Studienplätze oder Gewinn in einem Unternehmen gerecht verteilt werden Gerechtigkeitsprinzipien Gerechtigkeitstheorien Prinzipien der sozialen Marktwirtschaft Gerechtigkeitsvorstellungen in den Weltreligionen Inhalte Vertiefungsmöglichkeiten/mögliche Konkretisierungen Individuelle Perspektive Gesellschaftliche Perspektive Ideengeschichtliche Perspektive Recht und Gerechtigkeit Welche Rechte habe ich als Kind",Berlin,,7-10,2015.0,"Ethik, Philo"
722,4,0.3963274942842164,"der Menschenrechte und deren Begründung Menschenwürde und deren philosophische, religiöse bzw. weltanschauliche Deutungen und Begründungen Gerechtigkeit und Strafe Welche Strafen kenne ich aus eigener Erfahrung Welche Strafe habe ich als gerecht, welche als ungerecht empfunden Sind Strafen notwendig Wie sollen Regelverletzungen sanktioniert werden Wie lassen sich staatliche Strafen rechtfertigen Begriffe: Rache, Vergeltung, Strafe als Abschreckung, Faustrecht, Gewaltmonopol Straf- und Strafrechtstheorien etc.",Berlin,,7-10,2015.0,"Ethik, Philo"
723,11,0.32906861301135587,"gibt, nach denen z. B. Güter gerecht verteilt oder Verfahren gerecht vollzogen werden können. Wer Regeln und Gesetze nicht einhält oder verletzt, dem droht eine Strafe. Doch was ist eine gerechte Strafe Und welche Strafen sind angemessen Um diese Fragen beantworten zu können, muss eine Auseinandersetzung mit Kriterien für gerechte Strafen stattfinden. Vereinbarte Regeln einer Gruppe oder auch die geltenden staatlichen",Berlin,,7-10,2015.0,"Ethik, Philo"
724,11,0.4016169124552042,"einhält oder verletzt, dem droht eine Strafe. Doch was ist eine gerechte Strafe Und welche Strafen sind angemessen Um diese Fragen beantworten zu können, muss eine Auseinandersetzung mit Kriterien für gerechte Strafen stattfinden. Vereinbarte Regeln einer Gruppe oder auch die geltenden staatlichen Gesetze können dem Gerechtigkeitsempfinden des Einzelnen widersprechen. Anhand solcher Fälle gilt es beispielhaft zu prüfen, wann der Mensch das",Berlin,,7-10,2015.0,"Ethik, Philo"
725,1,0.5597108643973557,Individuelle Perspektive Gesellschaftliche Perspektive Ideengeschichtliche Perspektive Gerechtigkeit in verschiedenen Sphären Was empfinde ich als gerecht bzw. ungerecht Wann fühle ich mich gerecht bzw. ungerecht behandelt Wie sieht für mich eine gerechte Schule aus Muss ich ungerechte Gesetze befolgen Wann sind Regeln oder Gesetze ungerecht Haben alle Kinder in unserer Gesellschaft die gleichen Chancen Sollte es ein Weltgericht geben Müssen wir uns,Berlin,,7-10,2015.0,"Ethik, Philo"
726,3,0.3804338521019463,"Müssen wir uns gegen Ungerechtigkeit in anderen Ländern einsetzen Allegorien der Gerechtigkeit Recht und Moral Rechtspositivismus und Naturrecht UNBehindertenrechtskonvention Widerstandsrecht Gerechtes Verteilen Muss ich Almosen geben Was bedeutet für mich gerechte Notengebung Ist es ungerecht, dass es Arme und Reiche gibt gesellschaftliche Verteilungsprinzipien Gibt es eine moralische Pflicht zu spenden Wie können begrenzte Güter z. B. Studienplätze oder Gewinn in einem",Berlin,,7-10,2015.0,"Ethik, Philo"
727,1,0.7134210788692259,"in der Wissenschaft heute Was ist gerecht - Recht und Gerechtigkeit Schülerinnen und Schüler erleben in ihrem Alltag immer wieder Situationen, die sie als ungerecht empfinden. Doch was ist gerecht Gerechtes Handeln kann sowohl gleiche Behandlung als auch ungleiche Behandlung erfordern, je nachdem, in welchem Kontext es stattfindet. Hieraus ergibt sich die Notwendigkeit zu klären, was Gerechtigkeit in verschiedenen Situationen eigentlich",Berlin,,7-10,2015.0,"Ethik, Philo"
728,3,0.3188887727910727,"unserer Gesellschaft die gleichen Chancen Sollte es ein Weltgericht geben Müssen wir uns gegen Ungerechtigkeit in anderen Ländern einsetzen Allegorien der Gerechtigkeit Recht und Moral Rechtspositivismus und Naturrecht UNBehindertenrechtskonvention Widerstandsrecht Gerechtes Verteilen Muss ich Almosen geben Was bedeutet für mich gerechte Notengebung Ist es ungerecht, dass es Arme und Reiche gibt gesellschaftliche Verteilungsprinzipien Gibt es eine moralische Pflicht zu spenden Wie",Berlin,,7-10,2015.0,"Ethik, Philo"
729,2,0.9450980160166269,"Diese haben orientierende Funktion, da sich Schüler am Ende der Klassenstufe auf unterschiedlichen Niveaustufen ihrer Kompetenzentwicklung befinden können und der beschriebenen Lernausgangslage und den damit verbundenen Erwartungen in differenzierter Weise gerecht werden. Im Ethikunterricht der Grundschule hat sich der Schüler mit vier Themenkomplexen auseinandergesetzt, die sich aus den vier Kantischen Fragen ableiten. Diese vier Themenkomplexe werden in den folgenden Klassenstufen aufgenommen",Thüringen,Regelschule,,2012.0,"Ethik, Philo"
730,6,0.5782950433950577,"Sozialkompetenz Der Schüler kann - seine Mitschüler in ihren Stärken und Schwächen einschätzen und individuelle Eigenarten akzeptieren, - eigene Bedürfnisse und Zielvorstellungen artikulieren, - darüber reflektieren, welches Verhalten fair und gerecht ist, - eigene Ve r a n t w o r t u n g und Mitgestaltungsmöglichkeiten für das schulische Leben wahrnehmen, - Gestaltungsmöglichkeiten für das G l ü c",Thüringen,Regelschule,,2012.0,"Ethik, Philo"
731,11,0.6451850239178027,"leicht. Daraus ergeben sich grundlegende Fragen des menschlichen Zusammenlebens, die der Ethikunterricht aufnehmen und reflektieren kann. So entwickelt er die Voraussetzung für die Wahrnehmung von Verantwortung für eine demokratische und gerechte Gesellschaft im Sinne der im Grundgesetz vorgegebenen unveräußerlichen Menschenrechte. Was darf ich hoffen - Wir und die Anderen Für den Schüler ergeben sich in der Zeit des Heranwachsens viele Fragen",Thüringen,Regelschule,,2012.0,"Ethik, Philo"
732,15,0.5080563576566123,"bearbeitet worden. Das bedeutet für die Klassenstufen /: Der Schüler kann in Auseinandersetzung mit eigenen Bedürfnissen und Interessen sowie mit den Bedürfnissen und Interessen der Anderen über ein faires und gerechtes Miteinander reflektieren. Er denkt über seine Möglichkeiten nach, das gemeinsame Leben innerhalb und außerhalb der Schule zu verbessern, und überprüft verschiedene Handlungsstrategien. Er übernimmt Verantwortung für das Gelingen des Zusammenlebens.",Thüringen,Regelschule,,2012.0,"Ethik, Philo"
733,15,0.5648876230669342,Argumentieren ca. Stunden im Jahr Themenfelder Halbjahr der Hauptphase Allgemeine Ethik LK Moraltheoretische Modelle Stunden Angewandte Ethik I - Naturethik Stunden Argumentieren s.o. Themenfelder Halbjahr der Hauptphase Allgemeine Ethik LK Gerechtigkeit Stunden Sinn und Transzendenz Stunden Themenfelder Halbjahr der Hauptphase Allgemeine Ethik LK Ethik und Psychologie Stunden Variabler Pflichtbereich: Angewandte Ethik II Stunden Variabler Pflichtbereich ein bis zwei Ganzschriften zu den,Saarland,Gym,Sek2,2019.0,"Ethik, Philo"
734,11,0.5463647742221789,"Unterscheiden zwischen der Verwendung bestehender Normen und ihrer systematischen und argumentativen Begründung anhand von Beispielen identifizieren grundlegende Prinzipien und Werte des ethischen Argumentierens und Reflektierens, nämlich Begründbarkeit, Universalisierbarkeit, Wahrheit, Freiheit, Gerechtigkeit, Verantwortung, Vernunft, Würde Problematisieren dieser Prinzipien und Werte im Hinblick auf ihre Begründbarkeit/Herleitbarkeit Klären des Bedingungsverhältnisses zwischen diesen Prinzipien und Werten Problematisieren des Amoralismus Problematisieren des ethischen Relativismus unterscheiden in",Saarland,Gym,Sek2,2019.0,"Ethik, Philo"
735,4,0.5371912078751769,"das Bedingungsverhältnis zwischen ethisch-moralischen und gesellschaftlich-gesetzlichen Normen, unterscheiden zwischen Legalität und Legitimität. Unterscheiden von Menschen- und Bürgerrechten Analysieren von Beispielen des Konflikts zwischen Legalität und Legitimität z. B. Schießbefehl, zwischen Gerechtigkeit und Mehrheitsmeinung z. B. Mobbing siehe auch Thema Gerechtigkeit Vorschläge und Anregungen Handeln Einbringen von ethischen Problem- und Fragestellungen in Unterrichtsthemen anderer Schulfächer Grundbegriffe der Ethik und der Moral Allgemeine",Saarland,Gym,Sek2,2019.0,"Ethik, Philo"
736,4,0.5373354703964468,"Legalität und Legitimität. Unterscheiden von Menschen- und Bürgerrechten Analysieren von Beispielen des Konflikts zwischen Legalität und Legitimität z. B. Schießbefehl, zwischen Gerechtigkeit und Mehrheitsmeinung z. B. Mobbing siehe auch Thema Gerechtigkeit Vorschläge und Anregungen Handeln Einbringen von ethischen Problem- und Fragestellungen in Unterrichtsthemen anderer Schulfächer Grundbegriffe der Ethik und der Moral Allgemeine Ethik Hauptphase LK Literatur Bayertz, Kurt: Warum überhaupt moralisch",Saarland,Gym,Sek2,2019.0,"Ethik, Philo"
737,3,0.28321218329129916,"CO-Fußabdrucks Literatur Birnbacher, Dieter, Bioethik zwischen Natur und Interesse. Frankfurt am Main: Suhrkamp, Hoerster, Norbert: Haben Tiere eine Würde München: Beck, Krebs, Angelika Hg.: Naturethik. Frankfurt am Main: Suhrkamp, https://www.bpb.de/gesellschaft/umwelt/bioethik//naturethik Gerechtigkeit Allgemeine Ethik Hauptphase LK Die Forderung nach Gerechtigkeit ist im Zusammenleben der Menschen allgegenwärtig, ebenso wie das Beklagen ungerechter Zustände oder Behandlungen. Häufig wird dabei verkürzend auf den Gleichheitsgrundsatz zurückgegriffen,",Saarland,Gym,Sek2,2019.0,"Ethik, Philo"
738,2,0.27669758946463563,"Interesse. Frankfurt am Main: Suhrkamp, Hoerster, Norbert: Haben Tiere eine Würde München: Beck, Krebs, Angelika Hg.: Naturethik. Frankfurt am Main: Suhrkamp, https://www.bpb.de/gesellschaft/umwelt/bioethik//naturethik Gerechtigkeit Allgemeine Ethik Hauptphase LK Die Forderung nach Gerechtigkeit ist im Zusammenleben der Menschen allgegenwärtig, ebenso wie das Beklagen ungerechter Zustände oder Behandlungen. Häufig wird dabei verkürzend auf den Gleichheitsgrundsatz zurückgegriffen, wohingegen andere Grundwerte wie Freiheit und Solidarität eher",Saarland,Gym,Sek2,2019.0,"Ethik, Philo"
739,11,0.5089081081447848,"wohingegen andere Grundwerte wie Freiheit und Solidarität eher außer Acht gelassen werden. Die genaue Begriffsklärung ist für eine gerechtfertigte Beurteilung gesellschaftlicher Zustände und der sich daraus ergebenden Forderungen unabdingbar. Da Gerechtigkeit auch als zentrales Prinzip unserer staatlichen Ordnung gilt, muss sich diese selbst an diesem Maßstab messen lassen. Daraus kann sich das Recht auf - vielleicht sogar die Pflicht zu -",Saarland,Gym,Sek2,2019.0,"Ethik, Philo"
740,11,0.8323811778427753,"lassen sich Güter gerecht verteilen Lassen sich Ungleichheiten rechtfertigen Welche Ziele sollen durch Strafe verfolgt werden Kompetenzerwartungen Die Schülerinnen und Schüler betrachten die Realität multiperspektivisch individuell, sozial, gesellschaftlich, global, ideell Gerechtigkeit. analysieren eigenes und fremdes Denken und Handeln im Spannungsfeld von Autonomie und Heteronomie Begründung gesellschaftlicher Herrschaft, Soziale Gerechtigkeit, erschließen die Denk-Handlungen initiierenden Werte und Normen Soziale Gerechtigkeit, prüfen und rekonstruieren",Saarland,Gym,Sek2,2019.0,"Ethik, Philo"
741,11,0.9454724826624316,"Schülerinnen und Schüler betrachten die Realität multiperspektivisch individuell, sozial, gesellschaftlich, global, ideell Gerechtigkeit. analysieren eigenes und fremdes Denken und Handeln im Spannungsfeld von Autonomie und Heteronomie Begründung gesellschaftlicher Herrschaft, Soziale Gerechtigkeit, erschließen die Denk-Handlungen initiierenden Werte und Normen Soziale Gerechtigkeit, prüfen und rekonstruieren einen Argumentationsgang Begründung staatlicher Herrschaft, Soziale Gerechtigkeit, erschließen die in Aussagen, Handlungen und Theorien implizierten Menschenbilder Begründung staatlicher",Saarland,Gym,Sek2,2019.0,"Ethik, Philo"
742,11,0.8796493474180374,"gesellschaftlich, global, ideell Gerechtigkeit. analysieren eigenes und fremdes Denken und Handeln im Spannungsfeld von Autonomie und Heteronomie Begründung gesellschaftlicher Herrschaft, Soziale Gerechtigkeit, erschließen die Denk-Handlungen initiierenden Werte und Normen Soziale Gerechtigkeit, prüfen und rekonstruieren einen Argumentationsgang Begründung staatlicher Herrschaft, Soziale Gerechtigkeit, erschließen die in Aussagen, Handlungen und Theorien implizierten Menschenbilder Begründung staatlicher Herrschaft, fördern den gleichberechtigten Einbezug der Dialogpartner in den",Saarland,Gym,Sek2,2019.0,"Ethik, Philo"
743,11,0.7493116990948556,"Handeln im Spannungsfeld von Autonomie und Heteronomie Begründung gesellschaftlicher Herrschaft, Soziale Gerechtigkeit, erschließen die Denk-Handlungen initiierenden Werte und Normen Soziale Gerechtigkeit, prüfen und rekonstruieren einen Argumentationsgang Begründung staatlicher Herrschaft, Soziale Gerechtigkeit, erschließen die in Aussagen, Handlungen und Theorien implizierten Menschenbilder Begründung staatlicher Herrschaft, fördern den gleichberechtigten Einbezug der Dialogpartner in den Diskursprozess Begründung staatlicher Herrschaft, Die Gerechtigkeitskonzeption John Rawls, verändern gegebenenfalls",Saarland,Gym,Sek2,2019.0,"Ethik, Philo"
744,4,0.7500127851098134,"Sinne eines anzustrebenden Konsenses Begründung staatlicher Herrschaft, Die Gerechtigkeitskonzeption John Rawls, metakommunizieren Begründung staatlicher Herrschaft, Die Gerechtigkeitskonzeption John Rawls, diskutieren ergebnis- und ambiguitätsoffen Begründung staatlicher Herrschaft, Die Gerechtigkeitskonzeption John Rawls. Gerechtigkeit Allgemeine Ethik Hauptphase LK Inhaltsbezogene Kompetenzen Konkretisierungen und Hinweise Begründung staatlicher Herrschaft Die Schülerinnen und Schüler diskutieren das Verhältnis von Freiheit und staatlicher Herrschaft, Diskutieren von Fallbeispielen, z. B. Proudhon:",Saarland,Gym,Sek2,2019.0,"Ethik, Philo"
745,4,0.6068419064065992,"determiniert Konsensusprinzip, z. B. Rousseau: volonté générale, Menschenbild: vernünftig, frei, selbstbestimmt unterscheiden Naturrecht im Sinne von Vernunftrecht und positives Recht. Provokation: Ist die Würde des Menschen eine Erfindung der UNO Gerechtigkeit Die Schülerinnen und Schüler unterscheiden Legalität von Legitimität, Positives Recht vs. moralische Rechtfertigung Erörtern des Rechts auf Widerstand anhand von Fallbeispielen, z. B. o Schießbefehl, Mauerschützenprozesse o Widerstand in der",Saarland,Gym,Sek2,2019.0,"Ethik, Philo"
746,4,0.6003691327753314,"unterscheiden Legalität von Legitimität, Positives Recht vs. moralische Rechtfertigung Erörtern des Rechts auf Widerstand anhand von Fallbeispielen, z. B. o Schießbefehl, Mauerschützenprozesse o Widerstand in der Zeit des Nationalsozialismus beschreiben Gerechtigkeit als o Tugend, o ethisches Prinzip des Zusammenlebens, o Kriterium der Qualität von staatlicher Verfassung und Gesetz. zur Tugend: Aristoteles: Nikomachische Ethik, Auszüge aus Buch V, Veranschaulichung möglich durch Platons",Saarland,Gym,Sek2,2019.0,"Ethik, Philo"
747,3,0.4453152059555183,"ethisches Prinzip des Zusammenlebens, o Kriterium der Qualität von staatlicher Verfassung und Gesetz. zur Tugend: Aristoteles: Nikomachische Ethik, Auszüge aus Buch V, Veranschaulichung möglich durch Platons Gleichnis vom Seelenwagen Soziale Gerechtigkeit: Verteilungsgerechtigkeit Die Schülerinnen und Schüler unterscheiden o Verteilungsgerechtigkeit, die sich auf Gegenstände, gesellschaftliche Positionen bezieht und o ausgleichende Gerechtigkeit, die sich auf begangene Handlungen bezieht. Gerechtigkeit Allgemeine Ethik Hauptphase LK",Saarland,Gym,Sek2,2019.0,"Ethik, Philo"
748,3,0.40385358941490573,"aus Buch V, Veranschaulichung möglich durch Platons Gleichnis vom Seelenwagen Soziale Gerechtigkeit: Verteilungsgerechtigkeit Die Schülerinnen und Schüler unterscheiden o Verteilungsgerechtigkeit, die sich auf Gegenstände, gesellschaftliche Positionen bezieht und o ausgleichende Gerechtigkeit, die sich auf begangene Handlungen bezieht. Gerechtigkeit Allgemeine Ethik Hauptphase LK Inhaltsbezogene Kompetenzen Konkretisierungen und Hinweise Die Schülerinnen und Schüler erschließen und problematisieren mind. drei Prinzipien der Verteilungsgerechtigkeit, Gedankenexperiment Ultimatum-Spiel",Saarland,Gym,Sek2,2019.0,"Ethik, Philo"
