document_id,most_prevalent_topic_id,most_prevalent_topic_probability,text_excerpt,state,school type,grade,year,subject
349,6,0.5080447643612662,"Kinderrechte grundlegende Menschenrechte benennen und die Relevanz ihrer Achtung für ein menschenwürdiges Leben erklären z. B. Kinderrechte Die Schülerinnen und Schüler können G M E Handlungsmöglichkeiten zur Sicherung menschenwürdiger und gerechter Lebens-verhältnisse im eigenen Lebens-umfeld exemplarisch darlegen und angeleitet diskutieren beispielsweise bezogen auf Konsum, soziales Engagement, Fair Trade Handlungsmöglichkeiten zur Sicherung menschenwürdiger und gerechter Lebensverhältnisse im eigenen Lebensumfeld an Beispielen darlegen",BaWü,,Sek1,2016.0,"Ethik, Philo"
350,14,0.4963930119039984,"M E Handlungsmöglichkeiten zur Sicherung menschenwürdiger und gerechter Lebens-verhältnisse im eigenen Lebens-umfeld exemplarisch darlegen und angeleitet diskutieren beispielsweise bezogen auf Konsum, soziales Engagement, Fair Trade Handlungsmöglichkeiten zur Sicherung menschenwürdiger und gerechter Lebensverhältnisse im eigenen Lebensumfeld an Beispielen darlegen und diskutieren beispielsweise bezogen auf Konsum, soziales Engagement, Fair Trade Handlungsmöglichkeiten zur Sicherung menschenwürdiger und gerechter Lebensverhältnisse im eigenen Lebensumfeld darlegen und diskutieren",BaWü,,Sek1,2016.0,"Ethik, Philo"
351,14,0.6962962861037695,"Fair Trade Handlungsmöglichkeiten zur Sicherung menschenwürdiger und gerechter Lebensverhältnisse im eigenen Lebensumfeld an Beispielen darlegen und diskutieren beispielsweise bezogen auf Konsum, soziales Engagement, Fair Trade Handlungsmöglichkeiten zur Sicherung menschenwürdiger und gerechter Lebensverhältnisse im eigenen Lebensumfeld darlegen und diskutieren beispielsweise bezogen auf Konsum, soziales Engagement, Fair Trade VB Chancen und Risiken der Lebensführung VB Chancen und Risiken der Lebensführung VB Chancen und",BaWü,,Sek1,2016.0,"Ethik, Philo"
352,11,0.7606232687577472,"und kritisches Hinterfragen staatlicher und gesellschaftlicher Institutionen sowie aktuell bestehender Gesetze und der Güte ihrer Verwirklichung: Bildungsangebot, chancen, politische Mitbestimmung, soziale Unterstützungsangebote, Gesundheitssystem, Umweltschutz etc. z. B. Leistungsprinzip, Solidaritätsprinzip, soziale Gerechtigkeit, Konsum, marktliberale und -soziale Wertvorstellungen Gestalten von Plakaten: Gegenüberstellen von bedingenden, begrenzenden Einflüssen einerseits und Möglichkeiten, sich diesen gegenüber Freiräume zu erschließen andererseits, z. B. bezüglich Informationsund Kommunikationsmedien, Formen der",Saarland,GemS,"9,10",2018.0,"Ethik, Philo"
353,1,0.5119683070453583,Fachlehrpläne Gymnasium: Ethik grundlegendes Anforderungsniveau Eth Lernbereich : Recht und Gerechtigkeit ca. Std. Kompetenzerwartungen Die Schülerinnen und Schüler ... wählen in verschiedenen lebenspraktischen Kontexten Kriterien zur Beurteilung der Frage der Gerechtigkeit und wenden diese Kriterien adäquat an. Dabei berücksichtigen sie philosophische,Bayern,Gym,,,"Ethik, Philo"
354,1,0.429282422527759,"Fachlehrpläne Gymnasium: Ethik grundlegendes Anforderungsniveau Eth Lernbereich : Recht und Gerechtigkeit ca. Std. Kompetenzerwartungen Die Schülerinnen und Schüler ... wählen in verschiedenen lebenspraktischen Kontexten Kriterien zur Beurteilung der Frage der Gerechtigkeit und wenden diese Kriterien adäquat an. Dabei berücksichtigen sie philosophische Konzepte, z. B. von Aristoteles und J. Rawls. bewerten Berechtigung und Grenzen rechtspositivistischer und naturrechtlicher Positionen und prüfen deren Relevanz",Bayern,Gym,,,"Ethik, Philo"
355,6,0.34312729066052294,"Frage nach einer angemessenen Behandlung von Straftätern zwischen Tat- und Täterstrafrecht. Dabei berücksichtigen sie insbesondere den Entwicklungsstand und die Bedürfnisse jugendlicher Straftäter. bewerten den aktuellen Strafvollzug mithilfe der Kriterien Humanität, Gerechtigkeit und Effektivität und entwickeln ggf. Reformvorschläge. verfolgen den öffentlichen Diskurs über Fragen der Gerechtigkeit und beteiligen sich an diesem nach Möglichkeit mit eigenen Beiträgen. setzen sich mit Problemen und Perspektiven",Bayern,Gym,,,"Ethik, Philo"
356,6,0.3394133342382248,"insbesondere den Entwicklungsstand und die Bedürfnisse jugendlicher Straftäter. bewerten den aktuellen Strafvollzug mithilfe der Kriterien Humanität, Gerechtigkeit und Effektivität und entwickeln ggf. Reformvorschläge. verfolgen den öffentlichen Diskurs über Fragen der Gerechtigkeit und beteiligen sich an diesem nach Möglichkeit mit eigenen Beiträgen. setzen sich mit Problemen und Perspektiven einer globalen Friedensordnung auseinander, um ihr Urteilsvermögen in Fragen von Krieg und Frieden zu",Bayern,Gym,,,"Ethik, Philo"
357,4,0.5562950598806291,"globalen Friedensordnung auseinander, um ihr Urteilsvermögen in Fragen von Krieg und Frieden zu schärfen. entwickeln eine eigene Position zum universellen Geltungsanspruch der Menschenrechte. Inhalte zu den Kompetenzen: kommutative und distributive Gerechtigkeit bei Aristoteles positives Recht und Rechtspositivismus, Naturrecht Rechtsquellen, Problematik, Leistung, Radbruchsche Formel Kriminalitätstheorien, z. B. Anomie-Theorie, Etikettierungsansatz Strafzwecktheorien: absolute, relative, Mischform Wiedergutmachung Täter-Opfer-Ausgleich Zielsetzungen des modernen Strafvollzugs und Probleme in",Bayern,Gym,,,"Ethik, Philo"
358,4,0.6172120470518238,"Anomie-Theorie, Etikettierungsansatz Strafzwecktheorien: absolute, relative, Mischform Wiedergutmachung Täter-Opfer-Ausgleich Zielsetzungen des modernen Strafvollzugs und Probleme in der aktuellen Praxis Grundsätze der Strafzumessung: Tat- und Täterstrafrecht, u. a. Umgang mit jugendlichen Straftätern Gerechtigkeit als Fairness J. Rawls: Schleier des Nichtwissens, Gerechtigkeitsgrundsätze, Differenzprinzip als Abgrenzung zum Utilitarismus Probleme und Perspektiven einer gerechten globalen Friedensordnung Schutzverantwortung und Völkerrechtsproblematik bei internationalen Interventionen, Migration Schwierigkeiten bei der",Bayern,Gym,,,"Ethik, Philo"
359,4,0.563377927138198,"Grundsätze der Strafzumessung: Tat- und Täterstrafrecht, u. a. Umgang mit jugendlichen Straftätern Gerechtigkeit als Fairness J. Rawls: Schleier des Nichtwissens, Gerechtigkeitsgrundsätze, Differenzprinzip als Abgrenzung zum Utilitarismus Probleme und Perspektiven einer gerechten globalen Friedensordnung Schutzverantwortung und Völkerrechtsproblematik bei internationalen Interventionen, Migration Schwierigkeiten bei der Begründung der universalen Geltung der Menschenrechte, praktische Probleme bei ihrer Durchsetzung Eth Lernbereich : Sinnorientierung und Lebensgestaltung ca.",Bayern,Gym,,,"Ethik, Philo"
360,15,0.38892498733118397,"guten und glücklichen Leben ein. gestalten unter Berücksichtigung kommunikationspsychologischer Erkenntnisse ihre eigene Kommunikation konstruktiv und verantwortungsbewusst, u. a. im digitalen Bereich. berücksichtigen Gedanken aus Utopien bei der Suche nach dem Gerechten und Guten. Inhalte zu den Kompetenzen: Aristoteles: Eudaimonie als höchstes Gut; Tätigsein der Seele im Sinne ihres ergons und der arete: bios politikos und bios theoretikos Epikur: Eudaimonie durch Aponie,",Bayern,Gym,,,"Ethik, Philo"
361,6,0.9698924632666398,"Unterschiedliche Positionen bzw. Werturteile können geäußert werden und sie werden auf der Basis der demokratischen Grundordnung zur Diskussion gestellt. Wesentliche Kriterien eines guten Schulklimas am Gymnasium sind Transparenz der Entscheidungen, Gerechtigkeit und Toleranz sowie Achtung und Verlässlichkeit im Umgang aller an Schule Beteiligten. Wichtigste Partner sind die Eltern, die kontinuierlich den schulischen Erziehungsprozess begleiten und aktiv am Schulleben partizipieren sollen sowie",Sachsen,Gym,,2019.0,"Ethik, Philo"
362,10,0.9747747697868308,"Lebens: Raum und Zeit Sprache und Denken Individualität und Sozialität Natur und Kultur Perspektiven Die thematischen Bereiche umfassen: Verkehr Arbeit Medien Beruf Kommunikation Gesundheit Kunst Umwelt Verhältnis der Generationen Wirtschaft Gerechtigkeit Technik Eine Welt Politische Bildung, Medienbildung und Digitalisierung sowie Bildung für nachhaltige Entwicklung sind besonders geeignet für den fächerverbindenden Unterricht. thematische Bereiche Jede Schule kann zur Realisierung des fächerverbindenden Unterrichts",Sachsen,Gym,,2019.0,"Ethik, Philo"
363,13,0.7073275512128211,Misserfolgen lernen Wahlbereich : Demokratie in der Schule Klassenstufe Lernbereich : Wahrnehmung und Wahrheit Ustd. Lernbereich : Judentum Ustd. Lernbereich : Urteil und Vorurteil Ustd. Lernbereiche mit Wahlcharakter Wahlbereich : Gerechtigkeit in der Schule Wahlbereich : Die Welt anders wahrnehmen Wahlbereich : Glück Klassenstufe Lernbereich : Verstehen und Verständigung Ustd. Lernbereich : Christentum Ustd. Lernbereich : Medien: Ein Spiegel der Wirklichkeit,Sachsen,Gym,,2019.0,"Ethik, Philo"
364,13,0.7580330098049463,Literatur Wahlbereich : Gibt es einen gerechten Krieg Jahrgangsstufen / Lernbereich : Fragen nach der Freiheit Ustd. Lernbereich : Fragen nach dem guten Handeln Ustd. Lernbereich : Fragen nach der Gerechtigkeit Ustd. Lernbereiche mit Wahlcharakter Wahlbereich : Existenzialistische Literatur Wahlbereich : Kritik der Ethik Wahlbereich : Ethische Grenzfälle in der Medizin Wahlbereich : Mit dem Tode strafen Ziele interkulturelle Kompetenz: Die,Sachsen,Gym,,2019.0,"Ethik, Philo"
365,6,0.38719680171034937,"Vertreibung der Juden aus Europa Antijudaismus, Antisemitismus Massenmord an Juden: Shoa, Holocaust Rassismus Grundgesetz Artikel Richter: Damals war es Friedrich Dokumentationen LB LB GE, Kl. , LB Werteorientierung Wahlbereich : Gerechtigkeit in der Schule Kennen von Problemen der Gerechtigkeit in der Schule Fairness in der Schule: Sport, Bewertung, Hausaufgaben Schreibgespräch Placemat Gestalten eines Verbesserungsvorschlags Präsentation mit digitalen Medien, Videoclip Brief an",Sachsen,Gym,,2019.0,"Ethik, Philo"
366,6,0.42355464768580137,"an Juden: Shoa, Holocaust Rassismus Grundgesetz Artikel Richter: Damals war es Friedrich Dokumentationen LB LB GE, Kl. , LB Werteorientierung Wahlbereich : Gerechtigkeit in der Schule Kennen von Problemen der Gerechtigkeit in der Schule Fairness in der Schule: Sport, Bewertung, Hausaufgaben Schreibgespräch Placemat Gestalten eines Verbesserungsvorschlags Präsentation mit digitalen Medien, Videoclip Brief an den Schulleiter Kl. , LBW RE/e, Kl. ,",Sachsen,Gym,,2019.0,"Ethik, Philo"
367,15,0.2895213031352396,"auf der Suche nach Identität den eigenen Stil finden: Jugendkulturen und -szenen Frisuren, Kleidung, Sprache, Tattoos, Piercing Identität durch Konsum Wohlfahrtsgesellschaft und Nachhaltigkeit Engagement Jugendlicher für Umwelt, Frieden, Solidarität und Gerechtigkeit Rodari: Die Geschichte vom jungen Krebs Akrostichon: Identität Collage Bildung für nachhaltige Entwicklung Wahlbereich : Armut und Reichtum Einblick gewinnen in das Leben von Menschen in Armut und Reichtum Dimensionen",Sachsen,Gym,,2019.0,"Ethik, Philo"
368,4,0.6970064861541455,"Medien Sokratisches Gespräch Rollenspiel LBW EN, Lk, LB G/R/W, Kl. , LB G/R/W, Gk , LB G/R/W, Gk , LB Verantwortungsbereitschaft Bildung für nachhaltige Entwicklung Lernbereich : Fragen nach der Gerechtigkeit Ustd. Sich positionieren zu Vorstellungen von Recht und Gerechtigkeit Alltagsvorstellungen Fallstudie: aktuelle Rechtsfälle Aristoteles: Nikomachische Ethik Perelman: Über die Gerechtigkeit Rollenspiel Pro- und Kontra-Debatte Kennen von Gerechtigkeitstheorien Orientierung an: Natur,",Sachsen,Gym,,2019.0,"Ethik, Philo"
369,4,0.5963379141297346,"Kl. , LB G/R/W, Gk , LB G/R/W, Gk , LB Verantwortungsbereitschaft Bildung für nachhaltige Entwicklung Lernbereich : Fragen nach der Gerechtigkeit Ustd. Sich positionieren zu Vorstellungen von Recht und Gerechtigkeit Alltagsvorstellungen Fallstudie: aktuelle Rechtsfälle Aristoteles: Nikomachische Ethik Perelman: Über die Gerechtigkeit Rollenspiel Pro- und Kontra-Debatte Kennen von Gerechtigkeitstheorien Orientierung an: Natur, Gott, Gefühl, Vernunft, Verträgen Platon: Politeia Thomas von Aquin:",Sachsen,Gym,,2019.0,"Ethik, Philo"
370,4,0.617970214596379,"Verantwortungsbereitschaft Bildung für nachhaltige Entwicklung Lernbereich : Fragen nach der Gerechtigkeit Ustd. Sich positionieren zu Vorstellungen von Recht und Gerechtigkeit Alltagsvorstellungen Fallstudie: aktuelle Rechtsfälle Aristoteles: Nikomachische Ethik Perelman: Über die Gerechtigkeit Rollenspiel Pro- und Kontra-Debatte Kennen von Gerechtigkeitstheorien Orientierung an: Natur, Gott, Gefühl, Vernunft, Verträgen Platon: Politeia Thomas von Aquin: Summa Theologica Hobbes: Leviathan Smith: Theorie der ethischen Gefühle Rousseau: Der",Sachsen,Gym,,2019.0,"Ethik, Philo"
371,4,0.7067536428103979,"von Gerechtigkeitstheorien Orientierung an: Natur, Gott, Gefühl, Vernunft, Verträgen Platon: Politeia Thomas von Aquin: Summa Theologica Hobbes: Leviathan Smith: Theorie der ethischen Gefühle Rousseau: Der Gesellschaftsvertrag Rawls: Eine Theorie der Gerechtigkeit kommunitaristische Kritik an Rawls selbstständiges Texterschließen Gedankenexperiment Lernkompetenz Kennen der Unterscheidung von Naturrecht und positivem Recht religiöse oder philosophische Ableitungen des Naturrechts Funktion des positiven Rechts Rechtspositivismus Grundrechte als Nahtstelle",Sachsen,Gym,,2019.0,"Ethik, Philo"
372,13,0.7192792523202912,Religion in der Gegenwart Ustd. Lernbereich : Utopien Ustd. Lernbereiche mit Wahlcharakter Wahlbereich : Gewalt im Alltag Wahlbereich : Die Satansgestalt in Kunst und Literatur Wahlbereich : Gibt es einen gerechten Krieg Jahrgangsstufen / Lernbereich : Fragen nach der Freiheit Ustd. Lernbereich : Fragen nach dem guten Handeln Ustd. Lernbereich : Fragen nach der Gerechtigkeit Ustd. Lernbereiche mit Wahlcharakter Wahlbereich :,Sachsen,Gym,,2019.0,"Ethik, Philo"
373,4,0.565939570758946,"Kraft, die stets das Böse will und stets das Gute schafft. Luzifer als gefallener Engel Milton: Das verlorene Paradies Philosophieren mit Bildern Zusammenarbeit mit KU Wahlbereich : Gibt es einen gerechten Krieg Sich positionieren zur Frage nach dem gerechten Krieg Legitimationen für den Krieg: Eroberungskrieg, Verteidigungskrieg, Präventivkrieg, Heiliger Krieg Glucksmann: Philosophie der Abschreckung Tugendhat: Ethik und Politik Habermas: Dürfen wir Menschenrechte",Sachsen,Gym,,2019.0,"Ethik, Philo"
374,4,0.7576861410359119,"das Gute schafft. Luzifer als gefallener Engel Milton: Das verlorene Paradies Philosophieren mit Bildern Zusammenarbeit mit KU Wahlbereich : Gibt es einen gerechten Krieg Sich positionieren zur Frage nach dem gerechten Krieg Legitimationen für den Krieg: Eroberungskrieg, Verteidigungskrieg, Präventivkrieg, Heiliger Krieg Glucksmann: Philosophie der Abschreckung Tugendhat: Ethik und Politik Habermas: Dürfen wir Menschenrechte mit Gewalt erzwingen Fallbeispiele Sokratisches Gespräch Pro- und",Sachsen,Gym,,2019.0,"Ethik, Philo"
375,5,0.22839387487310456,"die Unsichtbare Hand und Grundprinzipien des Liberalismus K. Marx: entfremdete Arbeit, Warenfetischismus und Geldfetischismus ökonomische Rationalität und die Vorstellung vom homo oeconomicus, Spieltheorie: Ultimatumspiel ein ausgewähltes Problemfeld, z. B. soziale Gerechtigkeit, Fair Trade, Unternehmensethik, Wachstum und Ökologie Eth Lernbereich : Medienethik ca. Std. Kompetenzerwartungen Die Schülerinnen und Schüler ... orientieren sich in der Medienlandschaft und erkennen die Bedeutung und Verantwortung von",Bayern,Gym,10,,"Ethik, Philo"
376,11,0.5150015271319265,den Zusammenhang von Religion und existenziellen Fragen. vergleichen und beurteilen die ethischen Grundaussagen der Weltreligionen zu zentralen Fragen des Lebens und ordnen diese ggf. in ihre Vorstellung vom Guten und Gerechten ein. entwickeln vor dem Hintergrund des Theodizee-Problems und der Problematik der Gottesbeweise eigene Vorstellungen zur Frage nach der Existenz und dem Wesen Gottes. erfassen die Problematik einer philosophischen Letztbegründung. beurteilen,Bayern,Gym,10,,"Ethik, Philo"
377,11,0.9072235947569867,"Inhaltsfeld Zusammenleben in Staat und Gesellschaft In diesem Inhaltsfeld befassen sich Schülerinnen und Schüler mit Fragen der Ausgestaltung und Legitimation gesellschaftlicher und staatlicher Ordnungen. Darüber hinaus geht es um soziale Gerechtigkeit und Frieden in einer durch unterschiedliche Kulturen geprägten globalisierten Welt, womit auch Fragen nach Verlauf und Sinn der Geschichte berührt werden. Durch die Auseinandersetzung mit diesen Problemstellungen können die Schülerinnen",NRW,Gym,Sek2,2014.0,"Ethik, Philo"
378,11,0.22860510769210857,"die Freiheitsrechte der Bürger in ihren Grundgedanken und grenzen diese Ansätze voneinander ab, erklären im Kontext der erarbeiteten ethischen und rechtsphilosophischen Ansätze vorgenommene begriffliche Unterscheidungen u. a. Relativismus, Universalismus, Recht, Gerechtigkeit. URTEILSKOMPETENZ Die Schülerinnen und Schüler erörtern Konsequenzen, die sich aus der Sonderstellung des Menschen im Reich des Lebendigen ergeben, sowie die damit verbundenen Chancen und Risiken, bewerten den anthropologischen Ansatz",NRW,Gym,Sek2,2014.0,"Ethik, Philo"
379,11,0.9049500771163624,"Verantwortung in Entscheidungsfeldern angewandter Ethik. Inhaltsfeld Zusammenleben in Staat und Gesellschaft Inhaltliche Schwerpunkte Gemeinschaft als Prinzip staatsphilosophischer Legitimation Individualinteresse und Gesellschaftsvertrag als Prinzip staatsphilosophischer Legitimation Konzepte von Demokratie und sozialer Gerechtigkeit SACHKOMPETENZ Die Schülerinnen und Schüler stellen die Legitimationsbedürftigkeit staatlicher Herrschaft als philosophisches Problem dar und entwickeln eigene Lösungsansätze in Form von möglichen Staatsmodellen, rekonstruieren ein am Prinzip der Gemeinschaft orientiertes",NRW,Gym,Sek2,2014.0,"Ethik, Philo"
380,11,0.664130445966269,"als Form der Staatsbegründung und ordnen die behandelten Modelle in die kontraktualistische Begründungstradition ein, analysieren und rekonstruieren eine staatsphilosophische Position zur Bestimmung von Demokratie und eine zur Bestimmung von sozialer Gerechtigkeit in ihren wesentlichen Gedankenschritten. p g p Qi p URTEILSKOMPETENZ Die Schülerinnen und Schüler erörtern abwägend anthropologische Voraussetzungen der behandelten Staatsmodelle und deren Konsequenzen, bewerten die Überzeugungskraft der behandelten kontraktualistischen",NRW,Gym,Sek2,2014.0,"Ethik, Philo"
381,11,0.5642052426204228,"kriteriengeleitet und argumentierend die Tragfähigkeit der behandelten kontraktualistischen Staatsmodelle zur Orientierung in gegenwärtigen politischen Problemlagen, bewerten kriteriengeleitet und argumentierend die Tragfähigkeit der behandelten Konzepte zur Bestimmung von Demokratie und sozialer Gerechtigkeit, erörtern unter Bezugnahme auf die behandelten Positionen zur Bestimmung von Demokratie und sozialer Gerechtigkeit argumentativ abwägend die Frage nach dem Recht auf Widerstand in einer Demokratie. Inhaltsfeld Geltungsansprüche der Wissenschaften",NRW,Gym,Sek2,2014.0,"Ethik, Philo"
382,11,0.623810586309424,"Problemlagen, bewerten kriteriengeleitet und argumentierend die Tragfähigkeit der behandelten Konzepte zur Bestimmung von Demokratie und sozialer Gerechtigkeit, erörtern unter Bezugnahme auf die behandelten Positionen zur Bestimmung von Demokratie und sozialer Gerechtigkeit argumentativ abwägend die Frage nach dem Recht auf Widerstand in einer Demokratie. Inhaltsfeld Geltungsansprüche der Wissenschaften Inhaltliche Schwerpunkte Erkenntnistheoretische Grundlagen der Wissenschaften Der Anspruch der Naturwissenschaften auf Objektivität SACHKOMPETENZ Die",NRW,Gym,Sek2,2014.0,"Ethik, Philo"
383,11,0.8885651300409974,p g p Qi p Inhaltsfeld Zusammenleben in Staat und Gesellschaft Inhaltliche Schwerpunkte Gemeinschaft als Prinzip staatsphilosophischer Legitimation Individualinteresse und Gesellschaftsvertrag als Prinzip staatsphilosophischer Legitimation Konzepte von Demokratie und sozialer Gerechtigkeit Bedingungen einer dauerhaften Friedensordnung in einer globalisierten Welt SACHKOMPETENZ Die Schülerinnen und Schüler stellen die Legitimationsbedürftigkeit staatlicher Herrschaft als philosophisches Problem dar und entwickeln eigene Lösungsbeiträge in Form von möglichen,NRW,Gym,Sek2,2014.0,"Ethik, Philo"
384,11,0.9575757110424581,"als Form der Staatsbegründung und ordnen die behandelten Modelle in die kontraktualistische Begründungstradition ein, analysieren und rekonstruieren eine staatsphilosophische Position zur Bestimmung von Demokratie und eine zur Bestimmung von sozialer Gerechtigkeit in ihrem gedanklichen Aufbau, stellen differenziert gedankliche Bezüge zwischen den Positionen zur Bestimmung von Demokratie und sozialer Gerechtigkeit her und ordnen sie in die Tradition der Begründung des modernen demokratischen",NRW,Gym,Sek2,2014.0,"Ethik, Philo"
385,11,0.9080985100002815,"staatsphilosophische Position zur Bestimmung von Demokratie und eine zur Bestimmung von sozialer Gerechtigkeit in ihrem gedanklichen Aufbau, stellen differenziert gedankliche Bezüge zwischen den Positionen zur Bestimmung von Demokratie und sozialer Gerechtigkeit her und ordnen sie in die Tradition der Begründung des modernen demokratischen Rechtsstaates ein, stellen globale Probleme als Bedrohung für die friedliche Koexistenz der Völker und Staaten dar und entwickeln",NRW,Gym,Sek2,2014.0,"Ethik, Philo"
386,11,0.6517482667218969,"differenziert argumentierend die Tragfähigkeit der behandelten kontraktualistischen Staatsmodelle zur Orientierung in gegenwärtigen politischen Problemlagen, bewerten kriteriengeleitet und differenziert argumentierend die Tragfähigkeit der behandelten Positionen zur Bestimmung von Demokratie und sozialer Gerechtigkeit, erörtern argumentativ abwägend das Problem einer unter gegenwärtigen Verhältnissen tragfähigen Bestimmung von Demokratie und sozialer Gerechtigkeit und greifen dabei auf relevante Positionen zu ihrer Bestimmung zurück, bewerten kriteriengeleitet und differenziert",NRW,Gym,Sek2,2014.0,"Ethik, Philo"
387,11,0.6060285120377891,"und differenziert argumentierend die Tragfähigkeit der behandelten Positionen zur Bestimmung von Demokratie und sozialer Gerechtigkeit, erörtern argumentativ abwägend das Problem einer unter gegenwärtigen Verhältnissen tragfähigen Bestimmung von Demokratie und sozialer Gerechtigkeit und greifen dabei auf relevante Positionen zu ihrer Bestimmung zurück, bewerten kriteriengeleitet und differenziert argumentierend die Tragfähigkeit des behandelten Denkmodells zur Herstellung bzw. Sicherung des internationalen Friedens, erörtern argumentativ abwägend",NRW,Gym,Sek2,2014.0,"Ethik, Philo"
388,8,0.9626666584495344,"die Erreichung der dort aufgeführten Kompetenzerwartungen zu überprüfen. Ein isoliertes, lediglich auf Reproduktion angelegtes Abfragen einzelner Daten und Sachverhalte allein kann dabei den zuvor formulierten Ansprüchen an die Leistungsfeststellung nicht gerecht werden. g p g g g Die rechtlich verbindlichen Grundsätze der Leistungsbewertung sind im Schulgesetz sowie in der Ausbildungs- und Prüfungsordnung für die gymnasiale Oberstufe APO-GOSt dargestellt. Demgemäß sind bei",NRW,Gym,Sek2,2014.0,"Ethik, Philo"
389,8,0.9481481202017801,"schriftliche Hausarbeit und selbstständig zu verfassen. Umfang und Schwierigkeitsgrad der Facharbeit sind so zu g g g / g gestalten, dass sie ihrer Wertigkeit im Rahmen des Beurteilungsbereichs Schriftliche Arbeiten/Klausuren gerecht wird. Grundsätze der Leistungsbewertung von Facharbeiten regelt die Schule. Die Verpflichtung zur Anfertigung einer Facharbeit entfällt bei Belegung eines Projektkurses. Beurteilungsbereich Sonstige Leistungen im Unterricht/Sonstige Mitarbeit Im Beurteilungsbereich Sonstige Leistungen",NRW,Gym,Sek2,2014.0,"Ethik, Philo"
390,11,0.3504890599074846,"und Prinzipien sowie Kriterien zu ihrer Bewertung gewinnen. Darüber hinaus trägt diese Auseinandersetzung auch dazu bei, Einsicht in die Grundideen zu vermitteln, die hinter aktuellen politischen Diskursen zur Friedenssicherung und gerechten Güterverteilung stehen. Inhaltsfeld Geltungsansprüche der Wissenschaften In diesem Inhaltsfeld fragen Schülerinnen und Schüler nach dem spezifischen Vorgehen und dem Geltungs- und Objektivitätsanspruch der neuzeitlichen bzw. modernen Naturwissenschaften sowie in Abgrenzung",NRW,Gym,Sek2,2014.0,"Ethik, Philo"
391,4,0.36252074694061204,"Normen durch Streit rechtsphilosophische Fragen DRF Naturrecht vs. Rechtspositivismus Reflexionsbereiche: Ethik, Anthropologie, Geschichte und Gesellschaft, Sprachphilosophie, Metaphysik, Erkenntnistheorie, Lebenskunst Diskussion von Fragen des Stellenwerts allgemeiner und überpositiver Leitkriterien wie: politische Gerechtigkeit Fairness Gleichheit rechtliche Richtigkeit z. B. Ronald Dworkins Fall Riggs, Jürgen Habermas Ergänzungstheorie Das Gute und das Böse ca. / Unterrichtsstunden Verbindliche Inhalte Hinweise und Anregungen das Gute Reflexion der",MeckPomm,Gym,Sek2,2019.0,"Ethik, Philo"
392,14,0.9333332939301908,"einer jeden Schülerin ist mit den neu eingeführten Grund- und Leistungskursen für Sie besser zu realisieren, und die neue Generation der Rahmenpläne liefert Ihnen die Basis für einen diesem Anspruch gerecht werdenden Unterricht. Die Rahmenpläne sind nicht als Checkliste zu begreifen, anhand derer Sie behandelte Themengebiete und Lerninhalte abhaken. Der Fokus liegt nicht auf der Stofffülle, sondern vielmehr auf den zu",MeckPomm,Gym,Sek2,2019.0,"Ethik, Philo"
