document_id,most_prevalent_topic_id,most_prevalent_topic_probability,text_excerpt,state,school type,grade,year,subject
0,14,0.35986518429758213,"gelingendes Leben im Kontext globaler Krisen und Erfordernissen von Nachhaltigkeit. Inhaltsfeld : Sinnsuche und Lebensentwürfe Inhaltliche Schwerpunkte: - Lebensgestaltung - Grenzerfahrungen Sachkompetenz Die Schülerinnen und Schüler beschreiben Träume, Sinnsuche und Glück in ihrer Bedeutung für das eigene Leben, vergleichen Konzepte der Lebensgestaltung u. a. Eudaimonie, Religiosität, beschreiben Verhalten und Handlungen mit Bezug auf unterschiedliche Lebensweisen und Weltanschauungen, stellen unterschiedliche Lebensentwürfe und",NRW,,Sek1,2024.0,"Ethik, Philo"
1,2,0.6509718645930445,Schuljahrgänge und Leitthemen für die Schuljahrgänge und Fragen nach dem Ich Ich und meine Beziehungen Das Ich und seine sozialen Rollen Entwicklung und Gestaltung von Identität Fragen nach der Zukunft Glück und Lebensgestaltung Konstruktiver Umgang mit Krisen Verantwortung für Natur und Umwelt Fragen nach Moral und Ethik Regeln für das Zusammenleben Liebe und Sexualität Ethische Grundlagen für Konfliktlösungen Fragen nach der,Niedersachsen,Oberschule.pdf,,,"Ethik, Philo"
2,10,0.9747747599248165,"das eigene Leben. Identifikations- und Abgrenzungsangebote bezüglich verschiedener Kriterien: Schönheit, Berühmtheit, Reichtum, Erfolg, Mut, Zivilcourage, Hilfsbereitschaft, Gewaltlosigkeit ... Grundbegriffe: Familienformen, Freundschaft, Idol, Vorbild Inhaltsbezogener Kompetenzbereich: Fragen nach der Zukunft Leitthema: Glück und Lebensgestaltung Erwartete Kompetenzen am Ende von Schuljahrgang Mögliche Inhalte für den Kompetenzerwerb Die Schülerinnen und Schüler ... beschreiben individuelle Zukunftswünsche und nennen Kriterien für glückliches Leben. Berufswunsch, fiktiver Lebenslauf,",Niedersachsen,Oberschule.pdf,,,"Ethik, Philo"
3,13,0.6521748476098773,"von Kindern. geschlechtsspezifische Zukunftserwartungen, Kinder im Krieg, Kinder in Armut, Kinder mit Migrationshintergrund setzen sich mit dem Verständnis von Erfolg und Misserfolg auseinander. mögliche Bedingungen für Erfolg und Misserfolg: Leistungsbereitschaft, Glück, eigene und fremde Erwartungshaltungen, Faulheit, Pech, überzogene Erwartungshaltung, Minderwertigkeitsgefühl, Selbstvertrauen, Motivation und Demotivation entwickeln Verhaltensmöglichkeiten für den Umgang mit Erfolg bzw. Misserfolg. Trost, Lob, Anerkennung, Wertschätzung relativen Erfolgs, Inanspruchnahme fremder",Niedersachsen,Oberschule.pdf,,,"Ethik, Philo"
4,10,0.9740740683956653,"für Weiblichkeit und Männlichkeit LGBT bzw. LSBTTIQ offizielle Abkürzungen für eine Zusammenstellung verschiedener Geschlechtsidentitäten stellen individuelle Glücksvorstellungen dar. erörtern individuelle Glücksvorstellungen. Glückskonzeptionen in Vergangenheit und Gegenwart z. B. Stoa, Flow, Glück als aktive Sinnsetzung, Selbstwirksamkeit materielles vs. immaterielles Glück reflektieren den Umgang mit der eigenen Endlichkeit. Krankheit, Altern, Sterben, Tod Trauer Phasen der Trauerbewältigung, Leiden, carpe diem vs. memento mori religiöse",Niedersachsen,Oberschule.pdf,,,"Ethik, Philo"
5,10,0.9777777680357469,"Abkürzungen für eine Zusammenstellung verschiedener Geschlechtsidentitäten stellen individuelle Glücksvorstellungen dar. erörtern individuelle Glücksvorstellungen. Glückskonzeptionen in Vergangenheit und Gegenwart z. B. Stoa, Flow, Glück als aktive Sinnsetzung, Selbstwirksamkeit materielles vs. immaterielles Glück reflektieren den Umgang mit der eigenen Endlichkeit. Krankheit, Altern, Sterben, Tod Trauer Phasen der Trauerbewältigung, Leiden, carpe diem vs. memento mori religiöse Jenseitsvorstellungen ... Grundbegriffe: Endlichkeit, Freiheit, Gender/Sex, Glück, Identität",Niedersachsen,Oberschule.pdf,,,"Ethik, Philo"
6,10,0.9740740668757323,"immaterielles Glück reflektieren den Umgang mit der eigenen Endlichkeit. Krankheit, Altern, Sterben, Tod Trauer Phasen der Trauerbewältigung, Leiden, carpe diem vs. memento mori religiöse Jenseitsvorstellungen ... Grundbegriffe: Endlichkeit, Freiheit, Gender/Sex, Glück, Identität Inhaltsbezogener Kompetenzbereich: Fragen nach der Zukunft Leitthema: Verantwortung für Natur und Umwelt Erwartete Kompetenzen am Ende von Schuljahrgang am Ende von Schuljahrgang Mögliche Inhalte für den Kompetenzerwerb Die Schülerinnen",Niedersachsen,Oberschule.pdf,,,"Ethik, Philo"
7,14,0.9813333249193458,"Vorurteil Werte Ethik Geschlechterrolle Grundbedürfnisse Initiationsritus Konflikt Konvention Krise Liebe Menschenbild Menschenrechte Menschenwürde Mobbing Orientierung Prävention Selbstbestimmung Selbstwertgefühl Sexualität soziale Rolle Sucht Weltanschauung Weltbild Endlichkeit Erkennen Ethik Gender/Sex Gewalt Glauben/Meinen/Wissen Glück Identität Konflikt Medien Nachhaltigkeit Natur Ökologie Ökonomie Religionskritik Sinnstiftung Toleranz Umwelt Wahrnehmen Wahrheitsansprüche Weltanschauung Weltreligionen - Christentum, Judentum, Islam, Hinduismus, Buddhismus Wirklichkeit Verantwortung",Niedersachsen,Oberschule.pdf,,,"Ethik, Philo"
8,13,0.9733333167223247,"nach der Zukunft Leitthema: Glück und Lebensgestaltung Erwartete Kompetenzen am Ende von Schuljahrgang Mögliche Inhalte für den Kompetenzerwerb Die Schülerinnen und Schüler ... beschreiben individuelle Zukunftswünsche und nennen Kriterien für glückliches Leben. Berufswunsch, fiktiver Lebenslauf, Gesundheit, Frieden, persönliche Sicherheit intakte Umwelt verantwortungsvoller Umgang mit Tieren, Wasser, Luft und Energie, Möglichkeiten zur Übernahme von Verantwortung Schule, Freizeit, Familie und Gesellschaft vergleichen unterschiedliche",Niedersachsen,Oberschule.pdf,,,"Ethik, Philo"
9,13,0.97606836613263,"Motivation und Demotivation entwickeln Verhaltensmöglichkeiten für den Umgang mit Erfolg bzw. Misserfolg. Trost, Lob, Anerkennung, Wertschätzung relativen Erfolgs, Inanspruchnahme fremder Hilfe, Bescheidenheit, realistische Selbsteinschätzung, Aufstiegsmöglichkeiten, Versagensängste, Förderprogramme ... Grundbegriffe: Erfolg/Misserfolg, glückliches Leben, Verantwortungsbewusstsein Inhaltsbezogener Kompetenzbereich: Fragen nach Moral und Ethik Leitthema: Regeln für das Zusammenleben Erwartete Kompetenzen am Ende von Schuljahrgang Mögliche Inhalte für den Kompetenzerwerb Die Schülerinnen und Schüler ...",Niedersachsen,Oberschule.pdf,,,"Ethik, Philo"
10,14,0.9797101343901203,vorgegebenen Regeln vertreten gestalten entwerfen Aufgaben auf der Grundlage von Textkenntnissen und Sachwissen gestaltend interpretieren A Übersicht über die verbindlichen Grundbegriffe Schuljahrgänge und Schuljahrgänge und Schuljahrgänge und Erfolg/Misserfolg Familienformen Freundschaft glückliches Leben das Göttliche Goldene Regel Idol Klischee Mobbing Monotheismus/Polytheismus Naturwissenschaft Normen Religiosität Ritual Schöpfung Toleranz Verantwortungsbewusstsein Vorbild Vorurteil Werte Ethik Geschlechterrolle Grundbedürfnisse Initiationsritus Konflikt Konvention Krise Liebe Menschenbild Menschenrechte Menschenwürde,Niedersachsen,Oberschule.pdf,,,"Ethik, Philo"
11,13,0.5440324731923704,"im Christentum, Islam und Judentum Sollen Stunden Rechte und Regeln - Konflikte Moralisches Handeln - Werte und Normen Toleranz und Respekt - Vorurteil Wahrheit und Ehrlichkeit - Lüge Wege zum Glück - Freizeit Vorstellungen des guten Lebens Sein: Ich Mensch sein Ethik / Wer bin ich - Wer will ich sein In der Entwicklung vom Kind zum Jugendlichen grenzen die Schülerinnen",Saarland,GemS,"5,6",2018.0,"Ethik, Philo"
12,6,0.9555555033329101,"Woche ohne Fernsehen, Mobiltelefon und Internet durchhalten Sein: Die Welt Kultur Ethik / Armut und Wohlstand Armut und Wohlstand in der Konsumgesellschaft zeigen, inwiefern Wünsche und Bedürfnisse und damit menschliches Glück auf den Besitz und den Gebrauch von materiellen Gütern gerichtet sind. Jugendliche erleben dies in der Wahrnehmung von Unterschieden zwischen sich und anderen, zwischen sozialen Wohlstandsstandards innerhalb unserer Gesellschaft und",Saarland,GemS,"5,6",2018.0,"Ethik, Philo"
13,6,0.9611111031052662,"Die Schülerinnen und Schüler beschreiben und reflektieren eigene Gefühle und Gedanken in der Begegnung mit Armut und Wohlstand, geben an, was sie unter Armut und Wohlstand verstehen, grenzen Wohlstand und Glück voneinander ab, erklären die Relativität von Armut und Wohlstand, unterscheiden zwischen Bedarf und Bedürfnis, Schüler-Kurzvortrag, Blitzumfrage, Präsentation eines Kurzfilms, Bildimpulse Metaplanarbeit, Schreibgitter, Think-PairShare: Welche materiellen Dinge gehören zu einem guten",Saarland,GemS,"5,6",2018.0,"Ethik, Philo"
14,6,0.9717171514391704,"Präsentation eines Kurzfilms, Bildimpulse Metaplanarbeit, Schreibgitter, Think-PairShare: Welche materiellen Dinge gehören zu einem guten Leben Blitzumfrage: Wenn du drei Wünsche frei hättest Diskussionen: Ist der Reiche immer glücklicher Kann man Glück kaufen Vorstellen alternativer Lebenskonzepte, z. B. das des Buen Vivir Ist das Verhältnis von Wohlstand/Armut und Glück messbar Sein: Die Welt Kultur Ethik / Armut und Wohlstand inhaltsbezogene Kompetenzen methodisch-didaktische",Saarland,GemS,"5,6",2018.0,"Ethik, Philo"
15,6,0.965432084825565,"du drei Wünsche frei hättest Diskussionen: Ist der Reiche immer glücklicher Kann man Glück kaufen Vorstellen alternativer Lebenskonzepte, z. B. das des Buen Vivir Ist das Verhältnis von Wohlstand/Armut und Glück messbar Sein: Die Welt Kultur Ethik / Armut und Wohlstand inhaltsbezogene Kompetenzen methodisch-didaktische Hinweise beschreiben Ursachen, Faktoren und Folgen von Armut und Wohlstand: o soziale Unterschiede, o elementare/normale Bedürfnisse/Luxus, o",Saarland,GemS,"5,6",2018.0,"Ethik, Philo"
16,13,0.9666666333961924,"Fußballspiels: Wo wird dort gelogen, geschummelt, geschwindelt etc. Diskussion der Ergebnisse Handeln Versuch: einen Tag ohne jegliche Formen der Lüge verbringen Sollen: Vorstellungen des guten Lebens Ethik / Wege zum Glück - Freizeit Jugendliche der Klassenstufen und erleben Glück und Unglück zumeist unmittelbar als gefühlte Zustände. In der Reflexion wird die Abhängigkeit dieser Zustände von Bedürfnissen und Wünschen deutlich. Vornehmlich die",Saarland,GemS,"5,6",2018.0,"Ethik, Philo"
17,13,0.9688888627367216,Diskussion der Ergebnisse Handeln Versuch: einen Tag ohne jegliche Formen der Lüge verbringen Sollen: Vorstellungen des guten Lebens Ethik / Wege zum Glück - Freizeit Jugendliche der Klassenstufen und erleben Glück und Unglück zumeist unmittelbar als gefühlte Zustände. In der Reflexion wird die Abhängigkeit dieser Zustände von Bedürfnissen und Wünschen deutlich. Vornehmlich die Freizeit wird als der Spielraum für selbstbestimmtes Glück,Saarland,GemS,"5,6",2018.0,"Ethik, Philo"
18,13,0.5275088888449806,"Glück und Unglück zumeist unmittelbar als gefühlte Zustände. In der Reflexion wird die Abhängigkeit dieser Zustände von Bedürfnissen und Wünschen deutlich. Vornehmlich die Freizeit wird als der Spielraum für selbstbestimmtes Glück wahrgenommen. Denkanstöße Was brauche ich, was wünsche ich mir darüber hinaus Welche Wege zum Glück gibt es Wie gestalte ich meine freie Zeit Kompetenzerwartungen Die Schülerinnen und Schüler können Handlungsmuster",Saarland,GemS,"5,6",2018.0,"Ethik, Philo"
19,7,0.962666630651881,"Zustände von Bedürfnissen und Wünschen deutlich. Vornehmlich die Freizeit wird als der Spielraum für selbstbestimmtes Glück wahrgenommen. Denkanstöße Was brauche ich, was wünsche ich mir darüber hinaus Welche Wege zum Glück gibt es Wie gestalte ich meine freie Zeit Kompetenzerwartungen Die Schülerinnen und Schüler können Handlungsmuster z. B. Gewohnheiten beschreiben und vergleichen Wünsche und Bedürfnisse, ethisch relevante Fragen in Handlungen und",Saarland,GemS,"5,6",2018.0,"Ethik, Philo"
20,7,0.9678160818774605,"ich meine freie Zeit Kompetenzerwartungen Die Schülerinnen und Schüler können Handlungsmuster z. B. Gewohnheiten beschreiben und vergleichen Wünsche und Bedürfnisse, ethisch relevante Fragen in Handlungen und Situationen identifizieren Wege zum Glück, thematisch relevante Argumente selbst entwickeln Wege zum Glück, eigene Urteile durch den Verweis auf Regeln, Regelverstöße und Folgen begründen Wege zum Glück, verschiedene Argumente zu einem Problem sammeln und in",Saarland,GemS,"5,6",2018.0,"Ethik, Philo"
21,7,0.9708333251780179,"Schüler können Handlungsmuster z. B. Gewohnheiten beschreiben und vergleichen Wünsche und Bedürfnisse, ethisch relevante Fragen in Handlungen und Situationen identifizieren Wege zum Glück, thematisch relevante Argumente selbst entwickeln Wege zum Glück, eigene Urteile durch den Verweis auf Regeln, Regelverstöße und Folgen begründen Wege zum Glück, verschiedene Argumente zu einem Problem sammeln und in der Gruppe auf ihre Relevanz und Güte prüfen",Saarland,GemS,"5,6",2018.0,"Ethik, Philo"
22,7,0.9698924604465128,"Fragen in Handlungen und Situationen identifizieren Wege zum Glück, thematisch relevante Argumente selbst entwickeln Wege zum Glück, eigene Urteile durch den Verweis auf Regeln, Regelverstöße und Folgen begründen Wege zum Glück, verschiedene Argumente zu einem Problem sammeln und in der Gruppe auf ihre Relevanz und Güte prüfen Wege zum Glück. inhaltsbezogene Kompetenzen methodisch-didaktische Hinweise Wünsche und Bedürfnisse Die Schülerinnen und Schüler",Saarland,GemS,"5,6",2018.0,"Ethik, Philo"
23,7,0.9641025262765677,"durch den Verweis auf Regeln, Regelverstöße und Folgen begründen Wege zum Glück, verschiedene Argumente zu einem Problem sammeln und in der Gruppe auf ihre Relevanz und Güte prüfen Wege zum Glück. inhaltsbezogene Kompetenzen methodisch-didaktische Hinweise Wünsche und Bedürfnisse Die Schülerinnen und Schüler unterscheiden zwischen Bedürfnissen und Wünschen, ordnen ihre Bedürfnisse und Wünsche nach selbst erstellten Kriterien. Erstellen und Vergleichen von Wunschlisten:",Saarland,GemS,"5,6",2018.0,"Ethik, Philo"
24,9,0.6774926934714627,"Wünsche nach selbst erstellten Kriterien. Erstellen und Vergleichen von Wunschlisten: Was brauche ich Was wünsche ich mir Einteilen von Bedürfnisse/Wünschen: lebensnotwendige Grundbedürfnisse, angemessene und unangemessene Wünsche Kriterien diskutieren Wege zum Glück Die Schülerinnen und Schüler nennen und beschreiben Situationen, in denen sie sich glücklich fühlen, vergleichen und klassifizieren Glückssituationen nach selbst gewählten Kriterien, entwerfen Glücksstrategien, beschreiben eigene Vorstellungen zur Freizeitgestaltung, diskutieren,",Saarland,GemS,"5,6",2018.0,"Ethik, Philo"
25,13,0.9450979639227675,ansteuern o realistische Erwartungen haben o Ängste/Hindernisse überwinden Reflexion des eigenen Standpunktes: zwischen gesunder Langeweile und Freizeitstress sich auf einer Skala poSollen: Vorstellungen des guten Lebens Ethik / Wege zum Glück - Freizeit inhaltsbezogene Kompetenzen methodisch-didaktische Hinweise Diskutieren auf der Grundlage von Denkanstößen zum Thema sinnvolle Freizeit: Von was befreie ich mich in der FreiZeit Lasse ich mir meine Zeit stehlen,Saarland,GemS,"5,6",2018.0,"Ethik, Philo"
26,9,0.6616695091536788,"Was wünsche ich mir Einteilen von Bedürfnisse/Wünschen: lebensnotwendige Grundbedürfnisse, angemessene und unangemessene Wünsche Kriterien diskutieren Wege zum Glück Die Schülerinnen und Schüler nennen und beschreiben Situationen, in denen sie sich glücklich fühlen, vergleichen und klassifizieren Glückssituationen nach selbst gewählten Kriterien, entwerfen Glücksstrategien, beschreiben eigene Vorstellungen zur Freizeitgestaltung, diskutieren, ob und inwieweit ihre Bedürfnisse und Wünsche im Bereich der Freizeitgestaltung durch Medien",Saarland,GemS,"5,6",2018.0,"Ethik, Philo"
27,6,0.9717171511828067,"Bedürfnis, Schüler-Kurzvortrag, Blitzumfrage, Präsentation eines Kurzfilms, Bildimpulse Metaplanarbeit, Schreibgitter, Think-PairShare: Welche materiellen Dinge gehören zu einem guten Leben Blitzumfrage: Wenn du drei Wünsche frei hättest Diskussionen: Ist der Reiche immer glücklicher Kann man Glück kaufen Vorstellen alternativer Lebenskonzepte, z. B. das des Buen Vivir Ist das Verhältnis von Wohlstand/Armut und Glück messbar Sein: Die Welt Kultur Ethik / Armut und Wohlstand",Saarland,GemS,"5,6",2018.0,"Ethik, Philo"
28,2,0.8090057176588722,"differenziert wahrzunehmen und im eigenen Erfahrungshorizont zu reflektieren, moralisch-ethische Probleme als solche zu erkennen, Gegebenheiten des persönlichen und gesellschaftlichen Lebens kritisch zu hinterfragen, den persönlichen Lebensbereich und das Streben nach Glück bewusst, eigenständig und verantwortlich zu gestalten zu begreifen, dass Traditionskritik und Traditionsbewahrung für das Zusammenleben der Menschen notwendig ist, eigene Neigungen , Wünsche, Standpunkte und Wertmaßstäbe vor dem Hintergrund der",,,,2006.0,"Ethik, Philo"
29,2,0.5862105090231979,"und Grenzen der Erkenntnis. Hier sind auch Aspekte der Erkenntnistheorie, der Sprachphilosophie und der Logik gefragt. Dabei wird auch das Bewusstsein für die ethische Bedeutung der Begrenztheit unseres Wissens herausgestellt. Glück Die Schüler reflektieren die Notwendigkeit einer verantwortlichen Sinnorientierung und Lebensgestaltung. Dabei sollen sie Glück und Liebe als Basis menschlichen Selbst- und Beziehungsverständnisses begreifen. In Auseinandersetzung mit philosophischen Ansätzen und Aussagen",,,,2006.0,"Ethik, Philo"
30,2,0.594433436007781,"Logik gefragt. Dabei wird auch das Bewusstsein für die ethische Bedeutung der Begrenztheit unseres Wissens herausgestellt. Glück Die Schüler reflektieren die Notwendigkeit einer verantwortlichen Sinnorientierung und Lebensgestaltung. Dabei sollen sie Glück und Liebe als Basis menschlichen Selbst- und Beziehungsverständnisses begreifen. In Auseinandersetzung mit philosophischen Ansätzen und Aussagen der empirischen Forschung lernen sie, dass Selbstverwirklichung nicht durch egoistisches Eigeninteresse, sondern nur in",,,,2006.0,"Ethik, Philo"
31,13,0.7487195734880223,"der Frage nach dem Beginn der Menschenwürde. Positive oder negative Folgen, Nutzenerwägungen sind für Kant kein Moralkriterium. Die moralische Gesinnung, nicht Erfolg oder Misserfolg entscheiden über den moralischen Wert. Das Glück der Vielen rechtfertigt nach Kant nicht das Verfügen über den Einzelnen. AFB II Aufgabe Utilitaristische Überlegungen stellen als konsequenzialistische teleologische Ethik die Folgen von Handlungen ins Zentrum. Dem entsprechen auch",,,,2006.0,"Ethik, Philo"
32,9,0.7517419317081934,"zentralen Begriffe müssen vergleichend erläutert werden: Genuss/Lust Bei Aristoteles ist ein Leben für den Genuss animalisch , Epikur sieht in der zu erwartenden Lust das entscheidende Kriterium beim Streben nach Glück Hedonismus; nicht gemeint sind die Lüste der Wüstlinge, sondern ein Zustand ohne Schmerzen im Körper noch Beunruhigung der Seele Selbstgenügsamkeit, Tugenden, Aristoteles: Stufenleiter des Glücks. Arete Tugend, Tüchtigkeit Aristoteles: Voraussetzung",,,,2006.0,"Ethik, Philo"
33,9,0.9533333050272501,"Gerechtigkeit beruhigt die Seele, Selbstzucht mahnt, der Vernunft zu folgen, bringt Frieden der Seele, Weisheit als Kunst im Aufsuchen von Lust; etc. Philosoph Aristoteles: Hingabe an die Philosophie das höchste Glück Autarkie, Epikur: Der glückselige Weise ist immer im Glück. Polis Aristoteles: Glück als erfülltes Tätigsein in der polis, Die epikureische Eudaimonia ist nicht polisbezogen, sie tendiert zu einem Leben in",,,,2006.0,"Ethik, Philo"
34,9,0.834019430027541,"folgen, bringt Frieden der Seele, Weisheit als Kunst im Aufsuchen von Lust; etc. Philosoph Aristoteles: Hingabe an die Philosophie das höchste Glück Autarkie, Epikur: Der glückselige Weise ist immer im Glück. Polis Aristoteles: Glück als erfülltes Tätigsein in der polis, Die epikureische Eudaimonia ist nicht polisbezogen, sie tendiert zu einem Leben in Zurückgezogenheit individuelles, subjektives Glück. Mögliches Ergebnis des Vergleichs: Beide",,,,2006.0,"Ethik, Philo"
35,9,0.8234005478292677,"der Seele, Weisheit als Kunst im Aufsuchen von Lust; etc. Philosoph Aristoteles: Hingabe an die Philosophie das höchste Glück Autarkie, Epikur: Der glückselige Weise ist immer im Glück. Polis Aristoteles: Glück als erfülltes Tätigsein in der polis, Die epikureische Eudaimonia ist nicht polisbezogen, sie tendiert zu einem Leben in Zurückgezogenheit individuelles, subjektives Glück. Mögliches Ergebnis des Vergleichs: Beide Positionen unterscheiden sich",,,,2006.0,"Ethik, Philo"
36,2,0.48970668861498895,"glückselige Weise ist immer im Glück. Polis Aristoteles: Glück als erfülltes Tätigsein in der polis, Die epikureische Eudaimonia ist nicht polisbezogen, sie tendiert zu einem Leben in Zurückgezogenheit individuelles, subjektives Glück. Mögliches Ergebnis des Vergleichs: Beide Positionen unterscheiden sich weniger, als es auf den ersten Blick erscheint. AFB I/II Aufgabe Ausgewählte Aspekte des Vergleichs sollen vor dem Hintergrund gegenwärtiger Glücksvorstellungen kritisch",,,,2006.0,"Ethik, Philo"
37,9,0.9555555271192399,"entscheidende Kriterium beim Streben nach Glück Hedonismus; nicht gemeint sind die Lüste der Wüstlinge, sondern ein Zustand ohne Schmerzen im Körper noch Beunruhigung der Seele Selbstgenügsamkeit, Tugenden, Aristoteles: Stufenleiter des Glücks. Arete Tugend, Tüchtigkeit Aristoteles: Voraussetzung des geglückten Lebens, Epikur: Tugenden nur erstrebenswert, wenn sie Lust erzeugen Gerechtigkeit beruhigt die Seele, Selbstzucht mahnt, der Vernunft zu folgen, bringt Frieden der Seele,",,,,2006.0,"Ethik, Philo"
38,9,0.3422742537862124,"zwar hat, aber dabei schläft oder ein Leben lang untätig, ja darüber hinaus mit größtem Leid und Unglück beladen ist. Wer aber ein solches Leben führt, den wird niemand als glücklich bezeichnen, außer er möchte eine paradoxe Behauptung unter allen Umständen retten. ... c Die dritte Lebensform ist die Hingabe an die Philosophie. Darüber wird die Untersuchung später zu führen sein.",,,,2006.0,"Ethik, Philo"
39,4,0.4549809171609715,"auf diesem Gebiete der Kultur mit sich bringen, die Gottähnlichkeit noch weiter steigern. Im Interesse unserer Untersuchungen wollen wir aber nicht vergessen, dass der Mensch sich in seiner Gottähnlichkeit nicht glücklich fühlt. Quelle: S. Freud, Das Unbehagen in der Kultur. Aus A. Mitscherlich, A. Richards, J. Strachey Hrsg.,Sigmund Freud, Studienausgabe, Band IX, S., Frankfurt/Main Aufgabenstellung: Erörtern Sie das im Text aufgezeigte",,,,2006.0,"Ethik, Philo"
40,2,0.742906842661172,"darf ich hoffen Was ist der Mensch in Beziehung zu philosophischen Disziplinen und ihre Konkretisierung an einer gegebenen philosophischen Problemstellung Vergleich zwischen eigenen Definitionen von Begriffen wie Freundschaft, Liebe, Tod, Glück, Freiheit, Wissen, Zweifel mit den Definitionen von ausgewählten Philosophen Beschäftigung mit einem exemplarischen Philosophen z. B. SARTRE, SOKRATES Kompetenzerwerb im Themenfeld Die Einführung in die Philosophie macht die Schülerinnen und",Berlin,Gym,Sek2,2022.0,"Ethik, Philo"
41,5,0.49180390356328163,"B. Bilder, literarische Texte, Einnahme verschiedener Perspektiven und Entwerfen von Lösungsmöglichkeiten Analysieren von Begriffen und Gedankengängen in klar strukturierten, ethisch argumentierenden Texten und ihre schematische bzw. grafische Darstellung Mögliche Schwerpunkte Glück und Moral: Erörterung des Verhältnisses von Glück und Moral an Beispielen und Reflexion des Verhältnisses von Glück und Moral Grundbegriffe der Ethik: Norm, das Gute, Verantwortung, Gerechtigkeit Was ist Moral:",Berlin,Gym,Sek2,2022.0,"Ethik, Philo"
42,5,0.555960539857511,"und Entwerfen von Lösungsmöglichkeiten Analysieren von Begriffen und Gedankengängen in klar strukturierten, ethisch argumentierenden Texten und ihre schematische bzw. grafische Darstellung Mögliche Schwerpunkte Glück und Moral: Erörterung des Verhältnisses von Glück und Moral an Beispielen und Reflexion des Verhältnisses von Glück und Moral Grundbegriffe der Ethik: Norm, das Gute, Verantwortung, Gerechtigkeit Was ist Moral: moralische und nicht moralische Urteile, Intuition und",Berlin,Gym,Sek2,2022.0,"Ethik, Philo"
43,5,0.6091054841493034,"klar strukturierten, ethisch argumentierenden Texten und ihre schematische bzw. grafische Darstellung Mögliche Schwerpunkte Glück und Moral: Erörterung des Verhältnisses von Glück und Moral an Beispielen und Reflexion des Verhältnisses von Glück und Moral Grundbegriffe der Ethik: Norm, das Gute, Verantwortung, Gerechtigkeit Was ist Moral: moralische und nicht moralische Urteile, Intuition und moralisches Gefühl, Werte und ihre Bedeutung im Alltag, Wertevermittlung durch",Berlin,Gym,Sek2,2022.0,"Ethik, Philo"
44,13,0.4355627632596126,"gesellschaftlichen Werten und Normen und ihren Konsequenzen Reflexion philosophischer Entwürfe zur Bedeutung und Begründung von Werten und Normen Mögliche Schwerpunkte ethisches Argumentieren der Begriff des Guten, des Bösen und des Glücks Fragen der angewandten Ethik das menschliche Handeln im Spannungsfeld eigener und fremder Kultur Analyse aktueller ethischer Probleme Analyse und Kritik ethischer Positionen und gesellschaftlich anerkannter moralischer Verhaltensregeln Kompetenzerwerb im Themenfeld",Berlin,Gym,Sek2,2022.0,"Ethik, Philo"
