document_id,most_prevalent_topic_id,most_prevalent_topic_probability,text_excerpt,state,school type,grade,year,subject
456,1,0.508459910704293,"und Völkern Die Rolle des Verzichts in der Selbstverwirklichung z B Sportler, Gesundheitsfasten, Zurückstellen eigener Interessen zugunsten höheJ.trZiele .. und Werte, Rücksichtnahme l Auswahlthema: Streben nach Glück Inhalte: - Begriffsabgrenzngen: Glück- Lust- Freude - Zufriedenheit -Hoffnung - Unterschiedliche Glücksvorstellungen der Menschen - lehren vom Glück: z.B. Eudämonismus - Hedonismus - Utilitarismus - Zusammenhang zwischen Glück, Wert, Sinn und Lebensgestaltung - Begrenztheit",Rheinland-Pfalz,,Sek2,1983.0,"Ethik, Philo"
457,1,0.5264048663215933,"eigener Interessen zugunsten höheJ.trZiele .. und Werte, Rücksichtnahme l Auswahlthema: Streben nach Glück Inhalte: - Begriffsabgrenzngen: Glück- Lust- Freude - Zufriedenheit -Hoffnung - Unterschiedliche Glücksvorstellungen der Menschen - lehren vom Glück: z.B. Eudämonismus - Hedonismus - Utilitarismus - Zusammenhang zwischen Glück, Wert, Sinn und Lebensgestaltung - Begrenztheit des Glücks Edäuterung und Begründung der Themen: Die Grundfrage Was ist der Mensch beschäftigt",Rheinland-Pfalz,,Sek2,1983.0,"Ethik, Philo"
458,1,0.5410347726127217,"Streben nach Glück Inhalte: - Begriffsabgrenzngen: Glück- Lust- Freude - Zufriedenheit -Hoffnung - Unterschiedliche Glücksvorstellungen der Menschen - lehren vom Glück: z.B. Eudämonismus - Hedonismus - Utilitarismus - Zusammenhang zwischen Glück, Wert, Sinn und Lebensgestaltung - Begrenztheit des Glücks Edäuterung und Begründung der Themen: Die Grundfrage Was ist der Mensch beschäftigt den Menschen, seitdem er bewußt über sich und sein leben",Rheinland-Pfalz,,Sek2,1983.0,"Ethik, Philo"
459,2,0.7877691982098372,"dieser umfassenden Lebensbetrachtung aus die Möglichkeit der Sinnhaftigkeit im ganzen bejaht. Bedrohtheit und Gefährdung menschlichen Glücks, Unvollkommenheit und Grenzerfahrung sensibilisieren zugleich für Glücksmöglichkeiten und Glückserfahrungen, sie machen empfänglich für das Glück in einer Fülle von einfachen Dingen und zwischenmenschlichen Beziehungen. Wo das Glück des Verstehens erlebt wird, werden Hoffnung und Sinn in die Person- und Lebensgeschichte eingebunden. Als verbindliche Kernthemen sollen",Rheinland-Pfalz,,Sek2,1983.0,"Ethik, Philo"
460,2,0.8139606916420852,"und Gefährdung menschlichen Glücks, Unvollkommenheit und Grenzerfahrung sensibilisieren zugleich für Glücksmöglichkeiten und Glückserfahrungen, sie machen empfänglich für das Glück in einer Fülle von einfachen Dingen und zwischenmenschlichen Beziehungen. Wo das Glück des Verstehens erlebt wird, werden Hoffnung und Sinn in die Person- und Lebensgeschichte eingebunden. Als verbindliche Kernthemen sollen im EthikunterrichtDas Bild vom Menschen und die Sinnfrage sowie Der Selbstfindungsprozeß des",Rheinland-Pfalz,,Sek2,1983.0,"Ethik, Philo"
461,2,0.6896258277840193,"Person- und Lebensgeschichte eingebunden. Als verbindliche Kernthemen sollen im EthikunterrichtDas Bild vom Menschen und die Sinnfrage sowie Der Selbstfindungsprozeß des Menschen und die Sinnfrage behandelt werden Das Auswahlthema Streben nach Glück präzisiert wichtige Inhalte der Kernthemen, insofern als das Bild und der Selbstfindungsprozeß des Menschen ganz wesentlich von der Beantwortung der Sinnfrage und der Glückssuche im menschlichen Leben berührt werden ..",Rheinland-Pfalz,,Sek2,1983.0,"Ethik, Philo"
462,7,0.3660289335345305,"die Sinnfrage Bewußtsein der besonderen Stellung des Menschen in der Welt Kenntnis verschiedener Menschenbilder Einsicht in die Geschichtlichkeit des Menschen Fähigkeit zur Beurteilung von Menschenbildern Bewußtsein, daß die Sehnsucht nach Glück eine Grundbefindlichkeit des Menschen ist , Aufgeschlossenheit für die Frage nach dem Sinn als einer GrundfragemenschlichenL ebens Zu b: Der Selbstfindungsprozeß des Menschen und die Sinnfrage Einsicht in die Bedingtheit",Rheinland-Pfalz,,Sek2,1983.0,"Ethik, Philo"
463,2,0.9294856135388639,"Bezug, in Partnerschaft, Freundschaft, zwischenmenschlichen Beziehungen. Die Frage nach dem Menschen ist deshalb die Frage nach seiner Mitmenschlichkeit, seinen Personen-und Sachbezügen, seiner Verwiesenheit auf den anderen und das andere Menschliches Glück gibt es nur in bejahter Abhängigkeit, im Ernst des Vertrauens und im Wagnis det liebe. Selbstverwirklichung geschieht vor allem auf den anderen hin in Freiheit, Verantwortung, Dienstbereitschaft und Hingabe. Der",Rheinland-Pfalz,,Sek2,1983.0,"Ethik, Philo"
464,1,0.5610194716594641,"Freude - Zufriedenheit -Hoffnung - Unterschiedliche Glücksvorstellungen der Menschen - lehren vom Glück: z.B. Eudämonismus - Hedonismus - Utilitarismus - Zusammenhang zwischen Glück, Wert, Sinn und Lebensgestaltung - Begrenztheit des Glücks Edäuterung und Begründung der Themen: Die Grundfrage Was ist der Mensch beschäftigt den Menschen, seitdem er bewußt über sich und sein leben in menschlicher Gesellschaft und Welt nachdenkt. Diese Fragestellung",Rheinland-Pfalz,,Sek2,1983.0,"Ethik, Philo"
465,5,0.4212475411775841,"Suche nach dem Sinn als einer Problematik, mit derjeder sich auseinandersetzen muß, gerecht zu werden, wird diese Thematik ausdrücklich in den Kernthemen der Jahrgangsstufe zur Sprache gebracht Die Dialektik von Glücks-und Leidensgeschichte als Sich-Bemächtigen der Welt wird nur der begreifen, der das Einmalige des Lebens akzeptieren, diese Zustimmung zum L ebe,auch ohne Verdrängung der eigenen Todesgewißheit und der Todeserfahrung bei Mitmenschen",Rheinland-Pfalz,,Sek2,1983.0,"Ethik, Philo"
466,2,0.7333298600255702,"ebe,auch ohne Verdrängung der eigenen Todesgewißheit und der Todeserfahrung bei Mitmenschen geben kann und von dieser umfassenden Lebensbetrachtung aus die Möglichkeit der Sinnhaftigkeit im ganzen bejaht. Bedrohtheit und Gefährdung menschlichen Glücks, Unvollkommenheit und Grenzerfahrung sensibilisieren zugleich für Glücksmöglichkeiten und Glückserfahrungen, sie machen empfänglich für das Glück in einer Fülle von einfachen Dingen und zwischenmenschlichen Beziehungen. Wo das Glück des Verstehens erlebt",Rheinland-Pfalz,,Sek2,1983.0,"Ethik, Philo"
467,7,0.3233160597575737,"kommt dem Ethikunterricht angesichts vielfältiger Infragestellungen traditioneller Normen und Wertvorstellungen in einer globalisierten Welt die Aufgabe zu, die ethische Urteilsfähigkeit zu stärken. Dazu gehört die inhaltliche Auseinandersetzung mit Begriffen wie Glück, Freiheit, Verantwortung, Gerechtigkeit und Glaube, die in unserem Nachdenken über das Gute im menschlichen Leben eine zentrale Rolle spielen und deren konkrete Bedeutung für das eigene Leben und das Zusammenleben",Sachsen-Anhalt,,,2019.0,"Ethik, Philo"
468,7,0.5859119261018844,Guten und nach dem gelingenden Leben für die bewusste Lebensgestaltung der Schülerinnen und Schüler und aus den Fragestellungen der philosophischen Ethik. Folgende Kompetenzschwerpunkte lassen sich als grundlegend und exemplarisch ausweisen: Glück Freiheit Verantwortung Gerechtigkeit Glaube Lebensgestaltung Natur - Mensch - Technik Diese Kompetenzschwerpunkte vgl. Kap. . sind Kristallisationspunkte der ethischen Reflexion wesentlicher Lebensbereiche der Schülerinnen und Schüler. Die im Ethikunterricht erworbene,Sachsen-Anhalt,,,2019.0,"Ethik, Philo"
469,2,0.5103584004190056,für die Auseinandersetzung mit aktuellen ethischen Fragestellungen genutzt werden können. Abb. : Konzept grundlegender Wissensbestände für den Ethikunterricht an Sekundarschulen Biographischlebensweltliche Perspektive Philosophischethische Perspektive Die Frage nach dem gelingenden Leben Glück Möglichkeiten und Grenzen freier Selbstbestimmung Freiheit individueller Verantwortung in der Gesellschaft Verantwortung Gerechtigkeit den Gründen des Glaubens Glauben der eigenen Identität und gelingenden Beziehungen Lebensgestaltung Möglichkeiten und Grenzen des technischen,Sachsen-Anhalt,,,2019.0,"Ethik, Philo"
470,11,0.39843256237939845,"Menschen- und Bürgerrechte - Sicherung und Entwicklung der Demokratie als Staatsund Lebensform - Interessen, Interessenkonflikte und Ausgleich von Interessen Kompetenzentwicklung in den Schuljahrgängen Übersicht über die Kompetenzschwerpunkte Schuljahrgänge Kompetenzschwerpunkte / Glück: Die Vielfalt und Individualität von Glücksvorstellungen Freiheit: Freiheit und Vernunft Verantwortung: Formen und Motive von Verantwortungsübernahme Gerechtigkeit: Maßstäbe gerechter Verteilung Glaube: Die Bedeutung von Religiosität im Leben von Menschen Lebensgestaltung:",Sachsen-Anhalt,,,2019.0,"Ethik, Philo"
471,7,0.4399562113648417,Gerechtigkeit: Maßstäbe gerechter Verteilung Glaube: Die Bedeutung von Religiosität im Leben von Menschen Lebensgestaltung: Der Wert von sozialen Beziehungen Natur - Mensch - Technik: Das Verhältnis Mensch - Natur / Glück: Glücksversprechungen Freiheit: Eigene Freiheit und die Freiheit anderer Verantwortung: Eigenverantwortung in gesellschaftlichen Zusammenhängen Gerechtigkeit: Verschiedene Begriffe von Gerechtigkeit Glaube: Religionen und ihre Deutungen menschlicher Existenz Lebensgestaltung: Liebe und Sexualität Natur,Sachsen-Anhalt,,,2019.0,"Ethik, Philo"
472,7,0.5466738017145781,in gesellschaftlichen Zusammenhängen Gerechtigkeit: Verschiedene Begriffe von Gerechtigkeit Glaube: Religionen und ihre Deutungen menschlicher Existenz Lebensgestaltung: Liebe und Sexualität Natur - Mensch - Technik: Chancen und Grenzen von Medien / Glück: Der Zusammenhang von Glück und Moral Freiheit: Individuelle Freiheit als Grundlage und Erfordernis der Menschenwürde Verantwortung: Individuelle Verantwortung in sozialen Zusammenhängen Gerechtigkeit: Gesellschaftliche Probleme unter dem Aspekt von Gerechtigkeit Glaube:,Sachsen-Anhalt,,,2019.0,"Ethik, Philo"
473,7,0.5253758264436917,"Verschiedene Begriffe von Gerechtigkeit Glaube: Religionen und ihre Deutungen menschlicher Existenz Lebensgestaltung: Liebe und Sexualität Natur - Mensch - Technik: Chancen und Grenzen von Medien / Glück: Der Zusammenhang von Glück und Moral Freiheit: Individuelle Freiheit als Grundlage und Erfordernis der Menschenwürde Verantwortung: Individuelle Verantwortung in sozialen Zusammenhängen Gerechtigkeit: Gesellschaftliche Probleme unter dem Aspekt von Gerechtigkeit Glaube: Sinnstiftung durch Religionen, Fehlformen",Sachsen-Anhalt,,,2019.0,"Ethik, Philo"
474,11,0.3968687215202232,"Sinnstiftung durch Religionen, Fehlformen von Religionen und quasireligiöse Fremdbestimmung Lebensgestaltung: Die Endlichkeit des Lebens Natur - Mensch - Technik: Veränderungen der menschlichen Natur am Beispiel medizinischer Entwicklungen Schuljahrgänge / Kompetenzschwerpunkt Glück: Die Vielfalt und Individualität von Glücksvorstellungen sich mit der Vielfalt und Individualität von Glücksvorstellungen auseinandersetzen Differenzierendes Wahrnehmen von Alltagserfahrungen ausgehend die individuellen Aspekte von Glück und Unglück beschreiben die inhaltliche",Sachsen-Anhalt,,,2019.0,"Ethik, Philo"
475,11,0.44582005364948407,medizinischer Entwicklungen Schuljahrgänge / Kompetenzschwerpunkt Glück: Die Vielfalt und Individualität von Glücksvorstellungen sich mit der Vielfalt und Individualität von Glücksvorstellungen auseinandersetzen Differenzierendes Wahrnehmen von Alltagserfahrungen ausgehend die individuellen Aspekte von Glück und Unglück beschreiben die inhaltliche Vielfalt von Glücksvorstellungen als bedeutsam für das eigene Leben wahrnehmen Verstehen und Deuten anhand ausgewählter Texte Antworten auf die Frage nach dem Glück formulieren und,Sachsen-Anhalt,,,2019.0,"Ethik, Philo"
476,4,0.4431360725463585,Aspekte von Glück und Unglück beschreiben die inhaltliche Vielfalt von Glücksvorstellungen als bedeutsam für das eigene Leben wahrnehmen Verstehen und Deuten anhand ausgewählter Texte Antworten auf die Frage nach dem Glück formulieren und den eigenen Standpunkt überprüfen Untersuchen und Zergliedern in unserem Sprechen vom Glück und Unglück verschiedene Bedeutungen unterscheiden und den Unterschied zwischen zugefallenem und erarbeitetem Glück bestimmen Denken in,Sachsen-Anhalt,,,2019.0,"Ethik, Philo"
477,4,0.5904895857100014,das eigene Leben wahrnehmen Verstehen und Deuten anhand ausgewählter Texte Antworten auf die Frage nach dem Glück formulieren und den eigenen Standpunkt überprüfen Untersuchen und Zergliedern in unserem Sprechen vom Glück und Unglück verschiedene Bedeutungen unterscheiden und den Unterschied zwischen zugefallenem und erarbeitetem Glück bestimmen Denken in Gegensätzen im Widerstreit verschiedener Glücksvorstellungen begründet Stellung beziehen Kreatives Denken eigene Glücksvorstellungen in Form,Sachsen-Anhalt,,,2019.0,"Ethik, Philo"
478,4,0.6922029418181178,"Frage nach dem Glück formulieren und den eigenen Standpunkt überprüfen Untersuchen und Zergliedern in unserem Sprechen vom Glück und Unglück verschiedene Bedeutungen unterscheiden und den Unterschied zwischen zugefallenem und erarbeitetem Glück bestimmen Denken in Gegensätzen im Widerstreit verschiedener Glücksvorstellungen begründet Stellung beziehen Kreatives Denken eigene Glücksvorstellungen in Form von Bildern, Geschichten und Spielen ausdrücken und zur Diskussion stellen Grundlegende Wissensbestände Glück",Sachsen-Anhalt,,,2019.0,"Ethik, Philo"
479,4,0.5589443243134242,"Glück bestimmen Denken in Gegensätzen im Widerstreit verschiedener Glücksvorstellungen begründet Stellung beziehen Kreatives Denken eigene Glücksvorstellungen in Form von Bildern, Geschichten und Spielen ausdrücken und zur Diskussion stellen Grundlegende Wissensbestände Glück und verwandte Worte in unserer Sprache Arten von Bedürfnissen Utopien Kompetenzschwerpunkt Freiheit: Freiheit und Vernunft Freiheit und Vernunft als Voraussetzungen eigenverantwortlichen und begründeten Handelns reflektieren Differenzierendes Wahrnehmen den Menschen als",Sachsen-Anhalt,,,2019.0,"Ethik, Philo"
480,2,0.3230161145023928,präsentieren und das eigene Handeln unter ökologischen Gesichtspunkten reflektieren Grundlegende Wissensbestände Ökologische Verantwortung Ziele und Grenzen von Naturschutz Bezüge zu fächerübergreifenden Themen Tiere und Menschen leben zusammen Schuljahrgänge / Kompetenzschwerpunkt Glück: Glücksversprechungen Glücksversprechungen überprüfen und sich kritisch positionieren Differenzierendes Wahrnehmen sich selbst als Adressaten vielfältiger Glücksversprechungen wahrnehmen den Einfluss dieser Versprechungen auf das eigene Denken und Handeln aufdecken Verstehen und Deuten,Sachsen-Anhalt,,,2019.0,"Ethik, Philo"
481,7,0.43097291094353496,Netzwerken Jugendschutzgesetz Abschnitte und physische und psychische Auswirkungen übermäßigen Medienkonsums Medien und Macht Bezüge zu fächerübergreifenden Themen Freizeit sinnvoll gestalten Chancen und Risiken in der digitalen Welt Schuljahrgänge / Kompetenzschwerpunkt Glück: Der Zusammenhang von Glück und Moral den Zusammenhang von Glück und Moral bestimmen und bei der eigenen Lebensgestaltung berücksichtigen Differenzierendes Wahrnehmen Konflikte zwischen individuellem Glücksstreben und moralischen Erfordernissen wahrnehmen die,Sachsen-Anhalt,,,2019.0,"Ethik, Philo"
482,7,0.44087457190182044,physische und psychische Auswirkungen übermäßigen Medienkonsums Medien und Macht Bezüge zu fächerübergreifenden Themen Freizeit sinnvoll gestalten Chancen und Risiken in der digitalen Welt Schuljahrgänge / Kompetenzschwerpunkt Glück: Der Zusammenhang von Glück und Moral den Zusammenhang von Glück und Moral bestimmen und bei der eigenen Lebensgestaltung berücksichtigen Differenzierendes Wahrnehmen Konflikte zwischen individuellem Glücksstreben und moralischen Erfordernissen wahrnehmen die Bestimmungen des Guten in,Sachsen-Anhalt,,,2019.0,"Ethik, Philo"
483,7,0.40286366167942667,Medien und Macht Bezüge zu fächerübergreifenden Themen Freizeit sinnvoll gestalten Chancen und Risiken in der digitalen Welt Schuljahrgänge / Kompetenzschwerpunkt Glück: Der Zusammenhang von Glück und Moral den Zusammenhang von Glück und Moral bestimmen und bei der eigenen Lebensgestaltung berücksichtigen Differenzierendes Wahrnehmen Konflikte zwischen individuellem Glücksstreben und moralischen Erfordernissen wahrnehmen die Bestimmungen des Guten in populären Glücksvorstellungen beschreiben Verstehen und Deuten,Sachsen-Anhalt,,,2019.0,"Ethik, Philo"
484,4,0.5798684306887191,eigenen Lebensgestaltung berücksichtigen Differenzierendes Wahrnehmen Konflikte zwischen individuellem Glücksstreben und moralischen Erfordernissen wahrnehmen die Bestimmungen des Guten in populären Glücksvorstellungen beschreiben Verstehen und Deuten Texte/Filme zum Verhältnis von Moral und Glück interpretieren und den eigenen Standpunkt überprüfen Untersuchen und Zergliedern innere und äußere Faktoren von Glück im Hinblick auf die eigene Lebensgestaltung analysieren Denken in Gegensätzen moralisches oder unmoralisches Glücksstreben an,Sachsen-Anhalt,,,2019.0,"Ethik, Philo"
485,4,0.8430912968208382,des Guten in populären Glücksvorstellungen beschreiben Verstehen und Deuten Texte/Filme zum Verhältnis von Moral und Glück interpretieren und den eigenen Standpunkt überprüfen Untersuchen und Zergliedern innere und äußere Faktoren von Glück im Hinblick auf die eigene Lebensgestaltung analysieren Denken in Gegensätzen moralisches oder unmoralisches Glücksstreben an unterschiedlichen Beispielen erörtern und bewerten Kreatives Denken Konsequenzen eines schrankenlosen Hedonismus für das menschliche Zusammenleben,Sachsen-Anhalt,,,2019.0,"Ethik, Philo"
486,4,0.9346127687321748,"Denken in Gegensätzen moralisches oder unmoralisches Glücksstreben an unterschiedlichen Beispielen erörtern und bewerten Kreatives Denken Konsequenzen eines schrankenlosen Hedonismus für das menschliche Zusammenleben darstellen Grundlegende Wissensbestände grundlegende philosophische Aussagen zum Glück z. B. Glück als erfüllter Augenblick, Glück als selbstbestimmtes Leben, Glück als Wunscherfüllung Grundgedanken zum Verhältnis von Glück und Moral z. B. Eudämonismus, Hedonismus, Utilitarismus, Pflichtethik Kompetenzschwerpunkt Freiheit: Freiheit als",Sachsen-Anhalt,,,2019.0,"Ethik, Philo"
487,4,0.9319691821891453,"moralisches oder unmoralisches Glücksstreben an unterschiedlichen Beispielen erörtern und bewerten Kreatives Denken Konsequenzen eines schrankenlosen Hedonismus für das menschliche Zusammenleben darstellen Grundlegende Wissensbestände grundlegende philosophische Aussagen zum Glück z. B. Glück als erfüllter Augenblick, Glück als selbstbestimmtes Leben, Glück als Wunscherfüllung Grundgedanken zum Verhältnis von Glück und Moral z. B. Eudämonismus, Hedonismus, Utilitarismus, Pflichtethik Kompetenzschwerpunkt Freiheit: Freiheit als Grundlage und Erfordernis",Sachsen-Anhalt,,,2019.0,"Ethik, Philo"
488,4,0.9343485743148023,"an unterschiedlichen Beispielen erörtern und bewerten Kreatives Denken Konsequenzen eines schrankenlosen Hedonismus für das menschliche Zusammenleben darstellen Grundlegende Wissensbestände grundlegende philosophische Aussagen zum Glück z. B. Glück als erfüllter Augenblick, Glück als selbstbestimmtes Leben, Glück als Wunscherfüllung Grundgedanken zum Verhältnis von Glück und Moral z. B. Eudämonismus, Hedonismus, Utilitarismus, Pflichtethik Kompetenzschwerpunkt Freiheit: Freiheit als Grundlage und Erfordernis der Menschenwürde Freiheit als",Sachsen-Anhalt,,,2019.0,"Ethik, Philo"
489,4,0.9333365067595296,"und bewerten Kreatives Denken Konsequenzen eines schrankenlosen Hedonismus für das menschliche Zusammenleben darstellen Grundlegende Wissensbestände grundlegende philosophische Aussagen zum Glück z. B. Glück als erfüllter Augenblick, Glück als selbstbestimmtes Leben, Glück als Wunscherfüllung Grundgedanken zum Verhältnis von Glück und Moral z. B. Eudämonismus, Hedonismus, Utilitarismus, Pflichtethik Kompetenzschwerpunkt Freiheit: Freiheit als Grundlage und Erfordernis der Menschenwürde Freiheit als Grundlage und Erfordernis der",Sachsen-Anhalt,,,2019.0,"Ethik, Philo"
490,4,0.892172612753778,"Hedonismus für das menschliche Zusammenleben darstellen Grundlegende Wissensbestände grundlegende philosophische Aussagen zum Glück z. B. Glück als erfüllter Augenblick, Glück als selbstbestimmtes Leben, Glück als Wunscherfüllung Grundgedanken zum Verhältnis von Glück und Moral z. B. Eudämonismus, Hedonismus, Utilitarismus, Pflichtethik Kompetenzschwerpunkt Freiheit: Freiheit als Grundlage und Erfordernis der Menschenwürde Freiheit als Grundlage und Erfordernis der Menschenwürde verteidigen Differenzierendes Wahrnehmen Strukturen der Fremdbestimmung",Sachsen-Anhalt,,,2019.0,"Ethik, Philo"
491,2,0.958332434470689,"Leben Der Mensch als Einzel- und Gemeinschaftswesen Die Rolle von Gefühl und Vernunft im glücklichen Leben Selbstgenügsamkeit, Besonnenheit, Lust, Hedonismus, intrinsischer und instrumenteller Wert Zusätzlich im erhöhten Anforderungsniveau: Tugenden und Glück Eudaimonie, produktive Tätigkeit Beitrag zur Leitperspektive W: Die Schülerinnen und Schüler reflektieren Vorstellungen vom guten und gelingenden Leben auch im Zusammenhang mit der Bedeutung und Funktion von Autonomie, Rationalität und",Hamburg,,Studienstufe,2022.0,"Ethik, Philo"
492,2,0.8186362719728099,"Inhalte Fachbezogen Umsetzungshilfen Leitperspektiven Aufgabengebiete Gesundheitsförderung Interkulturelle Erziehung Sprachbildung Fachübergreifende Bezüge Vorstellungen vom guten und gelingenden Leben Der Mensch als Einzel- und Gemeinschaftswesen Die Rolle von Gefühl und Vernunft im glücklichen Leben Selbstgenügsamkeit, Besonnenheit, Lust, Hedonismus, intrinsischer und instrumenteller Wert Zusätzlich im erhöhten Anforderungsniveau: Tugenden und Glück Eudaimonie, produktive Tätigkeit Beitrag zur Leitperspektive W: Die Schülerinnen und Schüler reflektieren Vorstellungen vom",Hamburg,,Studienstufe,2022.0,"Ethik, Philo"
493,2,0.8551194572815469,"unterschiedliche gesellschaftliche Anerkennung auf die Berufswahl aus Welchen Einfluss haben Geschlechterrollen auf die Berufswahl Herstellen, Arbeiten und Handeln; Vita activa versus vita contemplativa H. Arendt Arbeit als Bestimmung des Menschen Glück und gelingendes Leben Was ist für mich ein gelingendes Leben Wie stelle ich mir ein glückliches Leben vor Welche Bedeutung hat mein Aussehen für mein Glück Macht Geld glücklich In",Berlin,,7-10,2015.0,"Ethik, Philo"
494,2,0.8682015277991174,"als Bestimmung des Menschen Glück und gelingendes Leben Was ist für mich ein gelingendes Leben Wie stelle ich mir ein glückliches Leben vor Welche Bedeutung hat mein Aussehen für mein Glück Macht Geld glücklich In welchem Zusammenhang stehen gelingendes und glückliches Leben Was kann ich dazu beitragen, dass ich ein glückliches Leben führe Inwieweit brauche ich andere Menschen, um glücklich zu",Berlin,,7-10,2015.0,"Ethik, Philo"
495,2,0.8230487721129218,glücklich zu sein Was erhoffe ich mir für meine Zukunft Welche gesellschaftlichen Vorbilder eines gelingenden Lebens gibt es Welche Rolle spielt die Selbstverwirklichung für ein gelingendes Leben Welche Bilder von Glück vermittelt die Gesellschaft Inwieweit tragen die Medien zu Stereotypisierung und Ausgrenzung von Menschen bei Inwiefern tragen positive Zukunftsversionen zur Gestaltung eines gelingenden Lebens bei Was bedeutet Wohlstand in einer Postwachstumsgesellschaft,Berlin,,7-10,2015.0,"Ethik, Philo"
496,2,0.4206019504996423,"und Ausgrenzung von Menschen bei Inwiefern tragen positive Zukunftsversionen zur Gestaltung eines gelingenden Lebens bei Was bedeutet Wohlstand in einer Postwachstumsgesellschaft Haben kontra Sein z. B. E. Fromm Lust und Glück als Grundlage der Ethik hedonistische und eudämonistische Ethiken Märchen z. B. Hans im Glück, Der Fischer und sin Fru Flow-Erfahrung M. Csikszentmihalyi Utopien und Dystopien: z. B. Lord of the",Berlin,,7-10,2015.0,"Ethik, Philo"
497,5,0.27661786976811004,"bei Was bedeutet Wohlstand in einer Postwachstumsgesellschaft Haben kontra Sein z. B. E. Fromm Lust und Glück als Grundlage der Ethik hedonistische und eudämonistische Ethiken Märchen z. B. Hans im Glück, Der Fischer und sin Fru Flow-Erfahrung M. Csikszentmihalyi Utopien und Dystopien: z. B. Lord of the Flies W. Golding, Utopia T. Morus, Kein Ort. Nirgends C. Wolf Wie frei bin",Berlin,,7-10,2015.0,"Ethik, Philo"
498,2,0.8555601856051821,"Menschen Glück und gelingendes Leben Was ist für mich ein gelingendes Leben Wie stelle ich mir ein glückliches Leben vor Welche Bedeutung hat mein Aussehen für mein Glück Macht Geld glücklich In welchem Zusammenhang stehen gelingendes und glückliches Leben Was kann ich dazu beitragen, dass ich ein glückliches Leben führe Inwieweit brauche ich andere Menschen, um glücklich zu sein Was erhoffe",Berlin,,7-10,2015.0,"Ethik, Philo"
499,2,0.8895127852567111,"mein Glück Macht Geld glücklich In welchem Zusammenhang stehen gelingendes und glückliches Leben Was kann ich dazu beitragen, dass ich ein glückliches Leben führe Inwieweit brauche ich andere Menschen, um glücklich zu sein Was erhoffe ich mir für meine Zukunft Welche gesellschaftlichen Vorbilder eines gelingenden Lebens gibt es Welche Rolle spielt die Selbstverwirklichung für ein gelingendes Leben Welche Bilder von Glück",Berlin,,7-10,2015.0,"Ethik, Philo"
500,2,0.9517531021495914,"und Handeln; Vita activa versus vita contemplativa H. Arendt Arbeit als Bestimmung des Menschen Glück und gelingendes Leben Was ist für mich ein gelingendes Leben Wie stelle ich mir ein glückliches Leben vor Welche Bedeutung hat mein Aussehen für mein Glück Macht Geld glücklich In welchem Zusammenhang stehen gelingendes und glückliches Leben Was kann ich dazu beitragen, dass ich ein glückliches",Berlin,,7-10,2015.0,"Ethik, Philo"
