document_id,most_prevalent_topic_id,most_prevalent_topic_probability,text_excerpt,state,school type,grade,year,subject
320,2,0.9713535471824755,und Leitthemen für die Schuljahrgänge und Fragen nach dem Ich Ich und meine Beziehungen Das Ich und seine sozialen Rollen Entwicklung und Gestaltung von Identität Schuljahrgang Fragen nach der Zukunft Glück und Lebensgestaltung Konstruktiver Umgang mit Krisen Verantwortung für Natur und Umwelt Schuljahrgang Fragen nach Moral und Ethik Regeln für das Zusammenleben Liebe und Sexualität Ethische Grundlagen für Konfliktlösungen Schuljahrgang Fragen,Niedersachsen,Realschule,,2018.0,"Ethik, Philo"
321,10,0.97522504117468,"das eigene Leben. Identifikations- und Abgrenzungsangebote bezüglich verschiedener Kriterien: Schönheit, Berühmtheit, Reichtum, Erfolg, Mut, Zivilcourage, Hilfsbereitschaft, Gewaltlosigkeit ... Grundbegriffe: Familienformen, Freundschaft, Idol, Vorbild Inhaltsbezogener Kompetenzbereich: Fragen nach der Zukunft Leitthema: Glück und Lebensgestaltung Erwartete Kompetenzen am Ende von Schuljahrgang Mögliche Inhalte für den Kompetenzerwerb Die Schülerinnen und Schüler ... beschreiben individuelle Zukunftswünsche und nennen Kriterien für glückliches Leben. Berufswunsch, fiktiver Lebenslauf,",Niedersachsen,Realschule,,2018.0,"Ethik, Philo"
322,2,0.9770832292248754,"von Kindern. geschlechtsspezifische Zukunftserwartungen, Kinder im Krieg, Kinder in Armut, Kinder mit Migrationshintergrund setzen sich mit dem Verständnis von Erfolg und Misserfolg auseinander. mögliche Bedingungen für Erfolg und Misserfolg: Leistungsbereitschaft, Glück, eigene und fremde Erwartungshaltungen, Faulheit, Pech, überzogene Erwartungshaltung, Minderwertigkeitsgefühl, Selbstvertrauen, Motivation und Demotivation entwickeln Verhaltensmöglichkeiten für den Umgang mit Erfolg bzw. Misserfolg. Trost, Lob, Anerkennung, Wertschätzung relativen Erfolgs, Inanspruchnahme fremder",Niedersachsen,Realschule,,2018.0,"Ethik, Philo"
323,8,0.9730391136743697,"Geschlecht gesellschaftlich determinierte Rollenzuweisungen für Weiblichkeit und Männlichkeit LGBT bzw. LSBTTIQ offizielle Abkürzungen für eine Zusammenstellung verschiedener Geschlechtsidentitäten erörtern individuelle Glücksvorstellungen. Glückskonzeptionen in Vergangenheit und Gegenwart z. B. Stoa, Flow, Glück als aktive Sinnsetzung, Selbstwirksamkeit materielles vs. immaterielles Glück reflektieren den Umgang mit der eigenen Endlichkeit. Krankheit, Altern, Sterben, Tod Trauer Phasen der Trauerbewältigung, Leiden, carpe diem vs. memento mori religiöse",Niedersachsen,Realschule,,2018.0,"Ethik, Philo"
324,8,0.9764956515897306,"LGBT bzw. LSBTTIQ offizielle Abkürzungen für eine Zusammenstellung verschiedener Geschlechtsidentitäten erörtern individuelle Glücksvorstellungen. Glückskonzeptionen in Vergangenheit und Gegenwart z. B. Stoa, Flow, Glück als aktive Sinnsetzung, Selbstwirksamkeit materielles vs. immaterielles Glück reflektieren den Umgang mit der eigenen Endlichkeit. Krankheit, Altern, Sterben, Tod Trauer Phasen der Trauerbewältigung, Leiden, carpe diem vs. memento mori religiöse Jenseitsvorstellungen ... Grundbegriffe: Endlichkeit, Freiheit, Gender/Sex, Glück, Identität",Niedersachsen,Realschule,,2018.0,"Ethik, Philo"
325,8,0.6129166645986324,"immaterielles Glück reflektieren den Umgang mit der eigenen Endlichkeit. Krankheit, Altern, Sterben, Tod Trauer Phasen der Trauerbewältigung, Leiden, carpe diem vs. memento mori religiöse Jenseitsvorstellungen ... Grundbegriffe: Endlichkeit, Freiheit, Gender/Sex, Glück, Identität Inhaltsbezogener Kompetenzbereich: Fragen nach der Zukunft Leitthema: Verantwortung für Natur und Umwelt Erwartete Kompetenzen am Ende von Schuljahrgang Mögliche Inhalte für den Kompetenzerwerb Die Schülerinnen und Schüler ... vergleichen",Niedersachsen,Realschule,,2018.0,"Ethik, Philo"
326,12,0.5111963667056219,"Werte Ethik Geschlechterrolle Grundbedürfnisse Initiationsritus Konflikt Konvention Krise Liebe Menschenbild Menschenrechte Menschenwürde Mobbing Orientierung Prävention Selbstbestimmung Selbstwertgefühl Sexualität soziale Rolle Sucht Weltanschauung Weltbild Endlichkeit Erkennen Ethik Freiheit Gender/Sex Gewalt Glauben/Meinen/Wissen Glück Identität Konflikt Medien Nachhaltigkeit Natur Ökologie Ökonomie Religionskritik Sinnstiftung Toleranz Umwelt Wahrnehmen Wahrheitsansprüche Weltanschauung Weltreligionen - Christentum, Judentum, Islam, Hinduismus, Buddhismus Wirklichkeit Verantwortung",Niedersachsen,Realschule,,2018.0,"Ethik, Philo"
327,2,0.5406535102548125,"nach der Zukunft Leitthema: Glück und Lebensgestaltung Erwartete Kompetenzen am Ende von Schuljahrgang Mögliche Inhalte für den Kompetenzerwerb Die Schülerinnen und Schüler ... beschreiben individuelle Zukunftswünsche und nennen Kriterien für glückliches Leben. Berufswunsch, fiktiver Lebenslauf, Gesundheit, Frieden, persönliche Sicherheit intakte Umwelt verantwortungsvoller Umgang mit Tieren, Wasser, Luft und Energie, Möglichkeiten zur Übernahme von Verantwortung Schule, Freizeit, Familie und Gesellschaft vergleichen unterschiedliche",Niedersachsen,Realschule,,2018.0,"Ethik, Philo"
328,2,0.9764953708622671,"Motivation und Demotivation entwickeln Verhaltensmöglichkeiten für den Umgang mit Erfolg bzw. Misserfolg. Trost, Lob, Anerkennung, Wertschätzung relativen Erfolgs, Inanspruchnahme fremder Hilfe, Bescheidenheit, realistische Selbsteinschätzung, Aufstiegsmöglichkeiten, Versagensängste, Förderprogramme ... Grundbegriffe: Erfolg/Misserfolg, glückliches Leben, Verantwortungsbewusstsein Inhaltsbezogener Kompetenzbereich: Fragen nach Moral und Ethik Leitthema: Regeln für das Zusammenleben Erwartete Kompetenzen am Ende von Schuljahrgang Mögliche Inhalte für den Kompetenzerwerb Die Schülerinnen und Schüler ...",Niedersachsen,Realschule,,2018.0,"Ethik, Philo"
329,11,0.9800721882478591,vorgegebenen Regeln vertreten gestalten entwerfen Aufgaben auf der Grundlage von Textkenntnissen und Sachwissen gestaltend interpretieren A Übersicht über die verbindlichen Grundbegriffe Schuljahrgänge und Schuljahrgänge und Schuljahrgänge und Erfolg/Misserfolg Familienformen Freundschaft glückliches Leben das Göttliche Goldene Regel Idol Klischee Mobbing Monotheismus/Polytheismus Naturwissenschaft Normen Religiosität Ritual Schöpfung Toleranz Verantwortungsbewusstsein Vorbild Vorurteil Werte Ethik Geschlechterrolle Grundbedürfnisse Initiationsritus Konflikt Konvention Krise Liebe Menschenbild Menschenrechte Menschenwürde,Niedersachsen,Realschule,,2018.0,"Ethik, Philo"
330,2,0.5457711640917234,"Die Schülerinnen und Schüler ... begründen ihre persönlichen Präferenzen in der Freizeitgestaltung. schätzen die Freizeit als wertvolle Möglichkeit der Selbstverwirklichung sowie als Ausgleich zu schulischen oder familiären Verpflichtungen und Aufgaben. Glück und Lebensfreude ca. Std. prüfen bestehende Freizeitangebote anhand einfacher Kriterien und berücksichtigen Möglichkeiten und Grenzen einer selbstbestimmten Freizeitgestaltung. Inhalte zu den Kompetenzen: mögliche Begründungen der Freizeitgestaltung: z. B. Neigungen, Interessen,",Bayern,Realschule,,2023.0,"Ethik, Philo"
331,10,0.8594393940859313,"als Adressaten vielfältiger Glücksversprechungen wahr und zeigen Bewusstsein für die verhaltensbeeinflussende Wirkung, z. B. der Werbung. schätzen individuelle Glückserlebnisse, bewerten eigene Reaktionen darauf und tragen durch moralisch verantwortbare Handlungen zum Glück anderer bewusst bei. verfügen über einfache Strategien, das persönliche Glück zu finden bzw. mit Frustration umzugehen. Inhalte zu den Kompetenzen: individuelle Glückserlebnisse, z. B. Geburt eines Geschwisterkindes, Sieg des Sportvereins,",Bayern,Realschule,,2023.0,"Ethik, Philo"
332,10,0.9003020022692974,"verhaltensbeeinflussende Wirkung, z. B. der Werbung. schätzen individuelle Glückserlebnisse, bewerten eigene Reaktionen darauf und tragen durch moralisch verantwortbare Handlungen zum Glück anderer bewusst bei. verfügen über einfache Strategien, das persönliche Glück zu finden bzw. mit Frustration umzugehen. Inhalte zu den Kompetenzen: individuelle Glückserlebnisse, z. B. Geburt eines Geschwisterkindes, Sieg des Sportvereins, Erfolg in der Schule, Erhalten eines Geschenkes Glück als glücklicher",Bayern,Realschule,,2023.0,"Ethik, Philo"
333,10,0.8476193291170904,"das persönliche Glück zu finden bzw. mit Frustration umzugehen. Inhalte zu den Kompetenzen: individuelle Glückserlebnisse, z. B. Geburt eines Geschwisterkindes, Sieg des Sportvereins, Erfolg in der Schule, Erhalten eines Geschenkes Glück als glücklicher Zufall luck und Glückseligkeit happiness persönliche und kulturelle Voraussetzungen für unterschiedliche Glücksvorstellungen: z. B. Leben in Armut bzw. Reichtum, Alter, persönliche Weltanschauung, Religion Glück durch materielle und immaterielle",Bayern,Realschule,,2023.0,"Ethik, Philo"
334,10,0.4679136905435145,"Schule, Erhalten eines Geschenkes Glück als glücklicher Zufall luck und Glückseligkeit happiness persönliche und kulturelle Voraussetzungen für unterschiedliche Glücksvorstellungen: z. B. Leben in Armut bzw. Reichtum, Alter, persönliche Weltanschauung, Religion Glück durch materielle und immaterielle Dinge positive Reaktionen auf Glückserlebnisse: z. B. Energieschub, Motivation zu guten Handlungen, Zufriedenheit negative Reaktionen auf vermeintliche Glückserlebnisse: z. B. Schadenfreude, Selbstüberschätzung, Arroganz, Überheblichkeit Unglück als",Bayern,Realschule,,2023.0,"Ethik, Philo"
335,1,0.4346153085299377,"Dinge positive Reaktionen auf Glückserlebnisse: z. B. Energieschub, Motivation zu guten Handlungen, Zufriedenheit negative Reaktionen auf vermeintliche Glückserlebnisse: z. B. Schadenfreude, Selbstüberschätzung, Arroganz, Überheblichkeit Unglück als Pech, Trauer, Leid vs. Glück als Zufriedenheit, Erfolg, Stolz, Chance, Freude, Erfüllung Lernbereich : Das Fremde verstehen und damit umgehen ca. Std. offene und versteckte Glücksversprechungen der Werbung, z. B. Schönheit, Anerkennung, Spaß Beitrag zum",Bayern,Realschule,,2023.0,"Ethik, Philo"
336,1,0.535175143494109,"als Zufriedenheit, Erfolg, Stolz, Chance, Freude, Erfüllung Lernbereich : Das Fremde verstehen und damit umgehen ca. Std. offene und versteckte Glücksversprechungen der Werbung, z. B. Schönheit, Anerkennung, Spaß Beitrag zum Glück anderer, z. B. durch spontane Hilfe, ehrenamtliches Engagement einfache Glücksstrategien, z. B. Vertrauen in die eigenen Fähigkeiten, Glückstagebuch, Glücksbringer Kompetenzerwartungen Die Schülerinnen und Schüler ... beschreiben ihre Gefühle in Situationen",Bayern,Realschule,,2023.0,"Ethik, Philo"
337,2,0.6475108739578385,"mit Blick auf ihre eigenen Einstellungen und Bedürfnisse. sind sich der Bedeutung der Sinnsuche als lebenslanger Prozess für ein gelingendes Leben bewusst. Grenzen im Leben verstehen ca. Std. Lernbereich : Glück ca. Std. prüfen kriteriengeleitet Sinnangebote und unterscheiden tragfähige Sinnangebote von verfehlten Sinndeutungen. Inhalte zu den Kompetenzen: Sinn durch z. B. Liebe, Familie, Religion, Freundschaften, soziales Engagement, Arbeit Hierarchie der Bedürfnisse,",Bayern,Realschule,,2023.0,"Ethik, Philo"
338,10,0.4763664524540956,"Unfall, Krankheit, Tod Kompetenzerwartungen Die Schülerinnen und Schüler ... nehmen die Veränderung der persönlichen Glücksvorstellungen im Vergleich zum Kindesalter bewusst wahr und erkennen, dass sie altersbedingt zunehmend für ihr persönliches Glück verantwortlich sind. wenden für das Jugendalter geeignete Strategien an, um ihr individuelles Glück zu steigern und um mit Frustrations- oder fehlenden Glückserlebnissen umzugehen. zeigen Bewusstsein dafür, dass sich das individuelle",Bayern,Realschule,,2023.0,"Ethik, Philo"
339,10,0.5538936460552485,"persönlichen Glücksvorstellungen im Vergleich zum Kindesalter bewusst wahr und erkennen, dass sie altersbedingt zunehmend für ihr persönliches Glück verantwortlich sind. wenden für das Jugendalter geeignete Strategien an, um ihr individuelles Glück zu steigern und um mit Frustrations- oder fehlenden Glückserlebnissen umzugehen. zeigen Bewusstsein dafür, dass sich das individuelle Glück aus der Hinwendung zu anderen und einer moralisch verantwortbaren Lebensführung ergeben kann.",Bayern,Realschule,,2023.0,"Ethik, Philo"
340,10,0.46584009697987755,"verantwortlich sind. wenden für das Jugendalter geeignete Strategien an, um ihr individuelles Glück zu steigern und um mit Frustrations- oder fehlenden Glückserlebnissen umzugehen. zeigen Bewusstsein dafür, dass sich das individuelle Glück aus der Hinwendung zu anderen und einer moralisch verantwortbaren Lebensführung ergeben kann. Lernbereich : Ethik in der Welt der digitalen Medien ca. Std. vergleichen und bewerten verschiedene Glücksauffassungen, die sich",Bayern,Realschule,,2023.0,"Ethik, Philo"
341,2,0.4483465159843406,"im philosophischen Denken finden. hinterfragen kritisch Glückskonzepte, wie sie von der Werbeindustrie und den Medien suggeriert werden. Inhalte zu den Kompetenzen: persönliche Glückserlebnisse in der Jugendzeit: z. B. erste Liebe, Glück durch Freundschaften, Glück durch Konsum, Glück durch Freizeit- und Feriengestaltung, schulischer Erfolg veränderte Glücksvorstellungen durch z. B. vergrößerten persönlichen Freiraum z. B. in der Freizeitgestaltung, beim Taschengeld, zunehmende Lebenserfahrung und",Bayern,Realschule,,2023.0,"Ethik, Philo"
342,2,0.6322836171516678,"finden. hinterfragen kritisch Glückskonzepte, wie sie von der Werbeindustrie und den Medien suggeriert werden. Inhalte zu den Kompetenzen: persönliche Glückserlebnisse in der Jugendzeit: z. B. erste Liebe, Glück durch Freundschaften, Glück durch Konsum, Glück durch Freizeit- und Feriengestaltung, schulischer Erfolg veränderte Glücksvorstellungen durch z. B. vergrößerten persönlichen Freiraum z. B. in der Freizeitgestaltung, beim Taschengeld, zunehmende Lebenserfahrung und veränderte soziale Bindungen",Bayern,Realschule,,2023.0,"Ethik, Philo"
343,2,0.5944429659530279,"Glückskonzepte, wie sie von der Werbeindustrie und den Medien suggeriert werden. Inhalte zu den Kompetenzen: persönliche Glückserlebnisse in der Jugendzeit: z. B. erste Liebe, Glück durch Freundschaften, Glück durch Konsum, Glück durch Freizeit- und Feriengestaltung, schulischer Erfolg veränderte Glücksvorstellungen durch z. B. vergrößerten persönlichen Freiraum z. B. in der Freizeitgestaltung, beim Taschengeld, zunehmende Lebenserfahrung und veränderte soziale Bindungen Glücksstrategien in Bezug",Bayern,Realschule,,2023.0,"Ethik, Philo"
344,12,0.3492059719385499,"durch Verzicht auf Vergleiche mit anderen, Aufgehen in einer Tätigkeit M. Csikszentmihalyi: Flow Glücksstrategien in Bezug auf soziale Bindungen: gelingende Kommunikation z. B. F. Schulz von Thun, Achtsamkeit Hinweise auf Glück im philosophischen Denken: Texte zum Zusammenhang zwischen Glück und verantwortbarer Lebensführung, z. B. Aristoteles, E. Fromm Hinweise auf Glück in den Weltreligionen, z. B. Hinduismus, Buddhismus Glücksindizes, z. B. Happy",Bayern,Realschule,,2023.0,"Ethik, Philo"
345,12,0.3470447848243844,"einer Tätigkeit M. Csikszentmihalyi: Flow Glücksstrategien in Bezug auf soziale Bindungen: gelingende Kommunikation z. B. F. Schulz von Thun, Achtsamkeit Hinweise auf Glück im philosophischen Denken: Texte zum Zusammenhang zwischen Glück und verantwortbarer Lebensführung, z. B. Aristoteles, E. Fromm Hinweise auf Glück in den Weltreligionen, z. B. Hinduismus, Buddhismus Glücksindizes, z. B. Happy Planet Index Glücksversprechungen z. B. der Medien, Werbeindustrie,",Bayern,Realschule,,2023.0,"Ethik, Philo"
346,12,0.2896878610123816,"gelingende Kommunikation z. B. F. Schulz von Thun, Achtsamkeit Hinweise auf Glück im philosophischen Denken: Texte zum Zusammenhang zwischen Glück und verantwortbarer Lebensführung, z. B. Aristoteles, E. Fromm Hinweise auf Glück in den Weltreligionen, z. B. Hinduismus, Buddhismus Glücksindizes, z. B. Happy Planet Index Glücksversprechungen z. B. der Medien, Werbeindustrie, virtuellen Realität: Schönheit, materieller Wohlstand, beruflicher Erfolg, Jugendlichkeit, Genuss Kompetenzerwartungen Die",Bayern,Realschule,,2023.0,"Ethik, Philo"
347,2,0.3842478311695912,"B. Gesundheit, Psyche, Umwelt, Kosten; Gruppenzwänge, Freizeitstress Grenzen der Möglichkeiten, z. B. finanzielle und örtliche Rahmenbedingungen Kompetenzerwartungen Die Schülerinnen und Schüler ... nutzen ausgehend von eigenen Lebenserfahrungen individuelle Quellen des Glücks und die Vielfalt von Glücksvorstellungen für das eigene Leben. nehmen sich selbst als Adressaten vielfältiger Glücksversprechungen wahr und zeigen Bewusstsein für die verhaltensbeeinflussende Wirkung, z. B. der Werbung. schätzen individuelle",Bayern,Realschule,,2023.0,"Ethik, Philo"
348,10,0.6857175136315634,"Glück zu finden bzw. mit Frustration umzugehen. Inhalte zu den Kompetenzen: individuelle Glückserlebnisse, z. B. Geburt eines Geschwisterkindes, Sieg des Sportvereins, Erfolg in der Schule, Erhalten eines Geschenkes Glück als glücklicher Zufall luck und Glückseligkeit happiness persönliche und kulturelle Voraussetzungen für unterschiedliche Glücksvorstellungen: z. B. Leben in Armut bzw. Reichtum, Alter, persönliche Weltanschauung, Religion Glück durch materielle und immaterielle Dinge positive",Bayern,Realschule,,2023.0,"Ethik, Philo"
349,7,0.5349328853341667,"Umweltschutzes Natur Religion und Gesellschaft Welt und Transzendenz Religionen der Welt Sollen Stunden Gewissen als Ort des moralischen Urteilens Moralisches Handeln - Werte und Normen Der praktische Syllogismus Selbstverwirklichung und Glück Vorstellungen des guten Lebens Sein: Ich Mensch sein Ethik Motive menschlichen Handelns Wir handeln beständig. Insbesondere von Jugendlichen heißt es des Öfteren, dass sie unbedacht handeln. Neben den Folgen einer",Saarland,Gym,9,2018.0,"Ethik, Philo"
350,9,0.2904089973887312,"etc., Denkmuster wie Die Erde wird sich sowieso erholen., Bequemlichkeit etc. Hinweis s. Thema Was ist wichtig und sollte sein - Werte und Normen Lehrplan / und Thema Selbstverwirklichung und Glück Sein: Ich und die anderen In Gemeinschaft leben Ethik Kulturelle Vielfalt Durch die Präsenz anderer Kulturen in den Medien sowie durch die Erfahrungen mit Migration erscheint die Welt einerseits als",Saarland,Gym,9,2018.0,"Ethik, Philo"
351,6,0.9563471202354151,"von autoritären oder emotionalen Einflüssen etc.; Gefahren: Reduktion auf Objektives, Missachtung emotionaler Anteile etc Sein: Die Welt Kultur Ethik Wissenschaft und Technik inhaltsbezogene Kompetenzen methodisch-didaktische Hinweise Differenzierung zwischen Lebensstandard und Glück Wissenschaft und Technik Die Schülerinnen und Schüler erläutern den Zusammenhang zwischen Wissenschaft und Technik, erläutern den Beitrag von Technik für ein menschenwürdiges Leben, diskutieren, ob man das, was man technisch",Saarland,Gym,9,2018.0,"Ethik, Philo"
352,7,0.7987402867889524,was geht nicht Woran lag es Durchführen eines Schulentwicklungsprojekts/einer Zukunftswerkstatt im schulischen Raum: Wir verändern gemeinsam unser Lebensumfeld nach unseren Vorstellungen. Hinweis s. Themen Motive menschlichen Handelns und Selbstverwirklichung und Glück Sein: Die Welt Natur Ethik Ethik des Natur- und Umweltschutzes Die Schülerinnen und Schüler bekommen in der Schule Natur primär als Gegenstand der Naturwissenschaften in den Blick. Natur erscheint hier,Saarland,Gym,9,2018.0,"Ethik, Philo"
353,5,0.8802446281652393,"auf ethisch relevante Auseinandersetzungen mit anderen im Alltag: Gemeinsames Prüfen der Prämissen und Schließen auf eine Conclusio. Lässt sich der StreitPartner überzeugen Sollen: Vorstellungen des guten Lebens Ethik Selbstverwirklichung und Glück Die Suche der jungen Menschen nach einem stabilen Selbst braucht Orientierungen, wobei sich das Glück - auch vermittelt durch Idealbilder glücklicher Menschen in Werbungen nahezu selbstverständlich anbietet. Ebenso scheint die",Saarland,Gym,9,2018.0,"Ethik, Philo"
354,5,0.9633329519265504,"eine Conclusio. Lässt sich der StreitPartner überzeugen Sollen: Vorstellungen des guten Lebens Ethik Selbstverwirklichung und Glück Die Suche der jungen Menschen nach einem stabilen Selbst braucht Orientierungen, wobei sich das Glück - auch vermittelt durch Idealbilder glücklicher Menschen in Werbungen nahezu selbstverständlich anbietet. Ebenso scheint die Selbstverwirklichung eine selbstverständliche Form individuellen Glücks zu sein. Doch das Glück selbst ist zunächst meist",Saarland,Gym,9,2018.0,"Ethik, Philo"
355,5,0.9633330885696528,"Orientierungen, wobei sich das Glück - auch vermittelt durch Idealbilder glücklicher Menschen in Werbungen nahezu selbstverständlich anbietet. Ebenso scheint die Selbstverwirklichung eine selbstverständliche Form individuellen Glücks zu sein. Doch das Glück selbst ist zunächst meist kein Gegenstand der Reflexion. Scheinbar eigene Vorstellungen von Glück und Selbstverwirklichung sind vielmehr oft Objekte der Fremdbestimmung. Denkanstöße Was ist Glück Kann ich überhaupt glücklich werden",Saarland,Gym,9,2018.0,"Ethik, Philo"
356,5,0.960144594398726,Werbungen nahezu selbstverständlich anbietet. Ebenso scheint die Selbstverwirklichung eine selbstverständliche Form individuellen Glücks zu sein. Doch das Glück selbst ist zunächst meist kein Gegenstand der Reflexion. Scheinbar eigene Vorstellungen von Glück und Selbstverwirklichung sind vielmehr oft Objekte der Fremdbestimmung. Denkanstöße Was ist Glück Kann ich überhaupt glücklich werden Bin ich selbst meines Glückes Schmied/Schmiedin Sind meine Lebensziele wirklich meine Ziele Mein,Saarland,Gym,9,2018.0,"Ethik, Philo"
357,5,0.9427076965155624,Glücks zu sein. Doch das Glück selbst ist zunächst meist kein Gegenstand der Reflexion. Scheinbar eigene Vorstellungen von Glück und Selbstverwirklichung sind vielmehr oft Objekte der Fremdbestimmung. Denkanstöße Was ist Glück Kann ich überhaupt glücklich werden Bin ich selbst meines Glückes Schmied/Schmiedin Sind meine Lebensziele wirklich meine Ziele Mein Glück ist das wichtigste im Leben. Kompetenzerwartungen Die Schülerinnen und Schüler können,Saarland,Gym,9,2018.0,"Ethik, Philo"
358,5,0.5057680578774371,"und Selbstverwirklichung sind vielmehr oft Objekte der Fremdbestimmung. Denkanstöße Was ist Glück Kann ich überhaupt glücklich werden Bin ich selbst meines Glückes Schmied/Schmiedin Sind meine Lebensziele wirklich meine Ziele Mein Glück ist das wichtigste im Leben. Kompetenzerwartungen Die Schülerinnen und Schüler können durch Ideen und Ideologien gelenkte Wahrnehmung beschreiben und reflektieren Was ist Glück, Gemeinsamkeiten und Differenzen von Handlungsgrundsätzen und Wertvorstellungen",Saarland,Gym,9,2018.0,"Ethik, Philo"
359,6,0.9618045040055384,"Sind meine Lebensziele wirklich meine Ziele Mein Glück ist das wichtigste im Leben. Kompetenzerwartungen Die Schülerinnen und Schüler können durch Ideen und Ideologien gelenkte Wahrnehmung beschreiben und reflektieren Was ist Glück, Gemeinsamkeiten und Differenzen von Handlungsgrundsätzen und Wertvorstellungen erklären und diskutieren Selbstverwirklichung und Glück, die Relevanz sozialer Kontexte für Handlungen analysieren Selbstverwirklichung und Glück, pointierte sprachliche Ausdrucksformen für eigene Gedanken entwickeln",Saarland,Gym,9,2018.0,"Ethik, Philo"
360,6,0.9647435151137395,"Kompetenzerwartungen Die Schülerinnen und Schüler können durch Ideen und Ideologien gelenkte Wahrnehmung beschreiben und reflektieren Was ist Glück, Gemeinsamkeiten und Differenzen von Handlungsgrundsätzen und Wertvorstellungen erklären und diskutieren Selbstverwirklichung und Glück, die Relevanz sozialer Kontexte für Handlungen analysieren Selbstverwirklichung und Glück, pointierte sprachliche Ausdrucksformen für eigene Gedanken entwickeln und schriftlich formulieren z. B. Metaphern, Neologismen Was ist Glück, die korrekte Verwendung",Saarland,Gym,9,2018.0,"Ethik, Philo"
361,6,0.96726179724181,"gelenkte Wahrnehmung beschreiben und reflektieren Was ist Glück, Gemeinsamkeiten und Differenzen von Handlungsgrundsätzen und Wertvorstellungen erklären und diskutieren Selbstverwirklichung und Glück, die Relevanz sozialer Kontexte für Handlungen analysieren Selbstverwirklichung und Glück, pointierte sprachliche Ausdrucksformen für eigene Gedanken entwickeln und schriftlich formulieren z. B. Metaphern, Neologismen Was ist Glück, die korrekte Verwendung von Begriffen in Diskussionen und Texten prüfen Was ist Glück,",Saarland,Gym,9,2018.0,"Ethik, Philo"
362,6,0.9672617760919731,"diskutieren Selbstverwirklichung und Glück, die Relevanz sozialer Kontexte für Handlungen analysieren Selbstverwirklichung und Glück, pointierte sprachliche Ausdrucksformen für eigene Gedanken entwickeln und schriftlich formulieren z. B. Metaphern, Neologismen Was ist Glück, die korrekte Verwendung von Begriffen in Diskussionen und Texten prüfen Was ist Glück, Begriffe durch Oberbegriffe und Unterscheidungsmerkmale definieren Was ist Glück. inhaltsbezogene Kompetenzen methodisch-didaktische Hinweise Was ist Glück Die",Saarland,Gym,9,2018.0,"Ethik, Philo"
