document_id,most_prevalent_topic_id,most_prevalent_topic_probability,text_excerpt,state,school type,grade,year,subject
847,3,0.9740174445702025,"dennoch in einzelnen Fällen Urheberrechte nicht berücksichtigt worden sein, wenden Sie sich bitte an den Herausgeber. Alle eingesetzten beziehungsweise verarbeiteten Rohstoffe und Materialien entsprechen den zum Zeitpunkt der Angebotsabgabe gültigen Normen beziehungsweise geltenden Bestimmungen und Gesetzen der Bundesrepublik Deutschland. Der Herausgeber hat bei seinen Leistungen sowie bei Zulieferungen Dritter im Rahmen der wirtschaftlichen und technischen Möglichkeiten umweltfreundliche Verfahren und Erzeugnisse bevorzugt",BaWü,,Sek 1,2022.0,Bio
848,6,0.4012012618362513,"Beitrag zur Erschließung neuer Anforderungssituationen. In diesem Zusammenhang kommt dem Kompetenzbereich Bewertung besondere Bedeutung zu. In einen Bewertungsprozess fließen auf der einen Seite Reflexionen über individuelle und gesellschaftliche Werte und Normen sowie ethische Aspekte, auf der anderen Seite ökologische und ökonomische Ansätze ein. Ziel ist es, insbesondere auf Basis naturwissenschaftlich ableitbarer Erkenntnisse und festgelegter Kriterien Handlungsmöglichkeiten zu entwickeln, die aus dem",Hessen,,Sek1,,Bio
849,6,0.5468387244456336,"und deren Herkunft sowie damit verbundene Werte zu identifizieren. In einem Bewertungsprozess werden Handlungsoptionen ausgewertet, Entscheidungen in Bezug auf biologische Aspekte aufgrund von gesellschaftlich akzeptierten und persönlich relevanten Werten und Normen getroffen, begründet sowie reflektiert. Dabei werden drei sich überlappende Teilkompetenzbereiche unterschieden: Sachverhalte und Informationen multiperspektivisch beurteilen, kriteriengeleitet Meinungen bilden und Entscheidungen treffen, Entscheidungsprozesse und Folgen reflektieren. Basiskonzepte Ergänzt wird die",Bayern,Gym,,,Bio
850,1,0.4022924314827776,"Ökonomische Verbraucherbildung Im Biologieunterricht erwerben die Schülerinnen und Schüler die Kompetenzen, wissenschaftliche und nicht-wissenschaftliche Aussagen zu unterscheiden und Kriterien zur Prüfung der Glaubwürdigkeit und zur Beurteilung des Einflusses von Werten, Normen und Interessen auf bestimmte Meinungsbildungsprozesse zu nutzen. Durch die Beschreibung und Bewertung der Folgen von Warenproduktion und -transport auf die Umwelt, auf andere Lebewesen und die Gesundheit von Menschen werden",Bayern,Gym,,,Bio
851,6,0.7372649288853388,Machbarem und richten ihr Handeln an der Verantwortung gegenüber sich selbst und der Mitwelt aus. Aus der Bewertung können auf der Grundlage von gesellschaftlich akzeptierten und persönlich relevanten Werten und Normen Handlungsoptionen abgeleitet werden.,Bayern,Gym,,,Bio
852,6,0.4358514628071811,"und Argumente und deren Herkunft sowie die damit verbundenen Werte identifiziert werden. Handlungsoptionen werden ausgewertet, Entscheidungen in Bezug auf biologische Aspekte aufgrund von gesellschaftlich akzeptierten und persönlich relevanten Werten und Norm getroffen, begründet sowie reflektiert. B analysieren Sachverhalte im Hinblick auf ihre Bewertungsrelevanz G a erläutern die Analyse von Gentests und Familienstammbäumen beim Menschen und leiten eine genetische Beratung ab B",Saarland,Gym,Sek2,2024.0,Bio
853,1,0.6135123639665613,"zu reflektieren. Erkenntnisse und Anwendungen der Biologie haben direkte Einflüsse auf Individuum, Gesellschaft und Umwelt. Ethisch relevante Aspekte der naturwissenschaftlichen Forschung müssen daher erkannt und die damit verknüpften Werte und Normen analysiert und gewichtet werden; dabei werden deskriptiv-beschreibende von normativ-wertenden Aussagen unterschieden. Biotechnologische Verfahren bringen Chancen, aber auch Risiken mit sich, deren Folgen erkannt, bewertet und bei Entscheidungen berücksichtigt werden müssen.",Saarland,Gym,Sek2,2024.0,Bio
854,7,0.4054644617089383,"Ö Ökosysteme verändern sich Ö Jeder Mensch hat individuelle Handlungsoptionen. Die Schülerinnen und Schüler a, b c Earth Overshoot Day, Nachhaltigkeit, Agenda , Sustainable Development Goals a analysieren Werte und Normen bezüglich verantwortungsvollen und nachhaltigen Umgangs mit Ressourcen, a Kriterien können sein: Herkunft, Anbau / Abbau, Transport, ökologischer Rucksack, Wasserverbrauch, Umweltbelastung, Arbeitsbedingungen... b beurteilen an einem selbst gewählten Beispiel die verantwortungsvolle",Saarland,Gym,Sek2,2024.0,Bio
855,1,0.783240441732976,"THC, a erklären die Wirkung von Nikotin, Alkohol und Tetrahydrocannabinol THC als Suchtstoffe, a Folgen von THC-Konsum für Konzentration und Gedächtnis b Sucht, Suchtprävention, Abhängigkeit, deskriptive Aussagen, normative Aussagen, Werte, Normen b diskutieren den Konsum von Suchtstoffen multiperspektivisch und bewerten Maßnahmen zur Suchtprävention und -therapie. b Mögliche Debatte: Legalisierung bestimmter Suchtstoffe; Deskriptive Aussagen beschreiben Sachverhalte wertfrei; normative Aussagen beruhen auf moralischen",Saarland,Gym,Sek2,2024.0,Bio
856,1,0.8074330916824538,"multiperspektivisch und bewerten Maßnahmen zur Suchtprävention und -therapie. b Mögliche Debatte: Legalisierung bestimmter Suchtstoffe; Deskriptive Aussagen beschreiben Sachverhalte wertfrei; normative Aussagen beruhen auf moralischen gesellschaftlich geprägten bzw. ethischen Werten und Normen. Fakultative Inhalte Biologie GK Inhalte / Basisbegriffe Kompetenzerwartungen Vorschläge und Hinweise Inf F Das vegetative Nervensystem beeinflusst unser inneres Gleichgewicht Die Schülerinnen und Schüler a somatisches Nervensystem, willkürlich, unwillkürlich, vegetatives",Saarland,Gym,Sek2,2024.0,Bio
857,1,0.4145909602418705,"G b erläutern Möglichkeiten und Grenzen der Therapie genetisch be dingter Erkrankungen und des therapeutischen Klonens B stellen Bewertungskriterien auf, auch unter Berücksichtigung außerfachlicher Aspekte Ö a analysieren Werte und Normen bezüglich verantwortungsvollen und nachhaltigen Umgangs mit Ressourcen, B entwickeln anhand relevanter Bewertungskriterien Handlungsoptionen in gesellschaftlich- oder alltagsrelevanten Entscheidungssituationen mit fachlichem Bezug und wägen sie ab Ö b beurteilen an einem",Saarland,Gym,Sek2,2024.0,Bio
858,1,0.5422880462053082,"beziehen. Normative und deskriptive Argumente z. B. im Rahmen eines praktischen Syllogismus Deskriptive beschreibende Aussagen sind faktenbasiert, objektiv wahr und nicht wertend. Normative Aussagen hingegen basieren auf moralischen Werten und Normen, die sich aus diesen Werten ergeben. Der Praktische Syllogismus ist ein Argumentationsschema, welches sich aus drei Schritten zusammensetzt syn zusammen, logos Wort: Eine deskriptive Prämisse Aussage und eine normative Prämisse",Saarland,Gym,Sek2,2024.0,Bio
859,1,0.7016440531635989,"Zusammenhänge strukturiert und unter Verwendung der Fachsprache formulieren beurteilen Das zu fällende Sachurteil ist mithilfe fachlicher Kriterien zu begründen. bewerten Das zu fällende Werturteil ist unter Berücksichtigung gesellschaftlicher Werte und Normen zu begründen. darstellen Strukturen, Sachverhalte oder Zusammenhänge strukturiert und unter Verwendung der Fachsprache formulieren, auch mithilfe von Zeichnungen und Tabellen diskutieren Argumente zu einer Aussage oder These einander gegenüberstellen und",Saarland,Gym,Sek2,2024.0,Bio
860,5,0.52305810341296,"sich bewusst für Nachhaltigkeit einzusetzen und gestaltend daran mitzuwirken. Sie lernen dabei Partizipationsmöglichkeiten zu nutzen. Bildung für nachhaltige Entwicklung In der Oberschule erleben die Schüler im sozialen Miteinander Regeln und Normen, erkennen deren Sinnhaftigkeit und streben deren Einhaltung an. Sie lernen dabei verlässlich zu handeln, Verantwortung zu übernehmen, Kritik zu üben und konstruktiv mit Kritik umzugehen. Sozialkompetenz Gestaltung des Bildungs- und",Sachsen,Oberschule,,2019.0,Bio
861,7,0.8085640458567264,"sowie Schülerfirmen fördern die Identifikation mit der Schule, die Schaffung neuer Lernräume und die Öffnung der Schule in die Region. Toleranz, Transparenz, Verlässlichkeit sind handlungsleitende Prinzipien schulischer Arbeit. Regeln und Normen des Verhaltens in der Schule werden gemeinschaftlich erarbeitet. Im besonderen Maße richtet sich der Blick auf die Bedeutung authentischer Bezugspersonen für Heranwachsende. Während fachübergreifendes Arbeiten durchgängiges Unterrichtsprinzip ist, setzt fächerverbindender",Sachsen,Oberschule,,2019.0,Bio
862,6,0.8673106334232918,"/ Die Schülerinnen und Schüler ... achlich fundierte Pro- und rgumente bei alltagsnahen dungen. entwickeln fachlich fundierte Argumente in komplexen Entscheidungssituationen. unterscheiden zwischen naturwissenschaftlichen und ethischen Argumenten. RELIGION, WERTE UND NORMEN entwickeln Argumente aus unterschiedlichen Perspektiven. en die Argumente unter Eing von biologischem Fachwis überprüfen die Argumente, indem sie Folgen eigenen Handelns abschätzen. gewichten Argumente unter Anleitung. überprüfen die Argumente, indem",Niedersachsen,Hauptschule,5-10,2021.0,Bio
863,1,0.6124583120874841,"Organen. beschreiben Maßnahmen zur Gesunderhaltung des menschlichen Organismus. beschreiben und erläutern das Zusammenwirken von Organsystemen im Organismus. beschreiben Krankheiten als Systemstörung im Organismus. beschreiben Möglichkeiten der Organtransplantation. RELIGION, WERTE UND NORMEN ausgewählte Tierarten in densräumen. ausgewählte Pflanzenarten in bensräumen. nfache Nahrungsbeziehunorm von Nahrungsketten dar. beschreiben ein Ökosystem. beschreiben die Beziehungen zwischen Produzenten, Konsumenten und Destruenten. beschreiben abiotische und biotische Faktoren und",Niedersachsen,Hauptschule,5-10,2021.0,Bio
864,4,0.6703121375489396,"von Schuljahrgang / Die Schülerinnen und Schüler ... ben entwicklungsbedingte ungen des menschlichen Körer Pubertät. die zunehmende Sexualisieen Medien. RELIGION, WERTE EN beschreiben Formen der sexuellen Orientierung. RELIGION, WERTE UND NORMEN beschreiben Aspekte selbstbestimmter Sexualität und entwickeln Toleranz gegenüber verschiedenen Arten sexueller Orientierung. RELIGION, WERTE UND NORMEN erläutern die Mitose und ihre Bedeutung für die Individualentwicklung. beschreiben Aspekte selbstbestimmter Sexualität und",Niedersachsen,Hauptschule,5-10,2021.0,Bio
865,4,0.5991838194784831,"zunehmende Sexualisieen Medien. RELIGION, WERTE EN beschreiben Formen der sexuellen Orientierung. RELIGION, WERTE UND NORMEN beschreiben Aspekte selbstbestimmter Sexualität und entwickeln Toleranz gegenüber verschiedenen Arten sexueller Orientierung. RELIGION, WERTE UND NORMEN erläutern die Mitose und ihre Bedeutung für die Individualentwicklung. beschreiben Aspekte selbstbestimmter Sexualität und Identität und entwickeln Akzeptanz gegenüber unterschiedlichen sexuellen Identitäten. RELIGION, WERTE UND NORMEN ben Grundaspekte der sexutpflanzung,",Niedersachsen,Hauptschule,5-10,2021.0,Bio
866,4,0.5877482326127683,"Orientierung. RELIGION, WERTE UND NORMEN erläutern die Mitose und ihre Bedeutung für die Individualentwicklung. beschreiben Aspekte selbstbestimmter Sexualität und Identität und entwickeln Akzeptanz gegenüber unterschiedlichen sexuellen Identitäten. RELIGION, WERTE UND NORMEN ben Grundaspekte der sexutpflanzung, Schwangerschaft fängnisverhütung beim Meneiden zwischen geschlechtliungeschlechtlicher FortpflanBlütenpflanzen. beschreiben Methoden der Empfängnisverhütung und der Verhütung von sexuell übertragbaren Erkrankungen. erörtern verantwortliches Verhalten in der Sexualpartnerschaft. RELIGION, WERTE",Niedersachsen,Hauptschule,5-10,2021.0,Bio
867,7,0.5731320201519705,"Grundaspekte der sexutpflanzung, Schwangerschaft fängnisverhütung beim Meneiden zwischen geschlechtliungeschlechtlicher FortpflanBlütenpflanzen. beschreiben Methoden der Empfängnisverhütung und der Verhütung von sexuell übertragbaren Erkrankungen. erörtern verantwortliches Verhalten in der Sexualpartnerschaft. RELIGION, WERTE UND NORMEN erklären menschliche Fortpflanzung unter hormonellen Aspekten. erörtern rechtliche und ethische Aspekte des Schwangerschaftsabbruchs. RELIGION, WERTE UND NORMEN erklären die Meiose und ihre Bedeutung für Fortpflanzung und Vererbung. beschreiben Mutationen. erörtern",Niedersachsen,Hauptschule,5-10,2021.0,Bio
868,7,0.4933563990265229,"von sexuell übertragbaren Erkrankungen. erörtern verantwortliches Verhalten in der Sexualpartnerschaft. RELIGION, WERTE UND NORMEN erklären menschliche Fortpflanzung unter hormonellen Aspekten. erörtern rechtliche und ethische Aspekte des Schwangerschaftsabbruchs. RELIGION, WERTE UND NORMEN erklären die Meiose und ihre Bedeutung für Fortpflanzung und Vererbung. beschreiben Mutationen. erörtern ethische und soziale Aspekte als Folge von Genomveränderungen. RELIGION, WERTE UND NORMEN ben die Bedeutung von Verg",Niedersachsen,Hauptschule,5-10,2021.0,Bio
869,4,0.7084465424253522,"des Schwangerschaftsabbruchs. RELIGION, WERTE UND NORMEN erklären die Meiose und ihre Bedeutung für Fortpflanzung und Vererbung. beschreiben Mutationen. erörtern ethische und soziale Aspekte als Folge von Genomveränderungen. RELIGION, WERTE UND NORMEN ben die Bedeutung von Verg und Umwelteinflüssen für dualentwicklung. SPORT beschreiben die Bedeutung der Gene und der Umweltbedingungen für die Ausprägung des Phänotyps. vergleichen Züchtung und Gentechnik. erörtern Methoden der",Niedersachsen,Hauptschule,5-10,2021.0,Bio
870,4,0.42661645696680867,"für dualentwicklung. SPORT beschreiben die Bedeutung der Gene und der Umweltbedingungen für die Ausprägung des Phänotyps. vergleichen Züchtung und Gentechnik. erörtern Methoden der Züchtung und Gentechnik WIRTSCHAFT, RELIGION, WERTE UND NORMEN ben die Angepasstheit der en an Jahreszeiten und Lem. erklären das Zusammenleben verschiedener Arten in einem Ökosystem anhand unterschiedlicher Ansprüche an ihren Lebensraum. beschreiben Entstehung und Angepasstheit von Arten als",Niedersachsen,Hauptschule,5-10,2021.0,Bio
871,4,0.3349548496404828,"Jahreszeiten und Lem. erklären das Zusammenleben verschiedener Arten in einem Ökosystem anhand unterschiedlicher Ansprüche an ihren Lebensraum. beschreiben Entstehung und Angepasstheit von Arten als Ergebnis von Evolutionsprozessen. RELIGION, WERTE UND NORMEN en Haustiere mit Wildformen n daraus Aspekte einer artgeTierhaltung ab. wichtige Unterscheidungse und Gemeinsamkeiten von rklassen. erklären stammesgeschichtliche Verwandtschaft an ausgewählten Beispielen. benennen Belege für Evolutionsprozesse. beschreiben ausgewählte Aspekte der",Niedersachsen,Hauptschule,5-10,2021.0,Bio
872,6,0.6137858356872589,"sowie damit verbundene Werte zu identifizieren und zu beurteilen. In einem Bewertungsprozess werden Handlungsoptionen ausgewertet, Entscheidungen in Bezug auf biologische Aspekte aufgrund von gesellschaftlich akzeptierten und persönlich relevanten Werten und Normen getroffen, begründet sowie reflektiert. Beim systematischen Bewerten von Handlungsmöglichkeiten werden diese mit ethischen Werten in Beziehung gesetzt. Auf der Basis eines Urteils wird der eigene Standpunkt unter Einbezug individueller und",Hamburg,Stadtteilschule,5-11,2024.0,Bio
873,6,0.9731953575467477,"beurteilen den Inhalt von Argumenten; B. überprüfen die Struktur von Argumenten zu bewertungsrelevanten Sachverhalten. Kriteriengeleitet Entscheidungen treffen Die Schülerinnen und Schüler ... B. benennen Bewertungskriterien ausgehend von Sachinformationen, Werten und Normen; B. gewichten Handlungsoptionen für Entscheidungen zu bewertungsrelevanten Sachverhalten; B. treffen Entscheidungen auf der Grundlage von Argumenten, Bewertungskriterien und Handlungsoptionen. Entscheidungsprozesse und Folgen reflektieren Die Schülerinnen und Schüler ... B. reflektieren",Hamburg,Stadtteilschule,5-11,2024.0,Bio
874,6,0.5580357820061917,"Grundlage biologischer Erkenntnisse. Bewertungskompetenz Die Schülerinnen und Schüler ... identifizieren in bewertungsrelevanten Sachverhalten biologiebezogene deskriptive und normative Aussagen, beurteilen Argumente über bewertungsrelevante Sachverhalte, benennen Bewertungskriterien ausgehend von Sachinformationen, Werten und Normen, identifizieren in bewertungsrelevanten Sachverhalten biologiebezogene deskriptive und normative Aussagen, analysieren Werte in normativen Aussagen, die bewertungsrelevante Sachverhalte betreffen, beurteilen Argumente über bewertungsrelevante Sachverhalte, identifizieren in bewertungsrelevanten Sachverhalten biologiebezogene deskriptive und",Hamburg,Stadtteilschule,5-11,2024.0,Bio
875,6,0.5548934087678111,"Studienstufe am Ende der Jahrgangsstufe gewichten Handlungsoptionen für Entscheidungen zu bewertungsrelevanten Sachverhalten, bewerten Verhaltensweisen zur Erhaltung der eigenen Gesundheit und Maßnahmen nachhaltiger Entwicklung. benennen Bewertungskriterien ausgehend von Sachinformationen, Werten und Normen, treffen Entscheidungen auf der Grundlage von Handlungsoptionen und Bewertungskriterien, nennen Folgen von Entscheidungen für die Natur, das Individuum und die Gesellschaft, bewerten Verhaltensweisen zur Erhaltung der eigenen Gesundheit und Maßnahmen",Hamburg,Stadtteilschule,5-11,2024.0,Bio
876,6,0.5659055283858939,"Entscheidungen für die Natur, das Individuum und die Gesellschaft, bewerten Verhaltensweisen zur Erhaltung der eigenen Gesundheit und Maßnahmen nachhaltiger Entwicklung aus verschiedenen Perspektiven. benennen Bewertungskriterien ausgehend von Sachinformationen, Werten und Normen, entwickeln Handlungsoptionen für Entscheidungen zu bewertungsrelevanten Sachverhalten, treffen Entscheidungen auf der Grundlage von Handlungsoptionen und Bewertungskriterien, nennen Folgen von Entscheidungen für die Natur, das Individuum und die Geselklschaft, bewerten Verhaltensweisen",Hamburg,Stadtteilschule,5-11,2024.0,Bio
877,1,0.5354127955918438,"Sachverhalte und Informationen Sachverhalte analysieren, fachliche Informationen bzw. Daten recherchieren, Quellen hinsichtlich Herkunft und Vertrauenswürdigkeit prüfen, ein Sachurteil fällen, die Meinungsbildung unter Einbeziehung des Sachurteils und unter Beachtung von Werten, Normen bzw. Interessen geeignete fachliche und überfachliche Bewertungskriterien, z. B. ökonomische, soziale, ökologische, politische Aspekte festlegen, Handlungsoptionen gegeneinander abwägen, Entscheidungen treffen, das Reflektieren von Entscheidungsprozessen und Folgen. Bildung in der digitalen",Thüringen,Gym,,2024.0,Bio
878,6,0.9747648272697412,"Bezügen zu Basiskonzepten, beurteilen B die Struktur von Argumenten zu bewertungsrelevanten Sachverhalten überprüfen B : Kriteriengeleitet Entscheidungen treffen Die Lernenden können B Bewertungskriterien und Handlungsoptionen, ausgehend von Sachinformationen, Werten und Normen, benennen B Bewertungskriterien und Handlungsoptionen für Entscheidungen zu bewertungsrelevanten Sachverhalten gewichten B Entscheidungen auf der Grundlage von Argumenten, Bewertungskriterien und Handlungsoptionen treffen B : Entscheidungsprozesse und Folgen reflektieren Die Lernenden",Thüringen,Gym,,2024.0,Bio
879,1,0.7257952942884854,"Methoden, Verfahren oder Zusammenhänge strukturiert und unter Verwendung der Fachsprache formulieren beurteilen das zu fällende Sachurteil mithilfe fachlicher Kriterien begründen bewerten das zu fällende Werturteil unter Berücksichtigung gesellschaftlicher Werte und Normen begründen darstellen Strukturen, Sachverhalte oder Zusammenhänge strukturiert und unter Verwendung der Fachsprache formulieren, auch mithilfe von Zeichnungen und Tabellen definieren einen Begriff durch Nennung des Oberbegriffs und typischer Merkmale bestimmen",Thüringen,Gym,,2024.0,Bio
880,5,0.49164933789920867,"und deren Herkunft sowie damit verbundene Werte zu identifizieren. In einem Bewertungsprozess werden Handlungsoptionen ausgewertet, Entscheidungen in Bezug auf biologische Aspekte aufgrund von gesellschaftlich akzeptierten und persönlich relevanten Werten und Normen getroffen, begründet sowie reflektiert. Sachverhalte und Informationen multiperspektivisch beurteilen Die Lernenden ... B analysieren Sachverhalte im Hinblick auf ihre Bewertungsrelevanz; B betrachten Sachverhalte aus unterschiedlichen Perspektiven; B unterscheiden deskriptive und",,,,2020.0,Bio
881,6,0.5074185471805919,"und deren Herkunft sowie damit verbundene Werte zu identifizieren. In einem Bewertungsprozess werden Handlungsoptionen ausgewertet, Entscheidungen in Bezug auf biologische Aspekte aufgrund von gesellschaftlich akzeptierten und persönlich relevanten Werten und Normen getroffen, begründet sowie reflektiert. Im Leistungskurs können Schülerinnen und Schüler im Bereich der Bewertungskompetenz mehr und komplexere Argumente mit Belegen heranziehen. Auch gelingt es ihnen, eigene Standpunkte differenzierter zu begründen",MeckPomm,Gym,Sek 2,2022.0,Bio
882,1,0.6135123639665613,"zu reflektieren. Erkenntnisse und Anwendungen der Biologie haben direkte Einflüsse auf Individuum, Gesellschaft und Umwelt. Ethisch relevante Aspekte der naturwissenschaftlichen Forschung müssen daher erkannt und die damit verknüpften Werte und Normen analysiert und gewichtet werden; dabei werden deskriptiv-beschreibende von normativ-wertenden Aussagen unterschieden. Biotechnologische Verfahren bringen Chancen, aber auch Risiken mit sich, deren Folgen erkannt, bewertet und bei Entscheidungen berücksichtigt werden müssen.",Saarland,Gym,Sek2,2024.0,Bio
883,1,0.39412568157031647,"Jeder Mensch hat individuelle Handlungsoptionen. Die Schülerinnen und Schüler a, b, c, d ökologischer Fußabdruck, ökologischer Rucksack, Earth Overshoot Day, Nachhaltigkeit, Agenda , Sustainable Development Goals a analysieren Werte und Normen bezüglich verantwortungsvollen und nachhaltigen Umgangs mit Ressourcen, a Kriterien können z. B. sein: Herkunft, Anbau/Abbau, Transport, ökologischer Rucksack, Wasserverbrauch, Umweltbelastung, Arbeitsbedingungen b beurteilen an einem selbst gewählten Beispiel die verantwortungsvolle",Saarland,Gym,Sek2,2024.0,Bio
884,1,0.7756946910376786,"für Konzentration und Gedächtnis b Nikotin, Alkohol, Tetrahydrocannabinol THC b erklären die Wirkung von Nikotin, Alkohol und Tetrahydrocannabinol THC als Suchtstoffe, c Sucht, Suchtprävention, Abhängigkeit, deskriptive Aussagen, normative Aussagen, Werte, Normen c diskutieren den Konsum von Suchtstoffen multiperspektivisch und bewerten Maßnahmen zur Suchtprävention und -therapie. c mögliche Debatte: Legalisierung bestimmter Suchtstoffe; Deskriptive Aussagen beschreiben Sachverhalte wertfrei; normative Aussagen beruhen auf moralischen",Saarland,Gym,Sek2,2024.0,Bio
885,1,0.5518431753006233,"multiperspektivisch und bewerten Maßnahmen zur Suchtprävention und -therapie. c mögliche Debatte: Legalisierung bestimmter Suchtstoffe; Deskriptive Aussagen beschreiben Sachverhalte wertfrei; normative Aussagen beruhen auf moralischen gesellschaftlich geprägten bzw. ethischen Werten und Normen. Anhang Anhang zum Lehrplan Biologie für die Gymnasiale Oberstufe Saar - Abitur ab - Leistungskurs Verschränkung der Kompetenzen aus Bildungsstandards und Lehrplan Die vorliegende Übersicht stellt dar, wie die in",Saarland,Gym,Sek2,2024.0,Bio
886,6,0.4358514628071811,"und Argumente und deren Herkunft sowie die damit verbundenen Werte identifiziert werden. Handlungsoptionen werden ausgewertet, Entscheidungen in Bezug auf biologische Aspekte aufgrund von gesellschaftlich akzeptierten und persönlich relevanten Werten und Normen getroffen, begründet sowie reflektiert. B analysieren Sachverhalte im Hinblick auf ihre Bewertungsrelevanz G d erläutern die Analyse von Gentests und Familienstammbäumen beim Menschen und leiten eine genetische Beratung ab B",Saarland,Gym,Sek2,2024.0,Bio
887,1,0.4141742884985424,"Sichtweisen G e diskutieren Möglichkeiten und Grenzen der Therapie genetisch bedingter Erkrankungen und des therapeutischen Klonens B stellen Bewertungskriterien auf, auch unter Berücksichtigung außerfachlicher Aspekte Ö a analysieren Werte und Normen bezüglich verantwortungsvollen und nachhaltigen Umgangs mit Ressourcen, B entwickeln anhand relevanter Bewertungskriterien Handlungsoptionen in gesellschaftlich- oder alltagsrelevanten Entscheidungssituationen mit fachlichem Bezug und wägen sie ab Ö b beurteilen an einem",Saarland,Gym,Sek2,2024.0,Bio
888,1,0.5422880462053082,"beziehen. Normative und deskriptive Argumente z. B. im Rahmen eines praktischen Syllogismus Deskriptive beschreibende Aussagen sind faktenbasiert, objektiv wahr und nicht wertend. Normative Aussagen hingegen basieren auf moralischen Werten und Normen, die sich aus diesen Werten ergeben. Der Praktische Syllogismus ist ein Argumentationsschema, welches sich aus drei Schritten zusammensetzt syn zusammen, logos Wort: Eine deskriptive Prämisse Aussage und eine normative Prämisse",Saarland,Gym,Sek2,2024.0,Bio
889,1,0.7016440531635989,"Zusammenhänge strukturiert und unter Verwendung der Fachsprache formulieren beurteilen Das zu fällende Sachurteil ist mithilfe fachlicher Kriterien zu begründen. bewerten Das zu fällende Werturteil ist unter Berücksichtigung gesellschaftlicher Werte und Normen zu begründen. darstellen Strukturen, Sachverhalte oder Zusammenhänge strukturiert und unter Verwendung der Fachsprache formulieren, auch mithilfe von Zeichnungen und Tabellen diskutieren Argumente zu einer Aussage oder These einander gegenüberstellen und",Saarland,Gym,Sek2,2024.0,Bio
