document_id,most_prevalent_topic_id,most_prevalent_topic_probability,text_excerpt,state,school type,grade,year,subject
536,1,0.9722379431436571,"der Nachdenklichkeit ermöglicht eigenorganisiertes Wissen, mit dem Schülerinnen und Schüler in unterschiedlichen Kontexten anwendungsbezogen und angemessen handeln können. Entwicklung ethischer Urteilsfähigkeit Es ist Aufgabe des Unterrichts im Fach Werte und Normen, die Schülerinnen und Schüler für die moralischen und sittlichen Dimensionen menschlichen Handelns zu sensibilisieren sowie Unterscheidungs- und Kritikfähigkeit in der Auseinandersetzung mit Handlungs- und Wertfragen im privaten und öffentlichen Leben",Niedersachsen,Hauptschule,,2018.0,"Ethik, Philo"
537,6,0.9723059131899037,"denen häufig komplexe Entscheidungen anstehen. Dabei sind fundamentale Lebensbedingungen und elementare Lebensbedürfnisse zu berücksichtigen und mögliche Folgen gewählter Handlungsweisen zu antizipieren. Eben hier hat der Unterricht im Fach Werte und Normen seinen genuinen Platz, denn die Lernenden erwerben durch dieses Fach Kenntnisse und Fähigkeiten zur Anwendung der Kriterien ethischer Argumentationsweisen. Bei den Schülerinnen und Schülern wird eine Haltung angestrebt, die sich",Niedersachsen,Hauptschule,,2018.0,"Ethik, Philo"
538,6,0.9723114562450219,"und Schüler ausüben, denn hier sind fachspezifische Kenntnisse, Fähigkeiten und Fertigkeiten wie kritisches, differenziertes Urteilsvermögen und verantwortungsvolles, prosoziales Handeln von großer Bedeutung. In diesem Sinne leistet das Fach Werte und Normen zusätzlich einen wichtigen Beitrag zur Medienbildung. Werteorientierung Der Unterricht im Fach Werte und Normen strebt das übergeordnete Ziel an, dass die Schülerinnen und Schüler gesellschaftliche und persönliche Herausforderungen unter den",Niedersachsen,Hauptschule,,2018.0,"Ethik, Philo"
539,6,0.9722818346562939,"Urteilsvermögen und verantwortungsvolles, prosoziales Handeln von großer Bedeutung. In diesem Sinne leistet das Fach Werte und Normen zusätzlich einen wichtigen Beitrag zur Medienbildung. Werteorientierung Der Unterricht im Fach Werte und Normen strebt das übergeordnete Ziel an, dass die Schülerinnen und Schüler gesellschaftliche und persönliche Herausforderungen unter den Gesichtspunkten eines guten und gerechten Lebens, der Freiheit und Verantwortung, der Pluralität und der",Niedersachsen,Hauptschule,,2018.0,"Ethik, Philo"
540,6,0.9681873176432529,"und der Menschenwürde interpretieren und bewerten können. Dieses Ziel kann vorwiegend im Rahmen von Diskursen erreicht werden. Daher sollen die Schülerinnen und Schüler dazu befähigt werden, exemplarisch grundlegende Werteorientierungen und Normen zu erkennen, die in verschiedenen gesellschaftlichen Diskursen, in Handlungsweisen, aber auch in wissenschaftlichen Theorien und Religionen bzw. Weltanschauungen von Bedeutung sind. Diese sollen kritisch hinsichtlich der Frage reflektiert werden, ob",Niedersachsen,Hauptschule,,2018.0,"Ethik, Philo"
541,6,0.9656600767012757,"von Bedeutung sind. Diese sollen kritisch hinsichtlich der Frage reflektiert werden, ob sie mit Wertorientierungen des Grundgesetzes und dem NSchG in Einklang zu bringen sind. Bezugswissenschaften Das Unterrichtsfach Werte und Normen bezieht sich in erster Linie auf Problemstellungen - der Philosophie, - der Religionswissenschaft, - geeigneter Gesellschaftswissenschaften. Bei bestimmten Fragestellungen sind weitere Einzelwissenschaften zu berücksichtigen, wie zum Beispiel die RechtswissenPhilosophischer Bezug",Niedersachsen,Hauptschule,,2018.0,"Ethik, Philo"
542,6,0.9740014976562033,auch ethische Akzentuierungen der Religionen bzw. Weltanschauungen. Geeignete Forschungsergebnisse der Naturwissenschaften sind bei der Erörterung bestimmter ethischer Fragen in angemessener Weise einzubeziehen. Religionswissenschaftlicher Bezug Der Unterricht im Fach Werte und Normen soll religionskundliche Kenntnisse und den Zugang zu weltanschaulichen und religiösen Fragen vermitteln vgl. NSchG. Die Schülerinnen und Schüler sind also mit Weltanschauungen und Religionen und deren Wirkungsgeschichten wie Orientierungsmöglichkeiten bekannt,Niedersachsen,Hauptschule,,2018.0,"Ethik, Philo"
543,6,0.9704196296437426,"Erfahrungsraum von Schülerinnen und Schülern, weltanschauliche sowie auch religiöse Daseinsentwürfe sind in den Unterricht einzubeziehen. Die christlich-abendländischen Traditionen spielen hierbei insofern eine größere Rolle, als sie seit Jahrhunderten die Wertvorstellungen, Normen und ethischen Grundsätze der hier lebenden Menschen mitgeprägt haben und nach wie vor mitprägen. Diese Aufgaben verlangen den Rückgriff auf Begriffe und Forschungsergebnisse der Religionswissenschaft. Auch deshalb stimmt sich die",Niedersachsen,Hauptschule,,2018.0,"Ethik, Philo"
544,6,0.9703948225961371,"lebenden Menschen mitgeprägt haben und nach wie vor mitprägen. Diese Aufgaben verlangen den Rückgriff auf Begriffe und Forschungsergebnisse der Religionswissenschaft. Auch deshalb stimmt sich die Fachkonferenz des Faches Werte und Normen mit den Fachkonferenzen der Konfessionen und Religionen bezüglich formaler Vorgaben und der Kooperation, z. B. bei gemeinsamen Exkursionen, ab. Gesellschaftswissenschaftlicher Bezug Der Unterricht im Fach Werte und Normen soll zum",Niedersachsen,Hauptschule,,2018.0,"Ethik, Philo"
545,6,0.9704078264366321,"Werte und Normen mit den Fachkonferenzen der Konfessionen und Religionen bezüglich formaler Vorgaben und der Kooperation, z. B. bei gemeinsamen Exkursionen, ab. Gesellschaftswissenschaftlicher Bezug Der Unterricht im Fach Werte und Normen soll zum Verständnis der in der Gesellschaft wirksamen Wertvorstellungen und Normen beitragen. Dies verlangt neben der philosophischen Reflexion auch empirische und historische Betrachtungen. So hat der Unterricht die Lernenden mit",Niedersachsen,Hauptschule,,2018.0,"Ethik, Philo"
546,6,0.9714008930083863,"formaler Vorgaben und der Kooperation, z. B. bei gemeinsamen Exkursionen, ab. Gesellschaftswissenschaftlicher Bezug Der Unterricht im Fach Werte und Normen soll zum Verständnis der in der Gesellschaft wirksamen Wertvorstellungen und Normen beitragen. Dies verlangt neben der philosophischen Reflexion auch empirische und historische Betrachtungen. So hat der Unterricht die Lernenden mit dem Bestand der demokratischen Grundwerte bekannt zu machen, gesellschaftlich anerkannte moralische",Niedersachsen,Hauptschule,,2018.0,"Ethik, Philo"
547,6,0.9747438275277862,"verlangt neben der philosophischen Reflexion auch empirische und historische Betrachtungen. So hat der Unterricht die Lernenden mit dem Bestand der demokratischen Grundwerte bekannt zu machen, gesellschaftlich anerkannte moralische und rechtliche Normen aufzuzeigen und Aspekte des Werte- und Normenwandels zu untersuchen. Zu diesem Zweck sind insbesondere Fragestellungen und Ergebnisse geeigneter Sozialwissenschaften wie Politikwissenschaft, Soziologie und Psychologie hilfreich. Der Unterricht im Fach Werte",Niedersachsen,Hauptschule,,2018.0,"Ethik, Philo"
548,6,0.5335273946375763,"und Aspekte des Werte- und Normenwandels zu untersuchen. Zu diesem Zweck sind insbesondere Fragestellungen und Ergebnisse geeigneter Sozialwissenschaften wie Politikwissenschaft, Soziologie und Psychologie hilfreich. Der Unterricht im Fach Werte und Normen leistet auch auf dieser Grundlage einen Beitrag zu den fachübergreifenden Bildungsbereichen Bildung für nachhaltige Entwicklung, Gesundheitliche Bildung, Interkulturelle Bildung, Medienbildung, MINT-Bildung, Mobilität, Musisch-ästhetische Bildung, Sprachbildung sowie Verbraucherbildung. Dies schließt auch",Niedersachsen,Hauptschule,,2018.0,"Ethik, Philo"
549,7,0.9739844342246285,"Bildung, Interkulturelle Bildung, Medienbildung, MINT-Bildung, Mobilität, Musisch-ästhetische Bildung, Sprachbildung sowie Verbraucherbildung. Dies schließt auch die Berücksichtigung der Vielfalt sexueller Identitäten ein. Eine zentrale Aufgabe des Unterrichts im Fach Werte und Normen ist es, dazu beizutragen, dass die Schülerinnen und Schüler die für den erfolgreichen Schulbesuch und die gesellschaftliche Teilhabe notwendigen sprachlichen Kompetenzen erwerben. Die kompetente Verwendung von Sprache ist deshalb auch",Niedersachsen,Hauptschule,,2018.0,"Ethik, Philo"
550,7,0.9693096269083802,"dass die Schülerinnen und Schüler die für den erfolgreichen Schulbesuch und die gesellschaftliche Teilhabe notwendigen sprachlichen Kompetenzen erwerben. Die kompetente Verwendung von Sprache ist deshalb auch im Fach Werte und Normen Teil des Unterrichts. Im Unterricht geht es darum, die Lernenden schrittweise und kontinuierlich von der Verwendung der Alltagssprache zur kompetenten Verwendung der Bildungssprache einschließlich der Fachbegriffe aus dem Bereich Werte",Niedersachsen,Hauptschule,,2018.0,"Ethik, Philo"
551,4,0.9641594263980086,"des Unterrichts. Im Unterricht geht es darum, die Lernenden schrittweise und kontinuierlich von der Verwendung der Alltagssprache zur kompetenten Verwendung der Bildungssprache einschließlich der Fachbegriffe aus dem Bereich Werte und Normen zu führen. Die Schülerinnen und Schüler erhalten Gelegenheit, die Bildungssprache und die Fachsprache aufzunehmen, selbst zu erproben und Sprachbewusstsein zu entwickeln. Dabei werden die verwendeten sprachlichen Mittel und die sprachlichen",Niedersachsen,Hauptschule,,2018.0,"Ethik, Philo"
552,2,0.9704115318925824,"und Durchführung konkreter Unterrichtseinheiten und Unterrichtsstunden ist Sorge dafür zu tragen, dass die sprachlichen Kenntnisse nach Bedarf vermittelt und nicht vorausgesetzt werden. Kompetenzorientierter Unterricht Im Kerncurriculum des Faches Werte und Normen werden die Zielsetzungen des Bildungsbeitrags durch verbindlich erwartete Lernergebnisse konkretisiert und als Kompetenzen formuliert. Dabei werden im Sinne eines Kerns die als grundlegend und unverzichtbar erachteten fachbezogenen Kenntnisse und Fertigkeiten",Niedersachsen,Hauptschule,,2018.0,"Ethik, Philo"
553,7,0.972289406472903,"die weitere schulische und berufliche Ausbildung von Bedeutung und ermöglichen anschlussfähiges Lernen. Die erwarteten Kompetenzen werden in Kompetenzbereichen zusammengefasst, die das Fach strukturieren. Aufgabe des Unterrichts im Fach Werte und Normen ist es, die Kompetenzentwicklung der Schülerinnen und Schüler anzuregen, zu unterstützen, zu fördern und langfristig zu sichern. Dies gilt auch für die fachübergreifenden Zielsetzungen der Persönlichkeitsbildung. Kompetenzbereiche Das vorliegende Kerncurriculum",Niedersachsen,Hauptschule,,2018.0,"Ethik, Philo"
554,1,0.5806527394809404,"Menschen. Eine intensive Beschäftigung mit diesen Aspekten leistet somit einen wichtigen Beitrag, damit die Schülerinnen und Schüler der Zukunft realistisch, verantwortungsbewusst und selbstbejahend entgegentreten. Fragen nach Moral und Ethik Moralische Normen bieten für die Schülerinnen und Schüler Orientierung und Verlässlichkeit im Alltag. Eben dort erfahren die Schülerinnen und Schüler aber auch, dass im menschlichen Miteinander Interessen kollidieren und dass daraus Konflikte",Niedersachsen,Hauptschule,,2018.0,"Ethik, Philo"
555,5,0.9693128704287456,"bewertenden und begründenden Ansätzen und artikulieren begründet eigene und auch fremde Interessen. Auf dieser Basis ist es den Schülerinnen und Schülern möglich, eine eigene Haltung zu den tragenden Werten und Normen einer menschenwürdigen und demokratischen Gesellschaft sowie eines gerechten und verantwortungsvollen Miteinanders zu entwickeln. Dem Kompetenzbereich Fragen nach Moral und Ethik kommt also im Rahmen des zentralen didaktischen Bereichs Entwicklung der",Niedersachsen,Hauptschule,,2018.0,"Ethik, Philo"
556,4,0.967004496583955,"eine Auseinandersetzung mit einander widersprechenden Wahrheitsansprüchen sind Empathiefähigkeit sowie eine grundsätzliche Toleranzbereitschaft maßgeblich. Toleranz darf dabei nicht mit Beliebigkeit und Gleichgültigkeit verwechselt werden. So bilden etwa Menschenwürde und Menschenrechte als Normen mit universalem Geltungsanspruch die unverhandelbare Basis der Demokratie und des sozialen Rechtsstaats. Der Kompetenzbereich Fragen nach der Wirklichkeit fordert die Schülerinnen und Schüler also dazu auf, sich eigene und ihnen",Niedersachsen,Hauptschule,,2018.0,"Ethik, Philo"
557,3,0.9747577160679731,"Kompetenzbereich: Fragen nach Moral und Ethik Leitthema: Regeln für das Zusammenleben Erwartete Kompetenzen am Ende von Schuljahrgang Mögliche Inhalte für den Kompetenzerwerb Die Schülerinnen und Schüler ... benennen verschiedene Regeln, Normen und Rituale sowie deren Bedeutung für das Zusammenleben. Regeln und Normen in Klasse, Familie, Freundeskreis, Verein Sicherheit, Verlässlichkeit, Einschränkung Welt ohne Regeln und Normen arbeiten die Werte, die bestimmten Regeln",Niedersachsen,Hauptschule,,2018.0,"Ethik, Philo"
558,3,0.9747716944425019,"Erwartete Kompetenzen am Ende von Schuljahrgang Mögliche Inhalte für den Kompetenzerwerb Die Schülerinnen und Schüler ... benennen verschiedene Regeln, Normen und Rituale sowie deren Bedeutung für das Zusammenleben. Regeln und Normen in Klasse, Familie, Freundeskreis, Verein Sicherheit, Verlässlichkeit, Einschränkung Welt ohne Regeln und Normen arbeiten die Werte, die bestimmten Regeln und Normen zugrunde liegen, heraus. z. B. Ehrlichkeit, Höflichkeit, Achtsamkeit, Geselligkeit",Niedersachsen,Hauptschule,,2018.0,"Ethik, Philo"
559,3,0.975489908125714,"und Schüler ... benennen verschiedene Regeln, Normen und Rituale sowie deren Bedeutung für das Zusammenleben. Regeln und Normen in Klasse, Familie, Freundeskreis, Verein Sicherheit, Verlässlichkeit, Einschränkung Welt ohne Regeln und Normen arbeiten die Werte, die bestimmten Regeln und Normen zugrunde liegen, heraus. z. B. Ehrlichkeit, Höflichkeit, Achtsamkeit, Geselligkeit im Hinblick auf Verhaltensregeln in verschiedenen Sportarten und Spielen Schulregeln erläutern die Goldene",Niedersachsen,Hauptschule,,2018.0,"Ethik, Philo"
560,3,0.9767816942590308,"Rituale sowie deren Bedeutung für das Zusammenleben. Regeln und Normen in Klasse, Familie, Freundeskreis, Verein Sicherheit, Verlässlichkeit, Einschränkung Welt ohne Regeln und Normen arbeiten die Werte, die bestimmten Regeln und Normen zugrunde liegen, heraus. z. B. Ehrlichkeit, Höflichkeit, Achtsamkeit, Geselligkeit im Hinblick auf Verhaltensregeln in verschiedenen Sportarten und Spielen Schulregeln erläutern die Goldene Regel und stellen Beispiele einer sinnvollen Anwendung dar.",Niedersachsen,Hauptschule,,2018.0,"Ethik, Philo"
561,4,0.9795551453225855,"Regel im Sport beurteilen Formen und Folgen von Regelverletzungen. Prävention, Sanktion, Strafe Funktionen von Strafe: Abschreckung, Wiedergutmachung, Vorbeugung, Einsicht, Vergeltung physisches Mobbing, psychisches Mobbing, Cybermobbing ... Grundbegriffe: Goldene Regel, Mobbing, Normen, Ritual, Werte Inhaltsbezogener Kompetenzbereich: Fragen nach der Wirklichkeit Leitthema: Leben in Vielfalt Erwartete Kompetenzen am Ende von Schuljahrgang Mögliche Inhalte für den Kompetenzerwerb Die Schülerinnen und Schüler ... beschreiben unterschiedliche",Niedersachsen,Hauptschule,,2018.0,"Ethik, Philo"
562,4,0.9388547633744324,"einem Sachverhalt formulieren, wobei die Kriterien und die wesentlichen Gründe für die Beurteilung offen gelegt werden Bewerten Stellung nehmen III Einen Sachverhalt oder ein Material nach selbst gewählten und begründeten Normen oder Kriterien beurteilen, wobei diese persönlichen Wertbezüge offenbart werden Erschließen III Etwas Neues oder nicht explizit Formuliertes auf der Basis von Theorien und Modellen durch Schlussfolgerungen herleiten Entwerfen III Ein",Bremen,Gym,5-9,2017.0,"Ethik, Philo"
563,1,0.5069532641097593,"als Bedingung der Erfahrung Was heißt normal Meine Wirklichkeit in den Augen des Anderen; Beständigkeit/ Veränderung Was soll ich tun Gerechtigkeit und Moral Gewissen und Verantwortung Unterschiedliche Regelsysteme Vorschriften, Gebote, Normen, Gesetze Was darf ich hoffen Utopien Lebensentwürfe und gesellschaftliche Glücksvorstellungen Was ist der Mensch Dimensionen des Mensch-Seins I Der Mensch als Homo Faber, Homo Ludens, Homo Investigans, Homo Pictor Dimensionen",Bremen,Gym,5-9,2017.0,"Ethik, Philo"
564,6,0.3723748817625727,"offenen Fragen ethischer Reflexion, auch der gegenwärtigen. Bereits der etymologische Ursprung des Wortes von griechisch ethos: Sitte, Gewohnheit verweist darauf, dass Ethik ihren Ausgang nimmt von gesellschaftlich anerkannten Einstellungen und Normen, die den Kontext darstellen, auf den sich die philosophische Ethik bezieht. Anthropologisch gesehen tragen Moral und Ethik dem Umstand Rechnung, dass der Mensch der aus der Natur Entlassene ist, der",Rheinland-Pfalz,Gym,Sek2,2011.0,"Ethik, Philo"
565,1,0.5513941820014465,"Ethik zum Gegenstand hat und deren Intention darin zu sehen ist, Ethik auf ihre Möglichkeit hin zu überprüfen GEORGE EDWARD MOORE, RICHARD MERVIN HARE u. a.. An welchen Wertmaßstäben und Normen Menschen tatsächlich ihr Leben und Handeln ausrichten, wird somit von der deskriptiven Ethik erfasst; Fragen wie zum Beispiel die, was wir überhaupt meinen, wenn wir im Kontext moralischer Urteile den",Rheinland-Pfalz,Gym,Sek2,2011.0,"Ethik, Philo"
566,6,0.6642679756885083,"bewirken. Unter ,Glück happiness ist dabei Lust pleasure und das Freisein von Unlust pain, unter ,Unglück unhappiness Unlust und das Fehlen von Lust verstanden. Damit die von dieser Theorie aufgestellte Norm deutlich wird, muss freilich noch einiges mehr gesagt werden, insbesondere darüber, was die Begriffe Lust und Unlust einschließen sollen und inwieweit dies von der Theorie offengelassen wird. Aber solche zusätzlichen",,,,2006.0,"Ethik, Philo"
567,4,0.9283674880307441,"TT : Wie kommen wir zu gltigen theoretischen und praktischen Stzen apophantische und prskriptive Rede, und wie berprft man sie auf ihre Geltung Logische Analyse von Stzen z.B. Aussage, Behauptung, Norm, Regel Explikation von Voraussetzungen z.B. Axiom, Hypothese Verallgemeinern und Konkretisieren Formalisieren und Quantifizieren Analogien bilden Problemstellungen variieren TT : Wie knnen wir konsistente Satzzusammenhnge aufbauen und Argumentationen auf Stichhaltigkeit und",Rheinland-Pfalz,Gym,Sek2,,"Ethik, Philo"
568,6,0.36777001036139273,"Wie rechtfertige ich mein Tun - Stunden Teilthemen Inhaltsaspekte TT .: Wie werden Handlungen, Verhaltensweisen und Einstellungen moralisch bewertet gute, schlechte, moralisch indifferente Handlung, Widerfahrnis Handlungsziel, -mittel, -konsequenz, -folge Fall, Norm, Wert, Prinzip, Grundsatz Wahrheit, Gott, Freiheit, Gerechtigkeit, Tugend deskriptive, prskriptive, emotive, empfehlende Stze Erklrung, Begrndung, Rechtfertigung TT .: Wie werden moralische Regeln begrndet Sollen, Wollen, Erfahrung, Hermeneutik, Postulat logischer Schluss,",Rheinland-Pfalz,Gym,Sek2,,"Ethik, Philo"
569,7,0.5298745066172095,"Kultur Ethik Anthropologie Philosophie der Natur Informationsverarbeitung und Verhalten Kommunikation Lernen und Gedchtnis Sozialverhalten des Menschen Anthropologie Erkenntnistheorie Evolution und Anthropologie Philosophische Deutungen des Menschen Der Mensch zwischen Freiheit und Norm Gehirn und Geist Anthropologie Ethik Geschichtsphilosophie Knstliche Intelligenz Philosophie des Geistes Informatik Philosophie Themen Hinweise/Aspekte/Beispiele Themen Algorithmen Schrittweise Verfeinerung, Topdown-Methode, Bottom-upMethode Modellbildung, Grenzen der Algorithmisierbarkeit Aussagenlogik Logik Wissenschaftstheorie Aktuelle Entwicklungen",Rheinland-Pfalz,Gym,Sek2,,"Ethik, Philo"
570,7,0.4153083875566361,"einer auf Begrndung und Rechtfertigung hin orientierten Ttigkeit. Fragen nach der Wahrheit, den Gesetzen unseres Denkens, nach dem Wesen des Menschen und der Dinge, nach der Geltung und Begrndung von Normen, nach dem Sinn unserer Welt und unseres Lebens, nach der Legitimation unserer gesellschaftlichen und staatlichen Ordnung knnen sowohl in lebensweltlichen wie wissenschaftlichen Zusammenhngen auftreten. Philosophieren heit dann, im Bemhen um",Rheinland-Pfalz,Gym,Sek2,,"Ethik, Philo"
571,7,0.7704471309482327,"Widerfahrnis, Scheitern Fhlen, Empfinden, Lachen, Weinen, Scham Gott, Sinn, Transzendenz, Wrde, Zweck Institution, Freiheit, Determination, Kultur TT .: Wie leben Menschen miteinander Individuum, der Andere, Gemeinschaft, Gesellschaft privat - ffentlich, Normen, Recht, Moral Subjekt - Objekt, Ich - Du, Herr - Knecht Lebensformen, Kult, Tradition, Ordnung, Staat Liebe, Erotik, Sexualitt, Beziehung, Distanz Macht, Wirtschaft, Handel, Krieg, Frieden Themenschwerpunkt : Wie gestaltet",Rheinland-Pfalz,Gym,Sek2,,"Ethik, Philo"
572,6,0.8651131069183564,"ffentlichen Handelns. Entsprechend der methodologischen Leitfrage Was heit: Folgerichtig denken kommen der Erarbeitung einer sachangemessenen Begrifflichkeit und dem Kennenlernen und Einben von spezifischen Argumentationsverfahren zur Rechtfertigung von Sinnentwrfen, Handlungszielen und Normen entscheidende Bedeutung zu. Erst eine philosophische Reflexion, die auch die argumentativen Mittel einbezieht, ermglicht es den Schlerinnen und Schlern, das eigene Denken und Handeln einschlielich seiner Folgen, die Standpunkte anderer,",Rheinland-Pfalz,Gym,Sek2,,"Ethik, Philo"
573,6,0.9523040805206088,"Erst eine philosophische Reflexion, die auch die argumentativen Mittel einbezieht, ermglicht es den Schlerinnen und Schlern, das eigene Denken und Handeln einschlielich seiner Folgen, die Standpunkte anderer, geltende Werte und Normen sowie gesellschaftliche Sinnentwrfe kritisch zu prfen und selbststndig zu begrndeten Handlungs- und Lebensentwrfen zu gelangen. Damit erarbeiten sie sich auch die Grundlagen fr eine kritische Einstellung gegenber Ideologien und Dogmatismen.",Rheinland-Pfalz,Gym,Sek2,,"Ethik, Philo"
574,6,0.36682481529486216,"seiner geschichtlichen und gesellschaftlichen Dimension zu reflektieren, lernen unterschiedliche Theorien der Geschichtsphilosophie, der Staats- und Rechtsphilosophie sowie der Ethik kennen, erarbeiten eine begrndete und kritische Einstellung zu Sinnentwrfen, Handlungszielen und Normen. Die Schlerinnen und Schler erweitern die bisher erworbenen Fhigkeiten im Argumentieren an neuen Themenbereichen, erwerben die Fhigkeit, in den neuen Problemfeldern eine angemessene Begrifflichkeit zu verwenden, lernen, theoretische und praktische",Rheinland-Pfalz,Gym,Sek2,,"Ethik, Philo"
575,7,0.5167429937416876,"Schpfungs-, Heilsordnung, staatl. Ordnung TT .: Was konstituiert ein staatliches Gemeinwesen Macht, Gewalt, Gemeinwohl, Gemeinwille Sicherheit, Frieden nach innen und auen, Eigentum, Arbeit, Recht Staatsform, Herrschaftsform, Verfassung, Gewaltenteilung, Gesetze Werte, Normen, prpositives und positives Recht, berpositive Verbindlichkeit Recht setzen, schpfen, wahren, durchsetzen Themenschwerpunkt : Wie werden staatliche Ordnungen legitimiert - Stunden Teilthemen Inhaltsaspekte TT .: Wie wird das Verhltnis des Einzelnen",Rheinland-Pfalz,Gym,Sek2,,"Ethik, Philo"
576,7,0.63238006392938,"Philosophie Themen Hinweise/Aspekte/Beispiele Themen Was ist der Mensch Geschpf, homo creator, Gemeinschaft, Dialog Anthropologie Der Mensch und seine Gtter Religionskritik Gott Sinn, Leid Religionsphilosophie Kulturphilosophie Auereuropisches Denken Grundzge christlicher Ethik Normen und Normenbegrndung, das Gute und das Bse Ethik Mensch und Zukunft Tod, Glck, Frieden, Hoffnung Anthropologie Ethik Geschichtsphilosophie Ethik Philosophie Themen Hinweise/Aspekte/Beispiele Themen Das Bild vom Menschen und die Sinnfrage",Rheinland-Pfalz,Gym,Sek2,,"Ethik, Philo"
577,6,0.6449164630574401,"die Möglichkeit an, Werte und Normen zu reflektieren und diskursiv zu verhandeln. Denkanstöße Welche Werte leiten mich Wie kann ich sie erkennen Welche Werte sind die wichtigsten Muss ich jede Norm einhalten Kompetenzerwartungen Die Schülerinnen und Schüler können Handlungsmuster in Beziehung zu Handlungsgrundsätzen und Wertvorstellungen setzen Werte, Werte und Normen, die Relevanz sozialer Kontexte für Handlungen analysieren Moralische Werte und Normen,",Saarland,Gym,"7,8",2018.0,"Ethik, Philo"
578,7,0.9713918932230815,"Technik und Natur/Natur- und Umweltschutz Natur Wert- und Moralvorstellungen im Christentum, Islam und Judentum Welt und Transzendenz Sollen Stunden Gerechtigkeit und Courage - sich einmischen Moralisches Handeln - Werte und Normen Rechte und Pflichten Was ist wichtig und sollte sein - Werte und Normen Welche Dinge brauche ich - Glück und Konsum Vorstellungen des guten Lebens Endlichkeit und Sinn des Lebens",Saarland,Gym,"7,8",2018.0,"Ethik, Philo"
579,7,0.8611044591341077,Judentum Welt und Transzendenz Sollen Stunden Gerechtigkeit und Courage - sich einmischen Moralisches Handeln - Werte und Normen Rechte und Pflichten Was ist wichtig und sollte sein - Werte und Normen Welche Dinge brauche ich - Glück und Konsum Vorstellungen des guten Lebens Endlichkeit und Sinn des Lebens Sein: Ich Mensch sein Ethik / Bedürfnisse und Sucht Gerade in Umbruchs- und,Saarland,Gym,"7,8",2018.0,"Ethik, Philo"
580,4,0.9669591711688605,"Respekts und der Toleranz für den Umgang miteinander in der Klassengemeinschaft Diskussion mit Repräsentanten religiöser und religionsfreier Gemeinschaften Hinweis s. Thema Was ist wichtig und sollte sein - Werte und Normen Sollen: Moralisches Handeln Werte und Normen Ethik / Gerechtigkeit und Courage - sich einmischen Insbesondere für Jugendliche, die ihr eigenes Wohlergehen in Auseinandersetzung mit vorgegebenen Regeln der Erwachsenen zunehmend selbst",Saarland,Gym,"7,8",2018.0,"Ethik, Philo"
