document_id,most_prevalent_topic_id,most_prevalent_topic_probability,text_excerpt,state,school type,grade,year,subject
267,3,0.9722858346435707,"der Kodifizierung oder Rechtfertigung von Normen oder der Anerkennung von Normen aus rein gesellschaftlichen Praktiken ohne normativen Anspruch der Notwendigkeit der zwangsbewehrten Sanktionierung von Normverstößen der Messbarkeit der Stärke von Normen des Verfalls gesellschaftlicher Normen der Möglichkeiten der Entfaltung von Normen durch Streit rechtsphilosophische Fragen DRF Naturrecht vs. Rechtspositivismus Reflexionsbereiche: Ethik, Anthropologie, Geschichte und Gesellschaft, Sprachphilosophie, Metaphysik, Erkenntnistheorie, Lebenskunst Diskussion von",MeckPomm,Gym,Sek2,2019.0,"Ethik, Philo"
268,3,0.896467764318334,"von Normen oder der Anerkennung von Normen aus rein gesellschaftlichen Praktiken ohne normativen Anspruch der Notwendigkeit der zwangsbewehrten Sanktionierung von Normverstößen der Messbarkeit der Stärke von Normen des Verfalls gesellschaftlicher Normen der Möglichkeiten der Entfaltung von Normen durch Streit rechtsphilosophische Fragen DRF Naturrecht vs. Rechtspositivismus Reflexionsbereiche: Ethik, Anthropologie, Geschichte und Gesellschaft, Sprachphilosophie, Metaphysik, Erkenntnistheorie, Lebenskunst Diskussion von Fragen des Stellenwerts allgemeiner",MeckPomm,Gym,Sek2,2019.0,"Ethik, Philo"
269,3,0.8139758590233281,"Normen aus rein gesellschaftlichen Praktiken ohne normativen Anspruch der Notwendigkeit der zwangsbewehrten Sanktionierung von Normverstößen der Messbarkeit der Stärke von Normen des Verfalls gesellschaftlicher Normen der Möglichkeiten der Entfaltung von Normen durch Streit rechtsphilosophische Fragen DRF Naturrecht vs. Rechtspositivismus Reflexionsbereiche: Ethik, Anthropologie, Geschichte und Gesellschaft, Sprachphilosophie, Metaphysik, Erkenntnistheorie, Lebenskunst Diskussion von Fragen des Stellenwerts allgemeiner und überpositiver Leitkriterien wie: politische Gerechtigkeit",MeckPomm,Gym,Sek2,2019.0,"Ethik, Philo"
270,7,0.4034960732652158,"entgegen. erfassen den Wert von Demokratie und Pluralismus und setzen sich dafür ein. verstehen internationale Organisationen als wesentlichen Beitrag zur Friedenssicherung zwischen Staaten. zeigen Einsicht in die Bedeutung verbindlicher übernationaler Normen wie der Menschenrechte für ein freiheitliches und friedliches Zusammenleben in einer pluralistischen Gesellschaft und einer globalisierten sowie digitalen Welt. erkennen und diskutieren Gefahren für Demokratien heute, z. B. populistische Strömungen.",Bayern,Gym,11,,"Ethik, Philo"
271,7,0.9126804651788407,"Vorstellungen und den lebendigen Austausch mit anderen ermöglicht. Kompetenzorientierung im Fach Ethik Kompetenzstrukturmodell Im Kompetenzstrukturmodell für das Fach Ethik sind die zentralen Kompetenz- und Gegenstandsbereiche mit den ethischen Leitbegriffen Werte, Normen, Moral und Sinn verbunden, wodurch der spezifische Charakter des Faches sichtbar wird. Moralisches Lernen ist in allen Jahrgangsstufen sowohl kognitives als auch die Motivation förderndes Lernen. Dies bedeutet, dass die",Bayern,Gym,13,,"Ethik, Philo"
272,7,0.965689296621801,"Moralisches Lernen ist in allen Jahrgangsstufen sowohl kognitives als auch die Motivation förderndes Lernen. Dies bedeutet, dass die Schülerinnen und Schüler im Ethikunterricht nicht nur verstehen sollen, welche Werte und Normen gelten und warum sie gelten, sondern auch lernen, dass für ein gelingendes Leben das Engagement für diese Werte und Normen notwendig ist. Die Beschäftigung mit der Sinnfrage bezüglich der Motivation",Bayern,Gym,13,,"Ethik, Philo"
273,7,0.9656808638681117,"Schüler im Ethikunterricht nicht nur verstehen sollen, welche Werte und Normen gelten und warum sie gelten, sondern auch lernen, dass für ein gelingendes Leben das Engagement für diese Werte und Normen notwendig ist. Die Beschäftigung mit der Sinnfrage bezüglich der Motivation für ein an Werten orientiertes Leben hat deshalb im Ethikunterricht einen besonders hohen Stellenwert. Die prozessbezogenen Kompetenzen, die in Ethik",Bayern,Gym,13,,"Ethik, Philo"
274,7,0.5167845219126822,"welche die menschliche Zivilisation seit mehr als Jahren in immer neuer Form prägen, neuartige ethische Herausforderungen entstanden sind. Perspektiven Im Mittelpunkt des Ethikunterrichts am Gymnasium stehen die Begriffe Werte und Normen, Sinn und Moral, denn der Ethikunterricht behandelt die Frage nach dem guten Leben. Dies beinhaltet das eigene Leben ebenso wie das gute Leben der anderen, womit sich die moralische Dimension",Bayern,Gym,13,,"Ethik, Philo"
275,5,0.735632649768299,"Niedersächsisches Kultusministerium Kerncurriculum für die Integrierte Gesamtschule Schuljahrgänge - Werte und Normen Niedersachsen An der Weiterentwicklung des Kerncurriculums für das Unterrichtsfach Werte und Normen in den Schuljahrgängen - der Integrierten Gesamtschule waren die nachstehend genannten Personen beteiligt: Dr. Robert Jan Berg, Wolfsburg",Niedersachsen,Gesamtschule,,2017.0,"Ethik, Philo"
276,5,0.7490468668617244,"Niedersächsisches Kultusministerium Kerncurriculum für die Integrierte Gesamtschule Schuljahrgänge - Werte und Normen Niedersachsen An der Weiterentwicklung des Kerncurriculums für das Unterrichtsfach Werte und Normen in den Schuljahrgängen - der Integrierten Gesamtschule waren die nachstehend genannten Personen beteiligt: Dr. Robert Jan Berg, Wolfsburg Christiane Michaelis, Göttingen Markus Rassiller, Hannover Sarah Lena Reuß, Garbsen Thorsten Schimschal,",Niedersachsen,Gesamtschule,,2017.0,"Ethik, Philo"
277,2,0.9809389025666885,"worden. Herausgegeben vom Niedersächsischen Kultusministerium Hannover, Schiffgraben Druck: Unidruck Weidendamm Hannover Das Kerncurriculum kann als PDF-Datei vom Niedersächsischen Bildungsserver NIBIS http://www.cuvo.nibis.de heruntergeladen werden. Inhalt Seite Bildungsbeitrag des Faches Werte und Normen Kompetenzorientierter Unterricht Kompetenzbereiche Kompetenzentwicklung Innere Differenzierung Erwartete Kompetenzen Prozessbezogene Kompetenzbereiche Inhaltsbezogene Kompetenzbereiche Kompetenzen nach Doppelschuljahrgängen Schuljahrgänge und Schuljahrgänge und Schuljahrgänge und Leistungsfeststellung und Leistungsbewertung Aufgaben der Fachkonferenz Anhang A Operatoren",Niedersachsen,Gesamtschule,,2017.0,"Ethik, Philo"
278,4,0.973165110800446,"Kompetenzbereiche Kompetenzen nach Doppelschuljahrgängen Schuljahrgänge und Schuljahrgänge und Schuljahrgänge und Leistungsfeststellung und Leistungsbewertung Aufgaben der Fachkonferenz Anhang A Operatoren A Übersicht über die verbindlichen Grundbegriffe Bildungsbeitrag des Faches Werte und Normen Das Unterrichtsfach Werte und Normen leistet einen wichtigen Beitrag, um den Ansprüchen gerecht zu werden, die der des Niedersächsischen Schulgesetzes formuliert. Dem dort verankerten Ziel, ... die Persönlichkeit der Schülerinnen",Niedersachsen,Gesamtschule,,2017.0,"Ethik, Philo"
279,4,0.9703951954966199,"und Schuljahrgänge und Schuljahrgänge und Leistungsfeststellung und Leistungsbewertung Aufgaben der Fachkonferenz Anhang A Operatoren A Übersicht über die verbindlichen Grundbegriffe Bildungsbeitrag des Faches Werte und Normen Das Unterrichtsfach Werte und Normen leistet einen wichtigen Beitrag, um den Ansprüchen gerecht zu werden, die der des Niedersächsischen Schulgesetzes formuliert. Dem dort verankerten Ziel, ... die Persönlichkeit der Schülerinnen und Schüler auf der Grundlage",Niedersachsen,Gesamtschule,,2017.0,"Ethik, Philo"
280,5,0.6240888577517183,"... die Persönlichkeit der Schülerinnen und Schüler auf der Grundlage des Christentums, des europäischen Humanismus und der Ideen der liberalen, demokratischen und sozialen Freiheitsbewegungen weiterzuentwickeln, trägt das Fach Werte und Normen in besonderem Maße Rechnung. Obwohl ein gewisser Konsens über gültige Werte und Normen unterstellt werden kann, wird die Lebenspraxis von häufigen und vielstimmigen Diskussionen über Wertvorstellungen und darauf aufbauende gesellschaftliche",Niedersachsen,Gesamtschule,,2017.0,"Ethik, Philo"
281,5,0.7433920852447211,"europäischen Humanismus und der Ideen der liberalen, demokratischen und sozialen Freiheitsbewegungen weiterzuentwickeln, trägt das Fach Werte und Normen in besonderem Maße Rechnung. Obwohl ein gewisser Konsens über gültige Werte und Normen unterstellt werden kann, wird die Lebenspraxis von häufigen und vielstimmigen Diskussionen über Wertvorstellungen und darauf aufbauende gesellschaftliche Normen geprägt. Dies liegt nicht zuletzt daran, dass sich jene Wertvorstellungen und Normen",Niedersachsen,Gesamtschule,,2017.0,"Ethik, Philo"
282,5,0.9740149424487923,"in besonderem Maße Rechnung. Obwohl ein gewisser Konsens über gültige Werte und Normen unterstellt werden kann, wird die Lebenspraxis von häufigen und vielstimmigen Diskussionen über Wertvorstellungen und darauf aufbauende gesellschaftliche Normen geprägt. Dies liegt nicht zuletzt daran, dass sich jene Wertvorstellungen und Normen aufgrund politischer, historischer, ökonomischer, gesellschaftlicher und religiöser Veränderungen wandeln oder zumindest modifizieren. Mehr oder minder bewusst werden Kinder",Niedersachsen,Gesamtschule,,2017.0,"Ethik, Philo"
283,5,0.9732039738927,"Normen unterstellt werden kann, wird die Lebenspraxis von häufigen und vielstimmigen Diskussionen über Wertvorstellungen und darauf aufbauende gesellschaftliche Normen geprägt. Dies liegt nicht zuletzt daran, dass sich jene Wertvorstellungen und Normen aufgrund politischer, historischer, ökonomischer, gesellschaftlicher und religiöser Veränderungen wandeln oder zumindest modifizieren. Mehr oder minder bewusst werden Kinder und Jugendliche zu Zeugen dieser Wandlungen, und oftmals resultiert daraus eine tief",Niedersachsen,Gesamtschule,,2017.0,"Ethik, Philo"
284,2,0.9747661589594596,"Gruppierungen Differenzen bestehen können. Daraus entwickeln sich gegebenenfalls Krisen und Konflikte. Den Orientierungsproblemen, die sich daraus ergeben und mit denen Kinder und Jugendliche häufig aufwachsen, will das Fach Werte und Normen inhaltlich facettenreich und pädagogisch sensibel begegnen. Auf der Grundlage der im Grundgesetz, der Niedersächsischen Verfassung sowie dem Niedersächsischen Schulgesetz explizit zum Ausdruck gebrachten Wertvorstellungen werden unterschiedliche Weltanschauungen und Wahrheitsauffassungen im",Niedersachsen,Gesamtschule,,2017.0,"Ethik, Philo"
285,4,0.9723158744463415,"Recht, seine Persönlichkeit frei und eigenverantwortlich zu entfalten und sich als selbstbestimmtes Individuum an der Gestaltung des menschlichen Zusammenlebens zu beteiligen. Diesen Zielsetzungen verpflichtet, bezieht sich das Unterrichtsfach Werte und Normen auf altersgerecht adäquate Problemstellungen und Fragen nicht nur der Religions- und Gesellschaftswissenschaften, sondern auch der Philosophie und hier insbesondere auf Fragen der Moralphilosophie bzw. Ethik. Immanuel Kants elementare Frage Was",Niedersachsen,Gesamtschule,,2017.0,"Ethik, Philo"
286,4,0.9739849640092793,"Gesellschaftswissenschaften, sondern auch der Philosophie und hier insbesondere auf Fragen der Moralphilosophie bzw. Ethik. Immanuel Kants elementare Frage Was soll ich tun stellt gewissermaßen ein Leitmotiv des Unterrichtsfaches Werte und Normen dar. In der Didaktik ist unstrittig, dass diesbezüglicher Unterricht auf aktives, eigenständiges und problemorientiertes Philosophieren und nicht bloß auf rein rezeptives Lernen von philosophiehistorischen Fakten und Systemen abzuzielen habe. Unter",Niedersachsen,Gesamtschule,,2017.0,"Ethik, Philo"
287,6,0.7589995506228977,"auf aktives, eigenständiges und problemorientiertes Philosophieren und nicht bloß auf rein rezeptives Lernen von philosophiehistorischen Fakten und Systemen abzuzielen habe. Unter diesen Voraussetzungen kann der Unterricht im Fach Werte und Normen den Schülerinnen und Schülern ein Rüstzeug bereitstellen, um Einsichten in die tragenden Wertvorstellungen und Normen einer menschenwürdigen Gesellschaft sowie in die entsprechenden ethischen Grundsätze zu gewinnen und um wesentliche kulturelle,",Niedersachsen,Gesamtschule,,2017.0,"Ethik, Philo"
288,6,0.9714016319976517,"Fakten und Systemen abzuzielen habe. Unter diesen Voraussetzungen kann der Unterricht im Fach Werte und Normen den Schülerinnen und Schülern ein Rüstzeug bereitstellen, um Einsichten in die tragenden Wertvorstellungen und Normen einer menschenwürdigen Gesellschaft sowie in die entsprechenden ethischen Grundsätze zu gewinnen und um wesentliche kulturelle, geistige und religiöse Bedingungen und Grundlagen der demokratischen Gesellschaftsordnungen kennenzulernen. Mit Blick auf religiöse bzw.",Niedersachsen,Gesamtschule,,2017.0,"Ethik, Philo"
289,6,0.9754901777160152,"gewinnen und um wesentliche kulturelle, geistige und religiöse Bedingungen und Grundlagen der demokratischen Gesellschaftsordnungen kennenzulernen. Mit Blick auf religiöse bzw. religionswissenschaftliche Unterrichtsinhalte ist zu betonen, dass das Fach Werte und Normen die Pluralität unterschiedlicher Wahrheitsansprüche in Religionen und Weltanschauungen thematisiert. Zur Wahrung der Freiheit des Glaubens, des Gewissens und des religiösen und weltanschaulichen Bekenntnisses verlangt der Unterricht im Fach Werte und",Niedersachsen,Gesamtschule,,2017.0,"Ethik, Philo"
290,6,0.974008212411149,"die Pluralität unterschiedlicher Wahrheitsansprüche in Religionen und Weltanschauungen thematisiert. Zur Wahrung der Freiheit des Glaubens, des Gewissens und des religiösen und weltanschaulichen Bekenntnisses verlangt der Unterricht im Fach Werte und Normen die weltanschauliche und religiöse Neutralität des Faches. Der gesetzliche Auftrag weist dem Fach zwar vergleichbare Fragestellungen, Probleme und Sachverhalte zu, wie sie auch im Fach Religion behandelt werden, doch ist",Niedersachsen,Gesamtschule,,2017.0,"Ethik, Philo"
291,2,0.9670022220353623,"und weltanschaulicher Art lernen die Schülerinnen und Schüler im Unterricht zwar kennen, doch eine spezifische Präferenz für eine dieser Positionen ist ausdrücklich nicht intendiert. Der Unterricht im Fach Werte und Normen leitet zur Reflexion über die verschiedenen Orientierungen in der Absicht an, diese bezüglich ihrer Plausibilität, ihrer sozialen Zumutbarkeit sowie ihres Sinnpotenzials zu unterscheiden. Er vermittelt den Schülerinnen und Schülern die",Niedersachsen,Gesamtschule,,2017.0,"Ethik, Philo"
292,6,0.9693403913009125,"Einsicht, dass es konkurrierende Wahrheits- und Weltauffassungen gibt. Diese erfordern einerseits eine Standortbestimmung und andererseits eine Haltung, die von Empathie und Toleranz geprägt ist. Der Unterricht im Fach Werte und Normen fördert dadurch die Bereitschaft zu reflektiertem und verantwortungsbewusstem Handeln sich selbst und anderen gegenüber. In diesem Sinne also trägt das Unterrichtsfach Werte und Normen zu einer differenzierten Auseinandersetzung sowohl mit",Niedersachsen,Gesamtschule,,2017.0,"Ethik, Philo"
293,6,0.6099531802222435,Der Unterricht im Fach Werte und Normen fördert dadurch die Bereitschaft zu reflektiertem und verantwortungsbewusstem Handeln sich selbst und anderen gegenüber. In diesem Sinne also trägt das Unterrichtsfach Werte und Normen zu einer differenzierten Auseinandersetzung sowohl mit individuell-existenziellen als auch mit gesellschaftlich-globalen Problemfeldern bei und fördert dadurch die Persönlichkeitsentwicklung der Schülerinnen und Schüler. Diese sollen ein die eigene Persönlichkeit bejahendes und,Niedersachsen,Gesamtschule,,2017.0,"Ethik, Philo"
294,3,0.5132417472810418,"leistet einen Beitrag, um wechselseitige Abhängigkeiten und Wertmaßstäbe für eigenes Handeln zu erkennen sowie ein Verständnis für gesellschaftliche Entscheidungen zu sensibilisieren. Aus den oben genannten Aufgaben des Unterrichtsfaches Werte und Normen lassen sich neben inhaltlichen Zielsetzungen auch drei didaktische Prioritäten ableiten: - Auseinandersetzung mit Wirklichkeit und Wahrheitsansprüchen - Entwicklung ethischer Urteilsfähigkeit - Werteorientierung Auseinandersetzung mit Wirklichkeit und Wahrheitsansprüchen Es ist notwendig,",Niedersachsen,Gesamtschule,,2017.0,"Ethik, Philo"
295,5,0.9713991610167982,"fremde Lebensvorstellungen und Auseinandersetzungen mit religiös und weltanschaulich begründeten Sinnentwürfen. Das nachvollziehende Kennenlernen anderer Lebensordnungen, Sinnentwürfe und Kulturen trägt dabei zur Erweiterung der eigenen Wahrnehmungsfähigkeit bei Das Fach Werte und Normen will durch die Kontrastierung des Gewohnten mit bisher unbekannten oder weniger vertrauten Perspektiven die Nachdenklichkeit der Schülerinnen und Schüler fördern. Dieses Prinzip der Nachdenklichkeit ermöglicht eigenorganisiertes Wissen, mit dem Schülerinnen",Niedersachsen,Gesamtschule,,2017.0,"Ethik, Philo"
296,1,0.9722379431436571,"der Nachdenklichkeit ermöglicht eigenorganisiertes Wissen, mit dem Schülerinnen und Schüler in unterschiedlichen Kontexten anwendungsbezogen und angemessen handeln können. Entwicklung ethischer Urteilsfähigkeit Es ist Aufgabe des Unterrichts im Fach Werte und Normen, die Schülerinnen und Schüler für die moralischen und sittlichen Dimensionen menschlichen Handelns zu sensibilisieren sowie Unterscheidungs- und Kritikfähigkeit in der Auseinandersetzung mit Handlungs- und Wertfragen im privaten und öffentlichen Leben",Niedersachsen,Gesamtschule,,2017.0,"Ethik, Philo"
297,6,0.9723059131899037,"denen häufig komplexe Entscheidungen anstehen. Dabei sind fundamentale Lebensbedingungen und elementare Lebensbedürfnisse zu berücksichtigen und mögliche Folgen gewählter Handlungsweisen zu antizipieren. Eben hier hat der Unterricht im Fach Werte und Normen seinen genuinen Platz, denn die Lernenden erwerben durch dieses Fach Kenntnisse und Fähigkeiten zur Anwendung der Kriterien ethischer Argumentationsweisen. Bei den Schülerinnen und Schülern wird eine Haltung angestrebt, die sich",Niedersachsen,Gesamtschule,,2017.0,"Ethik, Philo"
298,6,0.9723114562450219,"und Schüler ausüben, denn hier sind fachspezifische Kenntnisse, Fähigkeiten und Fertigkeiten wie kritisches, differenziertes Urteilsvermögen und verantwortungsvolles, prosoziales Handeln von großer Bedeutung. In diesem Sinne leistet das Fach Werte und Normen zusätzlich einen wichtigen Beitrag zur Medienbildung. Werteorientierung Der Unterricht im Fach Werte und Normen strebt das übergeordnete Ziel an, dass die Schülerinnen und Schüler gesellschaftliche und persönliche Herausforderungen unter den",Niedersachsen,Gesamtschule,,2017.0,"Ethik, Philo"
299,6,0.9722818346562939,"Urteilsvermögen und verantwortungsvolles, prosoziales Handeln von großer Bedeutung. In diesem Sinne leistet das Fach Werte und Normen zusätzlich einen wichtigen Beitrag zur Medienbildung. Werteorientierung Der Unterricht im Fach Werte und Normen strebt das übergeordnete Ziel an, dass die Schülerinnen und Schüler gesellschaftliche und persönliche Herausforderungen unter den Gesichtspunkten eines guten und gerechten Lebens, der Freiheit und Verantwortung, der Pluralität und der",Niedersachsen,Gesamtschule,,2017.0,"Ethik, Philo"
300,6,0.9681873176432529,"und der Menschenwürde interpretieren und bewerten können. Dieses Ziel kann vorwiegend im Rahmen von Diskursen erreicht werden. Daher sollen die Schülerinnen und Schüler dazu befähigt werden, exemplarisch grundlegende Werteorientierungen und Normen zu erkennen, die in verschiedenen gesellschaftlichen Diskursen, in Handlungsweisen, aber auch in wissenschaftlichen Theorien und Religionen bzw. Weltanschauungen von Bedeutung sind. Diese sollen kritisch hinsichtlich der Frage reflektiert werden, ob",Niedersachsen,Gesamtschule,,2017.0,"Ethik, Philo"
301,6,0.9681932923204882,"kritisch hinsichtlich der Frage reflektiert werden, ob sie mit Wertorientierungen des Grundgesetzes und dem NSchG in Einklang zu bringen sind. Dies gilt besonders bei Wertekonflikten und mit Blick auf soziale Normen. Bezugswissenschaften Das Unterrichtsfach Werte und Normen bezieht sich in erster Linie auf Problemstellungen - der Philosophie, - der Religionswissenschaft, - geeigneter Gesellschaftswissenschaften. Philosophischer Bezug Die Schülerinnen und Schüler setzen sich",Niedersachsen,Gesamtschule,,2017.0,"Ethik, Philo"
302,6,0.9669677989661736,"ob sie mit Wertorientierungen des Grundgesetzes und dem NSchG in Einklang zu bringen sind. Dies gilt besonders bei Wertekonflikten und mit Blick auf soziale Normen. Bezugswissenschaften Das Unterrichtsfach Werte und Normen bezieht sich in erster Linie auf Problemstellungen - der Philosophie, - der Religionswissenschaft, - geeigneter Gesellschaftswissenschaften. Philosophischer Bezug Die Schülerinnen und Schüler setzen sich mit individuellen und gesellschaftlichen Herausforderungen unter",Niedersachsen,Gesamtschule,,2017.0,"Ethik, Philo"
303,6,0.9740014976562033,auch ethische Akzentuierungen der Religionen bzw. Weltanschauungen. Geeignete Forschungsergebnisse der Naturwissenschaften sind bei der Erörterung bestimmter ethischer Fragen in angemessener Weise einzubeziehen. Religionswissenschaftlicher Bezug Der Unterricht im Fach Werte und Normen soll religionskundliche Kenntnisse und den Zugang zu weltanschaulichen und religiösen Fragen vermitteln vgl. NSchG. Die Schülerinnen und Schüler sind also mit Weltanschauungen und Religionen und deren Wirkungsgeschichten wie Orientierungsmöglichkeiten bekannt,Niedersachsen,Gesamtschule,,2017.0,"Ethik, Philo"
304,6,0.9723282326341465,"Erfahrungsraum von Schülerinnen und Schülern, weltanschauliche sowie auch religiöse Daseinsentwürfe sind in den Unterricht einzubeziehen. Die christlich-abendländischen Traditionen spielen hierbei insofern eine größere Rolle, als sie seit Jahrhunderten die Wertvorstellungen, Normen und ethischen Grundsätze der hier lebenden Menschen mitgeprägt haben und nach wie vor mitprägen. Diese Aufgaben verlangen den Rückgriff auf Begriffe und Forschungsergebnisse der Religionswissenschaft. Gesellschaftswissenschaftlicher Bezug Der Unterricht im",Niedersachsen,Gesamtschule,,2017.0,"Ethik, Philo"
305,6,0.9704131575082714,der hier lebenden Menschen mitgeprägt haben und nach wie vor mitprägen. Diese Aufgaben verlangen den Rückgriff auf Begriffe und Forschungsergebnisse der Religionswissenschaft. Gesellschaftswissenschaftlicher Bezug Der Unterricht im Fach Werte und Normen soll zum Verständnis der in der Gesellschaft wirksamen Wertvorstellungen und Normen beitragen. Dies verlangt neben der philosophischen Reflexion auch empirische und historische Betrachtungen. So hat der Unterricht die Lernenden mit,Niedersachsen,Gesamtschule,,2017.0,"Ethik, Philo"
306,6,0.9723254137534978,"Diese Aufgaben verlangen den Rückgriff auf Begriffe und Forschungsergebnisse der Religionswissenschaft. Gesellschaftswissenschaftlicher Bezug Der Unterricht im Fach Werte und Normen soll zum Verständnis der in der Gesellschaft wirksamen Wertvorstellungen und Normen beitragen. Dies verlangt neben der philosophischen Reflexion auch empirische und historische Betrachtungen. So hat der Unterricht die Lernenden mit dem Bestand der demokratischen Grundwerte bekannt zu machen, gesellschaftlich anerkannte moralische",Niedersachsen,Gesamtschule,,2017.0,"Ethik, Philo"
307,6,0.9739753535856062,"verlangt neben der philosophischen Reflexion auch empirische und historische Betrachtungen. So hat der Unterricht die Lernenden mit dem Bestand der demokratischen Grundwerte bekannt zu machen, gesellschaftlich anerkannte moralische und rechtliche Normen aufzuzeigen und Aspekte des Werte- und Normenwandels zu untersuchen. Zu diesem Zweck sind insbesondere Fragestellungen und Ergebnisse geeigneter Sozialwissenschaften wie Politikwissenschaft, Soziologie und Psychologie hilfreich. Bei bestimmten Fragestellungen sind weitere",Niedersachsen,Gesamtschule,,2017.0,"Ethik, Philo"
308,2,0.6008489801058592,"Ergebnisse geeigneter Sozialwissenschaften wie Politikwissenschaft, Soziologie und Psychologie hilfreich. Bei bestimmten Fragestellungen sind weitere Einzelwissenschaften zu berücksichtigen, wie zum Beispiel die Rechtswissen Kompetenzorientierter Unterricht Im Kerncurriculum des Faches Werte und Normen werden die Zielsetzungen des Bildungsbeitrags durch verbindlich erwartete Lernergebnisse konkretisiert und als Kompetenzen formuliert. Dabei werden im Sinne eines Kerns die als grundlegend und unverzichtbar erachteten fachbezogenen Kenntnisse und Fertigkeiten",Niedersachsen,Gesamtschule,,2017.0,"Ethik, Philo"
309,7,0.972289406472903,"die weitere schulische und berufliche Ausbildung von Bedeutung und ermöglichen anschlussfähiges Lernen. Die erwarteten Kompetenzen werden in Kompetenzbereichen zusammengefasst, die das Fach strukturieren. Aufgabe des Unterrichts im Fach Werte und Normen ist es, die Kompetenzentwicklung der Schülerinnen und Schüler anzuregen, zu unterstützen, zu fördern und langfristig zu sichern. Dies gilt auch für die fachübergreifenden Zielsetzungen der Persönlichkeitsbildung. Kompetenzbereiche Das vorliegende Kerncurriculum",Niedersachsen,Gesamtschule,,2017.0,"Ethik, Philo"
310,1,0.5806527394809404,"Menschen. Eine intensive Beschäftigung mit diesen Aspekten leistet somit einen wichtigen Beitrag, damit die Schülerinnen und Schüler der Zukunft realistisch, verantwortungsbewusst und selbstbejahend entgegentreten. Fragen nach Moral und Ethik Moralische Normen bieten für die Schülerinnen und Schüler Orientierung und Verlässlichkeit im Alltag. Eben dort erfahren die Schülerinnen und Schüler aber auch, dass im menschlichen Miteinander Interessen kollidieren und dass daraus Konflikte",Niedersachsen,Gesamtschule,,2017.0,"Ethik, Philo"
