document_id,most_prevalent_topic_id,most_prevalent_topic_probability,text_excerpt,state,school type,grade,year,subject
0,1,0.44619674257192604,"den Einfluss von Medien auf Urteile und Handlungen, erklären die Bedeutung von Vielfalt für das Leben in einer pluralen Welt, erläutern Grundprobleme des Wahrnehmens und Erkennens, erfassen grundlegende Werte und Normen von Nachhaltigkeit. Methodenkompetenz Die Schülerinnen und Schüler recherchieren in analogen und digitalen Materialien Informationen und philosophische Begriffe, entwickeln mit Gedankenexperimenten philosophische Fragen und Vorstellungen, erproben unterschiedliche Perspektiven im Rollenspiel, formulieren",NRW,,Sek1,2024.0,"Ethik, Philo"
1,5,0.9670067522786855,"Niedersächsisches Kultusministerium Kerncurriculum für die Oberschule Schuljahrgänge - Werte und Normen Niedersachsen An der Weiterentwicklung des Kerncurriculums für das Unterrichtsfach Werte und Normen in der Oberschule waren die nachstehend genannten Personen beteiligt: Evgeny Kochnev, Clausthal-Zellerfeld Kathrin Paul, Oldenburg Markus Rassiler, Hannover",Niedersachsen,Oberschule.pdf,,,"Ethik, Philo"
2,5,0.9714006971770093,"Niedersächsisches Kultusministerium Kerncurriculum für die Oberschule Schuljahrgänge - Werte und Normen Niedersachsen An der Weiterentwicklung des Kerncurriculums für das Unterrichtsfach Werte und Normen in der Oberschule waren die nachstehend genannten Personen beteiligt: Evgeny Kochnev, Clausthal-Zellerfeld Kathrin Paul, Oldenburg Markus Rassiler, Hannover Thorsten Schimschal, Friesoythe Till Warmbold, Seelze Jörg Weiland, Hildesheim Die Ergebnisse des",Niedersachsen,Oberschule.pdf,,,"Ethik, Philo"
3,2,0.9809389025666885,"worden. Herausgegeben vom Niedersächsischen Kultusministerium Hannover, Schiffgraben Druck: Unidruck Weidendamm Hannover Das Kerncurriculum kann als PDF-Datei vom Niedersächsischen Bildungsserver NiBiS http://www.cuvo.nibis.de heruntergeladen werden. Inhalt Seite Bildungsbeitrag des Faches Werte und Normen Kompetenzorientierter Unterricht Kompetenzbereiche Kompetenzentwicklung Innere Differenzierung Erwartete Kompetenzen Prozessbezogene Kompetenzbereiche Inhaltsbezogene Kompetenzbereiche Kompetenzen nach Doppelschuljahrgängen Schuljahrgänge und Schuljahrgänge und Schuljahrgänge und Leistungsfeststellung und Leistungsbewertung Aufgaben der Fachkonferenz Anhang A Operatoren",Niedersachsen,Oberschule.pdf,,,"Ethik, Philo"
4,4,0.973165110800446,"Kompetenzbereiche Kompetenzen nach Doppelschuljahrgängen Schuljahrgänge und Schuljahrgänge und Schuljahrgänge und Leistungsfeststellung und Leistungsbewertung Aufgaben der Fachkonferenz Anhang A Operatoren A Übersicht über die verbindlichen Grundbegriffe Bildungsbeitrag des Faches Werte und Normen Das Unterrichtsfach Werte und Normen leistet einen wichtigen Beitrag, um den Ansprüchen gerecht zu werden, die der des Niedersächsischen Schulgesetzes formuliert. Dem dort verankerten Ziel, ... die Persönlichkeit der Schülerinnen",Niedersachsen,Oberschule.pdf,,,"Ethik, Philo"
5,4,0.9703951954966199,"und Schuljahrgänge und Schuljahrgänge und Leistungsfeststellung und Leistungsbewertung Aufgaben der Fachkonferenz Anhang A Operatoren A Übersicht über die verbindlichen Grundbegriffe Bildungsbeitrag des Faches Werte und Normen Das Unterrichtsfach Werte und Normen leistet einen wichtigen Beitrag, um den Ansprüchen gerecht zu werden, die der des Niedersächsischen Schulgesetzes formuliert. Dem dort verankerten Ziel, ... die Persönlichkeit der Schülerinnen und Schüler auf der Grundlage",Niedersachsen,Oberschule.pdf,,,"Ethik, Philo"
6,5,0.6100255828292905,"... die Persönlichkeit der Schülerinnen und Schüler auf der Grundlage des Christentums, des europäischen Humanismus und der Ideen der liberalen, demokratischen und sozialen Freiheitsbewegungen weiterzuentwickeln, trägt das Fach Werte und Normen in besonderem Maße Rechnung. Obwohl gesellschaftlich von einem gewissen Konsens über gültige Werte und Normen ausgegangen werden kann, wird die Lebenspraxis von häufigen und vielstimmigen Diskussionen über Wertvorstellungen und darauf",Niedersachsen,Oberschule.pdf,,,"Ethik, Philo"
7,5,0.8135216085076445,"und der Ideen der liberalen, demokratischen und sozialen Freiheitsbewegungen weiterzuentwickeln, trägt das Fach Werte und Normen in besonderem Maße Rechnung. Obwohl gesellschaftlich von einem gewissen Konsens über gültige Werte und Normen ausgegangen werden kann, wird die Lebenspraxis von häufigen und vielstimmigen Diskussionen über Wertvorstellungen und darauf aufbauende gesellschaftliche Normen geprägt. Dies liegt nicht zuletzt daran, dass sich jene Wertvorstellungen und Normen",Niedersachsen,Oberschule.pdf,,,"Ethik, Philo"
8,5,0.9747788698584979,"Maße Rechnung. Obwohl gesellschaftlich von einem gewissen Konsens über gültige Werte und Normen ausgegangen werden kann, wird die Lebenspraxis von häufigen und vielstimmigen Diskussionen über Wertvorstellungen und darauf aufbauende gesellschaftliche Normen geprägt. Dies liegt nicht zuletzt daran, dass sich jene Wertvorstellungen und Normen aufgrund politischer, historischer, ökonomischer, gesellschaftlicher und religiöser Veränderungen wandeln oder zumindest modifizieren. Mehr oder minder bewusst werden Kinder",Niedersachsen,Oberschule.pdf,,,"Ethik, Philo"
9,5,0.9732039739145251,"Normen ausgegangen werden kann, wird die Lebenspraxis von häufigen und vielstimmigen Diskussionen über Wertvorstellungen und darauf aufbauende gesellschaftliche Normen geprägt. Dies liegt nicht zuletzt daran, dass sich jene Wertvorstellungen und Normen aufgrund politischer, historischer, ökonomischer, gesellschaftlicher und religiöser Veränderungen wandeln oder zumindest modifizieren. Mehr oder minder bewusst werden Kinder und Jugendliche zu Zeugen dieser Wandlungen und oftmals resultiert daraus eine tief",Niedersachsen,Oberschule.pdf,,,"Ethik, Philo"
10,2,0.9747661589594596,"Gruppierungen Differenzen bestehen können. Daraus entwickeln sich gegebenenfalls Krisen und Konflikte. Den Orientierungsproblemen, die sich daraus ergeben und mit denen Kinder und Jugendliche häufig aufwachsen, will das Fach Werte und Normen inhaltlich facettenreich und pädagogisch sensibel begegnen. Auf der Grundlage der im Grundgesetz, der Niedersächsischen Verfassung sowie dem Niedersächsischen Schulgesetz explizit zum Ausdruck gebrachten Wertvorstellungen werden unterschiedliche Weltanschauungen und Wahrheitsauffassungen im",Niedersachsen,Oberschule.pdf,,,"Ethik, Philo"
11,4,0.9723158744463415,"Recht, seine Persönlichkeit frei und eigenverantwortlich zu entfalten und sich als selbstbestimmtes Individuum an der Gestaltung des menschlichen Zusammenlebens zu beteiligen. Diesen Zielsetzungen verpflichtet, bezieht sich das Unterrichtsfach Werte und Normen auf altersgerecht adäquate Problemstellungen und Fragen nicht nur der Religions- und Gesellschaftswissenschaften, sondern auch der Philosophie und hier insbesondere auf Fragen der Moralphilosophie bzw. Ethik. Immanuel Kants elementare Frage Was",Niedersachsen,Oberschule.pdf,,,"Ethik, Philo"
12,4,0.9739849640092793,"Gesellschaftswissenschaften, sondern auch der Philosophie und hier insbesondere auf Fragen der Moralphilosophie bzw. Ethik. Immanuel Kants elementare Frage Was soll ich tun stellt gewissermaßen ein Leitmotiv des Unterrichtsfaches Werte und Normen dar. In der Didaktik ist unstrittig, dass diesbezüglicher Unterricht auf aktives, eigenständiges und problemorientiertes Philosophieren und nicht bloß auf rein rezeptives Lernen von philosophiehistorischen Fakten und Systemen abzuzielen habe. Unter",Niedersachsen,Oberschule.pdf,,,"Ethik, Philo"
13,6,0.7589995506228977,"auf aktives, eigenständiges und problemorientiertes Philosophieren und nicht bloß auf rein rezeptives Lernen von philosophiehistorischen Fakten und Systemen abzuzielen habe. Unter diesen Voraussetzungen kann der Unterricht im Fach Werte und Normen den Schülerinnen und Schülern ein Rüstzeug bereitstellen, um Einsichten in die tragenden Wertvorstellungen und Normen einer menschenwürdigen Gesellschaft sowie in die entsprechenden ethischen Grundsätze zu gewinnen und um wesentliche kulturelle,",Niedersachsen,Oberschule.pdf,,,"Ethik, Philo"
14,6,0.9714016319976517,"Fakten und Systemen abzuzielen habe. Unter diesen Voraussetzungen kann der Unterricht im Fach Werte und Normen den Schülerinnen und Schülern ein Rüstzeug bereitstellen, um Einsichten in die tragenden Wertvorstellungen und Normen einer menschenwürdigen Gesellschaft sowie in die entsprechenden ethischen Grundsätze zu gewinnen und um wesentliche kulturelle, geistige und religiöse Bedingungen und Grundlagen der demokratischen Gesellschaftsordnungen kennenzulernen. Mit Blick auf religiöse bzw.",Niedersachsen,Oberschule.pdf,,,"Ethik, Philo"
15,6,0.9754901777160152,"gewinnen und um wesentliche kulturelle, geistige und religiöse Bedingungen und Grundlagen der demokratischen Gesellschaftsordnungen kennenzulernen. Mit Blick auf religiöse bzw. religionswissenschaftliche Unterrichtsinhalte ist zu betonen, dass das Fach Werte und Normen die Pluralität unterschiedlicher Wahrheitsansprüche in Religionen und Weltanschauungen thematisiert. Zur Wahrung der Freiheit des Glaubens, des Gewissens und des religiösen und weltanschaulichen Bekenntnisses verlangt der Unterricht im Fach Werte und",Niedersachsen,Oberschule.pdf,,,"Ethik, Philo"
16,6,0.974008212411149,"die Pluralität unterschiedlicher Wahrheitsansprüche in Religionen und Weltanschauungen thematisiert. Zur Wahrung der Freiheit des Glaubens, des Gewissens und des religiösen und weltanschaulichen Bekenntnisses verlangt der Unterricht im Fach Werte und Normen die weltanschauliche und religiöse Neutralität des Faches. Der gesetzliche Auftrag weist dem Fach zwar vergleichbare Fragestellungen, Probleme und Sachverhalte zu, wie sie auch im Fach Religion behandelt werden, doch ist",Niedersachsen,Oberschule.pdf,,,"Ethik, Philo"
17,2,0.9670022220353623,"und weltanschaulicher Art lernen die Schülerinnen und Schüler im Unterricht zwar kennen, doch eine spezifische Präferenz für eine dieser Positionen ist ausdrücklich nicht intendiert. Der Unterricht im Fach Werte und Normen leitet zur Reflexion über die verschiedenen Orientierungen in der Absicht an, diese bezüglich ihrer Plausibilität, ihrer sozialen Zumutbarkeit sowie ihres Sinnpotenzials zu unterscheiden. Er vermittelt den Schülerinnen und Schülern die",Niedersachsen,Oberschule.pdf,,,"Ethik, Philo"
18,6,0.9693403913009125,"Einsicht, dass es konkurrierende Wahrheits- und Weltauffassungen gibt. Diese erfordern einerseits eine Standortbestimmung und andererseits eine Haltung, die von Empathie und Toleranz geprägt ist. Der Unterricht im Fach Werte und Normen fördert dadurch die Bereitschaft zu reflektiertem und verantwortungsbewusstem Handeln sich selbst und anderen gegenüber. In diesem Sinne also trägt das Unterrichtsfach Werte und Normen zu einer differenzierten Auseinandersetzung sowohl mit",Niedersachsen,Oberschule.pdf,,,"Ethik, Philo"
19,6,0.6099531802222435,Der Unterricht im Fach Werte und Normen fördert dadurch die Bereitschaft zu reflektiertem und verantwortungsbewusstem Handeln sich selbst und anderen gegenüber. In diesem Sinne also trägt das Unterrichtsfach Werte und Normen zu einer differenzierten Auseinandersetzung sowohl mit individuell-existenziellen als auch mit gesellschaftlich-globalen Problemfeldern bei und fördert dadurch die Persönlichkeitsentwicklung der Schülerinnen und Schüler. Diese sollen ein die eigene Persönlichkeit bejahendes und,Niedersachsen,Oberschule.pdf,,,"Ethik, Philo"
20,3,0.5132417472810418,"leistet einen Beitrag, um wechselseitige Abhängigkeiten und Wertmaßstäbe für eigenes Handeln zu erkennen sowie ein Verständnis für gesellschaftliche Entscheidungen zu sensibilisieren. Aus den oben genannten Aufgaben des Unterrichtsfaches Werte und Normen lassen sich neben inhaltlichen Zielsetzungen auch drei didaktische Prioritäten ableiten: - Auseinandersetzung mit Wirklichkeit und Wahrheitsansprüchen - Entwicklung ethischer Urteilsfähigkeit - Werteorientierung Auseinandersetzung mit Wirklichkeit und Wahrheitsansprüchen Es ist notwendig,",Niedersachsen,Oberschule.pdf,,,"Ethik, Philo"
21,5,0.9713991610167982,"fremde Lebensvorstellungen und Auseinandersetzungen mit religiös und weltanschaulich begründeten Sinnentwürfen. Das nachvollziehende Kennenlernen anderer Lebensordnungen, Sinnentwürfe und Kulturen trägt dabei zur Erweiterung der eigenen Wahrnehmungsfähigkeit bei Das Fach Werte und Normen will durch die Kontrastierung des Gewohnten mit bisher unbekannten oder weniger vertrauten Perspektiven die Nachdenklichkeit der Schülerinnen und Schüler fördern. Dieses Prinzip der Nachdenklichkeit ermöglicht eigenorganisiertes Wissen, mit dem Schülerinnen",Niedersachsen,Oberschule.pdf,,,"Ethik, Philo"
22,1,0.9722379431436571,"der Nachdenklichkeit ermöglicht eigenorganisiertes Wissen, mit dem Schülerinnen und Schüler in unterschiedlichen Kontexten anwendungsbezogen und angemessen handeln können. Entwicklung ethischer Urteilsfähigkeit Es ist Aufgabe des Unterrichts im Fach Werte und Normen, die Schülerinnen und Schüler für die moralischen und sittlichen Dimensionen menschlichen Handelns zu sensibilisieren sowie Unterscheidungs- und Kritikfähigkeit in der Auseinandersetzung mit Handlungs- und Wertfragen im privaten und öffentlichen Leben",Niedersachsen,Oberschule.pdf,,,"Ethik, Philo"
23,6,0.9723059131899037,"denen häufig komplexe Entscheidungen anstehen. Dabei sind fundamentale Lebensbedingungen und elementare Lebensbedürfnisse zu berücksichtigen und mögliche Folgen gewählter Handlungsweisen zu antizipieren. Eben hier hat der Unterricht im Fach Werte und Normen seinen genuinen Platz, denn die Lernenden erwerben durch dieses Fach Kenntnisse und Fähigkeiten zur Anwendung der Kriterien ethischer Argumentationsweisen. Bei den Schülerinnen und Schülern wird eine Haltung angestrebt, die sich",Niedersachsen,Oberschule.pdf,,,"Ethik, Philo"
24,6,0.9723114562450219,"und Schüler ausüben, denn hier sind fachspezifische Kenntnisse, Fähigkeiten und Fertigkeiten wie kritisches, differenziertes Urteilsvermögen und verantwortungsvolles, prosoziales Handeln von großer Bedeutung. In diesem Sinne leistet das Fach Werte und Normen zusätzlich einen wichtigen Beitrag zur Medienbildung. Werteorientierung Der Unterricht im Fach Werte und Normen strebt das übergeordnete Ziel an, dass die Schülerinnen und Schüler gesellschaftliche und persönliche Herausforderungen unter den",Niedersachsen,Oberschule.pdf,,,"Ethik, Philo"
25,6,0.9722818346562939,"Urteilsvermögen und verantwortungsvolles, prosoziales Handeln von großer Bedeutung. In diesem Sinne leistet das Fach Werte und Normen zusätzlich einen wichtigen Beitrag zur Medienbildung. Werteorientierung Der Unterricht im Fach Werte und Normen strebt das übergeordnete Ziel an, dass die Schülerinnen und Schüler gesellschaftliche und persönliche Herausforderungen unter den Gesichtspunkten eines guten und gerechten Lebens, der Freiheit und Verantwortung, der Pluralität und der",Niedersachsen,Oberschule.pdf,,,"Ethik, Philo"
26,6,0.9681873176432529,"und der Menschenwürde interpretieren und bewerten können. Dieses Ziel kann vorwiegend im Rahmen von Diskursen erreicht werden. Daher sollen die Schülerinnen und Schüler dazu befähigt werden, exemplarisch grundlegende Werteorientierungen und Normen zu erkennen, die in verschiedenen gesellschaftlichen Diskursen, in Handlungsweisen, aber auch in wissenschaftlichen Theorien und Religionen bzw. Weltanschauungen von Bedeutung sind. Diese sollen kritisch hinsichtlich der Frage reflektiert werden, ob",Niedersachsen,Oberschule.pdf,,,"Ethik, Philo"
27,6,0.9656600767012757,"von Bedeutung sind. Diese sollen kritisch hinsichtlich der Frage reflektiert werden, ob sie mit Wertorientierungen des Grundgesetzes und dem NSchG in Einklang zu bringen sind. Bezugswissenschaften Das Unterrichtsfach Werte und Normen bezieht sich in erster Linie auf Problemstellungen - der Philosophie, - der Religionswissenschaft, - geeigneter Gesellschaftswissenschaften. Bei bestimmten Fragestellungen sind weitere Einzelwissenschaften zu berücksichtigen, wie zum Beispiel die RechtswissenPhilosophischer Bezug",Niedersachsen,Oberschule.pdf,,,"Ethik, Philo"
28,6,0.9740014976562033,auch ethische Akzentuierungen der Religionen bzw. Weltanschauungen. Geeignete Forschungsergebnisse der Naturwissenschaften sind bei der Erörterung bestimmter ethischer Fragen in angemessener Weise einzubeziehen. Religionswissenschaftlicher Bezug Der Unterricht im Fach Werte und Normen soll religionskundliche Kenntnisse und den Zugang zu weltanschaulichen und religiösen Fragen vermitteln vgl. NSchG. Die Schülerinnen und Schüler sind also mit Weltanschauungen und Religionen und deren Wirkungsgeschichten wie Orientierungsmöglichkeiten bekannt,Niedersachsen,Oberschule.pdf,,,"Ethik, Philo"
29,6,0.9704196296437426,"Erfahrungsraum von Schülerinnen und Schülern, weltanschauliche sowie auch religiöse Daseinsentwürfe sind in den Unterricht einzubeziehen. Die christlich-abendländischen Traditionen spielen hierbei insofern eine größere Rolle, als sie seit Jahrhunderten die Wertvorstellungen, Normen und ethischen Grundsätze der hier lebenden Menschen mitgeprägt haben und nach wie vor mitprägen. Diese Aufgaben verlangen den Rückgriff auf Begriffe und Forschungsergebnisse der Religionswissenschaft. Auch deshalb stimmt sich die",Niedersachsen,Oberschule.pdf,,,"Ethik, Philo"
30,6,0.9703948225961371,"lebenden Menschen mitgeprägt haben und nach wie vor mitprägen. Diese Aufgaben verlangen den Rückgriff auf Begriffe und Forschungsergebnisse der Religionswissenschaft. Auch deshalb stimmt sich die Fachkonferenz des Faches Werte und Normen mit den Fachkonferenzen der Konfessionen und Religionen bezüglich formaler Vorgaben und der Kooperation, z. B. bei gemeinsamen Exkursionen, ab. Gesellschaftswissenschaftlicher Bezug Der Unterricht im Fach Werte und Normen soll zum",Niedersachsen,Oberschule.pdf,,,"Ethik, Philo"
31,6,0.9704078264366321,"Werte und Normen mit den Fachkonferenzen der Konfessionen und Religionen bezüglich formaler Vorgaben und der Kooperation, z. B. bei gemeinsamen Exkursionen, ab. Gesellschaftswissenschaftlicher Bezug Der Unterricht im Fach Werte und Normen soll zum Verständnis der in der Gesellschaft wirksamen Wertvorstellungen und Normen beitragen. Dies verlangt neben der philosophischen Reflexion auch empirische und historische Betrachtungen. So hat der Unterricht die Lernenden mit",Niedersachsen,Oberschule.pdf,,,"Ethik, Philo"
32,6,0.9714008930083863,"formaler Vorgaben und der Kooperation, z. B. bei gemeinsamen Exkursionen, ab. Gesellschaftswissenschaftlicher Bezug Der Unterricht im Fach Werte und Normen soll zum Verständnis der in der Gesellschaft wirksamen Wertvorstellungen und Normen beitragen. Dies verlangt neben der philosophischen Reflexion auch empirische und historische Betrachtungen. So hat der Unterricht die Lernenden mit dem Bestand der demokratischen Grundwerte bekannt zu machen, gesellschaftlich anerkannte moralische",Niedersachsen,Oberschule.pdf,,,"Ethik, Philo"
33,6,0.9747438275277862,"verlangt neben der philosophischen Reflexion auch empirische und historische Betrachtungen. So hat der Unterricht die Lernenden mit dem Bestand der demokratischen Grundwerte bekannt zu machen, gesellschaftlich anerkannte moralische und rechtliche Normen aufzuzeigen und Aspekte des Werte- und Normenwandels zu untersuchen. Zu diesem Zweck sind insbesondere Fragestellungen und Ergebnisse geeigneter Sozialwissenschaften wie Politikwissenschaft, Soziologie und Psychologie hilfreich. Der Unterricht im Fach Werte",Niedersachsen,Oberschule.pdf,,,"Ethik, Philo"
34,6,0.5335273946375763,"und Aspekte des Werte- und Normenwandels zu untersuchen. Zu diesem Zweck sind insbesondere Fragestellungen und Ergebnisse geeigneter Sozialwissenschaften wie Politikwissenschaft, Soziologie und Psychologie hilfreich. Der Unterricht im Fach Werte und Normen leistet auch auf dieser Grundlage einen Beitrag zu den fachübergreifenden Bildungsbereichen Bildung für nachhaltige Entwicklung, Gesundheitliche Bildung, Interkulturelle Bildung, Medienbildung, MINT-Bildung, Mobilität, Musisch-ästhetische Bildung, Sprachbildung sowie Verbraucherbildung. Dies schließt auch",Niedersachsen,Oberschule.pdf,,,"Ethik, Philo"
35,7,0.9739844342246285,"Bildung, Interkulturelle Bildung, Medienbildung, MINT-Bildung, Mobilität, Musisch-ästhetische Bildung, Sprachbildung sowie Verbraucherbildung. Dies schließt auch die Berücksichtigung der Vielfalt sexueller Identitäten ein. Eine zentrale Aufgabe des Unterrichts im Fach Werte und Normen ist es, dazu beizutragen, dass die Schülerinnen und Schüler die für den erfolgreichen Schulbesuch und die gesellschaftliche Teilhabe notwendigen sprachlichen Kompetenzen erwerben. Die kompetente Verwendung von Sprache ist deshalb auch",Niedersachsen,Oberschule.pdf,,,"Ethik, Philo"
36,7,0.9693096269083802,"dass die Schülerinnen und Schüler die für den erfolgreichen Schulbesuch und die gesellschaftliche Teilhabe notwendigen sprachlichen Kompetenzen erwerben. Die kompetente Verwendung von Sprache ist deshalb auch im Fach Werte und Normen Teil des Unterrichts. Im Unterricht geht es darum, die Lernenden schrittweise und kontinuierlich von der Verwendung der Alltagssprache zur kompetenten Verwendung der Bildungssprache einschließlich der Fachbegriffe aus dem Bereich Werte",Niedersachsen,Oberschule.pdf,,,"Ethik, Philo"
37,4,0.9641594263980086,"des Unterrichts. Im Unterricht geht es darum, die Lernenden schrittweise und kontinuierlich von der Verwendung der Alltagssprache zur kompetenten Verwendung der Bildungssprache einschließlich der Fachbegriffe aus dem Bereich Werte und Normen zu führen. Die Schülerinnen und Schüler erhalten Gelegenheit, die Bildungssprache und die Fachsprache aufzunehmen, selbst zu erproben und Sprachbewusstsein zu entwickeln. Dabei werden die verwendeten sprachlichen Mittel und die sprachlichen",Niedersachsen,Oberschule.pdf,,,"Ethik, Philo"
38,2,0.9704115318925824,"und Durchführung konkreter Unterrichtseinheiten und Unterrichtsstunden ist Sorge dafür zu tragen, dass die sprachlichen Kenntnisse nach Bedarf vermittelt und nicht vorausgesetzt werden. Kompetenzorientierter Unterricht Im Kerncurriculum des Faches Werte und Normen werden die Zielsetzungen des Bildungsbeitrags durch verbindlich erwartete Lernergebnisse konkretisiert und als Kompetenzen formuliert. Dabei werden im Sinne eines Kerns die als grundlegend und unverzichtbar erachteten fachbezogenen Kenntnisse und Fertigkeiten",Niedersachsen,Oberschule.pdf,,,"Ethik, Philo"
39,7,0.972289406472903,"die weitere schulische und berufliche Ausbildung von Bedeutung und ermöglichen anschlussfähiges Lernen. Die erwarteten Kompetenzen werden in Kompetenzbereichen zusammengefasst, die das Fach strukturieren. Aufgabe des Unterrichts im Fach Werte und Normen ist es, die Kompetenzentwicklung der Schülerinnen und Schüler anzuregen, zu unterstützen, zu fördern und langfristig zu sichern. Dies gilt auch für die fachübergreifenden Zielsetzungen der Persönlichkeitsbildung. Kompetenzbereiche Das vorliegende Kerncurriculum",Niedersachsen,Oberschule.pdf,,,"Ethik, Philo"
40,1,0.5806527394809404,"Menschen. Eine intensive Beschäftigung mit diesen Aspekten leistet somit einen wichtigen Beitrag, damit die Schülerinnen und Schüler der Zukunft realistisch, verantwortungsbewusst und selbstbejahend entgegentreten. Fragen nach Moral und Ethik Moralische Normen bieten für die Schülerinnen und Schüler Orientierung und Verlässlichkeit im Alltag. Eben dort erfahren die Schülerinnen und Schüler aber auch, dass im menschlichen Miteinander Interessen kollidieren und dass daraus Konflikte",Niedersachsen,Oberschule.pdf,,,"Ethik, Philo"
41,5,0.9693128704287456,"bewertenden und begründenden Ansätzen und artikulieren begründet eigene und auch fremde Interessen. Auf dieser Basis ist es den Schülerinnen und Schülern möglich, eine eigene Haltung zu den tragenden Werten und Normen einer menschenwürdigen und demokratischen Gesellschaft sowie eines gerechten und verantwortungsvollen Miteinanders zu entwickeln. Dem Kompetenzbereich Fragen nach Moral und Ethik kommt also im Rahmen des zentralen didaktischen Bereichs Entwicklung der",Niedersachsen,Oberschule.pdf,,,"Ethik, Philo"
42,4,0.967004496583955,"eine Auseinandersetzung mit einander widersprechenden Wahrheitsansprüchen sind Empathiefähigkeit sowie eine grundsätzliche Toleranzbereitschaft maßgeblich. Toleranz darf dabei nicht mit Beliebigkeit und Gleichgültigkeit verwechselt werden. So bilden etwa Menschenwürde und Menschenrechte als Normen mit universalem Geltungsanspruch die unverhandelbare Basis der Demokratie und des sozialen Rechtsstaats. Der Kompetenzbereich Fragen nach der Wirklichkeit fordert die Schülerinnen und Schüler also dazu auf, sich eigene und ihnen",Niedersachsen,Oberschule.pdf,,,"Ethik, Philo"
43,3,0.9747577160679731,"Kompetenzbereich: Fragen nach Moral und Ethik Leitthema: Regeln für das Zusammenleben Erwartete Kompetenzen am Ende von Schuljahrgang Mögliche Inhalte für den Kompetenzerwerb Die Schülerinnen und Schüler ... benennen verschiedene Regeln, Normen und Rituale sowie deren Bedeutung für das Zusammenleben. Regeln und Normen in Klasse, Familie, Freundeskreis, Verein Sicherheit, Verlässlichkeit, Einschränkung Welt ohne Regeln und Normen arbeiten die Werte, die bestimmten Regeln",Niedersachsen,Oberschule.pdf,,,"Ethik, Philo"
