document_id,most_prevalent_topic_id,most_prevalent_topic_probability,text_excerpt,state,school type,grade,year,subject
168,8,0.949996100532316,Diskussion gemeinschaftlich bindender Werte und Normen ermöglicht Begründungskriterien für die Toleranzforderung zu benennen und kritisch zu überprüfen Vorurteile - eine begriffliche Klärung Chancen und Gefahren von Vorurteilen Ein Leben ohne Vorurteile - ist dies möglich Die Konfrontation mit dem Anderen Wie erscheine ich dem Anderen Wie soll ich dem Anderen begegnen Der Begriff der Toleranz Toleranz vs. Willkür Probleme und Grenzen,Schleswig-Holstein,,,2016.0,"Ethik, Philo"
169,5,0.9571397231111775,"Wahrnehmung zu beschreiben und zu erläutern verschiedene Arten perspektivisch gebundener Wahrnehmung zu unterscheiden und zu analysieren den Einfluss von Vorerfahrungen und Vorurteilen zu beschreiben und argumentativ zu begründen die eigenen Vorurteile zu analysieren und zu beurteilen Kriterien einer möglichst objektiven und vorurteilsfreien Wahrnehmung zu benennen, zu erläutern und argumentativ zu stützen die Grenzen objektiver Wahrnehmung zu analysieren und zu beurteilen die",Schleswig-Holstein,,,2016.0,"Ethik, Philo"
170,5,0.9526252813813161,"der Lebenswelt als grundlegend für ihr Selbst- und Weltverständnis zu beschreiben und zu erläutern Die Schülerinnen und Schüler erwerben oder erweitern die Fähigkeit, die Abhängigkeit der Wahrnehmung von Vorerfahrungen und Vorurteilen zu beschreiben und zu erläutern die eigene Wahrnehmung als Deutung zu beschreiben die eigenen Wahrnehmungen in unterschiedlichen Deutungen wiederzugeben und zu erläutern einzelne Wahrnehmungen als Vorkommnisse allgemeiner Deutungsschemata zu analysieren",Schleswig-Holstein,,,2016.0,"Ethik, Philo"
171,5,0.9357109157330008,"als Beschränkung und Bereicherung meiner Handlungsmöglichkeiten Themenbezogene Kompetenzen Exemplarische Lerninhalte Die Schülerinnen und Schüler erwerben oder erweitern die Fähigkeit, eigene Vorurteile als solche zu erkennen das Für und Wider von Vorurteilen zu beschreiben und den Umgang mit Vorurteilen begründet zu beurteilen die Konfrontation mit dem Anderen als prinzipielle Irritation wahrzunehmen und diese zu benennen zu beurteilen, inwieweit das Andere als eine",Schleswig-Holstein,,,2016.0,"Ethik, Philo"
172,5,0.9399957978883164,"Kompetenzen Exemplarische Lerninhalte Die Schülerinnen und Schüler erwerben oder erweitern die Fähigkeit, eigene Vorurteile als solche zu erkennen das Für und Wider von Vorurteilen zu beschreiben und den Umgang mit Vorurteilen begründet zu beurteilen die Konfrontation mit dem Anderen als prinzipielle Irritation wahrzunehmen und diese zu benennen zu beurteilen, inwieweit das Andere als eine Einschränkung oder Bereicherung des eigenen Denkens und",Schleswig-Holstein,,,2016.0,"Ethik, Philo"
173,8,0.9470554423367413,"zu formulieren, welche eine Diskussion gemeinschaftlich bindender Werte und Normen ermöglicht Begründungskriterien für die Toleranzforderung zu benennen und kritisch zu überprüfen Vorurteile - eine begriffliche Klärung Chancen und Gefahren von Vorurteilen Ein Leben ohne Vorurteile - ist dies möglich Die Konfrontation mit dem Anderen Wie erscheine ich dem Anderen Wie soll ich dem Anderen begegnen Der Begriff der Toleranz Toleranz vs.",Schleswig-Holstein,,,2016.0,"Ethik, Philo"
174,5,0.9571402896297224,"eigenen Wahrnehmung zu beschreiben die Unterschiede verschiedener Standpunkte der Wahrnehmung zu beschreiben und zu erläutern verschiedene Arten perspektivisch gebundener Wahrnehmung zu unterscheiden und zu analysieren den Einfluss von Vorerfahrungen und Vorurteilen zu beschreiben und argumentativ zu begründen die eigenen Vorurteile zu analysieren und zu beurteilen Kriterien einer möglichst objektiven und vorurteilsfreien Wahrnehmung zu benennen, zu erläutern und argumentativ zu stützen die",Schleswig-Holstein,,,2016.0,"Ethik, Philo"
175,4,0.9399766061540653,"jemand aus freiem Willen gehandelt hat dar. Kompetenzbereich Analysieren Analysekompetenzen, A Teilkompetenz Mindestanforderungen für den Übergang in die Studienstufe Die Schülerinnen und Schüler ... A Voraussetzungen und Denkwege analysieren identifizieren Vorurteile, Gewohnheiten, Verständnisschwierigkeiten und fehlendes Wissen für einen begründeten Problemlösungsvorschlag oder eine klare Positionierung bei sich und anderen und analysieren differenziert Ursachen und Gründe, unterscheiden intuitive Positionierungen und unbegründete Überzeugungen von",Hamburg,Gym,Sek1,2024.0,"Ethik, Philo"
176,5,0.9499924095341701,"Bezüge III PM Allgemeine Ethik III WM Angewandte Ethik III WM Gerechtigkeit IV PM Brücken in eine friedliche Zukunft bleibt zunächst leer Frieden Frieden als Wert Gefährdung des Friedens durch Vorurteile, Diskriminierungen und Feindbilder Wertevielfalt, Wertekonflikte und universelle Werte Beitrag zur Leitperspektive W: Die Schülerinnen und Schüler erkennen Frieden als wichtigen demokratischen Grundwert und seine Verbindung zu anderen Werten wie z.",Hamburg,Gym,Sek1,2024.0,"Ethik, Philo"
177,4,0.6842047313519347,"Antisemitismus, Lebensraum, Volksgemeinschaft, Führerprinzip Der industrialisierte Nationalstaat - Weltdeutung: Radikalnationalismus, Militarismus, Antisemitismus Europa in der Zwischenkriegszeit - Herrschaft: Diktatur Europa in der Zwischenkriegszeit - Weltdeutung: Antidemokratisches Denken BTV Formen von Vorurteilen, Stereotypen, Klischees Mittel der Machtübernahme analysieren und bewerten Machtergreifung, Gleichschaltung das Alltagsleben in der NS-Diktatur zwischen Zustimmung, Unterdrückung und Widerstand erläutern und Auswirkungen auf die Stabilität der NS-Herrschaft beurteilen Diktatur;",BaWü,Gemeinschaftsschule,Sek2,2016.0,Geschichte
178,3,0.966664493753964,"den Nahost-Konflikt im Kontext der Dekolonisierung erläutern und bewerten Dekolonisierung, Shoah, UN-Teilungsplan, Palästina, Israel Imperialismus und Erster Weltkrieg - Vernetzung: Imperialismus GK Frieden und Menschenrechte BNE Friedensstrategien BTV Formen von Vorurteilen, Stereotypen, Klischees das Demokratieverständnis der beiden deutschen Staaten vergleichen Grundgesetz: Grundrechte, Mehrparteiensystem; Volksdemokratie: Einheitsliste Nationalsozialismus und Zweiter Weltkrieg - Herrschaft: Diktatur GK Grundrechte GK Politischer Willensbildungsprozess in Deutschland BNE Demokratiefähigkeit",BaWü,Gemeinschaftsschule,Sek2,2016.0,Geschichte
179,3,0.49053002584259703,"China sowie die Lebensbedingungen der Bevölkerung analysieren und beurteilen Maoismus, Der große Sprung nach vorn, Kulturrevolution, Umerziehung, Personenkult Sachkompetenz Imperialismus und Erster Weltkrieg - Herrschaft: Kommunismus, Oktoberrevolution BTV Formen von Vorurteilen, Stereotypen, Klischees die Reformen seit Deng Xiaoping charakterisieren Marktwirtschaft, Sozialismus, Reformpolitik Der industrialisierte Nationalstaat - Wirtschaft: Wirtschaftsliberalismus BRD und DDR - Herrschaft: Reformpolitik WI Grundlagen der Ökonomie VB Alltagskonsum aktuelle",BaWü,Gemeinschaftsschule,Sek2,2016.0,Geschichte
180,9,0.5859683160836122,"Lernprozesse gestalten und Lernergebnisse adressatengerecht präsentieren Die Schülerinnen und Schüler ... entwickeln Präsentationen zur Darstellung der erarbeiteten Erkenntnisse. Gegenwarts- und Vergangenheitsbezüge herstellen Die Schülerinnen und Schüler ... diskutieren Ängste und Vorurteile von Mehrheiten und Minderheiten in der Geschichte und heute. POLITIK Eigene Stellungnahmen formulieren, kontrovers diskutieren Die Schülerinnen und Schüler ... erörtern den Widerspruch zwischen jüdischen Kulturleistungen in Deutschland und antisemitischen",Niedersachsen,Realschule,,2014.0,Geschichte
181,9,0.9590871546936159,"von Mehrheiten und Minderheiten in der Geschichte und heute. POLITIK Eigene Stellungnahmen formulieren, kontrovers diskutieren Die Schülerinnen und Schüler ... erörtern den Widerspruch zwischen jüdischen Kulturleistungen in Deutschland und antisemitischen Vorurteilen. diskutieren den Unterschied zwischen Assimilation und Integration. Argumentieren und Argumente prüfen Die Schülerinnen und Schüler... nehmen Kommunikation als Grundlage zur Integration wahr. Vielfalt erkennen und würdigen Die Schülerinnen und Schüler...",Niedersachsen,Realschule,,2014.0,Geschichte
182,3,0.7536111533638488,"Welt: den Imperialismus am Beispiel Afrikas charakterisieren und bewerten Imperialismus, Kolonialreich, Sozialdarwinismus, Rassismus Wende zur Neuzeit - Vernetzung: Kolonialisierung Die Französische Revolution - Kultur: Menschen- und Bürgerrechte BTV Formen von Vorurteilen, Stereotypen, Klischees VB Alltagskonsum die Ursachen des Ersten Weltkriegs analysieren und seine Auswirkungen auf den Alltag der Menschen beurteilen Radikalnationalismus; Rüstungswettlauf, Bündnispolitik; zum Beispiel Materialschlacht, Heimatfront Reflexionskompetenz BO Geschlechtsspezifische Aspekte",BaWü,Gym,,2016.0,Geschichte
183,4,0.6842047313519347,"Antisemitismus, Lebensraum, Volksgemeinschaft, Führerprinzip Der industrialisierte Nationalstaat - Weltdeutung: Radikalnationalismus, Militarismus, Antisemitismus Europa in der Zwischenkriegszeit - Herrschaft: Diktatur Europa in der Zwischenkriegszeit - Weltdeutung: Antidemokratisches Denken BTV Formen von Vorurteilen, Stereotypen, Klischees Mittel der Machtübernahme analysieren und bewerten Machtergreifung, Gleichschaltung das Alltagsleben in der NS-Diktatur zwischen Zustimmung, Unterdrückung und Widerstand erläutern und Auswirkungen auf die Stabilität der NS-Herrschaft beurteilen Diktatur;",BaWü,Gym,,2016.0,Geschichte
184,3,0.966664493753964,"den Nahost-Konflikt im Kontext der Dekolonisierung erläutern und bewerten Dekolonisierung, Shoah, UN-Teilungsplan, Palästina, Israel Imperialismus und Erster Weltkrieg - Vernetzung: Imperialismus GK Frieden und Menschenrechte BNE Friedensstrategien BTV Formen von Vorurteilen, Stereotypen, Klischees das Demokratieverständnis der beiden deutschen Staaten vergleichen Grundgesetz: Grundrechte, Mehrparteiensystem; Volksdemokratie: Einheitsliste Nationalsozialismus und Zweiter Weltkrieg - Herrschaft: Diktatur GK Grundrechte GK Politischer Willensbildungsprozess in Deutschland BNE Demokratiefähigkeit",BaWü,Gym,,2016.0,Geschichte
185,3,0.49053002584259703,"China sowie die Lebensbedingungen der Bevölkerung analysieren und beurteilen Maoismus, Der große Sprung nach vorn, Kulturrevolution, Umerziehung, Personenkult Sachkompetenz Imperialismus und Erster Weltkrieg - Herrschaft: Kommunismus, Oktoberrevolution BTV Formen von Vorurteilen, Stereotypen, Klischees die Reformen seit Deng Xiaoping charakterisieren Marktwirtschaft, Sozialismus, Reformpolitik Der industrialisierte Nationalstaat - Wirtschaft: Wirtschaftsliberalismus BRD und DDR - Herrschaft: Reformpolitik WI Grundlagen der Ökonomie VB Alltagskonsum aktuelle",BaWü,Gym,,2016.0,Geschichte
186,5,0.5126361596343019,"Phänomene zu verstehen und die eigene Lebenswirklichkeit zu erklären. Sie ermöglicht es, das eigene Tun und Lassen plausibler zu begründen. Außerdem verhilft sie dazu, in aktuellen Diskussionen die eigenen Einstellungen, Vorurteile, Haltungen, Deutungsmuster und Wertmaßstäbe in den Geschichtsunterricht einzubringen, diese zu reflektieren und kritisch zu hinterfragen. Aus der Kenntnis von Zwängen und Freiheiten, denen historische Entscheidungen unterlagen, können Handlungsspielräume für die",Hessen,Gym,Sek1,2021.0,Geschichte
187,6,0.9742849458239572,"die Ergebnisse begründet beurteilen, mit Hilfe von Sachaussagen über historische Ereignisse und Zusammenhänge und ihre Auswirkungen auf die Gegenwart selbstständig begründete Sachurteile fällen. g Die Lernenden können ihre eigenen Einstellungen, Vorurteile, Haltungen, Deutungsmuster und Wertmaßstäbe in den Geschichtsunterricht einbringen und kritisch hinterfragen und bewerten, eigene bzw. gegenwärtige und frühere Wertvorstellungen und Urteilsmaßstäbe kritisch aufeinander beziehen und gegenüberstellen, an Beispielen die historische",Hessen,Gym,Sek1,2021.0,Geschichte
188,6,0.9727266787990326,"Ende der Jahrgangsstufe / ÜSekII mit Hilfe von Sachaussagen über historische Ereignisse und Zusammenhänge und ihre Auswirkungen auf die Gegenwart selbstständig begründete Sachurteile fällen. Orientierungskompetenz für Zeiterfahrung ihre eigenen Einstellungen, Vorurteile, Haltungen, Deutungsmuster und Wertmaßstäbe in den Geschichtsunterricht einbringen und kritisch hinterfragen und bewerten, eigene bzw. gegenwärtige und frühere Wertvorstellungen und Urteilsmaßstäbe kritisch aufeinander beziehen und gegenüberstellen, an Beispielen die historische",Hessen,Gym,Sek1,2021.0,Geschichte
189,9,0.5403796667468211,"Lernprozesse gestalten und Ergebnisse adressatengerecht präsentieren Die Schülerinnen und Schüler ... entwickeln Präsentationen zur Darstellung der erarbeiteten Erkenntnisse. Gegenwarts- und Vergangenheitsbezüge herstellen Die Schülerinnen und Schüler ... diskutieren Ängste und Vorurteile von Einheimischen und Fremden in der Geschichte und heute. POLITIK Eigene Stellungnahmen formulieren, kontrovers diskutieren Die Schülerinnen und Schüler ... erörtern die Diskrepanz zwischen jüdischer Emanzipation seit dem Jahrhundert und",Niedersachsen,Oberschule,,2015.0,Geschichte
190,9,0.9357078431245467,"Einheimischen und Fremden in der Geschichte und heute. POLITIK Eigene Stellungnahmen formulieren, kontrovers diskutieren Die Schülerinnen und Schüler ... erörtern die Diskrepanz zwischen jüdischer Emanzipation seit dem Jahrhundert und antisemitischen Vorurteilen. Erwartete Kompetenzen im gymnasialem Angebot Im gymnasialen Angebot bildet das Kerncurriculum für das Gymnasium die Grundlage für den schulzweigbezogenen Unterricht. Bei einem Übergang vom jahrgangsbezogenen zum schulzweigbezogenen Unterricht ist bei",Niedersachsen,Oberschule,,2015.0,Geschichte
191,5,0.5126361596343019,"Phänomene zu verstehen und die eigene Lebenswirklichkeit zu erklären. Sie ermöglicht es, das eigene Tun und Lassen plausibler zu begründen. Außerdem verhilft sie dazu, in aktuellen Diskussionen die eigenen Einstellungen, Vorurteile, Haltungen, Deutungsmuster und Wertmaßstäbe in den Geschichtsunterricht einzubringen, diese zu reflektieren und kritisch zu hinterfragen. Aus der Kenntnis von Zwängen und Freiheiten, denen historische Entscheidungen unterlagen, können Handlungsspielräume für die",Hessen,Realschule,,2021.0,Geschichte
192,6,0.9742849458239572,"die Ergebnisse begründet beurteilen, mit Hilfe von Sachaussagen über historische Ereignisse und Zusammenhänge und ihre Auswirkungen auf die Gegenwart selbstständig begründete Sachurteile fällen. g Die Lernenden können ihre eigenen Einstellungen, Vorurteile, Haltungen, Deutungsmuster und Wertmaßstäbe in den Geschichtsunterricht einbringen und kritisch hinterfragen und bewerten, eigene, bzw. gegenwärtige und frühere Wertvorstellungen und Urteilsmaßstäbe kritisch aufeinander beziehen und gegenüberstellen, an Beispielen die historische",Hessen,Realschule,,2021.0,Geschichte
193,6,0.9718739275384316,"zwischen verschiedenen Epochen oder Kulturen vornehmen und die Ergebnisse begründet beurteilen, mit Hilfe von Sachaussagen über historische Ereignisse und Zusammenhänge begründete Sachurteile fällen. g Die Lernenden können ihre eigenen Einstellungen, Vorurteile, Haltungen, Deutungsmuster und Wertmaßstäbe in den Geschichtsunterricht einbringen und kritisch hinterfragen und bewerten, in Ansätzen eigene, gegenwärtige und frühere Wertvorstellungen und Urteilsmaßstäbe kritisch aufeinander beziehen und gegenüberstellen, in Gegenständen und",Hessen,Realschule,,2021.0,Geschichte
194,6,0.9709671465604738,"über historische Ereignisse und Zusammenhänge und ihre Auswirkungen auf die Gegenwart selbstständig begründete Sachurteile fällen. am Ende achunterricht Bildungsstandards am Ende der Jahrgangsstufe MSA Orientierungskompetenz für Zeiterfahrung ihre eigenen Einstellungen, Vorurteile, Haltungen, Deutungsmuster und Wertmaßstäbe in den Geschichtsunterricht einbringen, kritisch hinterfragen und bewerten, eigene, bzw. gegenwärtige und frühere Wertvorstellungen und Urteilsmaßstäbe kritisch aufeinander beziehen und gegenüberstellen, an Beispielen die historische Bedingtheit",Hessen,Realschule,,2021.0,Geschichte
195,3,0.9608674229890426,"Welt: den Imperialismus am Beispiel Afrikas charakterisieren und bewerten Imperialismus, Kolonialreich, Sozialdarwinismus, -Rassismus Wende zur Neuzeit - Vernetzung: Dreieckshandel Die Französische Revolution - Kultur: Menschen- und Bürgerrechte BTV Formen von Vorurteilen, -Stereotypen, Klischees VB Alltagskonsum Wende zur Neuzeit - Vernetzung: Kolonialisierung Die Französische Revolution - Kultur: Menschen- und Bürgerrechte BTV Formen von Vorurteilen, -Stereotypen, Klischees VB Alltagskonsum Wende zur Neuzeit -",BaWü,,Sek1,2016.0,Geschichte
196,3,0.9226412142990588,"- Kultur: Menschen- und Bürgerrechte BTV Formen von Vorurteilen, -Stereotypen, Klischees VB Alltagskonsum Wende zur Neuzeit - Vernetzung: Kolonialisierung Die Französische Revolution - Kultur: Menschen- und Bürgerrechte BTV Formen von Vorurteilen, -Stereotypen, Klischees VB Alltagskonsum Wende zur Neuzeit - Vernetzung: Kolonialisierung Die Französische Revolution - Kultur: Menschen- und Bürgerrechte BTV Formen von Vorurteilen, -Stereotypen, Klischees VB Alltagskonsum die Ursachen des Ersten",BaWü,,Sek1,2016.0,Geschichte
197,3,0.8049953179458982,"- Kultur: Menschen- und Bürgerrechte BTV Formen von Vorurteilen, -Stereotypen, Klischees VB Alltagskonsum Wende zur Neuzeit - Vernetzung: Kolonialisierung Die Französische Revolution - Kultur: Menschen- und Bürgerrechte BTV Formen von Vorurteilen, -Stereotypen, Klischees VB Alltagskonsum die Ursachen des Ersten Weltkriegs und seine Auswirkungen auf den Alltag der Menschen beschreiben z. B. Rüstungswettlauf, Blankoscheck; z. B. Materialschlacht, Heimatfront die Ursachen des Ersten",BaWü,,Sek1,2016.0,Geschichte
198,4,0.6343709951337105,"des Nationalsozialismus charakterisieren und bewerten Nationalsozialismus, Sozialdarwinismus, Rassismus, Antisemitismus, Lebensraum, Volksgemeinschaft, Führerprinzip Europa in der Zwischenkriegszeit - Herrschaft: -Diktatur Europa in der Zwischenkriegszeit - Weltdeutung: Antidemokratisches Denken BTV Formen von Vorurteilen, -Stereotypen, Klischees Der industrialisierte -Nationalstaat - Weltdeutung: -Antisemitismus Europa in der Zwischenkriegszeit - Herrschaft: -Diktatur Europa in der Zwischenkriegszeit - Weltdeutung: Antidemokratisches Denken BTV Formen von Vorurteilen, S Kli h",BaWü,,Sek1,2016.0,Geschichte
199,4,0.7969466629354878,"BTV Formen von Vorurteilen, -Stereotypen, Klischees Der industrialisierte -Nationalstaat - Weltdeutung: -Antisemitismus Europa in der Zwischenkriegszeit - Herrschaft: -Diktatur Europa in der Zwischenkriegszeit - Weltdeutung: Antidemokratisches Denken BTV Formen von Vorurteilen, S Kli h Der industrialisierte Nationalstaat - Weltdeutung: Radikalnationalismus, Militarismus, Antisemitismus Europa in der Zwischenkriegszeit - Herrschaft: -Diktatur Europa in der Zwischenkriegszeit - Weltdeutung: Antidemokratisches Denken BTV F V il",BaWü,,Sek1,2016.0,Geschichte
200,3,0.9699994073902544,"den Nahost-Konflikt im Kontext der Dekolonisierung erläutern und bewerten Shoah, UN-Teilungsplan, -Palästina, Israel Reflexionskompetenz Imperialismus und Erster Weltkrieg - Vernetzung: -Imperialismus GK Frieden und -Menschenrechte BNE Friedensstrategien BTV Formen von Vorurteilen, -Stereotypen, Klischees Reflexionskompetenz Imperialismus und Erster Weltkrieg - Vernetzung: -Imperialismus GK Frieden und -Menschenrechte BNE Friedensstrategien BTV Formen von Vorurteilen, -Stereotypen, Klischees Reflexionskompetenz Imperialismus und Erster Weltkrieg - Vernetzung: -Imperialismus",BaWü,,Sek1,2016.0,Geschichte
201,3,0.9709671658582321,"-Imperialismus GK Frieden und -Menschenrechte BNE Friedensstrategien BTV Formen von Vorurteilen, -Stereotypen, Klischees Reflexionskompetenz Imperialismus und Erster Weltkrieg - Vernetzung: -Imperialismus GK Frieden und -Menschenrechte BNE Friedensstrategien BTV Formen von Vorurteilen, -Stereotypen, Klischees Reflexionskompetenz Imperialismus und Erster Weltkrieg - Vernetzung: -Imperialismus GK Frieden und -Menschenrechte BNE Friedensstrategien BTV Formen von Vorurteilen, -Stereotypen, Klischees Die Schülerinnen und Schüler können G M E",BaWü,,Sek1,2016.0,Geschichte
202,3,0.7394281468919099,"-Imperialismus GK Frieden und -Menschenrechte BNE Friedensstrategien BTV Formen von Vorurteilen, -Stereotypen, Klischees Reflexionskompetenz Imperialismus und Erster Weltkrieg - Vernetzung: -Imperialismus GK Frieden und -Menschenrechte BNE Friedensstrategien BTV Formen von Vorurteilen, -Stereotypen, Klischees Die Schülerinnen und Schüler können G M E einen aktuellen Konflikt aus historischer Perspektive analysieren und dabei die Bedeutung des Dekolonisierungsprozesses beurteilen z. B. September, Islamismus, failed state,",BaWü,,Sek1,2016.0,Geschichte
203,5,0.5126361596343019,"Phänomene zu verstehen und die eigene Lebenswirklichkeit zu erklären. Sie ermöglicht es, das eigene Tun und Lassen plausibler zu begründen. Außerdem verhilft sie dazu, in aktuellen Diskussionen die eigenen Einstellungen, Vorurteile, Haltungen, Deutungsmuster und Wertmaßstäbe in den Geschichtsunterricht einzubringen, diese zu reflektieren und kritisch zu hinterfragen. Aus der Kenntnis von Zwängen und Freiheiten, denen historische Entscheidungen unterlagen, können Handlungsspielräume für die",Hessen,Hauptschule,,2021.0,Geschichte
204,6,0.9742849458239572,"die Ergebnisse begründet beurteilen, mit Hilfe von Sachaussagen über historische Ereignisse und Zusammenhänge und ihre Auswirkungen auf die Gegenwart selbstständig begründete Sachurteile fällen. g Die Lernenden können ihre eigenen Einstellungen, Vorurteile, Haltungen, Deutungsmuster und Wertmaßstäbe in den Geschichtsunterricht einbringen, und kritisch hinterfragen und bewerten, eigene bzw. gegenwärtige und frühere Wertvorstellungen und Urteilsmaßstäbe kritisch aufeinander beziehen und gegenüberstellen, an Beispielen die historische",Hessen,Hauptschule,,2021.0,Geschichte
205,6,0.9718744420937666,"Sachaussagen über historische Ereignisse und Zusammenhänge und ihre Auswirkungen auf die Gegenwart selbstständig begründete Sachurteile fällen. angsstufe Sachunterricht Bildungsstandards am Ende der Jahrgangstufe HSA Orientierungskompetenz für Zeiterfahrung ihre eigenen Einstellungen, Vorurteile, Haltungen, Deutungsmuster und Wertmaßstäbe in den Geschichtsunterricht einbringen und kritisch hinterfragen und bewerten, eigene bzw. gegenwärtige und frühere Wertvorstellungen und Urteilsmaßstäbe kritisch aufeinander beziehen und gegenüberstellen, an Beispielen die historische",Hessen,Hauptschule,,2021.0,Geschichte
206,9,0.5859683160836122,"Lernprozesse gestalten und Lernergebnisse adressatengerecht präsentieren Die Schülerinnen und Schüler ... entwickeln Präsentationen zur Darstellung der erarbeiteten Erkenntnisse. Gegenwarts- und Vergangenheitsbezüge herstellen Die Schülerinnen und Schüler ... diskutieren Ängste und Vorurteile von Mehrheiten und Minderheiten in der Geschichte und heute. POLITIK Eigene Stellungnahmen formulieren, kontrovers diskutieren Die Schülerinnen und Schüler ... erörtern den Widerspruch zwischen jüdischen Kulturleistungen in Deutschland und antisemitischen",Niedersachsen,Hauptschule,,2014.0,Geschichte
207,9,0.9590871546936159,"von Mehrheiten und Minderheiten in der Geschichte und heute. POLITIK Eigene Stellungnahmen formulieren, kontrovers diskutieren Die Schülerinnen und Schüler ... erörtern den Widerspruch zwischen jüdischen Kulturleistungen in Deutschland und antisemitischen Vorurteilen. diskutieren den Unterschied zwischen Assimilation und Integration. Argumentieren und Argumente prüfen Die Schülerinnen und Schüler... nehmen Kommunikation als Grundlage zur Integration wahr. Vielfalt erkennen und würdigen Die Schülerinnen und Schüler...",Niedersachsen,Hauptschule,,2014.0,Geschichte
208,6,0.5495475367490399,"für den Umgang mit der komplexen globalisierten Gegenwart. Orientierungskompetenz beinhaltet im Detail: produktiven/pragmatischen/kenntnisreichen Umgang mit Begriffen, Daten, Ordnungskategorien der Geschichte, Alteritätserfahrung mittels Analyse historischer Sachverhalte, Dekonstruktion, Hinterfragen von Geschichtsdarstellungen, Deutungen, Vorurteilen, Mythen und Legenden, Kenntnis von Geschichtstheorien. Methodenkompetenz Da das Fach Geschichte ausschließlich über Medien vermittelt werden kann, kommt der Methodenkompetenz ein hoher Stellenwert zu, die auch eine historische Gattungskompetenz einschließt.",Saarland,Gym,Sek2,2019.0,Geschichte
209,6,0.5205567516723197,"Kompetenzbereich: Orientierungskompetenz für Zeiterfahrung O grundlegendes Niveau Grundkurs und Leistungskurs Die Lernenden können O eigene Einstellungen, Haltungen, Deutungsmuster und Wertmaßstäbe im Hinblick auf ihre ethischen und politischen Grundlagen überprüfen und Vorurteile gegebenenfalls revidieren, O gegenwärtige und frühere, eigene und fremde Wertvorstellungen vergleichen und erklären, warum die historischen Akteure nach anderen Wertvorstellungen gehandelt haben als Menschen in der Gegenwart, O zwischen aktuellen",Hessen,Gym,Sek2,2024.0,Geschichte
