document_id,most_prevalent_topic_id,most_prevalent_topic_probability,text_excerpt,state,school type,grade,year,subject
126,5,0.2943781783048459,"Bestimmen des Begriffs der Subkultur; Diskussionen: z. B.: typisch Deutsch - typisch Saarländisch Ist es sinnvoll, von z. B. Emos, Gothics, Hipster, Nerds, Porsche-Fahrern, Harzern zu sprechen Interpretieren von auf Vorurteilen und Stereotypen beruhenden Witzen beschreiben die emotionalen Effekte, die mit dem Vertrauten und mit dem Fremden verbunden sind, analysieren typische Streitfragen, die auf kulturellen Unterschieden gründen, diskutieren Möglichkeiten des friedlichen",Saarland,GemS,"7,8",2018.0,"Ethik, Philo"
127,10,0.9437383725318557,"Determinismus Was leitet mich bei meinen Entscheierforschen der Motive und Leitlinien des eidungen genen Handelns Bedürfnisse, Ängste, Gewohnheiten, Anpassung, Glaubensgrundsätze, Gewissen im Verhältnis zur Selbstbestimmung Rundgespräche; Erziehung und/ oder Manipulation; Vorurteile und Fremdenhass auf ihre Begründbarkeit hin untersuchen; das Phänomen der Fremdheit, Was wäre, wenn all mein Handeln vorherGedankenexperiment einer durchgängigen bestimmt wäre kausalen Bestimmtheit menschlichen Verhaltens und Handelns und der",MeckPomm,,7-10,2002.0,"Ethik, Philo"
128,1,0.9774986133676576,"Wir-Gefühls, Aufbau von Feindbildern, Ausgrenzung, Diskriminierung, Konflikte, Gewalt diskutieren Möglichkeiten eines toleranten Zusammenlebens. grundlegende Wertvorstellungen Informationen über andere Religionen und Kulturen, interkulturelle Begegnungen infolge von Migration, Fluchtursachen ... Grundbegriffe: Toleranz, Vorurteil Inhaltsbezogener Kompetenzbereich: Fragen nach Orientierungsmöglichkeiten Leitthema: Aspekte von Religionen und Weltanschauungen Erwartete Kompetenzen am Ende von Schuljahrgang Mögliche Inhalte für den Kompetenzerwerb Die Schülerinnen und Schüler ... benennen Gottesvorstellungen in",Niedersachsen,Hauptschule,,2018.0,"Ethik, Philo"
129,8,0.9816318579259442,A Übersicht über die verbindlichen Grundbegriffe Schuljahrgänge und Schuljahrgänge und Schuljahrgänge und Erfolg/Misserfolg Familienformen Freundschaft glückliches Leben das Göttliche Goldene Regel Mobbing Monotheismus/Polytheismus Naturwissenschaft Religiosität Ritual Schöpfung Toleranz Verantwortungsbewusstsein Vorbild Vorurteil Werte Geschlechterrolle Grundbedürfnisse Initiationsritus Konflikt Krise Liebe Menschenbild Menschenrechte Menschenwürde Mobbing Prävention Selbstbestimmung Selbstwertgefühl Sexualität soziale Rolle Sucht Weltanschauung Weltbild Endlichkeit Erkennen Ethik Gender/Sex Gewalt Glück Identität Konflikt Medien Nachhaltigkeit,Niedersachsen,Hauptschule,,2018.0,"Ethik, Philo"
130,10,0.9639977477637196,"Schüler also dazu auf, sich eigene und ihnen begegnende Wahrheits- und Wirklichkeitsvorstellungen bewusst zu machen und die Voraussetzungen ihrer Urteile über Wirklichkeit zu reflektieren. Kritisch hinterfragen die Schülerinnen und Schüler Vorurteile und Klischees und erweitern durch die Auseinandersetzung mit unbekannten Lebens- und Sinnentwürfen ihr Fremdverstehen und ihre Fähigkeit zur Perspektivenübernahme. Sie prüfen den Inhalt, den Anspruch und die Tragweite von Menschenrechten",Niedersachsen,Hauptschule,,2018.0,"Ethik, Philo"
131,1,0.9785703555636138,"... beschreiben unterschiedliche Formen der Lebensgestaltung. verschiedene Interessen, unterschiedliche Herkunft und Sitten, auch in der Folge von Migration Kleidung, Körpersprache, Mimik, Sprachstil, Umgangsformen, Temperament, auffällige Merkmale benennen Beispiele für gängige Vorurteile. Vorurteile und Klischees bezogen auf Aussehen, Geschlechterrollen, Lebensalter, Religionszugehörigkeit, soziale und ethnische Herkunft Vorurteile in den Medien stellen Ursachen und Folgen von Vorurteilen dar. Unkenntnis, Desinteresse, Intoleranz, Unsicherheit, Schwarz-Weiß-Denken, Stärkung",Niedersachsen,Hauptschule,,2018.0,"Ethik, Philo"
132,1,0.9785703555636138,"beschreiben unterschiedliche Formen der Lebensgestaltung. verschiedene Interessen, unterschiedliche Herkunft und Sitten, auch in der Folge von Migration Kleidung, Körpersprache, Mimik, Sprachstil, Umgangsformen, Temperament, auffällige Merkmale benennen Beispiele für gängige Vorurteile. Vorurteile und Klischees bezogen auf Aussehen, Geschlechterrollen, Lebensalter, Religionszugehörigkeit, soziale und ethnische Herkunft Vorurteile in den Medien stellen Ursachen und Folgen von Vorurteilen dar. Unkenntnis, Desinteresse, Intoleranz, Unsicherheit, Schwarz-Weiß-Denken, Stärkung des",Niedersachsen,Hauptschule,,2018.0,"Ethik, Philo"
133,1,0.9785708295900055,"der Folge von Migration Kleidung, Körpersprache, Mimik, Sprachstil, Umgangsformen, Temperament, auffällige Merkmale benennen Beispiele für gängige Vorurteile. Vorurteile und Klischees bezogen auf Aussehen, Geschlechterrollen, Lebensalter, Religionszugehörigkeit, soziale und ethnische Herkunft Vorurteile in den Medien stellen Ursachen und Folgen von Vorurteilen dar. Unkenntnis, Desinteresse, Intoleranz, Unsicherheit, Schwarz-Weiß-Denken, Stärkung des Ich- und Wir-Gefühls, Aufbau von Feindbildern, Ausgrenzung, Diskriminierung, Konflikte, Gewalt diskutieren Möglichkeiten eines",Niedersachsen,Hauptschule,,2018.0,"Ethik, Philo"
134,6,0.9718722452333646,"Nächstenliebe, Liebe zur Heimat, zur Natur, zur Kunst ... untersuchen geschlechtsspezifische Rollenerwartungen im Bereich von Liebe und Sexualität. vermeintlich typisch männliche bzw. typisch weibliche Eigenschaften und Vorstellungen, Rollenverhalten der Geschlechter, Vorurteile gegenüber Homosexualität Sexualität und Rollenklischees in den Medien diskutieren Möglichkeiten und Grenzen sexueller Selbstbestimmung. Liebe und Sexualität im Spannungsfeld von Partnerwahl und -konstellationen, Verhältnis zum eigenen Körper, Zurschaustellung von Sexualität,",Niedersachsen,Hauptschule,,2018.0,"Ethik, Philo"
135,6,0.9653823006112312,"zusätzlich dazu bei, dass die Schülerinnen und Schüler mit einer Fülle diverser Wahrheits- und Wirklichkeitsvorstellungen konfrontiert werden. Nicht selten dominiert dabei eine verzerrte oder zumindest bruchstückhafte Informationsvermittlung, die zu Klischees, Vorurteilen und Diskriminierungen führen kann. Daraus ergibt sich die Notwendigkeit, den Schülerinnen und Schülern Wege zu einer eigenständigen und kritischen Sichtweise auf die unterschiedlichen Wahrheits- und Wirklichkeitskonzeptionen zu eröffnen. Auch für",Niedersachsen,Hauptschule,,2018.0,"Ethik, Philo"
136,1,0.9780480958900892,"Temperament, auffällige Merkmale benennen Beispiele für gängige Vorurteile. Vorurteile und Klischees bezogen auf Aussehen, Geschlechterrollen, Lebensalter, Religionszugehörigkeit, soziale und ethnische Herkunft Vorurteile in den Medien stellen Ursachen und Folgen von Vorurteilen dar. Unkenntnis, Desinteresse, Intoleranz, Unsicherheit, Schwarz-Weiß-Denken, Stärkung des Ich- und Wir-Gefühls, Aufbau von Feindbildern, Ausgrenzung, Diskriminierung, Konflikte, Gewalt diskutieren Möglichkeiten eines toleranten Zusammenlebens. grundlegende Wertvorstellungen Informationen über andere Religionen und",Niedersachsen,Hauptschule,,2018.0,"Ethik, Philo"
137,8,0.9357070243661062,"von staatsphilosophischen Begründungen: Verträge und Rechte Was ist der Mensch Selbstbild und Fremdbild Rolle und Ich-Identität; Bin ich nur, indem ich eine bestimmte Rolle spiele Selbsterkenntnis und Selbstdeutung; Urteil und Vorurteil Der Mensch als selbstreflexives Wesen Das Ich unter psychologischer und philosophischer Perspektive Freiheit und Determination Unterscheidung von Handlungsund Willensfreiheit Materialistische und idealistische Auffassungen vom Menschen",Bremen,Gym,5-9,2017.0,"Ethik, Philo"
138,9,0.5888430948169432,"Transzendenz Ethik / Wert- und Moralvorstellungen im Christentum, Islam und Judentum inhaltsbezogene Kompetenzen methodisch-didaktische Hinweise Anwenden der Unterscheidung zwischen Respekt und Toleranz siehe Lehrplan /, Thema Toleranz und Respekt - Vorurteil Handeln Führen eines für die Klassengemeinschaft relevanten interreligiösen Gesprächs mit Schülerinnen und Schülern, Lehrerinnen und Lehrern, Eltern Erstellen einer Charta des Respekts und der Toleranz für den Umgang miteinander in",Saarland,Gym,"7,8",2018.0,"Ethik, Philo"
139,5,0.9624980809176437,"es Ab wann bin ich süchtig bzw. abhängig Habe ich die Freiheit, mich aus einer Abhängigkeit zu befreien Wenn ja, wie Kompetenzerwartungen Die Schülerinnen und Schüler können Effekte sozialer Wahrnehmung Vorurteile, Halo-Effekte, Konformitätsdenken beschreiben und reflektieren Bedürfnisse und Sucht, andere Perspektiven einnehmen - sich in die Befindlichkeit eines anderen hineinversetzen Bedürfnisse und Sucht, die Relevanz sozialer Kontexte für Handlungen analysieren Bedürfnisse",Saarland,Gym,"7,8",2018.0,"Ethik, Philo"
140,5,0.9499976764552395,"oder Vernunft Sich in das Gegenüber hineinversetzen, ohne sich anzupassen. Geht das Ich bleibe mir selbst treu und finde meinen Weg Kompetenzerwartungen Die Schülerinnen und Schüler können Effekte sozialer Wahrnehmung Vorurteile, Halo-Effekte, Konformitätsdenken beschreiben und reflektieren Denken, die ethische Relevanz von Handlungen und Situationen beschreiben und kategorisieren z. B. Zugehörigkeit zur Glücks- oder Sollensethik Selbst sein, auf Aussagen und Argumente von",Saarland,Gym,"7,8",2018.0,"Ethik, Philo"
141,4,0.5666521594760131,"Spock sein in selbst entworfenen durch Emotionen bestimmte Situationen Gefühle zähmen: Gefühle mitteilen IchBotschaft, Mitfühlen, Das Eisen schmieden, wenn es kalt ist auf dem Prüfstand: Essgewohnheiten, gewohnter Tagesablauf, Lerngewohnheiten Angst-Check: Vorurteile durch Fakten ersetzen Gewissen als bedrängende innere Stimme: Formulieren von Du sollst, du musst ..., Du darfst nicht ...- Sätzen Hinterfragen peinlicher, beschämender Erlebnisse Placemat-Methode: Erstellen und Vergleichen persönlicher Autoritätenlisten/hierarchien",Saarland,Gym,"7,8",2018.0,"Ethik, Philo"
142,5,0.8339673095443767,"Denkanstöße Die Kultur, meine zweite Natur. Sich das Fremde vertraut machen. Auch ich bin Ausländer - fast überall auf der Welt. Kompetenzerwartungen Die Schülerinnen und Schüler können Effekte sozialer Wahrnehmung Vorurteile, Halo-Effekte, Konformitätsdenken beschreiben und reflektieren Leben mit/in anderen Kulturen, andere Perspektiven einnehmen - sich in die Befindlichkeit eines anderen hineinversetzen Leben mit/in anderen Kulturen, die Relevanz sozialer Kontexte für Handlungen",Saarland,Gym,"7,8",2018.0,"Ethik, Philo"
143,6,0.841591427848456,"Kulturen inhaltsbezogene Kompetenzen methodisch-didaktische Hinweise Leben mit/in anderen Kulturen Die Schülerinnen und Schüler identifizieren Unterschiede und Gemeinsamkeiten verschiedener Kulturen, diskutieren mögliche Hintergründe für kulturelle Erscheinungsformen, hinterfragen kritisch die Tendenz kulturelle Vorurteile und Stereotypen zu bilden, Visualisieren im Eisbergmodell: Unterscheiden der sichtbaren Zeichen von Kultur und den Bedürfnissen und Wertvorstellungen, die darunter diesen zugrunde liegen z. B. an verschiedenen Ausdrucksformen der Höflichkeit,",Saarland,Gym,"7,8",2018.0,"Ethik, Philo"
144,6,0.7013735518259412,"sexueller Selbstbestimmung Sein: Ich Mensch sein Ethik / Verliebt-Sein, Liebe und Sexualität inhaltsbezogenen Kompetenzen methodisch-didaktische Hinweise Darstellung von Konfliktsituationen im Rollenspiel: Analyse/Beurteilung derselben mit begründeten Lösungsvorschlägen Ziel: Nein-sagen-Können Diskussion zu Vorurteilen gegenüber typisch männlicher/weiblicher Sexualität und Hetero-, Homo-, Trans- und Intersexualität Handeln Erarbeiten eines Love-hurts-Erste-HilfeKoffers mit eigenen Tipps, hilfreichen Beratungsadressen, Internetlinks, eigenen Lieblingsbüchern und -filmen zum Thema Liebe/Verliebt-Sein Hinweis s. Richtlinien",Saarland,Gym,"7,8",2018.0,"Ethik, Philo"
145,5,0.2943781783048459,"Bestimmen des Begriffs der Subkultur; Diskussionen: z. B.: typisch Deutsch - typisch Saarländisch Ist es sinnvoll, von z. B. Emos, Gothics, Hipster, Nerds, Porsche-Fahrern, Harzern zu sprechen Interpretieren von auf Vorurteilen und Stereotypen beruhenden Witzen beschreiben die emotionalen Effekte, die mit dem Vertrauten und mit dem Fremden verbunden sind, analysieren typische Streitfragen, die auf kulturellen Unterschieden gründen, diskutieren Möglichkeiten des friedlichen",Saarland,Gym,"7,8",2018.0,"Ethik, Philo"
146,2,0.4942766457847907,leben der Welt und des menschlichen Lebens b Der Sei stfindungsprozeß und die b Möglichkeiten und Grenzen Sinnfrage wissenschaftlicher Erkenntrusweisen für Lebens- und Weltdeutung Auswahlthema: Auswahlthema: Auswahlthema: Streben nach Glück Vorurteil und Aggression Die Bedeutung von Religion und Weltanschauung für die Gesellschaft /: DIE EIGENE SITTLICHE /: DER GRUNDKONSENS IN DER /: PLURALITÄT ALS WERT ENTSCHEIDUNG GESELLSCHAFT UND PROBLEM Kernthema: Kernthemen:,Rheinland-Pfalz,,Sek2,1983.0,"Ethik, Philo"
147,7,0.48721749908789447,"Entschlossenheit, Einsicht in eigene Schwächen und Stärken, Herausforderung, Selbstbehauptung, Selbstüberwindung, Entwicklung von Kreativität, Persönlichkeitsentfaltung - Negative Wirkungen von Konflikten z.B. Konfliktverdrängung, Aggressionen, Neid, Flucht in Drogen, Kriminalität, Persönlichkeitseinengung : Auswahlthema: Vorurteil und Aggression :: - Ursachen von Vorurteilen z.B. individual- und sozialpsychologische Ursachen, politisch-gesellschaftliche Ursachen, historische Ursachen - Verschiedene Formen von Vomrteilen z.B rassistische, nationalistische, gesellschaftliche, religiöse, ideologische Vorurteile Korrelation zwischen",Rheinland-Pfalz,,Sek2,1983.0,"Ethik, Philo"
148,2,0.5399846939825816,"und Aggression :: - Ursachen von Vorurteilen z.B. individual- und sozialpsychologische Ursachen, politisch-gesellschaftliche Ursachen, historische Ursachen - Verschiedene Formen von Vomrteilen z.B rassistische, nationalistische, gesellschaftliche, religiöse, ideologische Vorurteile Korrelation zwischen Vorurteil und Aggression am Beispiel: Antisemitismus Geschichte des Antisemitismus, Hintergründe antisemitistischer Maßnahmen, Judenprogrom und Judenvernichtung oder am Beispiel: .. Schwarz und Weiß ., Rassentrennung in den USA und Integrationsversuche, Apartheid-Politik r-------------------",Rheinland-Pfalz,,Sek2,1983.0,"Ethik, Philo"
149,2,0.5641679445321068,": Auswahlthema: Vorurteil und Aggression :: - Ursachen von Vorurteilen z.B. individual- und sozialpsychologische Ursachen, politisch-gesellschaftliche Ursachen, historische Ursachen - Verschiedene Formen von Vomrteilen z.B rassistische, nationalistische, gesellschaftliche, religiöse, ideologische Vorurteile Korrelation zwischen Vorurteil und Aggression am Beispiel: Antisemitismus Geschichte des Antisemitismus, Hintergründe antisemitistischer Maßnahmen, Judenprogrom und Judenvernichtung oder am Beispiel: .. Schwarz und Weiß ., Rassentrennung in den USA und",Rheinland-Pfalz,,Sek2,1983.0,"Ethik, Philo"
150,4,0.540970292894222,"Vorbringen, Anerkennen und Erfüllen von Ansprüchen - Verantwortung für den Mitmenschen - Verantwortungslosigkeit - Schuld z.B. in Erziehung, Beruf, Gemeinschaft, Partnerschaft, Sexualverhalten; Straßenverkehr, Umweltschutz, Entwicklungshilfe - Ursachen und Auswirkungen von Vorurteilen gegenüber den Mitmenschen z.B. Unkenntnis, Neid, Aggressivität, Feindschaft, Haß - Soziales Fehlverhalten , , z.B. üble Nachrede, lüge, Manipulation, Drohung, Eipressung, Gewaltanwendung Sklaverei ::: - Vertrauen und Kompromißbereitschaft als wesentliche",Rheinland-Pfalz,,Sek2,1983.0,"Ethik, Philo"
151,2,0.5019441795527114,"Herausforderung, Selbstbehauptung, Selbstüberwindung, Entwicklung von Kreativität, Persönlichkeitsentfaltung - Negative Wirkungen von Konflikten z.B. Konfliktverdrängung, Aggressionen, Neid, Flucht in Drogen, Kriminalität, Persönlichkeitseinengung : Auswahlthema: Vorurteil und Aggression :: - Ursachen von Vorurteilen z.B. individual- und sozialpsychologische Ursachen, politisch-gesellschaftliche Ursachen, historische Ursachen - Verschiedene Formen von Vomrteilen z.B rassistische, nationalistische, gesellschaftliche, religiöse, ideologische Vorurteile Korrelation zwischen Vorurteil und Aggression am Beispiel: Antisemitismus Geschichte",Rheinland-Pfalz,,Sek2,1983.0,"Ethik, Philo"
152,2,0.4774760035635535,"Antisemitismus, Hintergründe antisemitistischer Maßnahmen, Judenprogrom und Judenvernichtung oder am Beispiel: .. Schwarz und Weiß ., Rassentrennung in den USA und Integrationsversuche, Apartheid-Politik r------------------- - Formen der Aggression als Folge von Vorurteilen Diskriminierung, Gewalt und Bedrohung, physische Vernichtung - Möglichkeit zur Überwindung von Vorurteilen und zur Steuerung von Aggressionen Etweitemng und Vertiefung des eigenen Informationsstandes, Selbstbescheidung und Selbstvertrauen, Geltenlassen des anderen Menschen",Rheinland-Pfalz,,Sek2,1983.0,"Ethik, Philo"
153,1,0.48162569653800213,"und Weiß ., Rassentrennung in den USA und Integrationsversuche, Apartheid-Politik r------------------- - Formen der Aggression als Folge von Vorurteilen Diskriminierung, Gewalt und Bedrohung, physische Vernichtung - Möglichkeit zur Überwindung von Vorurteilen und zur Steuerung von Aggressionen Etweitemng und Vertiefung des eigenen Informationsstandes, Selbstbescheidung und Selbstvertrauen, Geltenlassen des anderen Menschen in seiner Andersartigkeit, Einfühlung in Probleme des anderen Menschen Erläuterung und Begründung",Rheinland-Pfalz,,Sek2,1983.0,"Ethik, Philo"
154,2,0.544233206605306,"und veränderbar erscheinen, zu ändem, solche, bei denen er das für unmöglich hält, gelassen hinzunehmen Solche Grundhaltungen entsprechen wirklichkeitsgerechtem Verhalten. Im persönlichen, beruflichen, gesellschaftlichen und politischen Bereich darfAndersartigkeit nicht zu Vorurteilen und Aggressionen führen, dürfen Unterschiede nicht Ausgangspunkt für Unterdrückung und Gewaltanwendung sein, sondern Bejahung von Vielfalt und Bereicherung menschlichen Zusammenlebens und Erlebens. Toleranz, die den eigenen Standpunkt voraussetzt, meint auch",Rheinland-Pfalz,,Sek2,1983.0,"Ethik, Philo"
155,10,0.5991369365194521,"durch das Du. Unterschiedliche Auffassungen wie unterschiedliche Rassen und Kulturengeben erst eine gefüllte und klarere Vorstellung der menschlichen Ganzheit Positive mitmenschliche Beziehungen sind nur möglich durch Abbau und Kontrolle von Vorurteilen und Aggressionen, Eine eingehendere Auseinandersetzung mit den Phänomenen des Vorurteils und der Aggression ist empfehlenswert und wird daher als Auswahlthema vorgeschlagen Eine positive oder zumindest erträgliche Gestaltung mitmenschlicher Beziehungen kann",Rheinland-Pfalz,,Sek2,1983.0,"Ethik, Philo"
156,2,0.359806420388872,"hier das methodisch geleitete Nachdenken über die Grundlagen des menschlichen Denkens, Handelns und Seins verstanden. Kennzeichnend für den philosophischen Umgang mit Problemen ist es, scheinbar Selbstverständliches infrage zu stellen und Vorurteile, die dem alltäglichen Denken und Handeln zugrunde liegen, der kritischen Prüfung zu unterziehen. Dabei berücksichtigt die Philosophie als Universalwissenschaft die Erkenntnisse aller Wissenschaften. Das Fach Ethik wird bekenntnisfrei - also",Berlin,,7-10,2015.0,"Ethik, Philo"
157,7,0.9437319438399651,"bezeichnen und einzuordnen. Dazu gehört die Fähigkeit, zu den eigenen Emotionen, Bedürfnissen und Interessen in Distanz zu treten, das Wahrgenommene aus dieser Distanz heraus zu beschreiben und vorgegebene Muster und Vorurteile zu bemerken. Hinzu kommt das Erfassen unterschiedlicher Interessen und Motive in alltäglichen Situationen und in gesellschaftlichen Bereichen von Technik, Ökonomie, Wissenschaft, Politik und Religion. Dies alles führt dazu, zu Sachverhalten",Berlin,,7-10,2015.0,"Ethik, Philo"
158,10,0.41351145082429325,"sowie über verschiedene Kulturen Lebensweisen die großen Welt Die im Ethikunterricht behandelten Probleme gehen von dem Vorwissen und der Erfahrungswelt der Schülerinnen und Schüler aus, d. h. von biographischen Erlebnissen, Vorurteilen, Meinungen, religiösen Überzeugungen, kulturellen und sozialen Prägungen etc. In der Auseinandersetzung mit unterschiedlichen Positionen reflektieren die Lernenden ihre Erfahrungswelt. Das Mittel, ethische Positionen in Richtung auf Wahrheit, Plausibilität und Richtigkeit",Berlin,,7-10,2015.0,"Ethik, Philo"
159,7,0.9666644957316747,"gegenwärtige Dimensionen von Naturveränderung durch Technik erörtern, sich mit verschiedenen Ansätzen der Umweltethik auseinandersetzen, - die Subjektivität unserer Wahrnehmungen mit Hilfe von Beispielen erläutern, - das Angewiesensein des Menschen auf Vorurteile als Entlastungs- und Schutzfunktion begründen, - an ausgewählten Beispielen die Beeinflussung der Wahrnehmung durch Vorurteile darstellen, - Ursachen für das Beharren auf Urteilen und Vorurteilen beschreiben und deren Folgen untersuchen.",Thüringen,Regelschule,,2012.0,"Ethik, Philo"
160,7,0.9678556385592741,"die Subjektivität unserer Wahrnehmungen mit Hilfe von Beispielen erläutern, - das Angewiesensein des Menschen auf Vorurteile als Entlastungs- und Schutzfunktion begründen, - an ausgewählten Beispielen die Beeinflussung der Wahrnehmung durch Vorurteile darstellen, - Ursachen für das Beharren auf Urteilen und Vorurteilen beschreiben und deren Folgen untersuchen. Methodenkompetenz Der Schüler kann - die Ambivalenz von Wissenschafts- und Techniknutzung in Geschichte und Gegenwart",Thüringen,Regelschule,,2012.0,"Ethik, Philo"
161,7,0.5627624244780149,"Ambivalenz von Wissenschafts- und Techniknutzung in Geschichte und Gegenwart mit Hilfe geeigneter Medien analysieren und werten, - Methoden der Begriffsklärung anwenden, - durch zielführende Fragestellungen Aussagen überprüfen, - durch Perspektivwechsel Vorurteile herausfinden, - in Texten die Argumentationsstruktur untersuchen, - den Geltungsanspruch von Aussagen und Urteilen kritisch hinterfragen und diskursiv überprüfen. Selbst- und Sozialkompetenz Der Schüler kann - sich als Natur- und",Thüringen,Regelschule,,2012.0,"Ethik, Philo"
162,7,0.966664601591207,"das Angewiesensein des Menschen auf Vorurteile als Entlastungs- und Schutzfunktion begründen, - an ausgewählten Beispielen die Beeinflussung der Wahrnehmung durch Vorurteile darstellen, - Ursachen für das Beharren auf Urteilen und Vorurteilen beschreiben und deren Folgen untersuchen. Methodenkompetenz Der Schüler kann - die Ambivalenz von Wissenschafts- und Techniknutzung in Geschichte und Gegenwart mit Hilfe geeigneter Medien analysieren und werten, - Methoden der",Thüringen,Regelschule,,2012.0,"Ethik, Philo"
163,5,0.6817776909996482,"Konsequenzen verschiedener Ansätze von Umweltethik für die eigene Lebenswirklichkeit abschätzen, - eine kritische Distanz zu Informationen aus unterschiedlichen Quellen entwickeln, - Formen von Manipulation erkennen, - Strategien zum Erkennen von Vorurteilen und deren Korrektur anwenden, - Folgen des begrenzten menschlichen Wissens reflektieren. Klassenstufe - hauptschulbezogener Abschluss Der Schüler in seiner Individualität und Persönlichkeitsentwicklung - Ich Durch die Reflexion ethischer Fragestellungen zum",Thüringen,Regelschule,,2012.0,"Ethik, Philo"
164,5,0.9549990835554404,"Bedingungen der Wahrnehmung beschreiben und reflektieren Klassenstufen / Die Schülerinnen und Schüler können Sinnestäuschungen und emotionale Befangenheit beschreiben und reflektieren. Klassenstufen / Die Schülerinnen und Schüler können Effekte sozialer Wahrnehmung Vorurteile, HaloEffekte, Konformitätsdenken beschreiben und reflektieren. Klassenstufe Die Schülerinnen und Schüler können durch Ideen und Ideologien gelenkte Wahrnehmung beschreiben und reflektieren. Einführungsphase Die Schülerinnen und Schüler können Einflussfaktoren auf die Wahrnehmung",Saarland,Gym,Sek2,2020.0,"Ethik, Philo"
165,10,0.9249867757417992,"definieren, was normal ist Benennung von Normalität als Be-schreiben und Vorschreiben Wahrnehmung der Welt mit anderen Augen Ordnungsmuster der Lebenswelt zur Herstellung von Normalität betrachten Inwiefern erzeugt Sprache Normalität Vorerfahrung, Vorurteil und Urteil Wie ist die Welt objektiv - und kann ich dies erkennen Reflexionsbereich : Was soll ich tun Jahrgangsstufe / Thema: Gewissen als kritische Instanz verantwortlichen Handelns Themenbezogene Kompetenzen",Schleswig-Holstein,,,2016.0,"Ethik, Philo"
166,5,0.9307627474659683,"Reflexionsbereich : Was soll ich tun Jahrgangsstufe Thema: Das Andere als Beschränkung und Bereicherung meiner Handlungsmöglichkeiten Themenbezogene Kompetenzen Exemplarische Lerninhalte Die Schülerinnen und Schüler erwerben oder erweitern die Fähigkeit, eigene Vorurteile als solche zu erkennen das Für und Wider von Vorurteilen zu beschreiben und den Umgang mit Vorurteilen begründet zu beurteilen die Konfrontation mit dem Anderen als prinzipielle Irritation wahrzunehmen und",Schleswig-Holstein,,,2016.0,"Ethik, Philo"
167,8,0.9399966502006198,"und einen kritischen Toleranzbegriff im Sinn einer allseitigen Offenheit zu formulieren, welche eine Diskussion gemeinschaftlich bindender Werte und Normen ermöglicht Begründungskriterien für die Toleranzforderung zu benennen und kritisch zu überprüfen Vorurteile - eine begriffliche Klärung Chancen und Gefahren von Vorurteilen Ein Leben ohne Vorurteile - ist dies möglich Die Konfrontation mit dem Anderen Wie erscheine ich dem Anderen Wie soll ich",Schleswig-Holstein,,,2016.0,"Ethik, Philo"
