document_id,most_prevalent_topic_id,most_prevalent_topic_probability,text_excerpt,state,school type,grade,year,subject
0,2,0.8130129158377414,"Krankheit, Tod für das eigene und für menschliches Leben allgemein, erörtern kriteriengeleitet Fragen hinsichtlich Ursprung und Grenzen des Lebens. Inhaltsfeld : Menschliche Erkenntnis Inhaltliche Schwerpunkte: - Realität und Virtualität - Vorurteil, Urteil, Wissen Sachkompetenz Die Schülerinnen und Schüler unterscheiden zwischen Wirklichkeit und medialer Realität, benennen Chancen und Herausforderungen von Virtualität, erläutern die Entstehung und Verbreitung von Vorurteilen, entwickeln Lösungsansätze zum Abbau",NRW,,Sek1,2024.0,"Ethik, Philo"
1,7,0.44233893413113046,"und Schüler begründen Urteile unter kritischer Berücksichtigung von Quellen, erörtern die Bedeutung von Meinungsverstärkern u. a. Peergroup, digitale Filterblasen auf Wahrnehmung und Handeln in der Welt, erörtern das Verhältnis von Vorurteil, Urteil und Wissen, erörtern eine mögliche Beeinflussung von Wahrnehmungs- und Erkenntnisprozessen. Lernerfolgsüberprüfung und Leistungsbewertung Die rechtlich verbindlichen Grundsätze der Leistungsbewertung sind im Schulgesetz SchulG sowie in der Ausbildungs- und Prüfungsordnung",NRW,,Sek1,2024.0,"Ethik, Philo"
2,2,0.5039955420332906,"Realität und Virtualität - Vorurteil, Urteil, Wissen Sachkompetenz Die Schülerinnen und Schüler unterscheiden zwischen Wirklichkeit und medialer Realität, benennen Chancen und Herausforderungen von Virtualität, erläutern die Entstehung und Verbreitung von Vorurteilen, entwickeln Lösungsansätze zum Abbau von Vorurteilen, beschreiben mögliche Einflüsse auf Wahrnehmungs- und Erkenntnisprozesse. Urteilskompetenz Die Schülerinnen und Schüler begründen Urteile unter kritischer Berücksichtigung von Quellen, erörtern die Bedeutung von Meinungsverstärkern",NRW,,Sek1,2024.0,"Ethik, Philo"
3,2,0.6256930424439086,"Wissen Sachkompetenz Die Schülerinnen und Schüler unterscheiden zwischen Wirklichkeit und medialer Realität, benennen Chancen und Herausforderungen von Virtualität, erläutern die Entstehung und Verbreitung von Vorurteilen, entwickeln Lösungsansätze zum Abbau von Vorurteilen, beschreiben mögliche Einflüsse auf Wahrnehmungs- und Erkenntnisprozesse. Urteilskompetenz Die Schülerinnen und Schüler begründen Urteile unter kritischer Berücksichtigung von Quellen, erörtern die Bedeutung von Meinungsverstärkern u. a. Peergroup, digitale Filterblasen auf",NRW,,Sek1,2024.0,"Ethik, Philo"
4,1,0.9774984839623513,"Ausgrenzung, Diskriminierung, Konflikte, Gewalt diskutieren Möglichkeiten und Voraussetzungen eines toleranten Zusammenlebens. Minimalkonsens grundlegender Wertvorstellungen Informationen über andere Religionen und Kulturen, interkulturelle Begegnungen infolge von Migration, Fluchtursachen ... Grundbegriffe: Klischee, Toleranz, Vorurteil Inhaltsbezogener Kompetenzbereich: Fragen nach Orientierungsmöglichkeiten Leitthema: Aspekte von Religionen und Weltanschauungen Erwartete Kompetenzen am Ende von Schuljahrgang Mögliche Inhalte für den Kompetenzerwerb Die Schülerinnen und Schüler ... arbeiten Gottesvorstellungen in",Niedersachsen,Oberschule.pdf,,,"Ethik, Philo"
5,8,0.9826916539434644,die verbindlichen Grundbegriffe Schuljahrgänge und Schuljahrgänge und Schuljahrgänge und Erfolg/Misserfolg Familienformen Freundschaft glückliches Leben das Göttliche Goldene Regel Idol Klischee Mobbing Monotheismus/Polytheismus Naturwissenschaft Normen Religiosität Ritual Schöpfung Toleranz Verantwortungsbewusstsein Vorbild Vorurteil Werte Ethik Geschlechterrolle Grundbedürfnisse Initiationsritus Konflikt Konvention Krise Liebe Menschenbild Menschenrechte Menschenwürde Mobbing Orientierung Prävention Selbstbestimmung Selbstwertgefühl Sexualität soziale Rolle Sucht Weltanschauung Weltbild Endlichkeit Erkennen Ethik Gender/Sex Gewalt Glauben/Meinen/Wissen Glück,Niedersachsen,Oberschule.pdf,,,"Ethik, Philo"
6,10,0.9639977477637196,"Schüler also dazu auf, sich eigene und ihnen begegnende Wahrheits- und Wirklichkeitsvorstellungen bewusst zu machen und die Voraussetzungen ihrer Urteile über Wirklichkeit zu reflektieren. Kritisch hinterfragen die Schülerinnen und Schüler Vorurteile und Klischees und erweitern durch die Auseinandersetzung mit unbekannten Lebens- und Sinnentwürfen ihr Fremdverstehen und ihre Fähigkeit zur Perspektivenübernahme. Sie prüfen den Inhalt, den Anspruch und die Tragweite von Menschenrechten",Niedersachsen,Oberschule.pdf,,,"Ethik, Philo"
7,1,0.979068537624735,"... beschreiben unterschiedliche Formen der Lebensgestaltung. verschiedene Interessen, unterschiedliche Herkunft und Sitten, auch in der Folge von Migration Kleidung, Körpersprache, Mimik, Sprachstil, Umgangsformen, Temperament, auffällige Merkmale benennen Beispiele für gängige Vorurteile und Klischees. Vorurteile und Klischees bezogen auf Aussehen, Geschlechterrollen, Lebensalter, Religionszugehörigkeit, soziale und ethnische Herkunft Klischees und Stereotype in den Medien erläutern Ursachen und Folgen von Vorurteilen. Unkenntnis, Desinteresse, Intoleranz,",Niedersachsen,Oberschule.pdf,,,"Ethik, Philo"
8,1,0.9795447102454181,"Formen der Lebensgestaltung. verschiedene Interessen, unterschiedliche Herkunft und Sitten, auch in der Folge von Migration Kleidung, Körpersprache, Mimik, Sprachstil, Umgangsformen, Temperament, auffällige Merkmale benennen Beispiele für gängige Vorurteile und Klischees. Vorurteile und Klischees bezogen auf Aussehen, Geschlechterrollen, Lebensalter, Religionszugehörigkeit, soziale und ethnische Herkunft Klischees und Stereotype in den Medien erläutern Ursachen und Folgen von Vorurteilen. Unkenntnis, Desinteresse, Intoleranz, Unsicherheit, Schwarz-Weiß-Denken, Stärkung",Niedersachsen,Oberschule.pdf,,,"Ethik, Philo"
9,6,0.974998618774291,"... untersuchen geschlechtsspezifische Rollenerwartungen im Bereich von Liebe und Sexualität und setzen sich mit diesen auseinander. vermeintlich typisch männliche bzw. typisch weibliche Eigenschaften und Vorstellungen, unterschiedliche Kommunikationsformen, Rollenverhalten der Geschlechter, Vorurteile gegenüber Homosexualität Sexualität und Rollenklischees in den Medien diskutieren Möglichkeiten und Grenzen sexueller Selbstbestimmung in Vergangenheit und Gegenwart. Konventionen im historischen Vergleich Liebe und Sexualität im Spannungsfeld von Partnerwahl und",Niedersachsen,Oberschule.pdf,,,"Ethik, Philo"
10,6,0.9653823006112312,"zusätzlich dazu bei, dass die Schülerinnen und Schüler mit einer Fülle diverser Wahrheits- und Wirklichkeitsvorstellungen konfrontiert werden. Nicht selten dominiert dabei eine verzerrte oder zumindest bruchstückhafte Informationsvermittlung, die zu Klischees, Vorurteilen und Diskriminierungen führen kann. Daraus ergibt sich die Notwendigkeit, den Schülerinnen und Schülern Wege zu einer eigenständigen und kritischen Sichtweise auf die unterschiedlichen Wahrheits- und Wirklichkeitskonzeptionen zu eröffnen. Auch für",Niedersachsen,Oberschule.pdf,,,"Ethik, Philo"
11,1,0.9785704875808157,"Beispiele für gängige Vorurteile und Klischees. Vorurteile und Klischees bezogen auf Aussehen, Geschlechterrollen, Lebensalter, Religionszugehörigkeit, soziale und ethnische Herkunft Klischees und Stereotype in den Medien erläutern Ursachen und Folgen von Vorurteilen. Unkenntnis, Desinteresse, Intoleranz, Unsicherheit, Schwarz-Weiß-Denken, Stärkung des Ich- und Wir-Gefühls, Aufbau von Feindbildern, Ausgrenzung, Diskriminierung, Konflikte, Gewalt diskutieren Möglichkeiten und Voraussetzungen eines toleranten Zusammenlebens. Minimalkonsens grundlegender Wertvorstellungen Informationen über andere",Niedersachsen,Oberschule.pdf,,,"Ethik, Philo"
12,10,0.6140264218714759,"der Welt Welt und Transzendenz Feste und Riten im Christentum, Islam und Judentum Sollen Stunden Rechte und Regeln - Konflikte Moralisches Handeln - Werte und Normen Toleranz und Respekt - Vorurteil Wahrheit und Ehrlichkeit - Lüge Wege zum Glück - Freizeit Vorstellungen des guten Lebens Sein: Ich Mensch sein Ethik / Wer bin ich - Wer will ich sein In der",Saarland,GemS,"5,6",2018.0,"Ethik, Philo"
13,9,0.9549928169595434,"geraten Untersuchung an Fallbeispielen; Lösungsmöglichkeiten Handeln Projekt: Ausbildung in einem Streitschlichterprogramm - Institutionalisierung von Mediation in der Klassen-/Schulgemeinschaft Sollen: Moralisches Handeln Werte und Normen Ethik / Toleranz und Respekt - Vorurteil Jeder Mensch ist einzigartig und unterscheidet sich von anderen. Zugleich gehört es zu seinem Wesen, in Gemeinschaft zu leben. Toleranz und Respekt bilden die Grundlage für ein friedliches Miteinander. Dabei",Saarland,GemS,"5,6",2018.0,"Ethik, Philo"
14,9,0.9699979713173009,Eigenschaften/Interessen unterscheiden Respekt und Toleranz. begründetes Zuordnen: Beispiele für Respekt und Toleranz Unterscheidungskriterien anwenden: anerkennen - dulden Sollen: Moralisches Handeln - Werte und Normen Ethik / Toleranz und Respekt - Vorurteil inhaltsbezogene Kompetenzen methodisch-didaktische Hinweise Diskussion: Gibt es Grenzen der Toleranz Handeln Klassenregeln gemeinsam aushandeln und realisieren - auch für die Lehrkräfte Realisieren einer symmetrischen Kommunikation Sollen: Moralisches Handeln Werte und,Saarland,GemS,"5,6",2018.0,"Ethik, Philo"
15,10,0.8751427270567866,"die Position des anderen verstehen und wertschätzen zu können, Toleranz für den Anspruch, trotz unverhandelbar unterschiedlicher Auffassungen dem anderen seine Lebensweise zuzugestehen. Voraussetzung für beide Haltungen ist die Fähigkeit, eigene Vorurteile zu erkennen und in Frage zu stellen. Denkanstöße Einzigartig sein und in Gemeinschaft leben - wie geht das Friedliches Miteinander und gegenseitige Anerkennung - zwei Seiten einer Medaille. Möglichkeiten und",Saarland,GemS,"5,6",2018.0,"Ethik, Philo"
16,9,0.9785708759215199,"denen sie fremd waren, Beschreiben, Schreiben, Vergleichen: Meine Geschichte vom Fremd-Sein: Schulwechsel, neuer Verein, neue Freunde etc. Gefühle beschreiben, Kurzgeschichten schreiben Erfahrungsbericht: Versuchen, etwas Fremdes auszuprobieren nennen, beschreiben und vergleichen Vorurteile, nennen und beschreiben mögliche Gründe für Vorurteile, diskutieren, inwiefern Vorurteile gefährlich sind, Rollenspiel: Darstellen von positiven und negativen Eigenschaften Beobachtungsprotokolle vergleichen, Gefühle beschreiben prüfen die Möglichkeit, Vorurteile durch gegenseitiges Kennenlernen",Saarland,GemS,"5,6",2018.0,"Ethik, Philo"
17,9,0.9799996420322051,"Meine Geschichte vom Fremd-Sein: Schulwechsel, neuer Verein, neue Freunde etc. Gefühle beschreiben, Kurzgeschichten schreiben Erfahrungsbericht: Versuchen, etwas Fremdes auszuprobieren nennen, beschreiben und vergleichen Vorurteile, nennen und beschreiben mögliche Gründe für Vorurteile, diskutieren, inwiefern Vorurteile gefährlich sind, Rollenspiel: Darstellen von positiven und negativen Eigenschaften Beobachtungsprotokolle vergleichen, Gefühle beschreiben prüfen die Möglichkeit, Vorurteile durch gegenseitiges Kennenlernen abzubauen, Kennenlernübungen Steckbrief erstellen, Stuhlkreisspiele, Gruppenbildung nach",Saarland,GemS,"5,6",2018.0,"Ethik, Philo"
18,9,0.9804344815725038,"Fremd-Sein: Schulwechsel, neuer Verein, neue Freunde etc. Gefühle beschreiben, Kurzgeschichten schreiben Erfahrungsbericht: Versuchen, etwas Fremdes auszuprobieren nennen, beschreiben und vergleichen Vorurteile, nennen und beschreiben mögliche Gründe für Vorurteile, diskutieren, inwiefern Vorurteile gefährlich sind, Rollenspiel: Darstellen von positiven und negativen Eigenschaften Beobachtungsprotokolle vergleichen, Gefühle beschreiben prüfen die Möglichkeit, Vorurteile durch gegenseitiges Kennenlernen abzubauen, Kennenlernübungen Steckbrief erstellen, Stuhlkreisspiele, Gruppenbildung nach besonderen Eigenschaften/Interessen unterscheiden",Saarland,GemS,"5,6",2018.0,"Ethik, Philo"
19,9,0.9774993191377122,"beschreiben und vergleichen Vorurteile, nennen und beschreiben mögliche Gründe für Vorurteile, diskutieren, inwiefern Vorurteile gefährlich sind, Rollenspiel: Darstellen von positiven und negativen Eigenschaften Beobachtungsprotokolle vergleichen, Gefühle beschreiben prüfen die Möglichkeit, Vorurteile durch gegenseitiges Kennenlernen abzubauen, Kennenlernübungen Steckbrief erstellen, Stuhlkreisspiele, Gruppenbildung nach besonderen Eigenschaften/Interessen unterscheiden Respekt und Toleranz. begründetes Zuordnen: Beispiele für Respekt und Toleranz Unterscheidungskriterien anwenden: anerkennen - dulden Sollen: Moralisches",Saarland,GemS,"5,6",2018.0,"Ethik, Philo"
20,7,0.9357052353156678,"Schülerinnen und Schüler ... akzeptieren Konflikte als alltägliche Herausforderung ihres Menschseins und nutzen die Entwicklungsmöglichkeiten, die sie bieten. erkennen mögliche Ursachen von Konflikten, indem sie Motive und Interessen sowie ggf. Vorurteile, unterschiedliche Wahrnehmungen und einfach strukturierte Kommunikationsprobleme analysieren. sprechen Konflikte offen an und geben sich nicht mit Scheinlösungen zufrieden. lösen einfach strukturierte Konflikte gewaltfrei, indem sie Kompromisse herbeiführen und Vereinbarungen für",Bayern,Gym,7,,"Ethik, Philo"
21,10,0.820247916515997,"Bedeutung der Zuschauer bewusst und tragen zur Beendigung von Mobbingfällen bei. Inhalte zu den Kompetenzen: Sach- und Beziehungsebene in der Kommunikation Ursachen von Konflikten: unterschiedliche Wahrnehmung, Interessen, Motive und Erwartungen, Vorurteile, Kommunikations- und Beziehungsprobleme Konflikte als Chance: Klärung zwischenmenschlicher Beziehungen, Interessenausgleich, persönliche Weiterentwicklung Konflikte in der eigenen Lebenswelt Eltern, Lehrer, Gleichaltrige und in der Literatur z. B. Jugendbuch, Analyse von Dialogen",Bayern,Gym,7,,"Ethik, Philo"
22,5,0.7386962007201786,"Genuss, zum Beispiel beim Betrachten von Bildern und beim Hören von Musik. Inhalte zu den Kompetenzen: Wahrnehmung durch die Sinnesorgane z. B. Wahrnehmungsspiele Bedingungen der Wahrnehmung Erfahrung, Information, Subjektivität, Täuschung, Vorurteil und Stereotyp, Einschätzung von Situationen Fremd- und Selbstwahrnehmung: charakteristische Merkmale der Person, eigene und fremde Gefühle und Bedürfnisse, Feedbackregeln Wahrnehmung als Erlebnis z. B. Bilder, Musik, Ruhe verschiedene Arten von",Bayern,Gym,5,,"Ethik, Philo"
23,5,0.6986008852167038,"abhängt. nehmen grundlegende Gefühle wahr und benennen sie. geben und empfangen Feedback zu Wahrnehmungen auf wertschätzende Art. überprüfen in überschaubaren Alltagszusammenhängen ihre ersten Urteile darauf, ob es sich dabei um Vorurteile handelt. machen sich eigene Bedürfnisse und die Bedürfnisse anderer bewusst und erkennen den inneren Zusammenhang von Bedürfnissen und Regeln. wägen in Alltagssituationen ab, ob der Verzicht auf sofortige Bedürfnisbefriedigung vorteilhaft",Bayern,Gym,5,,"Ethik, Philo"
24,1,0.595109201597019,"erläutern. Die Schülerinnen und Schüler können Ursachen und Folgen von Konflikten an Beispielen herausarbeiten und im Zusammenhang mit Vorstellungen eines friedlichen Zusammenlebens untersuchen zum Beispiel bezogen auf Intoleranz, Ungerechtigkeit, Wertekollision, Vorurteile, Diskriminierung BTV Konfliktbewältigung und Interessenausgleich Formen von Gewalt in ihrer eigenen Lebenswelt identifizieren, unterscheiden und diskutieren zum Beispiel physische, psychische, individuelle, kollektive Gewalt PG Mobbing und Gewalt moralische Werte und",BaWü,Gym,,2016.0,"Ethik, Philo"
25,5,0.37007731814872996,"soziales Wesen erfassen, Formen des Zusammenlebens beschreiben und eigene Erfahrungen mit verschiedenen Gruppen darlegen und bewerten. Sie können Erfahrungen mit Andersheit und Fremdheit, auch im Hinblick auf die Bedeutung von Vorurteilen, in ihrer Wirkung aufzeigen und erläutern. Sie können Grundlagen eines guten und friedlichen Miteinanders erarbeiten und begründen. Die Schülerinnen und Schüler können verschiedene Beziehungsformen beschreiben zum Beispiel Familie, Freundeskreis, Schulklasse,",BaWü,Gym,,2016.0,"Ethik, Philo"
26,3,0.9294039908693493,"und mögliche Folgen zum Beispiel Erkenntnisgewinn, Freundschaft, Verunsicherung, Ausgrenzung darlegen und diskutieren BNE Kriterien für nachhaltigkeitsfördernde und -hemmende Handlungen im Zusammenhang mit Erfahrungen von Andersheit und Fremdheit die Rolle von Vorurteilen identifizieren und prüfen BTV Formen von Vorurteilen, Stereotypen, Klischees; Toleranz, Solidarität, Inklusion, Antidiskriminierung mögliche Handlungsweisen zum Beispiel Ausgrenzung, Sprachgebrauch, Hilfsbereitschaft im Hinblick auf einen wertorientierten Umgang miteinander zum Beispiel Achtung,",BaWü,Gym,,2016.0,"Ethik, Philo"
27,3,0.9709632081273396,"Verunsicherung, Ausgrenzung darlegen und diskutieren BNE Kriterien für nachhaltigkeitsfördernde und -hemmende Handlungen im Zusammenhang mit Erfahrungen von Andersheit und Fremdheit die Rolle von Vorurteilen identifizieren und prüfen BTV Formen von Vorurteilen, Stereotypen, Klischees; Toleranz, Solidarität, Inklusion, Antidiskriminierung mögliche Handlungsweisen zum Beispiel Ausgrenzung, Sprachgebrauch, Hilfsbereitschaft im Hinblick auf einen wertorientierten Umgang miteinander zum Beispiel Achtung, Gerechtigkeit, Kinderrechte diskutieren und bewerten Wahrnehmen und",BaWü,Gym,,2016.0,"Ethik, Philo"
28,4,0.930760449289397,"für den ersten allgemeinbildenden Schulabschluss Mindestanforderungen für den mittleren Schulabschluss Mindestanforderungen für den Übergang in die Studienstufe Die Schülerinnen und Schüler ... A Voraussetzungen und Denkwege analysieren identifizieren mit Hilfestellung Vorurteile, Gewohnheiten, Verständnisschwierigkeite n und fehlendes Wissen für einen begründeten Problemlösungsvorschlag oder eine klare Positionierung bei sich und anderen und analysieren Ursachen und Gründe. identifizieren Vorurteile, Gewohnheiten, Verständnisschwierigkeiten und fehlendes Wissen",Hamburg,Stadtteilschule,5-11,2024.0,"Ethik, Philo"
29,4,0.9470521237550741,"Denkwege analysieren identifizieren mit Hilfestellung Vorurteile, Gewohnheiten, Verständnisschwierigkeite n und fehlendes Wissen für einen begründeten Problemlösungsvorschlag oder eine klare Positionierung bei sich und anderen und analysieren Ursachen und Gründe. identifizieren Vorurteile, Gewohnheiten, Verständnisschwierigkeiten und fehlendes Wissen für einen begründeten Problemlösungsvorschlag oder eine klare Positionierung bei sich und anderen und analysieren Ursachen und Gründe, unterscheiden intuitive Positionierungen und unbegründete Überzeugungen von methodisch",Hamburg,Stadtteilschule,5-11,2024.0,"Ethik, Philo"
30,4,0.9437421752088477,"für einen begründeten Problemlösungsvorschlag oder eine klare Positionierung bei sich und anderen und analysieren Ursachen und Gründe, unterscheiden intuitive Positionierungen und unbegründete Überzeugungen von methodisch nachvollziehbar gebildeten Urteilen. identifizieren differenziert Vorurteile, Gewohnheiten, Verständnisschwierigkeiten und fehlendes Wissen für einen begründeten Problemlösungsvorschlag oder eine klare Positionierung bei sich und anderen und analysieren differenziert Ursachen und Gründe, unterscheiden differenziert intuitive Positionierungen und unbegründete Überzeugungen",Hamburg,Stadtteilschule,5-11,2024.0,"Ethik, Philo"
31,5,0.9499924095341701,"Bezüge III PM Allgemeine Ethik III WM Angewandte Ethik III WM Gerechtigkeit IV PM Brücken in eine friedliche Zukunft bleibt zunächst leer Frieden Frieden als Wert Gefährdung des Friedens durch Vorurteile, Diskriminierungen und Feindbilder Wertevielfalt, Wertekonflikte und universelle Werte Beitrag zur Leitperspektive W: Die Schülerinnen und Schüler erkennen Frieden als wichtigen demokratischen Grundwert und seine Verbindung zu anderen Werten wie z.",Hamburg,Stadtteilschule,5-11,2024.0,"Ethik, Philo"
32,10,0.6140264218714759,"der Welt Welt und Transzendenz Feste und Riten im Christentum, Islam und Judentum Sollen Stunden Rechte und Regeln - Konflikte Moralisches Handeln - Werte und Normen Toleranz und Respekt - Vorurteil Wahrheit und Ehrlichkeit - Lüge Wege zum Glück - Freizeit Vorstellungen des guten Lebens Sein: Ich Mensch sein Ethik / Wer bin ich - Wer will ich sein In der",Saarland,Gym,"5,6",2018.0,"Ethik, Philo"
33,9,0.9549928169595434,"geraten Untersuchung an Fallbeispielen; Lösungsmöglichkeiten Handeln Projekt: Ausbildung in einem Streitschlichterprogramm - Institutionalisierung von Mediation in der Klassen-/Schulgemeinschaft Sollen: Moralisches Handeln Werte und Normen Ethik / Toleranz und Respekt - Vorurteil Jeder Mensch ist einzigartig und unterscheidet sich von anderen. Zugleich gehört es zu seinem Wesen, in Gemeinschaft zu leben. Toleranz und Respekt bilden die Grundlage für ein friedliches Miteinander. Dabei",Saarland,Gym,"5,6",2018.0,"Ethik, Philo"
34,9,0.9699979713173009,Eigenschaften/Interessen unterscheiden Respekt und Toleranz. begründetes Zuordnen: Beispiele für Respekt und Toleranz Unterscheidungskriterien anwenden: anerkennen - dulden Sollen: Moralisches Handeln - Werte und Normen Ethik / Toleranz und Respekt - Vorurteil inhaltsbezogene Kompetenzen methodisch-didaktische Hinweise Diskussion: Gibt es Grenzen der Toleranz Handeln Klassenregeln gemeinsam aushandeln und realisieren - auch für die Lehrkräfte Realisieren einer symmetrischen Kommunikation Sollen: Moralisches Handeln Werte und,Saarland,Gym,"5,6",2018.0,"Ethik, Philo"
35,10,0.8751427270567866,"die Position des anderen verstehen und wertschätzen zu können, Toleranz für den Anspruch, trotz unverhandelbar unterschiedlicher Auffassungen dem anderen seine Lebensweise zuzugestehen. Voraussetzung für beide Haltungen ist die Fähigkeit, eigene Vorurteile zu erkennen und in Frage zu stellen. Denkanstöße Einzigartig sein und in Gemeinschaft leben - wie geht das Friedliches Miteinander und gegenseitige Anerkennung - zwei Seiten einer Medaille. Möglichkeiten und",Saarland,Gym,"5,6",2018.0,"Ethik, Philo"
36,9,0.9785708759215199,"denen sie fremd waren, Beschreiben, Schreiben, Vergleichen: Meine Geschichte vom Fremd-Sein: Schulwechsel, neuer Verein, neue Freunde etc. Gefühle beschreiben, Kurzgeschichten schreiben Erfahrungsbericht: Versuchen, etwas Fremdes auszuprobieren nennen, beschreiben und vergleichen Vorurteile, nennen und beschreiben mögliche Gründe für Vorurteile, diskutieren, inwiefern Vorurteile gefährlich sind, Rollenspiel: Darstellen von positiven und negativen Eigenschaften Beobachtungsprotokolle vergleichen, Gefühle beschreiben prüfen die Möglichkeit, Vorurteile durch gegenseitiges Kennenlernen",Saarland,Gym,"5,6",2018.0,"Ethik, Philo"
37,9,0.9799996420322051,"Meine Geschichte vom Fremd-Sein: Schulwechsel, neuer Verein, neue Freunde etc. Gefühle beschreiben, Kurzgeschichten schreiben Erfahrungsbericht: Versuchen, etwas Fremdes auszuprobieren nennen, beschreiben und vergleichen Vorurteile, nennen und beschreiben mögliche Gründe für Vorurteile, diskutieren, inwiefern Vorurteile gefährlich sind, Rollenspiel: Darstellen von positiven und negativen Eigenschaften Beobachtungsprotokolle vergleichen, Gefühle beschreiben prüfen die Möglichkeit, Vorurteile durch gegenseitiges Kennenlernen abzubauen, Kennenlernübungen Steckbrief erstellen, Stuhlkreisspiele, Gruppenbildung nach",Saarland,Gym,"5,6",2018.0,"Ethik, Philo"
38,9,0.9804344815725038,"Fremd-Sein: Schulwechsel, neuer Verein, neue Freunde etc. Gefühle beschreiben, Kurzgeschichten schreiben Erfahrungsbericht: Versuchen, etwas Fremdes auszuprobieren nennen, beschreiben und vergleichen Vorurteile, nennen und beschreiben mögliche Gründe für Vorurteile, diskutieren, inwiefern Vorurteile gefährlich sind, Rollenspiel: Darstellen von positiven und negativen Eigenschaften Beobachtungsprotokolle vergleichen, Gefühle beschreiben prüfen die Möglichkeit, Vorurteile durch gegenseitiges Kennenlernen abzubauen, Kennenlernübungen Steckbrief erstellen, Stuhlkreisspiele, Gruppenbildung nach besonderen Eigenschaften/Interessen unterscheiden",Saarland,Gym,"5,6",2018.0,"Ethik, Philo"
39,9,0.9774993191377122,"beschreiben und vergleichen Vorurteile, nennen und beschreiben mögliche Gründe für Vorurteile, diskutieren, inwiefern Vorurteile gefährlich sind, Rollenspiel: Darstellen von positiven und negativen Eigenschaften Beobachtungsprotokolle vergleichen, Gefühle beschreiben prüfen die Möglichkeit, Vorurteile durch gegenseitiges Kennenlernen abzubauen, Kennenlernübungen Steckbrief erstellen, Stuhlkreisspiele, Gruppenbildung nach besonderen Eigenschaften/Interessen unterscheiden Respekt und Toleranz. begründetes Zuordnen: Beispiele für Respekt und Toleranz Unterscheidungskriterien anwenden: anerkennen - dulden Sollen: Moralisches",Saarland,Gym,"5,6",2018.0,"Ethik, Philo"
40,4,0.9689630988358197,"des Antisemitismus Werteorientierung Lernbereich : Der Mensch und seine Verantwortung für den Mitmenschen Ustd. Kennen der Entstehung von Vorurteilen und von Möglichkeiten zum Abbau von Vorurteilen Kein Mensch ist ohne Vorurteil. Jeder Mensch muss bereit sein, Vorurteile zu prüfen und gegebenenfalls zu korrigieren. Werteorientierung Unterscheidung der Begriffe Urteil und Vorurteil Urteil als subjektive, aber begründete Entscheidung Vorurteile als Ergebnis begrenzter Wahrnehmung",Sachsen,Oberschule,,2019.0,"Ethik, Philo"
