document_id,most_prevalent_topic_id,most_prevalent_topic_probability,text_excerpt,state,school type,grade,year,subject
0,6,0.9463097032809151,"Gottesvorstellungen in polytheistischen und monotheistischen Religionen heraus. altägyptische, griechische, römische, germanische Gottheiten, Jahwe, Gott, Allah Göttergeschichten z. B. ägyptische, griechische, indische Mythologien naturreligiöse Schöpfungsgeschichten vergleichen Schöpfungsmythen und naturwissenschaftliche Darstellungen der Evolution des Menschen. Genesis und Evolutionslehre Schöpfungserzählungen als Glaubensaussagen, Wissenschaft als Deutungsansatz, Urknalltheorie vergleichen wesentliche Aspekte religiöser Praxis im Lebensalltag. Gotteshäuser, heilige Orte, Feste und Feiern, Zeiten und Symbole, Rituale, Bräuche,",Niedersachsen,Oberschule.pdf,,,"Ethik, Philo"
1,6,0.9780142699025491,"des Islam, Achtfacher Pfad, Konfuzianismus etc. setzen sich mit grundlegenden Aspekten religiöser und weltanschaulicher Menschenund Weltbilder auseinander. Mensch als Ebenbild Gottes, Mensch als Teil der Schöpfung, Mensch als Produkt der Evolution, humanistisches Menschenbild, Mensch als Bedürfnis- und Triebwesen Welt als Schöpfung, Weltbilder in Mythen ptolemäisches vs. kopernikanisches Weltbild Welt als Produkt des Zufalls ... Grundbegriffe: Ethik, Initiationsritus, Menschenbild, Weltanschauung, Weltbild Schuljahrgänge",Niedersachsen,Oberschule.pdf,,,"Ethik, Philo"
2,3,0.6160346821974998,"aller Zeiten festgelegt waren, hatten wir offenbar nie wirklich die Wahl, deshalb sind wir weder verantwortlich für unsere Taten noch verdienen wir Lob oder Tadel für sie. Im Laufe der Evolution bestand der entscheidende Schritt auf dem Weg zur willentlichen Verhaltenssteuerung darin, dass einige Lebewesen die Fähigkeit entwickelten, ihr Verhalten an der inneren Vorstellung zukünftiger Zustände auszurichten. Es sind insbesondere zwei",,,,2006.0,"Ethik, Philo"
3,6,0.7264584508566608,"Kausalität in der gesamten Welt und somit auch bei menschlichen Entscheidungen aus, womit dem Menschen dann auch keine Verantwortung für seine Handlungen zukäme. Die Entwicklung willentlichen Handelns im Laufe der Evolution gründet auf der Fähigkeit zur Antizipation. Dazu gehören die gedankliche Vorwegnahme von Handlungsfolgen und von Bedürfnislagen sowie die entsprechende Anpassung des Verhaltens. Da aber aktuelle Bedürfnisse häufig in Konkurrenz zu",,,,2006.0,"Ethik, Philo"
4,3,0.49408941163578635,"Arbeit mit Bildern und Gedichten Empathie und Perspektivwechsel Sich positionieren zu zentralen Unterscheidungen Mensch und Tier Abgrenzung des Menschen vom Tier in natürlicher Gestalt, Beschaffenheit, Erkenntniskraft, Sprache und Denken biologische, evolutionäre Anthropologie und Hirnforschung Prometheusmythos Mensch als Mängelwesen Begriffsanalyse: Instinkt, Verhalten, Handlung Natur und Kultur menschliche Entwicklung in ihrer Abhängigkeit von Natur und Gesellschaft Bedeutung gesellschaftlicher Strukturen und Institutionen Mensch als",Sachsen,Gym,,2019.0,"Ethik, Philo"
5,7,0.4519419518061439,"das eigene Leben auseinandersetzen zum Beispiel hinsichtlich Sicherheit, Selbstbeschränkung, Identitäten, Konventionen, Gerechtigkeit BTV Selbstfindung und Akzeptanz anderer Lebensformen Analysieren und interpretieren , , Moralphilosophie Angewandte Ethik Religion und Religionskritik BIO Evolution und Ökologie Freiheit und Anthropologie Die Schülerinnen und Schüler können Aspekte philosophischer Anthropologie darstellen und im Kontext von Freiheit diskutieren. Sie können die Funktion von Erziehung, Bildung und Sozialisation kritisch",BaWü,Gym,,2016.0,"Ethik, Philo"
6,7,0.5442060578614029,"bezogen auf Vernunft, Freiheit, Aufklärung anhand von Beispielen aus der Lebenswelt beschreiben und sich damit auseinandersetzen BTV Selbstfindung und Akzeptanz anderer Lebensformen Argumentieren und reflektieren , , Moralphilosophie Verantwortungsethik BIO Evolution und Ökologie Gerechtigkeit, Recht und Zusammenleben Grundlagen des Zusammenlebens Die Schülerinnen und Schüler können Grundlagen des Zusammenlebens in einer pluralistischen Gesellschaft darstellen. Sie können ethisch-moralische Konflikte in einer pluralistischen Gesellschaft",BaWü,Gym,,2016.0,"Ethik, Philo"
7,7,0.9670000963776494,"begründen VB Chancen und Risiken der Lebensführung Analysieren und interpretieren , , , , , , Beurteilen und sich entscheiden , , , , , Freiheit und Naturalismus Moralphilosophie BIO Evolution und Ökologie D Medien GEO Globale Herausforderungen WI Fallstudie Moral, Religion und Kritik Grundlagen philosophischer Ethik Die Schülerinnen und Schüler können Aufgaben von Ethik in einer pluralistischen Gesellschaft benennen und",BaWü,Gym,,2016.0,"Ethik, Philo"
8,7,0.4154955401542054,"den Stellenwert von Freiheit in gesellschaftlichen Kontroversen zum Beispiel in Kulturen, Medien, Medizin, Religion, Wirtschaft herausarbeiten und diskutieren Analysieren und interpretieren , , Moralphilosophie Angewandte Ethik Religion und Religionskritik BIO Evolution und Ökologie Freiheit und Anthropologie Die Schülerinnen und Schüler können Aspekte philosophischer Anthropologie darstellen und im Kontext von Freiheit diskutieren. Sie können unterschiedliche Zugänge zum Menschen und zur Welt vergleichen",BaWü,Gym,,2016.0,"Ethik, Philo"
9,7,0.4044505393094353,"erarbeiten und sich damit auseinandersetzen zum Beispiel bezogen auf Selbstoptimierung, Beschleunigung, Rationalisierung BTV Selbstfindung und Akzeptanz anderer Lebensformen Argumentieren und reflektieren , , Gerechtigkeit und globalisierte Welt Moralphilosophie Verantwortungsethik BIO Evolution und Ökologie Freiheit und digitale Welt Die Schülerinnen und Schüler können die digitale Welt in Grundzügen beschreiben und ethische Probleme der Digitalisierung erfassen und reflektiert darlegen. Sie können Freiheit und",BaWü,Gym,,2016.0,"Ethik, Philo"
10,7,0.9191947326639448,"reflektiert begründen BNE Demokratiefähigkeit Analysieren und interpretieren , , , , , Beurteilen und sich entscheiden , , , , , Freiheit und Naturalismus Freiheit und digitale Welt Moralphilosophie BIO Evolution und Ökologie D Medien GEO Globale Herausforderungen WI Fallstudie Moral, Religion und Kritik Grundlagen philosophischer Ethik Die Schülerinnen und Schüler können Aufgaben von Ethik in einer pluralistischen Gesellschaft benennen und",BaWü,Gym,,2016.0,"Ethik, Philo"
11,6,0.7361082950955571,"von Religionen und Weltanschauungen Verbindliche Unterrichtsaspekte: Unterscheidung von sogenannten Weltreligionen und ethnischen Religionen religiöse Phänomene in ihrem kulturellen Kontext Adaption ethnischer Religionen im zeitgenössischen Kontext Mögliche Konkretisierungen und Ergänzungen: die Evolution von Religionen aus primitiven Kulturen z. B. Lubbock, Frazer Kategorien des Religiösen z. B. Naturreligion, Animismus, Hochgötter, Schamenentum, religiöse Schriften, Monotheismus/Polytheismus, Ethik und Moral Kritik des Begriffs primitive Religion z.",Niedersachsen,Gym,Sek2,2018.0,"Ethik, Philo"
12,7,0.9642700028838891,"BNE Friedensstrategien BNE Friedensstrategien Analysieren und interpretieren , , , , Argumentieren und reflektieren , , , Beurteilen und sich entscheiden , , Gesellschaft und Toleranz Glück und Moral BIO Evolution GK Aufgaben und Probleme des Sozialstaats Analysieren und interpretieren , , , , Argumentieren und reflektieren , , , Beurteilen und sich entscheiden , , Gesellschaft und Toleranz Glück und",BaWü,,Sek1,2016.0,"Ethik, Philo"
13,7,0.962717155005615,"und Probleme des Sozialstaats Analysieren und interpretieren , , , , Argumentieren und reflektieren , , , Beurteilen und sich entscheiden , , Gesellschaft und Toleranz Glück und Moral BIO Evolution GK Aufgaben und Probleme des Sozialstaats Analysieren und interpretieren , , , , Argumentieren und reflektieren , , , Beurteilen und sich entscheiden , , Gesellschaft und Toleranz Glück und",BaWü,,Sek1,2016.0,"Ethik, Philo"
14,7,0.7648581031058287,"und Probleme des Sozialstaats Analysieren und interpretieren , , , , Argumentieren und reflektieren , , , Beurteilen und sich entscheiden , , Gesellschaft und Toleranz Glück und Moral BIO Evolution GK Aufgaben und Probleme des Sozialstaats Gesellschaft und Toleranz Die Schülerinnen und Schüler können die moderne Lebenswelt in ihrer Vielfalt erfassen und die Bedeutung von Toleranz beschreiben. Sie können Orientierungshilfen",BaWü,,Sek1,2016.0,"Ethik, Philo"
15,3,0.7603450488619379,"Sonderstellung des Menschen Werte und Normen des Handelns im interkulturellen Kontext Umfang und Grenzen staatlichen Handelns SACHKOMPETENZ Die Schülerinnen und Schüler erläutern Merkmale des Menschen als eines aus der natürlichen Evolution hervorgegangenen Lebewesens und erklären wesentliche Unterschiede zwischen Mensch und Tier bzw. anderen nicht menschlichen Lebensformen u. a. Sprache, Kultur, analysieren einen anthropologischen Ansatz zur Bestimmung des Unterschiedes von Mensch und",NRW,Gym,Sek2,2014.0,"Ethik, Philo"
16,3,0.632132965985784,"zwischen Mensch und Tier bzw. anderen nicht menschlichen Lebensformen u. a. Sprache, Kultur, analysieren einen anthropologischen Ansatz zur Bestimmung des Unterschiedes von Mensch und Tier auf der Basis ihrer gemeinsamen evolutionären Herkunft in seinen Grundgedanken, rekonstruieren einen relativistischen und einen universalistischen ethischen Ansatz in ihren Grundgedanken und erläutern diese Ansätze an Beispielen, analysieren unterschiedliche rechtsphilosophische Ansätze zur Begründung für Eingriffe in",NRW,Gym,Sek2,2014.0,"Ethik, Philo"
17,6,0.5498446002133563,"Moderne, um daraus Orientierung in grundlegenden Lebensfragen zu erhalten. entwickeln in der mehrperspektivischen Auseinandersetzung mit der Wesensbestimmung des Menschen ein differenziertes Verständnis von sich selbst und anderen. erkennen Einflüsse der evolutionären Herkunft des Menschen auf sein Verhalten. erkennen Sprachlichkeit als Charakteristikum des Menschen, das seine Wahrnehmung, sein Denken und sein Handeln prägt. ordnen in ihr eigenes Bild vom Menschen wesentliche Erkenntnisse",Bayern,Gym,11,,"Ethik, Philo"
18,6,0.978543468221516,"Humanismus, Fünf-Säulen des Islam, Achtfacher Pfad, Konfuzianismus etc. erläutern grundlegende Aspekte religiöser und weltanschaulicher Menschen- und Weltbilder. Mensch als Ebenbild Gottes, Mensch als Teil der Schöpfung, Mensch als Produkt der Evolution, humanistisches Menschenbild, Mensch als Bedürfnis- und Triebwesen Welt als Schöpfung, Weltbilder in Mythen ptolemäisches vs. kopernikanisches Weltbild Welt als Produkt des Zufalls ... Grundbegriffe: Ethik, Initiationsritus, Menschenbild, Weltanschauung, Weltbild Schuljahrgänge",Niedersachsen,Gesamtschule,,2017.0,"Ethik, Philo"
19,3,0.3973339899627609,Politik diskutieren mit Blick auf ein politisches Ereignis mögliche analoge und digitale Inszenierungen von Politik oder Protest unter Berücksichtigung verschiedener Kommunikationsabsichten diskutieren - Biologie: Biologische Phänomene auf der Grundlage der Evolution interpretieren naturwissenschaftliche Analyse von Phänomenen anderen Möglichkeiten der Weltbetrachtung gegenüberstellen Recht und Gerechtigkeit: Den Fairness-Gedanken darstellen Phänomenologische Kompetenz - die Aspekte der Zusicherung und Angemessenheit als kritische Merkmale einer fairen,Sachsen-Anhalt,Gym,,2022.0,"Ethik, Philo"
20,6,0.978543468221516,"Humanismus, Fünf-Säulen des Islam, Achtfacher Pfad, Konfuzianismus etc. erläutern grundlegende Aspekte religiöser und weltanschaulicher Menschen- und Weltbilder. Mensch als Ebenbild Gottes, Mensch als Teil der Schöpfung, Mensch als Produkt der Evolution, humanistisches Menschenbild, Mensch als Bedürfnis- und Triebwesen Welt als Schöpfung, Weltbilder in Mythen ptolemäisches vs. kopernikanisches Weltbild Welt als Produkt des Zufalls ... Grundbegriffe: Ethik, Initiationsritus, Menschenbild, Weltanschauung, Weltbild Schuljahrgänge",Niedersachsen,Gym,Sek1,2017.0,"Ethik, Philo"
21,3,0.9547487890922933,"Hoffnung Ist der Mensch Teil der Natur oder steht er ihr gegenüber In welchem Verhältnis stehen Natur und Freiheit, Natur und Geist Gibt es ein Anthropozän Setzt Technik die natürliche Evolution fort Emanzipiert sich der Mensch durch Technik von der Natur Wie kann sich der Mensch auch anders als über die Technik entwickeln und verbessern Ist Vergänglichkeit Fluch oder Segen Ist",Rheinland-Pfalz,,Sek1,2021.0,"Ethik, Philo"
22,6,0.9463097032809151,"Gottesvorstellungen in polytheistischen und monotheistischen Religionen heraus. altägyptische, griechische, römische, germanische Gottheiten, Jahwe, Gott, Allah Göttergeschichten z. B. ägyptische, griechische, indische Mythologien naturreligiöse Schöpfungsgeschichten vergleichen Schöpfungsmythen und naturwissenschaftliche Darstellungen der Evolution des Menschen. Genesis und Evolutionslehre Schöpfungserzählungen als Glaubensaussagen, Wissenschaft als Deutungsansatz, Urknalltheorie vergleichen wesentliche Aspekte religiöser Praxis im Lebensalltag. Gotteshäuser, heilige Orte, Feste und Feiern, Zeiten und Symbole, Rituale, Bräuche,",Niedersachsen,Realschule,,2018.0,"Ethik, Philo"
23,6,0.9785633816019386,"Islam, Achtfacher Pfad, Konfuzianismus etc. setzen sich mit grundlegenden Aspekten religiöser und weltanschaulicher Menschen- und Weltbilder auseinander. Mensch als Ebenbild Gottes, Mensch als Teil der Schöpfung, Mensch als Produkt der Evolution, humanistisches Menschenbild, Mensch als Bedürfnis- und Triebwesen Welt als Schöpfung, Weltbilder in Mythen ptolemäisches vs. kopernikanisches Weltbild Welt als Produkt des Zufalls ... Grundbegriffe: Ethik, Initiationsritus, Menschenbild, Weltanschauung, Weltbild Schuljahrgänge",Niedersachsen,Realschule,,2018.0,"Ethik, Philo"
24,6,0.823071503313883,"Schüler ... benennen Gottesvorstellungen in polytheistischen und monotheistischen Religionen. altägyptische, griechische, römische, germanische Gottheiten, Jahwe, Gott, Allah Göttergeschichten z. B. ägyptische, griechische, indische Mythologien vergleichen Schöpfungsmythen und naturwissenschaftliche Darstellungen der Evolution des Menschen. Genesis und Evolutionslehre Schöpfungserzählungen als Glaubensaussagen, Wissenschaft als Deutungsansatz stellen wesentliche Aspekte religiöser Praxis im Lebensalltag dar. Gotteshäuser, heilige Orte, Feste und Feiern, Zeiten und Symbole, Rituale, Bräuche,",Niedersachsen,Hauptschule,,2018.0,"Ethik, Philo"
25,6,0.9774075321893055,"des Islam, Achtfacher Pfad, Konfuzianismus etc. setzen sich mit grundlegenden Aspekten religiöser und weltanschaulicher Menschenund Weltbilder auseinander. Mensch als Ebenbild Gottes, Mensch als Teil der Schöpfung, Mensch als Produkt der Evolution, humanistisches Menschenbild, Mensch als Bedürfnis- und Triebwesen Welt als Schöpfung, Weltbilder in Mythen ... Grundbegriffe: Initiationsritus, Menschenbild, Weltanschauung, Weltbild Schuljahrgänge und Schuljahrgang : Inhaltsbezogener Kompetenzbereich: Fragen nach dem Ich Leitthema:",Niedersachsen,Hauptschule,,2018.0,"Ethik, Philo"
26,6,0.6517244616247023,"Ist die Sterblichkeit eine Last oder ein Segen - Kann es ein Ich ohne Körper geben - Kann der Mensch die Welt überleben - Ist der Mensch das Ende der Evolution - Läuft die Evolution zum Menschen hin - Welche Bedeutung hat die Schrift für den Menschen - Braucht der Mensch Kunst - Ist der Mensch nur da ganz Mensch, wo",Rheinland-Pfalz,Gym,Sek2,2011.0,"Ethik, Philo"
27,6,0.6851558135963957,"Last oder ein Segen - Kann es ein Ich ohne Körper geben - Kann der Mensch die Welt überleben - Ist der Mensch das Ende der Evolution - Läuft die Evolution zum Menschen hin - Welche Bedeutung hat die Schrift für den Menschen - Braucht der Mensch Kunst - Ist der Mensch nur da ganz Mensch, wo er spielt - Ist",Rheinland-Pfalz,Gym,Sek2,2011.0,"Ethik, Philo"
28,6,0.30078246971288475,"das Gedicht auch ganz ohne einen Bezug zu seiner Philosophie interpretiert bzw. inhaltlich reflektiert werden. Quarks: Bausteine von Atomen I. Unterrichtliche Voraussetzungen Kursthemen: Erkenntnistheorie z. B. Rationalismus, Empirismus, Radikaler Konstruktivismus, Evolutionäre Erkenntnistheorie; Anthropologie anthropologische Grundannahmen aus Antike, Beginn der Neuzeit, Aufklärung, Jh. Auseinandersetzung mit unterschiedlichen philosophischen Textsorten II. Erwartungshorizont Für die Entfaltung möglicher Problemzusammenhänge müssen zunächst die inhaltlichen Aussagen des Gedichttexts",,,,2006.0,"Ethik, Philo"
29,6,0.3929467430024701,"ergeben sich im Hinblick auf Erkenntnistheorie und Anthropologie folgende Bezugsmöglichkeiten: Konstruktivismus z. B. V. GLASERSFELDT, V. FOERSTER; Rationalismus z. B. PLATON, DESCARTES; empiristisch orientierte Ansätze z. B. ARISTOTELES, LOCKE, HUME; evolutionäre Erkenntnistheorie z. B. LORENZ, VOLLMER; Anthropologie z. B. frühe Neuzeit, KANT, Jh.. Im Hinblick auf die Ausdrucksform sind folgende Anknüpfungsmöglichkeiten denkbar: Sprachbilder, Gleichnisse, Mythenerzählungen z. B. PLATON; Lehrgedichte des und",,,,2006.0,"Ethik, Philo"
30,3,0.5176489341921756,"Lehrgedichte des und Jh.; Programmatische Poesie der Romantik z.B. NOVALIS. Vergleichende Reflexionen sind denkbar: zu Möglichkeiten und Grenzen rationalistischer und empiristischer Theorien speziell zum Radikalen Konstruktivismus, z.B. in Auseinandersetzung mit Evolutionärer Erkenntnistheorie zum Sinn philosophischer Erkenntnistheorie z. B. unter Rückgriff auf die Phänomenologie zur Frage im Rahmen der Anthropologie, ob der Mensch die Wirklichkeit durch Wissen und Vernunft beherrschen kann oder",,,,2006.0,"Ethik, Philo"
31,3,0.933809664560739,"der Mensch Mythos - Logos, Alltag - Wissenschaft , Materie, Atom Kosmos, Schpfung, ordo naturalis, Animismus, Theorie Organismus, Mechanismus, Maschine, Demiurg Teleologie, Finalitt, Determinierung, Chaos Einfachheit der Natur, Symmetrie, Gesetzmigkeit, Evolution Themenschwerpunkt : Wie verhlt sich der Mensch der Natur gegenber - Stunden Teilthemen Inhaltsaspekte TT .: Wie geht der Mensch mit der Natur um Betrachten, Beschreiben, Erklren, Erforschen, Genieen Experimentieren,",Rheinland-Pfalz,Gym,Sek2,,"Ethik, Philo"
32,6,0.9681293603799419,Themen Hinweise/Aspekte/Beispiele Themen ...kologie und Umweltschutz Umweltschutz Mensch und Biosphre Natur und Kultur Ethik Anthropologie Philosophie der Natur Informationsverarbeitung und Verhalten Kommunikation Lernen und Gedchtnis Sozialverhalten des Menschen Anthropologie Erkenntnistheorie Evolution und Anthropologie Philosophische Deutungen des Menschen Der Mensch zwischen Freiheit und Norm Gehirn und Geist Anthropologie Ethik Geschichtsphilosophie Knstliche Intelligenz Philosophie des Geistes Informatik Philosophie Themen Hinweise/Aspekte/Beispiele Themen Algorithmen Schrittweise,Rheinland-Pfalz,Gym,Sek2,,"Ethik, Philo"
33,3,0.7597419477068307,"menschlichen Existenz gegenüber der anderer Lebewesen und anderer Lebensformen zu erörtern und zu beurteilen Der Mensch als Teil der Natur - der Mensch als Lebewesen Der Mensch im Spiegel seiner Stammesgeschichte Der Mensch als Lebewesen, das zur Sachlichkeit fähig ist Instinktentbundenheit Der Mensch als Lebewesen, das nach sich selbst fragt Die anthropologische Differenz des Menschen Der Mensch als Lebewesen, das Kultur",Schleswig-Holstein,,,2016.0,"Ethik, Philo"
34,3,0.5378729844584329,"auf gesellschaftliche Denkweisen, Haltungen und Wertmaßstäbe. Aspekte: Herrschaft und politische Teilhabe; Gewaltsame Konflikte, Verfolgungen und Kriege Erkenntnisgewinnung durch Methoden und Medien Beurteilung und Bewertung en und Strukbieten beesellschaftsbsolutismus. sstände und evolution geer Ereignisse ntwicklung bis leons diktatong von Errunaus. sse adäquat Beziehung ben opäischen Köe Frankreich. Mit einzelnen Gattungen von Quellen und Darstellungen adäquat umgehen Die Schülerinnen und Schüler ... analysieren",Niedersachsen,Realschule,,2014.0,Geschichte
35,3,0.4676380718169164,"im Hinblick auf ihre Reichweite, d. h. auf Allgemeingültigkeit und Singularität bzw. Totalität und Partikularität Allgemeines - Singuläres; Ganzes - Teil. o charakterisieren Verlauf und Ergebnisse historischer Veränderungen z. B. Evolution Revolution. o bestimmen die Bedeutung von Zugehörigkeiten an historischen Beispielen Integration Ausgrenzung. analysieren die historische Bedingtheit vergangener und gegenwärtiger Identitätskonstruktionen. Methodenkompetenz Die Methodenkompetenz bezieht sich auf die Fähigkeit, historische Zusammenhänge",Niedersachsen,Gym,Sek2,2018.0,Geschichte
36,3,0.9547678788839381,"indem sie geschichtliche Phänomene mit Hilfe von Kategorien erklären und beurteilen. p g g p g g g g g g Ereignis und Struktur Fortschritt und Rückschritt Dauer und Wandel Evolution und Revolution Gewalt und Gewaltfreiheit Allgemeines und Singuläres Gleichzeitigkeit und Ungleichzeitigkeit Integration und Ausgrenzung In der Abiturprüfung zeigen die Prüflinge ihre Fähigkeit, mit verschiedenen Grundformen historischer Untersuchung sachgerecht umgehen zu",,,,2005.0,Geschichte
37,3,0.9739940987571218,"ordnen einzelne Epochen der Geschichte, Daten, Personen, Namen und Fachbegriffe zeitlich und räumlich ein. Es wird nach Ursachen und Wirkungen gefragt. Mithilfe von fachspezifischen Konzepten der Geschichtsdeutung Reform, Revolution und Evolution; Ereignis und Struktur; Fortschritt und Rückschritt; Gleichzeitigkeit des Ungleichzeitigen und Ordnungsmustern menschlicher Aktivitäten Alltagskulturen, Herrschaft, Wirtschaft, Eigenes und Fremdes, Bewältigung und Nutzung von Raum interpretieren die Lernenden Spielarten von Veränderung",Hessen,Gym,Sek1,2021.0,Geschichte
38,6,0.9642188707408652,"historisches Konzept, mit dem Geschichte gedeutet und verhandelt wird. Damit sind Zeitverlaufsvorstellungen gemeint, wie etwa Fortschritt, Verfall, Gleichzeitigkeit des Ungleichzeitigen, Epochenbegriffe sowie spezielle Formen historischer Zustände und Vorgänge Ereignis, Struktur, Evolution und Revolution. Diesen Vorstellungen von geschichtlicher Zeit ist gemeinsam, dass sie sich mit Kontinuität und Veränderung befassen. Den Lernenden wird ein Instrumentarium an die Hand gegeben, um eine eigene Position",Hessen,Gym,Sek1,2021.0,Geschichte
39,3,0.9120713120154775,"Zeiterfahrungen und deren Strukturierung Kalender, Zeitstrahl, Zeitrechnung wenden Strukturierungskonzepte zeitlicher Verläufe sinnvoll an Ereignis - Struktur; Kontinuität als Dauer und Wandel unterscheiden verschiedene normative Konzeptualisierungen zeitlicher Verläufe Fortschritt - Rückschritt; Evolution - Revolution reflektieren zeitliche Strukturierun konzepte und problematisieren die ggf. als Konstrukte Gleichzeitigke Ungleichzeitigkeit Raum bezeichnen die Lage historischer Orte und beschreiben Raum als historische Ressource charakterisieren Raumvorstellungen in der",Niedersachsen,Gym,Sek1,2015.0,Geschichte
40,3,0.9739940987571218,"ordnen einzelne Epochen der Geschichte, Daten, Personen, Namen und Fachbegriffe zeitlich und räumlich ein. Es wird nach Ursachen und Wirkungen gefragt. Mithilfe von fachspezifischen Konzepten der Geschichtsdeutung Reform, Revolution und Evolution; Ereignis und Struktur; Fortschritt und Rückschritt; Gleichzeitigkeit des Ungleichzeitigen und Ordnungsmustern menschlicher Aktivitäten Alltagskulturen, Herrschaft, Wirtschaft, Eigenes und Fremdes, Bewältigung und Nutzung von Raum interpretieren die Lernenden Spielarten von Veränderung",Hessen,Realschule,,2021.0,Geschichte
41,6,0.9642188707408652,"historisches Konzept, mit dem Geschichte gedeutet und verhandelt wird. Damit sind Zeitverlaufsvorstellungen gemeint, wie etwa Fortschritt, Verfall, Gleichzeitigkeit des Ungleichzeitigen, Epochenbegriffe sowie spezielle Formen historischer Zustände und Vorgänge Ereignis, Struktur, Evolution und Revolution. Diesen Vorstellungen von geschichtlicher Zeit ist gemeinsam, dass sie sich mit Kontinuität und Veränderung befassen. Den Lernenden wird ein Instrumentarium an die Hand gegeben, um eine eigene Position",Hessen,Realschule,,2021.0,Geschichte
42,3,0.9739940987571218,"ordnen einzelne Epochen der Geschichte, Daten, Personen, Namen und Fachbegriffe zeitlich und räumlich ein. Es wird nach Ursachen und Wirkungen gefragt. Mithilfe von fachspezifischen Konzepten der Geschichtsdeutung Reform, Revolution und Evolution; Ereignis und Struktur; Fortschritt und Rückschritt; Gleichzeitigkeit des Ungleichzeitigen und Ordnungsmustern menschlicher Aktivitäten Alltagskulturen, Herrschaft, Wirtschaft, Eigenes und Fremdes, Bewältigung und Nutzung von Raum interpretieren die Lernenden Spielarten von Veränderung",Hessen,Hauptschule,,2021.0,Geschichte
43,6,0.9642188707408652,"historisches Konzept, mit dem Geschichte gedeutet und verhandelt wird. Damit sind Zeitverlaufsvorstellungen gemeint, wie etwa Fortschritt, Verfall, Gleichzeitigkeit des Ungleichzeitigen, Epochenbegriffe sowie spezielle Formen historischer Zustände und Vorgänge Ereignis, Struktur, Evolution und Revolution. Diesen Vorstellungen von geschichtlicher Zeit ist gemeinsam, dass sie sich mit Kontinuität und Veränderung befassen. Den Lernenden wird ein Instrumentarium an die Hand gegeben, um eine eigene Position",Hessen,Hauptschule,,2021.0,Geschichte
44,3,0.5306501209757704,"Indianer und indigene Völker. Schuljahrgänge / Aspekte: Herrschaft und politische Teilhabe; Gewaltsame Konflikte, Verfolgungen und Kriege Erkenntnisgewinnung durch Methoden und Medien Beurteilung und Bewertung en und Strukbieten beesellschaftsbsolutismus. sstände und evolution geer Ereignisse ntwicklung bis sse adäquat Beziehung ben opäischen Köe Frankreich. Mit einzelnen Gattungen von Quellen und Darstellungen adäquat umgehen Die Schülerinnen und Schüler ... analysieren Karikaturen. Die Perspektivität von",Niedersachsen,Hauptschule,,2014.0,Geschichte
