document_id,most_prevalent_topic_id,most_prevalent_topic_probability,text_excerpt,state,school type,grade,year,subject
624,20,0.6002459572821276,"und Wirklichkeit Probleme der Umsetzbarkeit der Idee von Gerechtigkeit Begriffe des Feldes Ethik/Moral/Gerechtigkeit verschiedene Straftheorien/gesellschaftliche Möglichkeiten, mit Rechtsverletzungen umzugehen die Bedeutung von Gerechtigkeit und Recht im gesellschaftlichen Zusammenleben Bedeutung von Moral für die Gesellschaft und ihre Erscheinungsform im Zusammenleben auch als Moralismus Welche moralischen Begriffe und Vorstellungen habe ich Mit welchen Moralvorstellungen bin ich in besonderer Weise konfrontiert Soll ich moralisch",Rheinland-Pfalz,,Sek1,2021.0,"Ethik, Philo"
625,20,0.5472289857141303,"ich mich an Gesetze und Regeln Gibt es Werte und Regeln, die immer und für alle gelten Was ist Gerechtigkeit Wie ist das Verhältnis von Recht und Gerechtigkeit Was bedeutet Moral im Vergleich zu Ethik Wie lässt sich Strafe begründen Was ist eine gerechte Strafe Was macht eine Gesellschaft zu einer gerechten Gesellschaft Welche Rolle spielt der Staat für eine gerechte",Rheinland-Pfalz,,Sek1,2021.0,"Ethik, Philo"
626,20,0.4762302042760068,"Ethikunterricht orientiert sich daher an der Idee eines herrschaftsfreien Diskurses. Insofern wäre der in fachdidaktischen Zusammenhängen häufig benutzte Begriff der Werteerziehung missverstanden, wenn er die Existenz eines Expertenwissens über das moralisch Richtige suggerierte, das von der Lehrkraft auf die Schülerinnen und Schüler übertragen werden und auf diese Weise ein Verhalten gemäß bestimmter moralischer Anforderungen einer Gesellschaft sichern könnte. Ethikunterricht kann und",Rheinland-Pfalz,,Sek1,2021.0,"Ethik, Philo"
627,13,0.9586956521067457,"Fachdidaktische Intention Erfahrungen mit Wahrheit und Lüge gehören für Schülerinnen und Schüler zum Alltag und stellen sie regelmäßig vor moralische Herausforderungen. Dabei machen sie durchaus zwiespältige Erfahrungen: Lügen gilt als moralisch verwerflich und die Wahrheit zu sagen als geboten. Allerdings erleben sie auch früh, dass Wahrheit verletzen kann und die Lüge dagegen manchmal vor größerem Unheil zu bewahren scheint. Das wirft",Rheinland-Pfalz,,Sek1,2021.0,"Ethik, Philo"
628,13,0.9586956521067457,"Fachdidaktische Intention Erfahrungen mit Wahrheit und Lüge gehören für Schülerinnen und Schüler zum Alltag und stellen sie -regelmäßig vor moralische Herausforderungen. Dabei machen sie durchaus zwiespältige Erfahrungen: Lügen gilt als moralisch verwerflich und die Wahrheit zu sagen als geboten. Allerdings erleben sie auch früh, dass Wahrheit verletzen kann und die Lüge dagegen manchmal vor größerem Unheil zu bewahren scheint. Das wirft",Rheinland-Pfalz,,Sek1,2021.0,"Ethik, Philo"
629,20,0.7331459335696738,"gegenüber Gibt es Pflichten gegenüber Tieren und Umwelt Beruhen Pflichten immer auf Gegenseitigkeit Ist gut gemeint immer gut Oder ist eine Handlung gut, wenn sie gute Folgen hat Handeln wir moralisch, wenn wir aus Eigennutz, Mitgefühl, Einsicht handeln Woher wissen Menschen, was gut ist Wie kommt es zu unterschiedlichen Ansichten Gibt es moralische Pflichten, die überall gelten sollten Gibt es Dinge,",Rheinland-Pfalz,,Sek1,2021.0,"Ethik, Philo"
630,14,0.7380644135944077,"Moral für die Gesellschaft und ihre Erscheinungsform im Zusammenleben auch als Moralismus Welche moralischen Begriffe und Vorstellungen habe ich Mit welchen Moralvorstellungen bin ich in besonderer Weise konfrontiert Soll ich moralisch handeln Was macht eine Entscheidung zu einer moralischen Entscheidung Ist jede meiner Entscheidungen eine moralische Entscheidung Was halte ich für gerecht, was für ungerecht Warum halte ich mich an Gesetze",Rheinland-Pfalz,,Sek1,2021.0,"Ethik, Philo"
631,8,0.48516324257892596,"würde aber seinen vorrangigen Zielen wiederum widersprechen, wollte er diese - etwa als Forderung bestimmter Handlungen oder Verhaltensweisen - in Performanz einfordern. Der Lehrkraft kommt zudem nicht a priori eine moralische Überlegenheit zu. Ihre Aufgabe besteht in diesem Sinne auch nicht darin, eine Art Lebenshilfe zur Bewältigung der ethischen Komplexität der modernen Welt mit der ihr eigenen Vielfalt von Entscheidungsmöglichkeiten anzubieten.",Rheinland-Pfalz,,Sek1,2021.0,"Ethik, Philo"
632,17,0.7607043201253373,"nicht eingeschränkt wird. Meinung und Begründung Schülerinnen und Schüler bilden durch Sozialisation und eigenes Zutun Haltungen aus, die sich in Meinungen äußern können. Diese haben im sozialen Rahmen oft eine moralische Komponente und werden dadurch Gegenstand der Ethik. Im unterrichtlichen Diskurs kommen Meinungen zur Sprache. Diese verlangen immer nach guten Gründen, um sie im kommunikativen Prozess für andere nachvollziehbar und überprüfbar",Rheinland-Pfalz,,Sek1,2021.0,"Ethik, Philo"
633,13,0.8118490957771854,"mit differierenden Perspektiven individuelle Bedeutung und gesellschaftliche Funktion des Zweifelns persönliches Verständnis von Wahrheit und Lüge soziale Auswirkungen von Wahrheit und Lüge verschiedene Definitionen von Wahrheit, Lüge und verwandten Begriffen moralische Berechtigung von Wahrheit und Lüge in unterschiedlichen Handlungskontexten Was nehme ich alles wahr Was kann ich gut bzw. weniger gut oder sogar gar nicht wahrnehmen Woher wissen wir von dem,",Rheinland-Pfalz,,Sek1,2021.0,"Ethik, Philo"
634,13,0.9586956520545381,"Freundeskreis, Familie, Schule usw. INHALTE PROBLEMFRAGEN wahrnehmen analysieren reflektieren argumentieren beurteilen Fachdidaktische Intention Erfahrungen mit Wahrheit und Lüge gehören für Schülerinnen und Schüler zum Alltag und stellen sie regelmäßig vor moralische Herausforderungen. Dabei machen sie durchaus zwiespältige Erfahrungen: Lügen gilt als moralisch verwerflich und die Wahrheit zu sagen als geboten. Allerdings erleben sie auch früh, dass Wahrheit verletzen kann und die",Rheinland-Pfalz,,Sek1,2021.0,"Ethik, Philo"
635,17,0.3905679265228944,"ein bestimmtes Halbjahr festlegen. LEISTUNGSFESTSTELLUNG UND LEISTUNGSBEURTEILUNG Ethik ist ordentliches Unterrichtsfach und damit auch versetzungsrelevant. Für die Leistungsfeststellung und die Leistungsbeurteilung gelten grundsätzlich dieselben Regelungen wie für alle anderen Unterrichtsfächer. Moralische Werthaltungen der Schülerinnen und Schüler dürfen keiner Bewertung durch die Lehrkraft unterzogen werden, insbesondere keiner Leistungsbeurteilung. Der Ethikunterricht ist zum Teil Ort des Austausches sehr persönlicher Äußerungen, die für die",Rheinland-Pfalz,,Sek1,2021.0,"Ethik, Philo"
636,13,0.9089666029707125,"Inhaltskompetenzen als Verknüpfung der fünf Basiskompetenzen mit den ausgewählten Inhalten THEMENFELDER Fachdidaktische Intention Erfahrungen mit Wahrheit und Lüge gehören für Schülerinnen und Schüler zum Alltag und stellen sie -regelmäßig vor moralische Herausforderungen. Dabei machen sie durchaus zwiespältige Erfahrungen: Lügen gilt als moralisch verwerflich und die Wahrheit zu sagen als geboten. Allerdings erleben sie auch früh, dass Wahrheit verletzen kann und die",Rheinland-Pfalz,,Sek1,2021.0,"Ethik, Philo"
637,13,0.8118490957771854,"mit -differierenden Perspektiven individuelle Bedeutung und gesellschaftliche Funktion des Zweifelns persönliches Verständnis von Wahrheit und Lüge soziale Auswirkungen von Wahrheit und Lüge verschiedene Definitionen von Wahrheit, Lüge und verwandten Begriffen moralische Berechtigung von Wahrheit und Lüge in unterschiedlichen Handlungskontexten Was nehme ich alles wahr Was kann ich gut bzw. weniger gut oder sogar gar nicht wahrnehmen Woher wissen wir von dem,",Rheinland-Pfalz,,Sek1,2021.0,"Ethik, Philo"
638,20,0.8047182142974116,von Pflicht Begriff der Pflicht und seine Implikationen in Bezug auf Freiheit und Herkunft von Verpflichtung mögliche Differenz zwischen moralischer und gesetzlicher Pflicht Bedeutung von nicht beabsichtigten Folgen für die moralische Bewertung von Handlungen Was motiviert mich im Leben Was hilft mir bei Entscheidungen An welchen Maßstäben orientiere ich mich Wozu bin ich verpflichtet Wie gehe ich mit widersprüchlichen Erwartungen um,Rheinland-Pfalz,,Sek1,2021.0,"Ethik, Philo"
639,20,0.8117132204402812,"Lebens habe ich das Gefühl, dass ich wirklich entscheiden kann Welche Rolle spielen für mich mögliche Konsequenzen meines Handelns Was bedeutet es, sich jemandem verpflichtet zu fühlen Was unterscheidet eine moralische von einer gesetzlichen Verpflichtung Gibt es Pflichten mir selbst gegenüber Gibt es Pflichten gegenüber Tieren und Umwelt Beruhen Pflichten immer auf Gegenseitigkeit Ist gut gemeint immer gut Oder ist eine",Rheinland-Pfalz,,Sek1,2021.0,"Ethik, Philo"
640,20,0.6483725699616929,"gut, wenn sie gute Folgen hat Handeln wir moralisch, wenn wir aus Eigennutz, Mitgefühl, Einsicht handeln Woher wissen Menschen, was gut ist Wie kommt es zu unterschiedlichen Ansichten Gibt es moralische Pflichten, die überall gelten sollten Gibt es Dinge, zu denen Menschen als Menschen gegenseitig verpflichtet sind Dürfen Menschen alles tun, was sie wollen, solange kein anderer Schaden nimmt Wie sollte",Rheinland-Pfalz,,Sek1,2021.0,"Ethik, Philo"
641,7,0.5765187340099451,"Recht, Gerechtigkeit, Moral Individuelle Perspektive Fachwissenschaftliche Perspektive Gesellschaftliche Perspektive eigene Moralvorstellungen und eigenes Verhältnis zu moralischen Ansprüchen Herkunft der eigenen Vorstellungen und Grad ihrer Wirksamkeit mögliche innere Konflikte, die durch moralische Anforderungen entstehen können eigene Gerechtigkeitsvorstellungen Theorien der Gerechtigkeit Universalität und Relativität bei Rechten Anspruch und Wirklichkeit Probleme der Umsetzbarkeit der Idee von Gerechtigkeit Begriffe des Feldes Ethik/Moral/Gerechtigkeit verschiedene Straftheorien/gesellschaftliche Möglichkeiten,",Rheinland-Pfalz,,Sek1,2021.0,"Ethik, Philo"
642,14,0.6391649443665547,"und Vorstellungen habe ich Mit welchen Moralvorstellungen bin ich in besonderer Weise konfrontiert Soll ich moralisch handeln Was macht eine Entscheidung zu einer moralischen Entscheidung Ist jede meiner Entscheidungen eine moralische Entscheidung Was halte ich für gerecht, was für ungerecht Warum halte ich mich an Gesetze und Regeln Gibt es Werte und Regeln, die immer und für alle gelten Was ist",Rheinland-Pfalz,,Sek1,2021.0,"Ethik, Philo"
643,12,0.5449663416122464,"Was macht eine Gesellschaft zu einer gerechten Gesellschaft Welche Rolle spielt der Staat für eine gerechte Gesellschaft Wie ist damit umzugehen, wenn Gesetze als ungerecht empfunden werden Wie wichtig sind moralische Vorstellungen für eine Gesellschaft Wie können Gesellschaften mit Rechtsverletzungen umgehen Wie kann umfassende auch globale und intergenerationelle Gerechtigkeit umgesetzt werden INHALTE PROBLEMFRAGEN wahrnehmen analysieren reflektieren argumentieren beurteilen Fachdidaktische Intention Schülerinnen",Rheinland-Pfalz,,Sek1,2021.0,"Ethik, Philo"
644,20,0.45459734341059826,"Erzählen setzt einzelne Erlebnisse oder Ereignisse zueinander in Beziehung, erläutert Handlungen und Entscheidungen und produziert so Sinnzusammenhänge. Dadurch werden auch Wertüberzeugungen deutlich oder neu geschaffen, die eine tragende Rolle für moralische Entscheidungen spielen und die Grundlage für die Ausbildung individueller Werthaltungen sein können. Ziel dieses Themenfeldes ist es, Schülerinnen und Schüler zur inhaltlichen Reflexion von Erzählungen und ihrer immanenten Wert- und",Rheinland-Pfalz,,Sek1,2021.0,"Ethik, Philo"
645,20,0.48297910509919506,"So prägt beispielsweise die Digitalisierung als technologische Modernisierung die Lebensverhältnisse von Menschen inzwischen ebenso grundlegend wie dies durch die pluralen Lebenswelten unserer Gesellschaft erfolgt. Ethische Orientierungskompetenz manifestiert sich darin, bei moralischen Fragen und Entscheidungen in variierenden Lebenskontexten eigenständige Antworten und praktikable Wege finden zu können. Die Einzelnen werden befähigt, sich orientieren zu können. Diese Orientierungsfähigkeit gründet auf philosophisch-ethischem Fachwissen und fachspezifischen",Rheinland-Pfalz,,Sek1,2021.0,"Ethik, Philo"
646,16,0.33052776217303087,"ethische Dimension von Wahrheit hinaus stellen sich hier noch grundlegendere Fragen nach unserem Zugang zu Wahrheit und Wirklichkeit. Ziel dieses Themenfeldes ist es, die Schülerinnen und Schüler zum Hinterfragen von moralischen und erkenntnistheoretischen Überzeugungen anzuregen, die auf einem naiven Realismus beruhen, und ihren Blick für die Komplexität von Erkenntnisprozessen zu schärfen. Fragen nach der Wirklichkeit I /: Wahrnehmung, Wahrheit, Lüge Lehrplan",Rheinland-Pfalz,,Sek1,2021.0,"Ethik, Philo"
647,16,0.330794918118412,"ethische Dimension von Wahrheit hinaus stellen sich hier noch grundlegendere Fragen nach unserem Zugang zu Wahrheit und Wirklichkeit. Ziel dieses Themenfeldes ist es, die Schülerinnen und Schüler zum Hinterfragen von moralischen und -erkenntnistheoretischen Überzeugungen anzuregen, die auf einem naiven Realismus beruhen, und ihren Blick für die Komplexität von Erkenntnisprozessen zu schärfen. Fragen nach der Wirklichkeit I /: Wahrnehmung, Wahrheit, Lüge Individuelle",Rheinland-Pfalz,,Sek1,2021.0,"Ethik, Philo"
648,20,0.5028173684920475,"der Diskrepanz von äußeren Erwartungen und innerer Motivation Schwierigkeit, sich gegen eine Mehrheit zu entscheiden Existenz und Begründbarkeit universaler Menschenrechte Spannung zwischen Minimalund Maximalethik unterschiedliche Auffassungen von Herkunft und Inhalt moralischen Handelns sowie des Begriffs des Guten mögliche Begründungen, Subjekte, Objekte und Inhalte von Pflicht Begriff der Pflicht und seine Implikationen in Bezug auf Freiheit und Herkunft von Verpflichtung mögliche Differenz",Rheinland-Pfalz,,Sek1,2021.0,"Ethik, Philo"
649,7,0.44574644581030454,"Handelns oder stellen die dahinterstehenden Motive infrage. Ziel dieses Themenfeldes ist es, die Beschäftigung der Schülerinnen und Schüler mit dem Spannungsfeld Freiheit-Verantwortung zu unterstützen und die Entwicklung einer eigenen vermittelnden moralischen Instanz zu fördern. /: Gewissen, Verantwortung, Freiheit Individuelle Perspektive Fachwissenschaftliche Perspektive Gesellschaftliche Perspektive Begriff des Gewissens und seine Implikationen Voraussetzungen und Implikationen von Verantwortung Verständnis des Zusammenhangs von Gewissen, Freiheit",Rheinland-Pfalz,,Sek1,2021.0,"Ethik, Philo"
650,7,0.5343483979318622,"verschiedene Auffassungen von Gerechtigkeit und Moral zu analysieren sowie eine eigene Urteilsfähigkeit zu entwickeln. /: Recht, Gerechtigkeit, Moral Individuelle Perspektive Fachwissenschaftliche Perspektive Gesellschaftliche Perspektive eigene Moralvorstellungen und eigenes Verhältnis zu moralischen Ansprüchen Herkunft der eigenen Vorstellungen und Grad ihrer Wirksamkeit mögliche innere Konflikte, die durch moralische Anforderungen entstehen können eigene Gerechtigkeitsvorstellungen Theorien der Gerechtigkeit Universalität und Relativität bei Rechten Anspruch und",Rheinland-Pfalz,,Sek1,2021.0,"Ethik, Philo"
651,20,0.5333847173563023,"verschiedene Straftheorien/gesellschaftliche Möglichkeiten, mit Rechtsverletzungen umzugehen die Bedeutung von Gerechtigkeit und Recht im gesellschaftlichen Zusammenleben Bedeutung von Moral für die Gesellschaft und ihre Erscheinungsform im Zusammenleben auch als Moralismus Welche moralischen Begriffe und Vorstellungen habe ich Mit welchen Moralvorstellungen bin ich in besonderer Weise konfrontiert Soll ich moralisch handeln Was macht eine Entscheidung zu einer moralischen Entscheidung Ist jede meiner Entscheidungen",Rheinland-Pfalz,,Sek1,2021.0,"Ethik, Philo"
652,14,0.6614192863158007,"Zusammenleben auch als Moralismus Welche moralischen Begriffe und Vorstellungen habe ich Mit welchen Moralvorstellungen bin ich in besonderer Weise konfrontiert Soll ich moralisch handeln Was macht eine Entscheidung zu einer moralischen Entscheidung Ist jede meiner Entscheidungen eine moralische Entscheidung Was halte ich für gerecht, was für ungerecht Warum halte ich mich an Gesetze und Regeln Gibt es Werte und Regeln, die",Rheinland-Pfalz,,Sek1,2021.0,"Ethik, Philo"
653,6,0.2950664924851626,"wenn er die Existenz eines Expertenwissens über das moralisch Richtige suggerierte, das von der Lehrkraft auf die Schülerinnen und Schüler übertragen werden und auf diese Weise ein Verhalten gemäß bestimmter moralischer Anforderungen einer Gesellschaft sichern könnte. Ethikunterricht kann und wird durch die besonders ausgeprägte Beschäftigung mit Werten, Einstellungen und Handlungsoptionen bei Schülerinnen und Schülern zur Prüfung des eigenen Verhaltens beitragen. Er",Rheinland-Pfalz,,Sek1,2021.0,"Ethik, Philo"
654,20,0.7500799820710099,"sowie des Begriffs des Guten mögliche Begründungen, Subjekte, Objekte und Inhalte von Pflicht Begriff der Pflicht und seine Implikationen in Bezug auf Freiheit und Herkunft von Verpflichtung mögliche Differenz zwischen moralischer und gesetzlicher Pflicht Bedeutung von nicht beabsichtigten Folgen für die moralische Bewertung von Handlungen Was motiviert mich im Leben Was hilft mir bei Entscheidungen An welchen Maßstäben orientiere ich mich",Rheinland-Pfalz,,Sek1,2021.0,"Ethik, Philo"
655,20,0.5998995795582376,"Gewissen Was bedeutet es, dem Gewissen verpflichtet zu sein Was ist Verantwortung Was ist Freiheit Welche Dimensionen von Freiheit gibt es Was schränkt den Menschen ein Kann formale Pflichterfüllung von moralischer Verantwortung befreien Ist Regelbruch in Ausnahmen gerechtfertigt Inwiefern gelten Menschen als frei bzw. nicht frei Welche gesellschaftliche Funktion soll Strafe haben Wozu darf oder muss der Staat verpflichten Welche Abhängigkeiten",Rheinland-Pfalz,,Sek1,2021.0,"Ethik, Philo"
656,16,0.39103576516841343,"Die Aufmerksamkeit wechselt von Fragen der Einigung Rechte und Achtung zu solchen des Verstehens Zuhören und Sprechen, Hören und Gehört-werden. Dieser Wechsel dokumentiert sich in einer Veränderung der Sprache der Moral - an die Stelle der Darlegung individueller Ansprüche auf Rechte und Achtung Ich habe ein Recht darauf ... Ich achte ihre Ansichten treten Momente von Beziehungsarbeit: das Gebot, zuzuhören und",Hessen,,Sek1,,"Ethik, Philo"
657,14,0.49275795784873355,"Verständnis zu bemühen Ich verstehe ... sie sollten zuhören ... und versuchen, zu verstehen, .... aus: Moralische Orientierung und moralische Entwicklung. Übersetzt von Elisabeth Seyfarth-Konau, in: Gertrud NummerWinkler Hrsg.: Weibliche Moral. Die Kontroverse um eine geschlechtsspezifische Ethik, Campus Verlag, Theorie und Gesellschaft Bd. , Frankfurt/New York, , S. - Otfried Höffe, Philosoph, In der heutigen Debatte gilt als Kern der Gerechtigkeit",Hessen,,Sek1,,"Ethik, Philo"
658,3,0.38754139272489857,"Existenz sowie Eingriffsmöglichkeiten des Menschen und daraus resultierenden Folgen geschieht auf Basis erworbenen Wissens. Auf der Ebene des Könnens stehen kommunikative Fähigkeiten wie Diskursfähigkeit und Textkompetenz im Vordergrund. Hinzu kommen moralische Urteilsfähigkeit, Aufgeschlossenheit sowie die Bereitschaft zur Übernahme von Verantwortung. vgl. Kerncurriculum, Kap. und Kap. - Beispiele dazu finden sich in Vorschlägen für ein Fach curriculum in Kap. Wahrnehmen und Deuten",Hessen,,Sek1,,"Ethik, Philo"
659,9,0.3946027565506892,"Kap. und Kap. - Beispiele dazu finden sich in Vorschlägen für ein Fach curriculum in Kap. Wahrnehmen und Deuten Wahrnehmungsfähigkeit Perspektivübernahme, Empathie, Interkulturelles Lernen Argumentieren und Urteilen Argumentations- und Urteilsfähigkeit, Moralische Urteilsfähigkeit, Ethische Urteilsfähigkeit Sich-Orientieren und Handeln Orientierungskompetenz, Handlungskompetenz Analysieren und Reflektieren Textverständnis, Sprachanalyse, Reflexionsfähigkeit, Interdisziplinarität Interagieren und Sich-Mitteilen Darstellungskompetenz, Konfliktlösungsfähigkeit, Diskursfähigkeit Die Kompetenzen Orientieren und Handeln zeichnen sich durch einen",Hessen,,Sek1,,"Ethik, Philo"
660,9,0.3057159485742219,"interkulturelle Verständigung Jg. . Aufbauend auf der Fähigkeit zum interreligiösen und interkulturellen Dialog können nun die kulturellen und religiösen Ursprünge moralischer Wertvorstellungen an konkreten Themen erarbeitet und es kann die moralische Urteilskompetenz gefördert werden Jg. . Themenfelder wie Ehe, Familie und Lebensentwürfe bieten sich entwicklungspsychologisch dafür an. Abschließend Jg. lässt sich das thematische Spektrum auf ethische Wertekonflikte, wie sie sich z.B.",Hessen,,Sek1,,"Ethik, Philo"
661,9,0.34487141019624384,im interkulturellen Dialog. Übersichtsdarstellung Kompetenzaufbau Orientierungsgrundlage Im Folgenden werden neben der hier erläuterten Entwicklung der interkulturellen Kompetenz zwei weitere Kompetenzbereiche des Faches Ethik tabellarisch dargestellt und erläutert. Ausgewählt wurden die moralische und die ethische Urteilsfähigkeit als zentrale Kompetenzbereiche des Faches. Diese Kompetenzen werden in ihrer Verknüpfung mit den Inhaltsfeldern und in ihrer Progression über die Jahrgangsstufen hinweg exemplarisch als eine Möglichkeit,Hessen,,Sek1,,"Ethik, Philo"
662,19,0.4822785963376233,"Lernenden können ... kulturelle Unterschiede und differierende Wertvorstellungen wahrnehmen, vergleichend beschreiben und einordnen, Handlungen, Entscheidungen und Motive anderer Personen rekonstruieren und bewerten, lösungsorientierte Urteile zu ethischen Konflikten des Alltags entwickeln, moralische Wertvorstellungen in ihren kulturellen und religiösen Zusammenhängen beschreiben und einordnen, Achtung und kritische Toleranz gegenüber Andersdenkenden entwickeln und praktizieren, sich innerhalb der Pluralität von Kulturen, Weltbildern und Religionen begründet verorten.",Hessen,,Sek1,,"Ethik, Philo"
663,19,0.402723807371261,"Lernenden können ... die Folgen eigenen und fremden Handelns für sich und andere beschreiben und bewerten, ethisch relevante Fragestellungen in ihrer jeweiligen Bedeutung für den Einzelnen und die Gemeinschaft reflektieren, moralische Wertvorstellungen in ihren kulturellen und religiösen Zusammenhängen beschreiben und einordnen, die Konsequenzen eigenen Handelns und Unterlassens sowie Entscheidungsspielräume für eigenes Handeln erkennen und im schulischen Umfeld erproben, beschreiben und bewerten.",Hessen,,Sek1,,"Ethik, Philo"
664,20,0.2888503579351916,"Lernenden können ... verschiedene Rechte und Pflichten von Familienmitgliedern beschreiben, im Zusammenhang mit Freiheit die Folgen eigenen und fremden Handelns für sich und andere beschreiben und bewerten, Inhaltsbezogene Kompetenzen: mpetenzaufbau Moralische Urteilsfähigkeit Orientierungsgrundlage Individuelle Freiheit und familiäre und soziale Prägung Gender-Aspekte in Familie und Schule Handlungs- und Willensfreiheit/Dilemmata Menschenwürde/Freiheit und Arbeit Angewandte Ethik: Menschenwürde und Sterbehilfe ethisch relevante Fragestellungen an konkreten",Hessen,,Sek1,,"Ethik, Philo"
665,9,0.31028786037296996,"und Deuten, Analysieren und Reflektieren, Argumentieren und Urteilen, ich-Orientieren und Handeln Die Lernenden können ... ihre persönliche Wahrnehmung beschreiben und hinterfragen, mediale Zugänge zur Welt vergleichend beschreiben und bewerten, unterschiedliche moralische Wertvorstellungen einordnen und bewerten, Verantwortung in persönlichen Entscheidungs- und Handlungssituationen erkennen und argumentativ darlegen. Überfachliche Kompetenzen: oziale Wahrnehmungsfähigkeit, Gesellschaftliche Verantwortung, Medienkompetenz, Kommunikationskompetenz Leitperspektiven: Individuum, Gesellschaft, Vergleichende Ideengeschichte Inhaltsfelder: Gewissen und",Hessen,,Sek1,,"Ethik, Philo"
666,19,0.577558002428576,"hin-Kampagnehttp://schau-hin.info/ medienerziehung/detail/ article/schau-hin-familiealltag-in-der-medienwelt.html Kompetenzbereiche/Bildungsstandards: Wahrnehmen und Deuten, Argumentieren und Urteilen, Interagieren und ich-Mitteilen, Sich-Orientieren und Handeln Die Lernenden können ... kulturelle Unterschiede und differierende Wertvorstellungen wahrnehmen, vergleichend beschreiben und einordnen, moralische Wertvorstellungen in ihren historischen, kulturellen und religiösen Zusammenhängen beschreiben und einordnen, ethische Argumentationen nachvollziehen und bewerten, Verantwortung in persönlichen und gesellschaftlichen Entscheidungs- und Handlungssituationen erkennen und argumentativ darlegen, Voraussetzungen für",Hessen,,Sek1,,"Ethik, Philo"
667,19,0.4509538765102136,"Lernenden, sich in Gruppen Themen auf der Basis von vorgegebenem Material unter Anleitung erschließen zu können. Es wird davon ausgegangen, dass die Jugendlichen ethische Konflikte des Alltags begründet bewerten, unterschiedliche moralische Wertvorstellungen einordnen und vergleichen, ethische Argumentationen nachvollziehen und bewerten, eigene und fremde Positionen abwägen und beurteilen sowie Texte unter fachspezifischen Fragestellungen erschließen können. Der Lernprozess ist im Sinne des Prozessmodells",Hessen,,Sek1,,"Ethik, Philo"
668,19,0.7513439118288392,"beschreiben und bewerten. Analysieren und Reflektieren ethisch relevante Fragestellungen in ihrer Bedeutung für den Einzelnen und die Gemeinschaft reflektieren, Texte unter fachspezifischen Fragestellungen selbstständig erschließen und interpretieren. Argumentieren und Urteilen moralische Wertvorstellungen in ihren historischen, kulturellen und religiösen Zusammenhängen beschreiben und einordnen, unter Bezug auf erworbenes Fachwissen eigene und fremde Positionen überprüfen und beurteilen, Argumente gewichten, begründet und widerspruchsfrei argumentieren. Interagieren",Hessen,,Sek1,,"Ethik, Philo"
