document_id,most_prevalent_topic_id,most_prevalent_topic_probability,text_excerpt,state,school type,grade,year,subject
938,8,0.24089947139210582,"und Schüler reflektieren das Verhältnis von Technologie und Ethik sowie ihr Verständnis grundlegender Werte, Einstellungen und Verhaltensweisen und entwickeln begründet Verantwortung für Mensch und Natur. Grundlegendes Ziel ist der Erwerb moralischer Urteilsfähigkeit, verstanden als Fähigkeit, gesellschaftlich vermittelte Probleme und Herausforderungen wahrzunehmen und in einer gegebenen Situation nach angemessenem Verhalten und einer jeweils gerechten Lösung zu suchen. Beitrag zur Leitperspektive BNE: Es",Hamburg,,Studienstufe,2022.0,"Ethik, Philo"
939,20,0.7318149836716709,"Wie frei bin ich - Freiheit und Verantwortung Was ist gerecht - Recht und Gerechtigkeit Was ist der Mensch - Mensch und Gemeinschaft Was soll ich tun - Handeln und Moral Worauf kann ich vertrauen - Wissen und Glauben Unterricht im Wahlpflichtfach Ethik Kompetenzentwicklung im Fach Ethik Ziele des Unterrichts Unsere Gesellschaft ist gekennzeichnet durch die Pluralisierung der Lebensformen, der sozialen",Berlin,,7-10,2015.0,"Ethik, Philo"
940,14,0.3873954777292553,"Gesetze ungerecht Haben alle Kinder in unserer Gesellschaft die gleichen Chancen Sollte es ein Weltgericht geben Müssen wir uns gegen Ungerechtigkeit in anderen Ländern einsetzen Allegorien der Gerechtigkeit Recht und Moral Rechtspositivismus und Naturrecht UNBehindertenrechtskonvention Widerstandsrecht Gerechtes Verteilen Muss ich Almosen geben Was bedeutet für mich gerechte Notengebung Ist es ungerecht, dass es Arme und Reiche gibt gesellschaftliche Verteilungsprinzipien Gibt es",Berlin,,7-10,2015.0,"Ethik, Philo"
941,20,0.5158337992782943,Menschen im Laufe der Jahrhunderte moralisch besser Welcher Zusammenhang besteht zwischen Technologie und Fortschritt Welche Rolle spielt wirtschaftliche Entwicklung beim Fortschritt Mensch als Kulturwesen Mensch als homo faber Mensch und Moral Was ist für mich ein moralisch guter Mensch Welche Idole oder Vorbilder habe ich Ist der Mensch von Natur aus gut oder böse Welche Tugenden sind heute gesellschaftlich anerkannt Welche,Berlin,,7-10,2015.0,"Ethik, Philo"
942,20,0.4328472332703675,"Respekt I. Kant, G. P. della Mirandola Projekt Weltethos Erklärung Ich-, Du-Botschaften, Gewaltfreie Kommunikation z. B. nach M.B. Rosenberg Fernstenliebe H. Jonas Sozialdarwinismus Was soll ich tun - Handeln und Moral Schülerinnen und Schüler müssen, ebenso wie alle Menschen, ständig Entscheidungen treffen und sich in verschiedenen Situationen mit der Frage auseinandersetzen, was sie in einer konkreten Situation tun sollen. Was soll",Berlin,,7-10,2015.0,"Ethik, Philo"
943,7,0.4001852283337552,"Menschenwürde Goldene Regel Ethik verschiedener Religionen und Weltanschauungen Prinzipien deontologischer, teleologischer und eudämonistischer Ethik, Mitleids- und Tugendethik philosophische, religiöse und weltanschauliche Deutungen Grundwissen moralischen Argumentierens Praktischer Syllogismus, Sein-SollensProblem Gewissen und Moral Was bedeutet es, wenn ich ein schlechtes Gewissen habe Woher stammt mein schlechtes Gewissen Was heißt es für mich, ein gutes oder ein schlechtes Gewissen zu haben In welchen Situationen",Berlin,,7-10,2015.0,"Ethik, Philo"
944,20,0.5869762675630589,"Verantwortung zu übernehmen. Daher ist die zentrale Kompetenz, die die Lernenden im Ethikunterricht erwerben sollen, die ethische Reflexionskompetenz. Sie bildet eine zentrale Voraussetzung, um sich im Leben zu orientieren und moralisch zu handeln. Die ethische Reflexionskompetenz besteht in der Bereitschaft und Fähigkeit, sich mit grundlegenden ethischen Problemen konstruktiv unter Berücksichtigung der jeweiligen Situation auseinanderzusetzen. Sie umfasst die folgenden sich ergänzenden, teils",Berlin,,7-10,2015.0,"Ethik, Philo"
945,7,0.5877262563808793,Individuelle Perspektive Gesellschaftliche Perspektive Ideengeschichtliche Perspektive Mensch und Fortschritt Was heißt für mich Fortschritt Sind wir heute klüger als die Menschen im Mittelalter Werden die Menschen im Laufe der Jahrhunderte moralisch besser Welcher Zusammenhang besteht zwischen Technologie und Fortschritt Welche Rolle spielt wirtschaftliche Entwicklung beim Fortschritt Mensch als Kulturwesen Mensch als homo faber Mensch und Moral Was ist für mich ein,Berlin,,7-10,2015.0,"Ethik, Philo"
946,20,0.5036222352772745,besser Welcher Zusammenhang besteht zwischen Technologie und Fortschritt Welche Rolle spielt wirtschaftliche Entwicklung beim Fortschritt Mensch als Kulturwesen Mensch als homo faber Mensch und Moral Was ist für mich ein moralisch guter Mensch Welche Idole oder Vorbilder habe ich Ist der Mensch von Natur aus gut oder böse Welche Tugenden sind heute gesellschaftlich anerkannt Welche waren es vor // Jahren Wer,Berlin,,7-10,2015.0,"Ethik, Philo"
947,20,0.44531985338076396,"Diese zweite der vier Kantischen Fragen stellen sich also auch Lernende ganz von selbst. Sie wird in der philosophischen Ethik unter zwei Perspektiven betrachtet: Was soll ich tun, um ein moralisch guter Mensch zu sein Was soll ich tun, um ein gelingendes Leben zu führen Die erste Perspektive ist dabei diejenige, mit der sich dieses Themenfeld vor allem auseinandersetzt. Dabei ist",Berlin,,7-10,2015.0,"Ethik, Philo"
948,7,0.6463004336733607,"Gültigkeit dieser Werte und Normen. Inhalte Vertiefungsmöglichkeiten/mögliche Konkretisierungen Individuelle Perspektive Gesellschaftliche Perspektive Ideengeschichtliche Perspektive Gut und Böse Wie unterscheiden sich moralische Gefühle von anderen Gefühlen Wann bezeichne ich Handlungen als moralisch gut bzw. moralisch böse Warum handeln Menschen gewalttätig Was klassifizieren verschiedene Gesellschaften als moralisch gut bzw. böse Gibt es universale Werte/Normen/ ethische Prinzipien, die alle Gesellschaften anerkennen philosophische, religiöse, weltanschauliche",Berlin,,7-10,2015.0,"Ethik, Philo"
949,7,0.6583798426527423,"und Normen. Inhalte Vertiefungsmöglichkeiten/mögliche Konkretisierungen Individuelle Perspektive Gesellschaftliche Perspektive Ideengeschichtliche Perspektive Gut und Böse Wie unterscheiden sich moralische Gefühle von anderen Gefühlen Wann bezeichne ich Handlungen als moralisch gut bzw. moralisch böse Warum handeln Menschen gewalttätig Was klassifizieren verschiedene Gesellschaften als moralisch gut bzw. böse Gibt es universale Werte/Normen/ ethische Prinzipien, die alle Gesellschaften anerkennen philosophische, religiöse, weltanschauliche Deutungen von gut",Berlin,,7-10,2015.0,"Ethik, Philo"
950,7,0.44594506911277126,"Gut und Böse Wie unterscheiden sich moralische Gefühle von anderen Gefühlen Wann bezeichne ich Handlungen als moralisch gut bzw. moralisch böse Warum handeln Menschen gewalttätig Was klassifizieren verschiedene Gesellschaften als moralisch gut bzw. böse Gibt es universale Werte/Normen/ ethische Prinzipien, die alle Gesellschaften anerkennen philosophische, religiöse, weltanschauliche Deutungen von gut und böse ethischer Universalismus versus ethischer Relativismus Aggressionstheorien Inhalte Vertiefungsmöglichkeiten/mögliche Konkretisierungen",Berlin,,7-10,2015.0,"Ethik, Philo"
951,7,0.3929761844809382,"Gesellschaften anerkennen philosophische, religiöse, weltanschauliche Deutungen von gut und böse ethischer Universalismus versus ethischer Relativismus Aggressionstheorien Inhalte Vertiefungsmöglichkeiten/mögliche Konkretisierungen Individuelle Perspektive Gesellschaftliche Perspektive Ideengeschichtliche Perspektive Moralische Kriterien Will ich überhaupt moralisch sein Warum soll ich moralisch sein Welche Kriterien liegen meinen moralischen Urteilen zugrunde Was ist wichtiger: das Motiv oder die Folgen meiner Handlung Wie treffe ich Entscheidungen in moralisch relevanten",Berlin,,7-10,2015.0,"Ethik, Philo"
952,7,0.36204356194022946,Deutungen von gut und böse ethischer Universalismus versus ethischer Relativismus Aggressionstheorien Inhalte Vertiefungsmöglichkeiten/mögliche Konkretisierungen Individuelle Perspektive Gesellschaftliche Perspektive Ideengeschichtliche Perspektive Moralische Kriterien Will ich überhaupt moralisch sein Warum soll ich moralisch sein Welche Kriterien liegen meinen moralischen Urteilen zugrunde Was ist wichtiger: das Motiv oder die Folgen meiner Handlung Wie treffe ich Entscheidungen in moralisch relevanten Handlungssituationen Wie rechtfertige ich anderen,Berlin,,7-10,2015.0,"Ethik, Philo"
953,8,0.29232388604948334,überhaupt moralisch sein Warum soll ich moralisch sein Welche Kriterien liegen meinen moralischen Urteilen zugrunde Was ist wichtiger: das Motiv oder die Folgen meiner Handlung Wie treffe ich Entscheidungen in moralisch relevanten Handlungssituationen Wie rechtfertige ich anderen gegenüber moralisch relevante Handlungen Welche moralisch anerkannten Grundlagen gibt es in verschiedenen Gesellschaften Welche ethischen Probleme sollten gesellschaftlich gelöst werden Wieviel unmoralisches Verhalten verkraftet,Berlin,,7-10,2015.0,"Ethik, Philo"
954,8,0.32626298977981655,Welche Kriterien liegen meinen moralischen Urteilen zugrunde Was ist wichtiger: das Motiv oder die Folgen meiner Handlung Wie treffe ich Entscheidungen in moralisch relevanten Handlungssituationen Wie rechtfertige ich anderen gegenüber moralisch relevante Handlungen Welche moralisch anerkannten Grundlagen gibt es in verschiedenen Gesellschaften Welche ethischen Probleme sollten gesellschaftlich gelöst werden Wieviel unmoralisches Verhalten verkraftet eine Gesellschaft Für welche Handlungen müssen wir uns,Berlin,,7-10,2015.0,"Ethik, Philo"
955,8,0.37340355040603496,moralischen Urteilen zugrunde Was ist wichtiger: das Motiv oder die Folgen meiner Handlung Wie treffe ich Entscheidungen in moralisch relevanten Handlungssituationen Wie rechtfertige ich anderen gegenüber moralisch relevante Handlungen Welche moralisch anerkannten Grundlagen gibt es in verschiedenen Gesellschaften Welche ethischen Probleme sollten gesellschaftlich gelöst werden Wieviel unmoralisches Verhalten verkraftet eine Gesellschaft Für welche Handlungen müssen wir uns gesellschaftlich rechtfertigen Begründung der,Berlin,,7-10,2015.0,"Ethik, Philo"
956,20,0.2739966597747042,"Religionswahl, Entscheidung für oder gegen Kinder etc.. Diese Notwendigkeit zu wählen besteht auch im Bereich der Werte und Normen: In einer durch Pluralismus gekennzeichneten Gesellschaft gelten als von allen geteilte moralische Verbindlichkeiten allein die Prinzipien, wie sie in den universellen Menschenrechten dargelegt und im Grundgesetz der Bundesrepublik Deutschland festgeschrieben sind. Ethische Fragen müssen daher in einem an der Vernunft orientierten Verständigungsprozess",Berlin,,7-10,2015.0,"Ethik, Philo"
957,5,0.24674619674862622,"formulieren Lösungsvorschläge für den Umgang mit Regelverletzungen nennen F zu medial dargestellten Problemen und Konflikten, die in sozialen, religiösen, kulturellen oder weltanschaulichen Zusammenhängen stehen, ethische Fragen formulieren in medialen Darstellungen moralische Gefühle z. B. Empörung, Zorn, Empathie, Sympathie, Schuld, Scham der Handelnden in Bezug zu soziokulturellen oder religiösen Zusammenhängen erläutern G H selbstständig ethische Fragen zu Problemen und Konflikten in sozialen,",Berlin,,7-10,2015.0,"Ethik, Philo"
958,19,0.3326480812245099,"Schuld, Scham der Handelnden in Bezug zu soziokulturellen oder religiösen Zusammenhängen erläutern G H selbstständig ethische Fragen zu Problemen und Konflikten in sozialen, religiösen, kulturellen oder weltanschaulichen Zusammenhängen formulieren unterschiedliche moralische Gefühlsreaktionen in soziokulturellen, religiösen oder weltanschaulichen Konflikten erläutern ethisch relevante Begriffe aus theoretischen Texten an Beispielen erläutern ethische Begriffe aus theoretischen Texten definieren und in Kategorien fassen in zunehmend komplexeren",Berlin,,7-10,2015.0,"Ethik, Philo"
959,13,0.22619562957371023,"einer Gruppe oder auch die geltenden staatlichen Gesetze können dem Gerechtigkeitsempfinden des Einzelnen widersprechen. Anhand solcher Fälle gilt es beispielhaft zu prüfen, wann der Mensch das Recht oder sogar die moralische Pflicht hat, sich geltendem Recht zu widersetzen. Schülerinnen und Schüler verbinden Gerechtigkeit oft mit Gleichheit. Daher gilt es kritisch zu hinterfragen, in welchem Verhältnis diese Begriffe stehen und wie sie",Berlin,,7-10,2015.0,"Ethik, Philo"
960,7,0.32802203520075124,"und Naturrecht UNBehindertenrechtskonvention Widerstandsrecht Gerechtes Verteilen Muss ich Almosen geben Was bedeutet für mich gerechte Notengebung Ist es ungerecht, dass es Arme und Reiche gibt gesellschaftliche Verteilungsprinzipien Gibt es eine moralische Pflicht zu spenden Wie können begrenzte Güter z. B. Studienplätze oder Gewinn in einem Unternehmen gerecht verteilt werden Gerechtigkeitsprinzipien Gerechtigkeitstheorien Prinzipien der sozialen Marktwirtschaft Gerechtigkeitsvorstellungen in den Weltreligionen Inhalte Vertiefungsmöglichkeiten/mögliche",Berlin,,7-10,2015.0,"Ethik, Philo"
961,8,0.2879887443609575,"böse Welche Tugenden sind heute gesellschaftlich anerkannt Welche waren es vor // Jahren Wer ist warum in den verschiedenen Gesellschaften und Kulturen Vorbild Welchen Einfluss hat eine Gesellschaft auf die moralische Entwicklung ihrer Mitglieder Begriffe: Tugend, Idol antike und moderne Tugendlehre und Tugendethik Gelten in den Weltreligionen unterschiedliche Tugenden natürliche Eigenschaften des Menschseins Egoismus, Altruismus; Aggressivität, Friedfertigkeit, Gewalt, Mensch im Naturzustand",Berlin,,7-10,2015.0,"Ethik, Philo"
962,20,0.4944562234394759,"Adoption von Kindern durch homosexuelle Paare liefert hierfür vielfältige Anlässe. Dabei spielen die Begriffe Pflicht und Gewissen eine große Rolle. Jeder Mensch ist tagtäglich mit einer Vielzahl von Verpflichtungen konfrontiert. Moralische Pflichten basieren auf Werten und Normen, die sich je nach Gesellschaft, Kultur, Religion oder Weltanschauung unterscheiden können. Das Gewissen bildet sich unter anderem in der Auseinandersetzung mit der Gültigkeit dieser",Berlin,,7-10,2015.0,"Ethik, Philo"
963,7,0.6300525887622822,Gewissen bildet sich unter anderem in der Auseinandersetzung mit der Gültigkeit dieser Werte und Normen. Inhalte Vertiefungsmöglichkeiten/mögliche Konkretisierungen Individuelle Perspektive Gesellschaftliche Perspektive Ideengeschichtliche Perspektive Gut und Böse Wie unterscheiden sich moralische Gefühle von anderen Gefühlen Wann bezeichne ich Handlungen als moralisch gut bzw. moralisch böse Warum handeln Menschen gewalttätig Was klassifizieren verschiedene Gesellschaften als moralisch gut bzw. böse Gibt es universale,Berlin,,7-10,2015.0,"Ethik, Philo"
964,7,0.44133068474385445,"Werte/Normen/ ethische Prinzipien, die alle Gesellschaften anerkennen philosophische, religiöse, weltanschauliche Deutungen von gut und böse ethischer Universalismus versus ethischer Relativismus Aggressionstheorien Inhalte Vertiefungsmöglichkeiten/mögliche Konkretisierungen Individuelle Perspektive Gesellschaftliche Perspektive Ideengeschichtliche Perspektive Moralische Kriterien Will ich überhaupt moralisch sein Warum soll ich moralisch sein Welche Kriterien liegen meinen moralischen Urteilen zugrunde Was ist wichtiger: das Motiv oder die Folgen meiner Handlung Wie treffe",Berlin,,7-10,2015.0,"Ethik, Philo"
965,20,0.407975083426649,"ihrem Leben orientieren und selbstbestimmt und verantwortungsvoll handeln können. Somit trägt der Ethikunterricht dazu bei, dass die Schülerinnen und Schüler sich in Konfliktsituationen mit den Beteiligten über den Sinn und moralischen Wert von Verhaltensweisen und unterschiedlichen Normen verständigen, also Menschen in ihrer Diversität akzeptieren und deren Würde anerkennen. Unterschiede zwischen Menschen in ihrem sozialen Stand, ihrer Lern- und Leistungsfähigkeit oder in",Berlin,,7-10,2015.0,"Ethik, Philo"
966,7,0.2998612202753965,Universalismus versus ethischer Relativismus Aggressionstheorien Inhalte Vertiefungsmöglichkeiten/mögliche Konkretisierungen Individuelle Perspektive Gesellschaftliche Perspektive Ideengeschichtliche Perspektive Moralische Kriterien Will ich überhaupt moralisch sein Warum soll ich moralisch sein Welche Kriterien liegen meinen moralischen Urteilen zugrunde Was ist wichtiger: das Motiv oder die Folgen meiner Handlung Wie treffe ich Entscheidungen in moralisch relevanten Handlungssituationen Wie rechtfertige ich anderen gegenüber moralisch relevante Handlungen Welche moralisch,Berlin,,7-10,2015.0,"Ethik, Philo"
967,7,0.34004763473704536,"müssen wir uns gesellschaftlich rechtfertigen Begründung der Menschenwürde Goldene Regel Ethik verschiedener Religionen und Weltanschauungen Prinzipien deontologischer, teleologischer und eudämonistischer Ethik, Mitleids- und Tugendethik philosophische, religiöse und weltanschauliche Deutungen Grundwissen moralischen Argumentierens Praktischer Syllogismus, Sein-SollensProblem Gewissen und Moral Was bedeutet es, wenn ich ein schlechtes Gewissen habe Woher stammt mein schlechtes Gewissen Was heißt es für mich, ein gutes oder ein",Berlin,,7-10,2015.0,"Ethik, Philo"
968,20,0.49971011301086854,"tun, um ein gelingendes Leben zu führen Die erste Perspektive ist dabei diejenige, mit der sich dieses Themenfeld vor allem auseinandersetzt. Dabei ist einerseits zu klären, welche Kriterien es für moralisches Handeln gibt und wie diese zu beurteilen sind. Zudem machen sich die Schülerinnen und Schüler ihre eigenen Werte und Normen bewusst, hinterfragen diese und beurteilen sie kritisch auf der Grundlage",Berlin,,7-10,2015.0,"Ethik, Philo"
969,6,0.38068234680507423,"den folgenden Klassenstufen aufgenommen und weitergeführt. Der Schüler in seiner Individualität und Persönlichkeitsentwicklung - Ich Lernausgangslage Durch das Beobachten der eigenen Gefühle, Entscheidungen und Handlungen hat der Schüler gelernt, zwischen moralisch zu rechtfertigenden und unmoralischen Denk- und Handlungsweisen begründet zu unterscheiden. Er ist in der Lage, sich und Andere auf ihre Stärken und Schwächen hin zu prüfen und die Möglichkeiten und",Thüringen,Regelschule,,2012.0,"Ethik, Philo"
970,9,0.5591164879978853,Lehrplan Allgemeine Ethik Gymnasiale Oberstufe Leistungskurs Hauptphase - Erprobungsphase Inhalt Vorwort Zum Umgang mit dem Lehrplan Themenfelder Hauptphase der gymnasialen Oberstufe Kompetenzerwartungen Anhang Vorwort In unserer Gesellschaft liegen Moral und Glück bzw. Sinn faktisch als gelebte Orientierung an bestehenden Verhaltens-Normen und Vorstellungen verschiedener Art immer schon vor. Ihrem Alter und ihrem erzieherischen Lebensumfeld gemäß verfügen Schülerinnen und Schüler zumeist,Saarland,Gym,Sek2,2019.0,"Ethik, Philo"
971,9,0.5066256971677974,Hauptphase der gymnasialen Oberstufe Themenfelder Halbjahr der Hauptphase Allgemeine Ethik LK Anthropologie - Freiheit und Verantwortung grundlegende Aspekte Stunden Glück und das gute Leben Stunden Grundbegriffe der Ethik und der Moral Stunden Argumentieren ca. Stunden im Jahr Themenfelder Halbjahr der Hauptphase Allgemeine Ethik LK Moraltheoretische Modelle Stunden Angewandte Ethik I - Naturethik Stunden Argumentieren s.o. Themenfelder Halbjahr der Hauptphase Allgemeine Ethik,Saarland,Gym,Sek2,2019.0,"Ethik, Philo"
972,13,0.5208766653835005,"der einzelnen begründenden Aussagen auch die Beziehungen der Aussagen zum Zielsatz des Begründens gibt. Ein gutes Argumentieren ist aber eine Grundvoraussetzung für eine produktive Teilnahme am ethischen Diskurs über die Moral und das Glück. Denkanstöße Ohne Argumente hast du nichts gesagt. Behaupten kann man vieles. Argumentiere und ich sage dir, was du im Geheimen denkst. Das gilt nur, wenn du auch",Saarland,Gym,Sek2,2019.0,"Ethik, Philo"
973,14,0.555825944459151,"Traditionen soll man einhalten. erklären den Aufbau eines praktischen Syllogismus. Voraussetzung einer normativen Prämisse bei einer normativen Konklusion Vorschläge und Anregungen Hinweis in Teilen Ethisches Argumentieren eher nach dem Thema Moral zu behandeln wegen der dort deutlich gemachten Trennung zwischen Deskriptivität und Normativität Handeln Schluss-Tag an der Schule: Prüfen von Dokumenten der Schule auf Wahrheit und Gültigkeit Literatur Franzen, Henning: Ethisch",Saarland,Gym,Sek2,2019.0,"Ethik, Philo"
974,13,0.5052139874319231,"Gleichzeitig scheint jeder andere Vorstellungen von Glück zu haben. Kann man im Nachdenken über Glück zu Aussagen kommen, die Gültigkeit über das Individuum hinaus erreichen, wie es im Bereich der Moral möglich zu sein scheint Und in welchem Verhältnis stehen diese beiden Grundorientierungen In der Antike wurde beides im Konzept des guten Lebens noch nicht getrennt: Zum glücklichen Leben gehörte das",Saarland,Gym,Sek2,2019.0,"Ethik, Philo"
975,10,0.6863677658810757,"wären wir ohne Glück Glück ist käuflich. Wie immer auch beim Glück: Haben oder Sein. Glück ist mehr als Genuss. Ist ein glückliches Leben auch ein gutes Leben Glück und Moral - passt das zusammen Kompetenzerwartungen Die Schülerinnen und Schüler betrachten die Realität multiperspektivisch individuell, sozial, gesellschaftlich, global, ideell Glück, erkennen Verantwortungsrelationen in ethisch relevanten Situationen Glück und Moral, analysieren Handlungen",Saarland,Gym,Sek2,2019.0,"Ethik, Philo"
976,10,0.47032455479733853,"Glück und Moral - passt das zusammen Kompetenzerwartungen Die Schülerinnen und Schüler betrachten die Realität multiperspektivisch individuell, sozial, gesellschaftlich, global, ideell Glück, erkennen Verantwortungsrelationen in ethisch relevanten Situationen Glück und Moral, analysieren Handlungen hinsichtlich ihrer Einflussfaktoren auf mehreren Ebenen Motive, Folgen, Situationen, Gesellschaft, Ideen Glück und Moral, analysieren eigenes und fremdes Denken und Handeln im Spannungsfeld von Autonomie und Heteronomie Glück,",Saarland,Gym,Sek2,2019.0,"Ethik, Philo"
977,2,0.40254076935924693,"individuell, sozial, gesellschaftlich, global, ideell Glück, erkennen Verantwortungsrelationen in ethisch relevanten Situationen Glück und Moral, analysieren Handlungen hinsichtlich ihrer Einflussfaktoren auf mehreren Ebenen Motive, Folgen, Situationen, Gesellschaft, Ideen Glück und Moral, analysieren eigenes und fremdes Denken und Handeln im Spannungsfeld von Autonomie und Heteronomie Glück, rekonstruieren und prüfen einen Argumentationsgang Das gute Leben in der Antike, analysieren und beurteilen die historische",Saarland,Gym,Sek2,2019.0,"Ethik, Philo"
978,20,0.48878330895865757,"Leben, Provokation mithilfe Freuds: Kultur führt mit ihren Einschränkungen zu Unbehagen diskutieren, ob der Anspruch auf Glück wichtiger sein darf als moralische Ansprüche. Diskussion von Entscheidungssituationen, in denen Glück und Moral scheinbar in einem Widerspruch stehen, z. B. Finden eines Geldscheines, die Möglichkeit eines Seitensprunges, das Kaufen billigen Fleisches für die Grillparty Glück und das gute Leben Allgemeine Ethik Hauptphase LK",Saarland,Gym,Sek2,2019.0,"Ethik, Philo"
979,2,0.34751382218332233,"es glücklich wird kritisieren den Ansatz des Aristoteles hinsichtlich seines Beitrags zu einem guten Leben, positiv, z. B. o Tugenden versprechen als Charaktereigenschaften dauerhaftes Glück o Verbindung von Glück und Moral im Begriff der Tugend negativ, z. B. o Problem der Lebbarkeit der Lebensformen o Art naturalistischer Fehlschluss bei der Ableitung und Wertung der Lebensformen aus den Seelenanteilen stellen die Grundzüge",Saarland,Gym,Sek2,2019.0,"Ethik, Philo"
980,20,0.408195494028893,"von dessen Aussagen. nämlich Atomismus als Grundlage für das Menschenbild materialistisch und Zustand der Polis als Grundlage für das Einrichten seiner Schule Kepos Unterscheidung zwischen Genese und Geltung Glück und Moral Die Schülerinnen und Schüler diskutieren, ob ein gutes Leben ohne Moralität möglich ist, Provokation: Wer Geld hat, darf alles. diskutieren, ob ich auch für das gute Leben anderer verantwortlich bin.",Saarland,Gym,Sek2,2019.0,"Ethik, Philo"
981,14,0.6114051583713153,"u. a. Hg.: Glück. Ein interdisziplinäres Handbuch. Stuttgart; Weimar: Metzler, Wolf, Ursula: Die Philosophie und die Frage nach dem guten Leben. Reinbek: Rowohlt Taschenbuch Verlag, Grundbegriffe der Ethik und der Moral Allgemeine Ethik Hauptphase LK Das Verständnis ethisch-moralischer Grundbegriffe ist eine wesentliche Grundlage für die Verständigung im ethischen Diskurs und für die Strukturierung ethisch-moralischer Fragestellungen und Analysen. Sie wirken wie Fixpunkte",Saarland,Gym,Sek2,2019.0,"Ethik, Philo"
982,17,0.8985849179704631,"Perspektive des Sollens und die ethische Perspektive des systematischen Begründens von Normen im eigenen und gemeinsamen Nachdenken nicht aus den Augen zu verlieren. Denkanstöße Was meinen wir, wenn wir von Moral oder moralisch, von Ethik oder ethisch sprechen Woran erkenne ich, dass etwas moralisch oder ethisch relevant ist Was hat Moral, was hat Ethik mit meinem Selbstverständnis als Mensch zu tun",Saarland,Gym,Sek2,2019.0,"Ethik, Philo"
983,17,0.8025558717162007,"Augen zu verlieren. Denkanstöße Was meinen wir, wenn wir von Moral oder moralisch, von Ethik oder ethisch sprechen Woran erkenne ich, dass etwas moralisch oder ethisch relevant ist Was hat Moral, was hat Ethik mit meinem Selbstverständnis als Mensch zu tun Welche Funktion hat Ethik als philosophische Disziplin und als Unterrichtsfach Inwiefern bedingen sich ethische Perspektiven und die Perspektiven anderer philosophischer",Saarland,Gym,Sek2,2019.0,"Ethik, Philo"
