document_id,most_prevalent_topic_id,most_prevalent_topic_probability,text_excerpt,state,school type,grade,year,subject
1104,1,0.6008957127721078,"Kommission gilt mein besonderer Dank für ihre Arbeit an diesem Rahmenlehrplan und für ihr großes Engagement bei der Weiterentwicklung des naturwissenschaftlichen Unterrichts in Rheinland-Pfalz. Ministerin für Bildung, Wissenschaft, Jugend und Kultur Rheinland-Pfalz Die Schule soll stets danach trachten, dass der junge Mensch sie als harmonische Persönlichkeit verlasse, nicht als Spezialist. Albert Einstein VORWORT Naturwissenschaftliche Grundbildung Gesellschaft und Kultur sind in bedeutendem",Rheinland-Pfalz,,,2014.0,Bio
1105,1,0.6111734588117624,"Wissenschaft, Jugend und Kultur Rheinland-Pfalz Die Schule soll stets danach trachten, dass der junge Mensch sie als harmonische Persönlichkeit verlasse, nicht als Spezialist. Albert Einstein VORWORT Naturwissenschaftliche Grundbildung Gesellschaft und Kultur sind in bedeutendem Maße von Naturwissenschaft und Technik geprägt. Das Wechselspiel zwischen naturwissenschaftlicher Erkenntnis und deren Anwendungen führt zu einer sich permanent verändernden Lebenswelt. Die Fortschrittsgeschwindigkeit wird durch effi ziente",Rheinland-Pfalz,,,2014.0,Bio
1106,1,0.4553683987606766,"/ Hörhilfen Leben in der Steinzeit: Von der Wichtigkeit der Sinne Von der Balkenwaage, Federwaage und Dehnungsmessstreifen Historische Temperaturmessung Vom Hörtrichter zum High-Tech-Gerät Kinderfragen Naturwissenschaftliche Themen und Inhalte Geschichte und Kultur Vorhaben und Projekte Anwendung in Lebenswelt, Umwelt und Technologie Denk- und Arbeitsweisen der Naturwissenschaften Wahrnehmung und Orientierung durch Sinneseindrücke Reiz - Erregung - Wahrnehmung Subjektivität - Objektivität Erweiterung und Objektivierung",Rheinland-Pfalz,,,2014.0,Bio
1107,1,0.498689787963628,"B. die Anordnung zweier Linsen im Fernrohr. Linse Struktur Eigenschaft Funktion THEMENFELD Struktur und Anregungen für Kontexte Titel des Kontexts Kinderfragen Naturwissenschaftliche Themen und Inhalte Vorhaben und Projekte Geschichte und Kultur Entdeckung der Mikroorganismen und medizinischer Fortschritt Orientierung an Sternen ... Wettlauf zum Mond Von der Lupe zum Rastertunnelmikroskop Ich sehe was, was du nicht siehst: Das Leben im Wassertropfen Dem",Rheinland-Pfalz,,,2014.0,Bio
1108,1,0.5699712204672888,"u.a. durch Modelle. Skelett Muskeln Gelenke Struktur - Eigenschaft - Funktion THEMENFELD Struktur und Anregungen für Kontexte Titel des Kontexts Kinderfragen Naturwissenschaftliche Themen und Inhalte Vorhaben und Projekte Geschichte und Kultur Der Traum vom Fliegen Die Welt rückt zusammen Von der Postkutsche zum Rennwagen Schneller, höher, weiter Im Wasser: Wie kommt der Mensch über das Meer Ein futuristisches Zukunftsfahrzeug konstruieren In",Rheinland-Pfalz,,,2014.0,Bio
1109,3,0.6795048151753055,mit Naturschützern führen Ein Tag auf dem Bauernhof Der Haushund stammt vom Wolf ab Vom Gras zum Getreide Leben auf dem Bauernhof Ausgestorbene Tiere Kinderfragen Vorhaben und Projekte Geschichte und Kultur Wie viele verschiedene Pflanzen gibt es Wie überleben Tiere in der Wildnis Warum sind manche Tiere giftig Wozu gibt es Naturschutzgebiete Wieso darf der Jäger Tiere erlegen Welche Tiere sind,Rheinland-Pfalz,,,2014.0,Bio
1110,1,0.7695364979161481,"Nachwachsende Rohstoffe Sonne und Sonnenkult Von Bauernregeln zum Wettersatelliten Vorratshaltung gestern und heute Jahreszeitliches Brauchtum Kinderfragen Naturwissenschaftliche Themen und Inhalte Denk- und Arbeitsweisen der Naturwissenschaften Vorhaben und Projekte Geschichte und Kultur Anwendung in Lebenswelt, Umwelt und Technologie Wie schaffen es die Wolken Regen zu machen Wie heiß sind Sonnenstrahlen Wie entsteht ein Gewitter Wieso sind die Blätter im Herbst bunt Wieso",Rheinland-Pfalz,,,2014.0,Bio
1111,1,0.6688921485043873,"als Leiter und Nichtleiter verwendet. Leiter und Nichtleiter Struktur Eigenschaft Funktion THEMENFELD Struktur und Anregungen für Kontexte Titel des Kontexts Kinderfragen Naturwissenschaftliche Themen und Inhalte Vorhaben und Projekte Geschichte und Kultur Anwendung in Lebenswelt, Umwelt und Technologie Alle Teile einer Maschine fixieren und beschriften Maschinenmodelle konstruieren mit Baukästen Zukunftsmaschinen erfinden und beschreiben Demontage von Maschinen protokollieren Qualität der Stoffe überprüfen Sicherheit",Rheinland-Pfalz,,,2014.0,Bio
1112,1,0.678956244221836,"aus brennbaren Stoffen Chemische Beständigkeit von Verpackungen Duft- und Aromastoffe Elektrische Isolatoren Wärmedämmung durch Kleidung Mülltrennung und Recycling Rohstoffe und Ressourcen Lebensmittel Kunststoffe Brandschutz ... Vorhaben und Projekte Geschichte und Kultur Anwendung in Lebenswelt, Umwelt und Technologie Naturwissenschaftliche Themen und Inhalte Kinderfragen Denk- und Arbeitsweisen der Naturwissenschaften Wie kann man Salz aus Meerwasser gewinnen Was ist eigentlich Luft Was ist in",Rheinland-Pfalz,,,2014.0,Bio
1113,3,0.516714072196372,"Wer liebt wen Männer lieben Männer, Frauen lieben Frauen, Männer lieben Frauen, Frauen lieben Männer Kinderfragen Naturwissenschaftliche Themen und Inhalte Denk- und Arbeitsweisen der Naturwissenschaften Vorhaben und Projekte Geschichte und Kultur Anwendung in Lebenswelt, Umwelt und Technologie Was muss ich essen, damit ich nicht zu dick werde Wie wird aus einer kleinen Eizelle ein Mensch Wie lang hält es ein Mensch",Rheinland-Pfalz,,,2014.0,Bio
1114,1,0.9196089172424756,"Veldenz Gymnasium, Lauterecken Ulf Schlenker Integrierte Gesamtschule und Realschule plus, Rheinzabern Waltraud Suwelack Staatliches Studienseminar für das Lehramt an Gymnasien Koblenz Leiterin Volker Tschiedel Ministerium für Bildung, Wissenschaft, Jugend und Kultur, Mainz Mittlere Bleiche Mainz Poststellembwjk.rlp.de www.mbwjk.rlp.de",Rheinland-Pfalz,,,2014.0,Bio
1115,1,0.4435989000152489,"Lehrplan Naturwissenschaften Gemeinschaftsschule Jahrgangsübergreifender Teil Gemeinschaftsschule Naturwissenschaften prägen mit ihren Erkenntnissen und Methoden das Bewusstsein eines jeden Einzelnen stärker als je zuvor. Die auf den Naturwissenschaften basierende Technik bestimmt unsere Kultur und das tägliche Leben in erheblichem Maße. Die technische Entwicklung schreitet zudem dynamisch fort. Wer an dem gesellschaftlichen Diskurs über diesen Fortschritt teilhaben will, muss über eine solide naturwissenschaftliche Grundbildung",Saarland,GemS,,2014.0,Bio
1116,1,0.7491648595396425,"der jeweils aktuellen Fassungen des Bundesnaturschutzgesetzes und der Bundesartenschutzverordnung sowie die Vorschriften des Thüringer Gesetzes für Natur und Landschaft vom in der gültigen Fassung. Thüringer Ministerium für Bildung, Wissenschaft und Kultur: Leitgedanken zu den Thüringer Lehrplänen für den Erwerb der allgemein bildenden Schulabschlüsse, Kapitel , Lernkompetenzen Alle Unterrichtsfächer zielen gleichermaßen auf die Entwicklung von Lernkompetenzen, da sie eine zentrale Bedeutung für",Thüringen,Gym,"5,6",2015.0,Bio
1117,5,0.972964543140358,"einschätzen, -Wege und Ergebnisse der gemeinsamen Arbeit analysieren und einschätzen und -Arbeitsergebnisse in geeigneter Form präsentieren. Leistungseinschätzung Bis zur Veröffentlichung einer fachlichen Empfehlung des Thüringer Ministeriums für Bildung, Wissenschaft und Kultur gelten folgende Ausführungen. Grundsätze Eine pädagogisch fundierte Leistungseinschätzung ist insbesondere darauf gerichtet, dass der Schüler -seinen eigenen Lernprozess reflektieren und seine Leistungen einschätzen kann, -zum Lernen motiviert wird, seine Lernbereitschaft",Thüringen,Gym,"5,6",2015.0,Bio
1118,1,0.7335494613119359,"wiederholenden Zusammenhang. Im MNT-Unterricht gehören dazu Nennen von naturwissenschaftlichen Fakten und Regeln, Beschreiben bekannter naturwissenschaftlicher Sachverhalte unter Verwendung der Fachsprache, Durchführen von bekannten Experimenten. Thüringer Ministerium für Bildung, Wissenschaft und Kultur: Leitgedanken zu den Thüringer Lehrplänen für den Erwerb der allgemein bildenden Schulabschlüsse, Kapitel , Sekretariat der Ständigen Konferenz der Kultusminister der Länder in der Bundesrepublik Deutschland: Bildungsstandards der Kultusministerkonferenz für",Thüringen,Gym,"5,6",2015.0,Bio
1119,1,0.7491648595396425,"der jeweils aktuellen Fassungen des Bundesnaturschutzgesetzes und der Bundesartenschutzverordnung sowie die Vorschriften des Thüringer Gesetzes für Natur und Landschaft vom in der gültigen Fassung. Thüringer Ministerium für Bildung, Wissenschaft und Kultur: Leitgedanken zu den Thüringer Lehrplänen für den Erwerb der allgemein bildenden Schulabschlüsse, Kapitel , Lernkompetenzen Alle Unterrichtsfächer zielen gleichermaßen auf die Entwicklung von Lernkompetenzen, da sie eine zentrale Bedeutung für",Thüringen,Regelschule,"5,6",2015.0,Bio
1120,5,0.9701204974109571,"das sachgerechte Argumentieren erschließen, kritisch betrachten und dokumentieren, -Informationen auf ihre Bedeutung für die Aufgabenlösung einschätzen Leistungseinschätzung Bis zur Veröffentlichung einer fachlichen Empfehlung des Thüringer Ministeriums für Bildung, Wissenschaft und Kultur gelten folgende Ausführungen. Grundsätze Eine pädagogisch fundierte Leistungseinschätzung ist insbesondere darauf gerichtet, dass der Schüler -seinen eigenen Lernprozess reflektieren und seine Leistungen einschätzen kann, -zum Lernen motiviert wird, seine Lernbereitschaft",Thüringen,Regelschule,"5,6",2015.0,Bio
1121,1,0.7335494613119359,"wiederholenden Zusammenhang. Im MNT-Unterricht gehören dazu Nennen von naturwissenschaftlichen Fakten und Regeln, Beschreiben bekannter naturwissenschaftlicher Sachverhalte unter Verwendung der Fachsprache, Durchführen von bekannten Experimenten. Thüringer Ministerium für Bildung, Wissenschaft und Kultur: Leitgedanken zu den Thüringer Lehrplänen für den Erwerb der allgemein bildenden Schulabschlüsse, Kapitel , Sekretariat der Ständigen Konferenz der Kultusminister der Länder in der Bundesrepublik Deutschland: Bildungsstandards der Kultusministerkonferenz für",Thüringen,Regelschule,"5,6",2015.0,Bio
1122,1,0.8646840023145612,"Missbrauch von Drogen und leistungssteigernden Substanzen entwickeln und eigenes Verhalten abwägen Bezüge zu den fächerübergreifenden Themen gemäß Grundsatzband Kap. Gesundheit und Wohlergehen Deutsch, Latein, Physik, Geschichte, Ethikunterricht, Informatik, Sport Bildung, Kultur und lebenslanges Lernen Deutsch, Englisch, Französisch, Spanisch, Russisch, Italienisch, Latein, Griechisch, Geschichte, Sozialkunde, Katholischer Religionsunterricht, Geographie, Informatik, Kunst, Musik, Sport Grundlegende Wissensbestände - Struktur und Funktion von marklosen und markhaltigen",Sachsen-Anhalt,Gym,,2022.0,Bio
1123,3,0.8830575228009285,"- Slow Food - Whole Food: Ernährung kritisch betrachtet - Essstörungen - mehr als eine Krankheit - Das Blut ist ein besonderer Saft - Herz- und Kreislauferkrankungen - Geißel unserer Kultur - Blutspende und Organtransplantation kann Leben retten - Erste-Hilfe-Maßnahmen - jeder kann helfen - Fette, Eiweiße, Kohlenhydrate - Enzyme - Schlüssel-Schloss-Prinzip - AB-System - Antigen, Antikörper - Arterien, Venen, Kapillaren",Berlin,,7-10,2015.0,Bio
1124,2,0.36835077808701894,"dem Original herzustellen. Indem die Schülerinnen und Schüler Einsicht in die Voraussetzungen und Bedingungen sowie den Weg der Erkenntnisgewinnung kennen lernen, werden sie eingeführt in einen wichtigen Teil der menschlichen Kultur - in die Naturwissenschaft Biologie. bewirkt Fortschritte auf vielen Gebieten, beispielsweise der Bio- und Gentechnik, der Medizin, der Kriminalistik, der Umwelttechnik, der Lebensmitteltechnik oder der Neurokognition. Die Entwicklungen verändern nicht",Bremen,,Sek1,2010.0,Bio
1125,5,0.5377864660430719,"oder der Neurokognition. Die Entwicklungen verändern nicht nur die Sichtweise auf die Natur, sondern auch das Umweltbewusstsein sowie die Bedingungen für Gesundheit und Lebensqualität und damit auch auf die gesellschaftliche Kultur. Entscheidungen im Zusammenhang mit Forschung und erst recht mit Anwendung erfordert nicht nur Sachkompetenz, sondern auch Bewertungskompetenz. Die Schülerinnen und Schüler sollen im Biologieunterricht ein entsprechendes Problembewusstsein und die Bereitschaft",Bremen,,Sek1,2010.0,Bio
1126,5,0.5781239621483366,"Verlauf der Erdgeschichte entwickelt. Das Zusammenspiel von Mutation, Variabilität und Selektion erklärt den Evolutionsprozess. Auch der Mensch ist Ergebnis dieses Prozesses. Zum Verständnis der Eigenart des Menschen gehört dessen Fähigkeit Kultur zu schaffen. Menschen sind Teil des Ökosystems Erde, gleichzeitig aber auch ein Gegenüber, weil sie in der Lage sind, das System zu verändern. Sie züchten Lebewesen und verändern sie gentechnisch,",Bremen,,Sek1,2010.0,Bio
1127,1,0.9816509373653521,"Fächer bearbeitet. Bezugspunkte für die Themenfindung sind Perspektiven und thematische Bereiche. Perspektiven beinhalten Grundfragen und Grundkonstanten des menschlichen Lebens: Raum und Zeit Sprache und Denken Individualität und Sozialität Natur und Kultur Perspektiven Die thematischen Bereiche umfassen: Verkehr Arbeit Medien Beruf Kommunikation Gesundheit Kunst Umwelt Verhältnis der Generationen Wirtschaft Gerechtigkeit Technik Eine Welt Politische Bildung, Medienbildung und Digitalisierung sowie Bildung für nachhaltige",Sachsen,Gym,,2022.0,Bio
1128,4,0.9756783991822405,"die demokratischen Grundrechte und nehmen ihre Mitsprache- und Mitgestaltungsrechte wahr. Interkulturelle Verständigung: Die Lernenden nehmen die kulturelle Prägung von Kommunikation, Handlungen, Werthaltungen und Einstellungen wahr. Sie sind aufgeschlossen gegenüber anderen Kulturen und reflektieren ihre eigenen Positionen und Überzeugungen in der Kommunikation mit Menschen anderer kultureller Prägung. Lernkompetenz Problemlösekompetenz: Die Lernenden planen ihren Arbeitsprozess, wobei sie die ihnen zur Verfügung stehenden Ressourcen",Hessen,Hauptschule,,2024.0,Bio
1129,3,0.45313117341933,"entgegentreten kann. Ein wichtiger Aspekt ist dabei auch die Prävention von psychischer und physischer Gewalt. Thema: Der Körper verändert sich - Wachstum und Pubertät Sexualität und Identität Prävention Gesellschaft und Kultur - biologische Veränderungen des Körpers während der Pubertät - Förderung eines positiven Körperbewusstseins und Körpergefühls - sexuelle Orientierungen - Geschlecht und Geschlechtsidentitäten - Fragen zur Sexualität Gefühle, Körperentwicklung und -wahrnehmung",Berlin,,"5,6",2015.0,Bio
1130,5,0.9782781441733305,"eigenes Lernen reflektieren Lernen lernen und selbst regulieren; Lernstrategien sowohl der Zielsetzung und Zielbindung als auch der Selbstbeobachtung self-monitoring anwenden; Probleme im Lernprozess wahrnehmen, analysieren und Lösungsstrategien entwickeln; eine positive Fehler-Kultur aufbauen; sich im Spannungsverhältnis zwischen Fremd- und Selbstbestimmung orientieren; fachliches Wissen nutzen und bewerten und dabei seine Perspektivität reflektieren, dabei verschiedene Stufen von Erkenntnis und Wissen erkennen und zwischen diesen",Hessen,Gym,Sek2,2024.0,Bio
1131,5,0.9793040002364518,"unmittelbaren persönlichen Erfahrungen und solchen in digitalen Welten identifizieren; in der mediatisierten Welt eigene Bedürfnisse wahrnehmen und Interessen vertreten; Möglichkeiten und Risiken digitaler Umgebungen in unterschiedlichen Lebensbereichen Alltag, soziale Beziehungen, Kultur, Politik kennen, reflektieren und berücksichtigen: zum Beispiel in sozialen Medien; Umgangsregeln bei digitaler Interaktion kennen und anwenden; Urheberrechte wahren; auch im online-Modus ethisch verantwortungsvoll handeln, das heißt unter anderem einen",Hessen,Gym,Sek2,2024.0,Bio
1132,3,0.36606518460042875,"empirisch erfassbare, in formalen Strukturen beschreibbare und durch Technik gestaltbare Wirklichkeit sowie die Verfahrens- und Erkenntnisweisen, die ihrer Erschließung und Gestaltung dienen. Naturwissenschaftliche Bildung gehört zu den konstitutiven Bestandteilen unserer Kultur und umfasst grundlegende und spezifische Denkstrukturen und Sichtweisen, die eine differenzierte Betrachtung der natürlichen und technischen Umwelt in ihrer Beziehung zum Menschen ermöglicht. Sie befähigt die Lernenden, ihre Umwelt in",Hessen,Gym,Sek2,2024.0,Bio
1133,3,0.9755742903504164,"Weltsicht reflektieren und Rückschlüsse auf das eigene Leben in der Gemeinschaft und zum Umgang mit der Natur ziehen; selbstbestimmt urteilen und handeln. interkulturelle Kompetenz: Menschen aus verschiedenen soziokulturellen Kontexten und Kulturen vorurteilsfrei sowie im Handeln reflektiert und offen begegnen; sich kulturell unterschiedlich geprägter Identitäten, einschließlich der eigenen, bewusst sein; die unverletzlichen und unveräußerlichen Menschenrechte achten und sich an den wesentlichen Traditionen",Hessen,Gym,Sek2,2024.0,Bio
1134,3,0.9815623585968742,"politische Verantwortung übernehmen; Rechte und Pflichten in der Gesellschaft wahrnehmen; sich einmischen, mitentscheiden und mitgestalten; sich persönlich für Einzelne und/oder das Gemeinwohl engagieren aktive Bürgerschaft; Fragen des Zusammenlebens der Geschlechter/Generationen/sozialen Gruppierungen/Kulturen reflektieren; Innovationspotenzial zur Lösung gesellschaftlicher Probleme des sozialen Miteinanders entfalten und einsetzen; entsprechende Kriterien des Wünschenswerten und Machbaren differenziert bedenken. Nachhaltigkeit/Lernen in globalen Zusammenhängen: globale Zusammenhänge bezogen auf ökologische, soziale",Hessen,Gym,Sek2,2024.0,Bio
1135,1,0.9741263182003645,"Klassenstufen bis / lehrpläne für die Naturwissenschaftlichen Fächer für die weiterführenden Schulen in Rheinland-Pfalz Biologie Chemie Physik Impressum Herausgeber: Ministerium für Bildung, Wissenschaft, Weiterbildung und Kultur Mittlere Bleiche Mainz poststellembwwk.rlp.de Verantwortlich: Volker Tschiedel, Ministerium für Bildung, Wissenschaft, Weiterbildung und Kultur Redaktion: Andrea Bürgin, Pädagogisches Landesinstitut Rheinland-Pfalz Skriptbearbeitung: Ute Nagelschmitt, Pädagogisches Landesinstitut Rheinland-Pfalz Erscheinungstermin: Ministerium für Bildung,",Rheinland-Pfalz,,Sek1,2014.0,Bio
1136,1,0.9756221378218897,"die weiterführenden Schulen in Rheinland-Pfalz Biologie Chemie Physik Impressum Herausgeber: Ministerium für Bildung, Wissenschaft, Weiterbildung und Kultur Mittlere Bleiche Mainz poststellembwwk.rlp.de Verantwortlich: Volker Tschiedel, Ministerium für Bildung, Wissenschaft, Weiterbildung und Kultur Redaktion: Andrea Bürgin, Pädagogisches Landesinstitut Rheinland-Pfalz Skriptbearbeitung: Ute Nagelschmitt, Pädagogisches Landesinstitut Rheinland-Pfalz Erscheinungstermin: Ministerium für Bildung, Wissenschaft, Weiterbildung und Kultur INHALT VORWORT GESAMTKONZEPTION DER LEHRPLÄNE DER NATURWISSENSCHAFTLICHEN FÄCHER Der Beitrag",Rheinland-Pfalz,,Sek1,2014.0,Bio
1137,1,0.9775435790165783,"poststellembwwk.rlp.de Verantwortlich: Volker Tschiedel, Ministerium für Bildung, Wissenschaft, Weiterbildung und Kultur Redaktion: Andrea Bürgin, Pädagogisches Landesinstitut Rheinland-Pfalz Skriptbearbeitung: Ute Nagelschmitt, Pädagogisches Landesinstitut Rheinland-Pfalz Erscheinungstermin: Ministerium für Bildung, Wissenschaft, Weiterbildung und Kultur INHALT VORWORT GESAMTKONZEPTION DER LEHRPLÄNE DER NATURWISSENSCHAFTLICHEN FÄCHER Der Beitrag der naturwissenschaftlichen Fächer zur Bildung Naturwissenschaftliche Grundbildung Bildungsstandards und Lehrplankonzeption Die Säulen des naturwissenschaftlichen Unterrichts Im lebensweltlichen Kontext lernen Fachwissen",Rheinland-Pfalz,,Sek1,2014.0,Bio
1138,1,0.9070234708987118,"Schülerinnen und Schüler bei der Entwicklung ihrer naturwissenschaftlichen Kompetenzen zu unterstützen und dabei selbst Freude und Erfolg in ihrer Tätigkeit zu erfahren. Doris Ahnen Ministerin für Bildung, Wissenschaft, Weiterbildung und Kultur Rheinland-Pfalz GESAMTKONZEPTION DER LEHRPLÄNE DER NATURWISSENSCHAFTLICHEN FÄCHER Der Beitrag der naturwissenschaftlichen Fächer zur Bildung Naturwissenschaftliche Grundbildung Gesellschaft und Kultur sind in bedeutendem Maße von Naturwissenschaft und Technik geprägt. Das Wechselspiel",Rheinland-Pfalz,,Sek1,2014.0,Bio
1139,1,0.8401345829961987,"Tätigkeit zu erfahren. Doris Ahnen Ministerin für Bildung, Wissenschaft, Weiterbildung und Kultur Rheinland-Pfalz GESAMTKONZEPTION DER LEHRPLÄNE DER NATURWISSENSCHAFTLICHEN FÄCHER Der Beitrag der naturwissenschaftlichen Fächer zur Bildung Naturwissenschaftliche Grundbildung Gesellschaft und Kultur sind in bedeutendem Maße von Naturwissenschaft und Technik geprägt. Das Wechselspiel zwischen naturwissenschaftlicher Erkenntnis und deren Anwendungen führt zu einer sich permanent verändernden Lebenswelt. Technischer Fortschritt ist Teil der kulturellen",Rheinland-Pfalz,,Sek1,2014.0,Bio
1140,1,0.5397334621164653,"verbindet sich über Kontexte und die Orientierung an lebensweltlichen Bereichen wie Gesundheit, Ernährung, Freizeit, Technik und Industrie zu einem Chemieunterricht, der auch dem Stellenwert der Chemie bei der Entwicklung von Kultur und Gesellschaft Rechnung trägt. Im Bereich der chemischen Industrie, der Nahrungsmittelindustrie, der Umwelteinrichtungen oder medizinischen Laboratorien finden junge Menschen zahlreiche Berufe. Der Chemieunterricht gibt Einblicke in den Zusammenhang von Naturwissenschaften",Rheinland-Pfalz,,Sek1,2014.0,Bio
1141,3,0.5265881085343754,"wenn Unterrichtsinhalte in lebensweltliche Zusammenhänge eingebunden werden. Für Schülerinnen und Schüler möglicherweise interessante Themen werden innerhalb der Fachlehrpläne als Mindmap dargestellt. Interessenorientierung und Bildungsrelevanz Hauptkategorien der Mindmap sind Geschichte und Kultur, tägliches Leben und Gesundheit, Umwelt und Verantwortung, Technologie und Industrie. Diese für die Allgemeinbildung übergeordneten lebensweltlichen Bereiche sind in allen drei Lehrplänen der Fächer als Strukturelemente enthalten. Kontextbereiche Die Vorschläge",Rheinland-Pfalz,,Sek1,2014.0,Bio
1142,1,0.6009645880567462,"Auf den Spuren großer Naturforscher Humboldt, Linne Das Mikrosk und der Mikrokosmos Vielfalt der Nutzpflanzen oder Nutztiere: früher und Natur in der Kunst Jagd und Fischerei Waldlehrpfade ... Geschichte und Kultur Technologie und Industrie Umwelt und Verantwortung Tägliches Leben und Gesundheit Ausstattung der Schule Projekte z. B. im Ganztag Fächerverbindung, integrierte Lernangebote Verbindung zu Wahlpflichtfach-Thema Aktuelle Themen, z. B. Artenschwund, Invasive",Rheinland-Pfalz,,Sek1,2014.0,Bio
1143,1,0.50228215537731,"den Spuren großer Naturforscher Humboldt, Linné Das Mikroskop und der Mikrokosmos Vielfalt der Nutzpflanzen oder Nutztiere: früher und heute Natur in der Kunst Jagd und Fischerei Waldlehrpfade ... Geschichte und Kultur Technologie und Industrie Umwelt und Verantwortung Tägliches Leben und Gesundheit TF : Vielfalt und Veränderung Wie entwickelten sich die Lebewesen Im Unterricht der Orientierungsstufe haben die Schülerinnen und Schüler Kenntnisse",Rheinland-Pfalz,,Sek1,2014.0,Bio
1144,4,0.4557356064938962,"Evolution ... Die Geschichte der Menschwerdung Leben in der Eiszeit Die Erdgeschichte Auf den Spuren Darwins Naturhistorische Museen und Geopfade Die Geschichte der Haustiere ... Vielfalt und Veränderung Geschichte und Kultur Tägliches Leben und Gesundheit Technologie und Industrie Umwelt und Verantwortung TF : Organismus, Organe, Zellen - Versorgung mit Stoffen und Energie In der Orientierungsstufe haben die Schülerinnen und Schüler Zellen",Rheinland-Pfalz,,Sek1,2014.0,Bio
1145,3,0.4253359185162391,"der Oberflächenvergrößerung in der Technik ... Analogien bilden: Blutgefäßsystem - Versorgungsund Entsorgungskanäle in einer Stadt Medizintechnik: Herz-Lungen-Maschine, Herzschrittmacher Organismus, Organe, Zellen Analogien bilden: Treibstoff - Brennstoff - Nährstoff Geschichte und Kultur Tägliches Leben und Gesundheit Technologie und Industrie Umwelt und Verantwortung TF : Pflanze, Pflanzenorgane, Pflanzenzellen - Licht ermöglicht Stoffaufbau In der Orientierungsstufe haben die Schülerinnen und Schüler die Fotosynthese kennengelernt.",Rheinland-Pfalz,,Sek1,2014.0,Bio
1146,1,0.5334031261597009,"aus Naturfasern Medikamente und Heilmittel aus Kräutern und Pflanzenstoffen Pflanzenstoffe in der Kosmetik Schulgarten Genussmittel aus Pflanzen: Schokolade, Tabak, Alkohol ... Pflanze, Pflanzenorgane, Pflanzenzellen Brauchtum, z. B. Erntedankfest Geschichte und Kultur Tägliches Leben und Gesundheit Technologie und Industrie Umwelt und Verantwortung TF : Ökosysteme im Wandel In der Orientierungsstufe haben die Schülerinnen und Schüler die Bedeutung der Fotosynthese kennengelernt. Der Bedarf",Rheinland-Pfalz,,Sek1,2014.0,Bio
1147,4,0.3113881921240608,"untersuchen: Wald, See, Stadtpark Trinkwasserschutzgebiete Umwelt als Erholungsraum ... Ökosysteme im Wandel Vom Urwald zum Nutzwald und vom Nutzwald zum Naturpark Umwelt und Verantwortung Tägliches Leben und Gesundheit Geschichte und Kultur Technologie und Industrie TF : Erwachsen werden Schülerinnen und Schüler nehmen an sich selbst und an anderen Veränderungen wahr. Im persönlichen Umfeld werden die Jugendlichen mit Erwartungen und Anforderungen konfrontiert,",Rheinland-Pfalz,,Sek1,2014.0,Bio
