document_id,most_prevalent_topic_id,most_prevalent_topic_probability,text_excerpt,state,school type,grade,year,subject
0,5,0.39674530747391545,"ist es, das Philosophieren zu lernen. Entsprechend philosophieren Schülerinnen und Schüler selbstständig, d. h. sie reflektieren grundsätzliche philosophische Fragestellungen und Probleme methodisch geleitet und unter Einbezug philosophischer Positionen. In einer Kultur der Digitalität gehört hierzu auch die reflektierte Auseinandersetzung mit generativen KI-Systemen. Im Sinne eines erweiterten Textbegriffs wird alles zeichenhaft Vermittelte dem Begriff Text zugeordnet, der mündliche und schriftliche Textsorten, kontinuierliche",NRW,,Sek1,2024.0,"Ethik, Philo"
1,3,0.7292307002814229,"Staatsformen, erläutern Grundprobleme moralischen Urteilens und Handelns, diskutieren den eigenen und gesellschaftlichen Umgang mit Medien und den Einfluss von Medien auf Urteile und Handlungen, erläutern die Bedeutung von Vielfalt, unterschiedlichen Kulturen und religiösen Ausdrucksformen für das Leben in einer pluralen Welt, erläutern Wahrnehmungs- und Erkenntnisprozesse auch im Hinblick auf den Einfluss und den Umgang mit Medien, erläutern Konzepte von Nachhaltigkeit, reflektieren",NRW,,Sek1,2024.0,"Ethik, Philo"
2,1,0.9695784176505625,"Wirkungsgeschichten, den kulturellen Ausprägungen sowie den ethischen Grundsätzen und Orientierungsmöglichkeiten verschiedener Religionen und Weltanschauungen bekannt. Besondere Bedeutung kommt dabei einerseits dem Umstand zu, dass die Schülerinnen und Schüler in einer Kultur leben, die weitgehend vom Christentum geprägt ist. Andererseits ist dessen Bindungskraft zunehmend anderen, oft auch säkularen Orientierungsangeboten gewichen. Die Schülerinnen und Schüler entdecken Gemeinsamkeiten und Unterschiede zwischen den Weltreligionen und",Niedersachsen,Oberschule.pdf,,,"Ethik, Philo"
3,2,0.9760930790398874,"mit Problemfeldern zum Thema Toleranz auseinander. Vorstellungen von Toleranz z. B. bei Lessing; Grenzen von Toleranz diskutieren Lösungsvorschläge für individuelle und gesellschaftliche Konflikte. Sterbehilfe, Organspende, PID/PND Präimplantations- und Pränataldiagnostik, Todesstrafe Kultur des Hinsehens, Aufmerksamkeit, Empathie, Organisation von Hilfe Möglichkeiten und Grenzen von Zivilcourage Mediationsverfahren im Rahmen fiktiver Fallbeispiele z. B. Mobbing, Petzen, Prügelei gerechter Interessenausgleich, Täter-OpferAusgleich, Motivation zur Toleranz, Übernahme anderer",Niedersachsen,Oberschule.pdf,,,"Ethik, Philo"
4,3,0.9740194193015235,"weltanschaulicher und religiöser Fragen und Wertvorstellungen befassen. Dazu gehören Reflexionen über eigene und fremde Lebensvorstellungen und Auseinandersetzungen mit religiös und weltanschaulich begründeten Sinnentwürfen. Das nachvollziehende Kennenlernen anderer Lebensordnungen, Sinnentwürfe und Kulturen trägt dabei zur Erweiterung der eigenen Wahrnehmungsfähigkeit bei Das Fach Werte und Normen will durch die Kontrastierung des Gewohnten mit bisher unbekannten oder weniger vertrauten Perspektiven die Nachdenklichkeit der Schülerinnen",Niedersachsen,Oberschule.pdf,,,"Ethik, Philo"
5,1,0.9767401245566542,"Grundlagen für Konfliktlösungen Fragen nach der Wirklichkeit Leben in Vielfalt Menschenrechte und Menschenwürde Wahrheit und Wirklichkeit Fragen nach Orientierungsmöglichkeiten Aspekte von Religionen und Weltanschauungen Leben in religiös und weltanschaulich geprägten Kulturen Deutungsmöglichkeiten und -grenzen von Religionen und Weltanschauungen Bei vertikaler Blickrichtung dokumentiert die Übersicht eine mögliche Abfolge der Leitthemen, die in den drei Doppelschuljahrgängen jeweils zu behandeln sind. Die hier skizzierte",Niedersachsen,Oberschule.pdf,,,"Ethik, Philo"
6,2,0.6248684502510389,"des zentralen didaktischen Bereichs Entwicklung der ethischen Urteilsfähigkeit eine besondere Bedeutung zu. Fragen nach der Wirklichkeit Die Lebenswirklichkeit der Schülerinnen und Schüler ist mehr denn je von einer Pluralität verschiedener Kulturen, Nationalitäten, Religionen, Weltanschauungen und individuellen Überzeugungen geprägt. Die Omnipräsenz moderner Medien trägt zusätzlich dazu bei, dass die Schülerinnen und Schüler mit einer Fülle diverser Wahrheits- und Wirklichkeitsvorstellungen konfrontiert werden. Nicht",Niedersachsen,Oberschule.pdf,,,"Ethik, Philo"
7,3,0.9792831110689474,"Intoleranz, Unsicherheit, Schwarz-Weiß-Denken, Stärkung des Ich- und Wir-Gefühls, Aufbau von Feindbildern, Ausgrenzung, Diskriminierung, Konflikte, Gewalt diskutieren Möglichkeiten und Voraussetzungen eines toleranten Zusammenlebens. Minimalkonsens grundlegender Wertvorstellungen Informationen über andere Religionen und Kulturen, interkulturelle Begegnungen infolge von Migration, Fluchtursachen ... Grundbegriffe: Klischee, Toleranz, Vorurteil Inhaltsbezogener Kompetenzbereich: Fragen nach Orientierungsmöglichkeiten Leitthema: Aspekte von Religionen und Weltanschauungen Erwartete Kompetenzen am Ende von Schuljahrgang Mögliche Inhalte",Niedersachsen,Oberschule.pdf,,,"Ethik, Philo"
8,1,0.9802119923254247,"Diskriminierung z. B. Rassismus, Mobbing, Folter, Todesstrafe Güterabwägung bei Produkten von Kinderarbeit ... Grundbegriffe: Grundbedürfnisse, Menschenrechte, Menschenwürde, Mobbing Inhaltsbezogener Kompetenzbereich: Fragen nach Orientierungsmöglichkeiten Leitthema: Leben in religiös und weltanschaulich geprägten Kulturen Erwartete Kompetenzen am Ende von Schuljahrgang Mögliche Inhalte für den Kompetenzerwerb Die Schülerinnen und Schüler ... beschreiben Ursprung und Bedeutung ausgewählter Initiationsriten. Kommunion, Firmung, Konfirmation, Bar/Bat Mizwa, Sünnet, Jugendweihe/Jugendfeier Initiationsriten",Niedersachsen,Oberschule.pdf,,,"Ethik, Philo"
9,5,0.6893055247506864,"Wer will ich sein Mensch sein Mädchen-/Junge-Sein Meine Gefühle Stärken/Schwächen - Erfolge/Misserfolge Ich und die anderen Stunden Familie In Gemeinschaft leben Freundschaft Klassengemeinschaft Die Welt Stunden Medien und soziale Netzwerke Kultur Armut und Wohlstand Schönheit der Natur - Natur erhalten Natur Mit Tieren leben Staunen - Mythen - vom Anfang der Welt Welt und Transzendenz Feste und Riten im Christentum, Islam",Saarland,GemS,"5,6",2018.0,"Ethik, Philo"
10,3,0.9631720996415611,"man dagegen tun Sein: Ich und die anderen In Gemeinschaft leben Ethik / Klassengemeinschaft inhaltsbezogene Kompetenzen methodisch-didaktische Hinweise Handeln Planen einer gemeinsamen Exkursion Klassenrat, Kummerkasten, Klassenfest etc. Sein: Die Welt Kultur Ethik / Medien und soziale Netzwerke Das Internet mit seinen vielfältigen Anwendungen und seiner flächendeckenden, mobilen Verfügbarkeit beeinflusst den Alltag der Schülerinnen und Schüler. TV-Angebote, Computerspiele, Chats und mobiles Online-Sein",Saarland,GemS,"5,6",2018.0,"Ethik, Philo"
11,3,0.9738932758122608,"Schülerinnen und Schüler beschreiben ausgewählte soziale Netzwerke im Internet, recherchieren Regeln innerhalb sozialer Netzwerke, erstellen einen Verhaltenskodex für soziale Netzwerke, Beschreiben von sozialen Netzwerken anhand von Screenshots Sein: Die Welt Kultur Ethik / Medien und soziale Netzwerke inhaltsbezogene Kompetenzen methodisch-didaktische Hinweise entwerfen einen Nutzungsplan für ihre zukünftige Teilnahme an sozialen Netzwerken, beurteilen potentielle Gefahren in sozialen Netzwerken. Erstellen einer Nutzungsübersicht: Wann",Saarland,GemS,"5,6",2018.0,"Ethik, Philo"
12,3,0.9664127017553834,"des betroffenen Freundeskreises bin Diskussion Recherche: z. B. Ethik macht klick - Werte-Navi fürs digitale Leben http://www.klicksafe.de/ Handeln Experiment: eine Woche ohne Fernsehen, Mobiltelefon und Internet durchhalten Sein: Die Welt Kultur Ethik / Armut und Wohlstand Armut und Wohlstand in der Konsumgesellschaft zeigen, inwiefern Wünsche und Bedürfnisse und damit menschliches Glück auf den Besitz und den Gebrauch von materiellen Gütern gerichtet",Saarland,GemS,"5,6",2018.0,"Ethik, Philo"
13,3,0.9686367466149485,"Diskussionen: Ist der Reiche immer glücklicher Kann man Glück kaufen Vorstellen alternativer Lebenskonzepte, z. B. das des Buen Vivir Ist das Verhältnis von Wohlstand/Armut und Glück messbar Sein: Die Welt Kultur Ethik / Armut und Wohlstand inhaltsbezogene Kompetenzen methodisch-didaktische Hinweise beschreiben Ursachen, Faktoren und Folgen von Armut und Wohlstand: o soziale Unterschiede, o elementare/normale Bedürfnisse/Luxus, o unterschiedliche Chancen Fairness, Gerechtigkeit, o",Saarland,GemS,"5,6",2018.0,"Ethik, Philo"
14,3,0.959462678728712,"durch Geschlechterrollenerwartungen. fiktiver Tagebucheintrag aus der Perspektive des anderen Geschlechts, Gedankenexperiment: Mein Tag als Mädchen/Junge; Ableiten von Problemen Diskussion: Gefangen-Sein im Mädchen-/Junge-Sein Recherche: Rollen von Männern und Frauen in anderen Kulturen/in der Vergangenheit Sein: Ich Mensch sein Ethik / Mädchen-/Junge-Sein inhaltsbezogene Kompetenzen methodisch-didaktische Hinweise Umgang mit dem anderen Geschlecht Die Schülerinnen und Schüler diskutieren, warum oftmals Ängste und Vorbehalte gegenüber dem",Saarland,GemS,"5,6",2018.0,"Ethik, Philo"
15,4,0.9522737195486194,"übernehmen. Gedankenexperiment: Ich gründe selbst eine Familie: Wofür trage ich die Verantwortung Welche Möglichkeiten der partnerschaftlichen Verteilung von Aufgaben in der Familie gibt es Recherche: Rolle der Familie in anderen Kulturen Handeln Organisation eines Klassenfestes mit den Familien Verbringen eines Tages in einer anderen Familie; Besuch von Familien z. B. in Flüchtlingsunterkünften, in einem SOSKinderdorf Sein: Ich und die anderen In",Saarland,GemS,"5,6",2018.0,"Ethik, Philo"
16,4,0.9544939020580363,"Mahlzeiten Ehrenamtliches Engagement im Tierschutzverein bzw. in Tierschutzverbänden Sein: Die Welt Welt und Transzendenz Ethik / Staunen - Mythen - vom Anfang der Welt Woher kommt die Welt In allen Kulturen gibt es Zeugnisse für den Drang des Menschen, diese Frage zu beantworten. Drei Aspekte können diese Thematik kennzeichnen: Staunen: Hinter dem, was wie selbstverständlich da ist, das Fragwürdige entdecken. Mythos:",Saarland,GemS,"5,6",2018.0,"Ethik, Philo"
17,3,0.9625893899018365,"Meditieren: Unendlichkeit - nur ein Wort Zettelabfrage: Stellung-Nehmen: Welchen Sinn haben die Welt und dein Leben für dich Mythos Die Schülerinnen und Schüler vergleichen Merkmale von Mythen und Schöpfungsgeschichten verschiedener Kulturen und identifizieren mythologischer Gestaltungselemente.. Textanalyse: Identifizieren mythologischer Gestaltungselemente Referieren philosophischer Erklärungsversuche der Antike durch die Lehrkraft Ursprung der Welt Die Schülerinnen und Schüler stellen exemplarisch Entstehungsmythen wissenschaftlichen Theorien gegenüber, unterscheiden",Saarland,GemS,"5,6",2018.0,"Ethik, Philo"
18,3,0.6496954629857511,"seine Hilfsorgane anlegt, aber sie sind nicht mit ihm verwachsen und machen ihm gelegentlich noch viel zu schaffen. Ferne Zeiten werden neue, wahrscheinlich unvorstellbar große Fortschritte auf diesem Gebiete der Kultur mit sich bringen, die Gottähnlichkeit noch weiter steigern. Im Interesse unserer Untersuchungen wollen wir aber nicht vergessen, dass der Mensch sich in seiner Gottähnlichkeit nicht glücklich fühlt. Quelle: S. Freud,",,,,2006.0,"Ethik, Philo"
19,3,0.6623783867835212,"Gottähnlichkeit noch weiter steigern. Im Interesse unserer Untersuchungen wollen wir aber nicht vergessen, dass der Mensch sich in seiner Gottähnlichkeit nicht glücklich fühlt. Quelle: S. Freud, Das Unbehagen in der Kultur. Aus A. Mitscherlich, A. Richards, J. Strachey Hrsg.,Sigmund Freud, Studienausgabe, Band IX, S., Frankfurt/Main Aufgabenstellung: Erörtern Sie das im Text aufgezeigte Menschenbild und seine ethischen Konsequenzen vor dem Hintergrund philosophischer",,,,2006.0,"Ethik, Philo"
20,5,0.7918363503512718,"Text aufgezeigte Menschenbild und seine ethischen Konsequenzen vor dem Hintergrund philosophischer Argumentation und aktueller Relevanz Erwartungshorizont a Unterrichtliche Voraussetzungen: Die Schüler besitzen Kenntnisse über verschiedene anthropologische Positionen, die Bedeutung von Kultur und Technik für die menschliche Existenz, Ambivalenz von Wissenschaft und Technik, Verantwortungsethik von Hans Jonas, den Kategorischen Imperativ von Kant. Die Schüler haben gelernt, wesentliche Aussagen eines Textes zu erkennen.",,,,2006.0,"Ethik, Philo"
21,5,0.8071681368345512,"Bezug zu Möglichkeiten der Gen - Forschung gesetzt werden und zu den Gefährdungen der menschlichen Gattung u.a. Jonas. Als ethisch relevante Konsequenzen sind beispielsweise aufzuzeigen die Ambivalenz der Wirkungen von Kultur, Wissenschaft und Technik, die Zwangsläufigkeit der Anwendung neuer Möglichkeiten, die Fernwirkungen menschlichen Handelns in Raum und Zeit, die Schwierigkeit der Reichweite und der Zuordnung von Verantwortung. Dabei kann im neuen",,,,2006.0,"Ethik, Philo"
22,5,0.6282231398597934,"religiösen Fragen sowie zu aktuellen Ereignissen und Phänomenen, die sittliche Grundfragen betreffen, Signifikante Fallbeispiele, Zeugnisse aus Kunst und Literatur in Vergangenheit und Gegenwart, Zeugnisse zu Traditionen und Ereignissen in anderen Kulturen, Religionen und Weltanschauungen, Darstellungen von Positionen und Ergebnissen der Wissenschaften. Differenzierung zwischen Unterricht mit grundlegendem Anforderungsniveau und Unterricht mit erhöhtem Anforderungsniveau. Die Vereinbarung zur Gestaltung der gymnasialen Oberstufe in der",,,,2006.0,"Ethik, Philo"
23,1,0.97496267282007,"die als gesonderte Teile vorliegen. Herausgeber Herausgeber des Kerncurriculums Senatsverwaltung für Bildung, Jugend und Sport Berlin Ministerium für Bildung, Jugend und Sport des Landes Brandenburg Ministerium für Bildung, Wissenschaft und Kultur Mecklenburg-Vorpommern Herausgeber des Kapitels Kurshalbjahre Senatsverwaltung für Bildung, Jugend und Sport Berlin Ministerium für Bildung, Jugend und Sport des Landes Brandenburg Herausgeber der Kapitel Einführungsphase, Sonstige Regelungen sowie Leistungsfeststellung und",Berlin,Gym,Sek2,2022.0,"Ethik, Philo"
24,3,0.595276762550176,"vom Menschen und Entwicklung eines ansatzweise begründeten Standpunktes dazu Analysieren von Begriffen und Gedankengängen in klar strukturierten, anthropologisch argumentierenden Texten und ihre schematische bzw. grafische Darstellung Mögliche Schwerpunkte Natur und Kultur: Auseinandersetzung mit der Bestimmung des Menschen als Kulturwesen im Vergleich zum Tier als Naturwesen, z. B. mithilfe der Positionen von Kant, Gehlen, Plessner oder in der Auseinandersetzung mit Begriffen wie",Berlin,Gym,Sek2,2022.0,"Ethik, Philo"
25,3,0.7105652047555172,"mit der Bestimmung des Menschen als Kulturwesen im Vergleich zum Tier als Naturwesen, z. B. mithilfe der Positionen von Kant, Gehlen, Plessner oder in der Auseinandersetzung mit Begriffen wie Sprache, Kultur, Technik, Scham Freiheit und Determinismus: Vergleich verschiedener philosophischer Definitionen, Differenzierung der Begriffe Entscheidungs- und Willensfreiheit; politische Freiheit etc. Menschenbilder in den Mythen, in der Kunst und in der Werbung: Schöpfungsmythen,",Berlin,Gym,Sek2,2022.0,"Ethik, Philo"
26,5,0.5924511332106254,"Begründung von Werten und Normen Mögliche Schwerpunkte ethisches Argumentieren der Begriff des Guten, des Bösen und des Glücks Fragen der angewandten Ethik das menschliche Handeln im Spannungsfeld eigener und fremder Kultur Analyse aktueller ethischer Probleme Analyse und Kritik ethischer Positionen und gesellschaftlich anerkannter moralischer Verhaltensregeln Kompetenzerwerb im Themenfeld Dieser Reflexionsbereich ist besonders geeignet, die praktische Kompetenz der Schülerinnen und Schüler zu",Berlin,Gym,Sek2,2022.0,"Ethik, Philo"
27,5,0.9782781441733305,"eigenes Lernen reflektieren Lernen lernen und selbst regulieren; Lernstrategien sowohl der Zielsetzung und Zielbindung als auch der Selbstbeobachtung self-monitoring anwenden; Probleme im Lernprozess wahrnehmen, analysieren und Lösungsstrategien entwickeln; eine positive Fehler-Kultur aufbauen; sich im Spannungsverhältnis zwischen Fremd- und Selbstbestimmung orientieren; fachliches Wissen nutzen und bewerten und dabei seine Perspektivität reflektieren, dabei verschiedene Stufen von Erkenntnis und Wissen erkennen und zwischen diesen",Hessen,Gym,Sek2,2024.0,"Ethik, Philo"
28,5,0.9793040002364518,"unmittelbaren persönlichen Erfahrungen und solchen in digitalen Welten identifizieren; in der mediatisierten Welt eigene Bedürfnisse wahrnehmen und Interessen vertreten; Möglichkeiten und Risiken digitaler Umgebungen in unterschiedlichen Lebensbereichen Alltag, soziale Beziehungen, Kultur, Politik kennen, reflektieren und berücksichtigen: zum Beispiel in sozialen Medien; Umgangsregeln bei digitaler Interaktion kennen und anwenden; Urheberrechte wahren; auch im online-Modus ethisch verantwortungsvoll handeln, das heißt unter anderem einen",Hessen,Gym,Sek2,2024.0,"Ethik, Philo"
29,3,0.9612502758131352,"Arendt Q. Menschenwürde und Menschenrechte grundlegendes Niveau Grundkurs und Leistungskurs Menschenwürde zum Beispiel Kant Was fundiert die Würde des Menschen Menschenwürde und Menschenbild der abendländischen Tradition Menschenrechte Entwicklung des Menschenrechtsgedankens Kultur- und Wertegebundenheit der Menschenrechte Globale Verantwortung oder humanistischer Utopismus - Menschenrechte und Migration zum Beispiel Benhabib, Nida-Rümelin Menschenrechtsbewegungen erhöhtes Niveau Leistungskurs Negationen universeller Menschenrechte Fundamentalismus, Totalitarismus, Kommunismus, Faschismus Q. Schuld",Hessen,Gym,Sek2,2024.0,"Ethik, Philo"
30,5,0.6295694166908613,"befähigt. Die Lernenden reflektieren die ideengeschichtliche Genese unseres heutigen Verhältnisses zur Natur, indem sie sich mit dem Übergang vom Mythos zum Logos, mit der Stellung des Menschen zwischen Natur und Kultur sowie mit den Problemen des zunehmend instrumentellen Verhältnisses zur Natur seit der Neuzeit beschäftigen. Das Verhältnis des Menschen zur Technik ist ambivalent. Technische Entwicklungen können für den Menschen eine Überlebenshilfe",Hessen,Gym,Sek2,2024.0,"Ethik, Philo"
31,5,0.971778616338726,"Komplexe ethische Fragestellungen bezüglich des Verhältnisses des Menschen zu Natur und Technik betonen die zunehmend globale und auch auf die Zukunft gerichtete Verantwortung menschlichen Handelns Gesellschaft. Die Auseinandersetzung mit Natur-, Kultur- und Technikbegriffen in unterschiedlichen Epochen und Kulturen ermöglicht einen ideengeschichtlichen Zugang zu aktuellen Fragestellungen Ideengeschichte. Themenfelder verbindlich: ein Themenfeld aus - durch Erlass festgelegt; innerhalb dieses Themenfelds können dabei Schwerpunkte",Hessen,Gym,Sek2,2024.0,"Ethik, Philo"
32,5,0.9632671306377865,"Themenfeld aus - durch Erlass festgelegt; innerhalb dieses Themenfelds können dabei Schwerpunkte sowie Konkretisierungen ausgewiesen werden. Q. Natur und Mensch grundlegendes Niveau Grundkurs und Leistungskurs Der Mensch zwischen Natur und Kultur zum Beispiel Aristoteles, Gehlen Natur und Mythos: vom Mythos zum Logos Stellung des Menschen in der Natur: das Mängelwesen Mensch Kultur als zweite Natur: menschengemachte Lebenswelten Selbst- und Naturbeherrschung: Probleme",Hessen,Gym,Sek2,2024.0,"Ethik, Philo"
33,5,0.8440605870617741,"Niveau Grundkurs und Leistungskurs Der Mensch zwischen Natur und Kultur zum Beispiel Aristoteles, Gehlen Natur und Mythos: vom Mythos zum Logos Stellung des Menschen in der Natur: das Mängelwesen Mensch Kultur als zweite Natur: menschengemachte Lebenswelten Selbst- und Naturbeherrschung: Probleme der einseitigen Verstandesaufklärung erhöhtes Niveau Leistungskurs Probleme der Selbst- und Naturbeherrschung Entzauberung der Welt zum Beispiel Weber Aspekte der Dialektik der",Hessen,Gym,Sek2,2024.0,"Ethik, Philo"
34,3,0.9755742903504164,"Weltsicht reflektieren und Rückschlüsse auf das eigene Leben in der Gemeinschaft und zum Umgang mit der Natur ziehen; selbstbestimmt urteilen und handeln. interkulturelle Kompetenz: Menschen aus verschiedenen soziokulturellen Kontexten und Kulturen vorurteilsfrei sowie im Handeln reflektiert und offen begegnen; sich kulturell unterschiedlich geprägter Identitäten, einschließlich der eigenen, bewusst sein; die unverletzlichen und unveräußerlichen Menschenrechte achten und sich an den wesentlichen Traditionen",Hessen,Gym,Sek2,2024.0,"Ethik, Philo"
35,3,0.9815623585968742,"politische Verantwortung übernehmen; Rechte und Pflichten in der Gesellschaft wahrnehmen; sich einmischen, mitentscheiden und mitgestalten; sich persönlich für Einzelne und/oder das Gemeinwohl engagieren aktive Bürgerschaft; Fragen des Zusammenlebens der Geschlechter/Generationen/sozialen Gruppierungen/Kulturen reflektieren; Innovationspotenzial zur Lösung gesellschaftlicher Probleme des sozialen Miteinanders entfalten und einsetzen; entsprechende Kriterien des Wünschenswerten und Machbaren differenziert bedenken. Nachhaltigkeit/Lernen in globalen Zusammenhängen: globale Zusammenhänge bezogen auf ökologische, soziale",Hessen,Gym,Sek2,2024.0,"Ethik, Philo"
36,5,0.8439125297925537,"in persönlichen und gesellschaftlichen Entscheidungs- und Handlungssituationen zu übernehmen, erkennen und argumentativ darlegen, OH Entscheidungsspielräume für eigenes Handeln reflektieren und im schulischen Umfeld erproben, OH sich innerhalb der Pluralität von Kulturen, Weltbildern und Religionen begründet verorten. Kurshalbjahre und Themenfelder Dem Unterricht in der Einführungsphase kommt mit Blick auf den Übergang in die Qualifikationsphase eine Brückenfunktion zu. Zum einen erhalten die Lernenden",Hessen,Gym,Sek2,2024.0,"Ethik, Philo"
37,5,0.970825942261351,"Menschen zu Natur und Technik betonen die zunehmend globale und auch auf die Zukunft gerichtete Verantwortung menschlichen Handelns Gesellschaft. Die Auseinandersetzung mit Natur-, Kultur- und Technikbegriffen in unterschiedlichen Epochen und Kulturen ermöglicht einen ideengeschichtlichen Zugang zu aktuellen Fragestellungen Ideengeschichte. Themenfelder verbindlich: ein Themenfeld aus - durch Erlass festgelegt; innerhalb dieses Themenfelds können dabei Schwerpunkte sowie Konkretisierungen ausgewiesen werden. Q. Natur und",Hessen,Gym,Sek2,2024.0,"Ethik, Philo"
38,1,0.9816509373653521,"Fächer bearbeitet. Bezugspunkte für die Themenfindung sind Perspektiven und thematische Bereiche. Perspektiven beinhalten Grundfragen und Grundkonstanten des menschlichen Lebens: Raum und Zeit Sprache und Denken Individualität und Sozialität Natur und Kultur Perspektiven Die thematischen Bereiche umfassen: Verkehr Arbeit Medien Beruf Kommunikation Gesundheit Kunst Umwelt Verhältnis der Generationen Wirtschaft Gerechtigkeit Technik Eine Welt Politische Bildung, Medienbildung und Digitalisierung sowie Bildung für nachhaltige",Sachsen,Gym,,2019.0,"Ethik, Philo"
39,4,0.6990280159713466,"und Tier Abgrenzung des Menschen vom Tier in natürlicher Gestalt, Beschaffenheit, Erkenntniskraft, Sprache und Denken biologische, evolutionäre Anthropologie und Hirnforschung Prometheusmythos Mensch als Mängelwesen Begriffsanalyse: Instinkt, Verhalten, Handlung Natur und Kultur menschliche Entwicklung in ihrer Abhängigkeit von Natur und Gesellschaft Bedeutung gesellschaftlicher Strukturen und Institutionen Mensch als Teil und Gestalter der Natur Kultur als Gestaltung der Welt und des Selbst Begriffsanalyse:",Sachsen,Gym,,2019.0,"Ethik, Philo"
40,5,0.6603189496861535,"als Mängelwesen Begriffsanalyse: Instinkt, Verhalten, Handlung Natur und Kultur menschliche Entwicklung in ihrer Abhängigkeit von Natur und Gesellschaft Bedeutung gesellschaftlicher Strukturen und Institutionen Mensch als Teil und Gestalter der Natur Kultur als Gestaltung der Welt und des Selbst Begriffsanalyse: Natur und Kultur Bild fü hh lti E t i kl Verstand und Gefühl Fähigkeit zur Reflexion Mensch als Vernunftwesen freier Wille",Sachsen,Gym,,2019.0,"Ethik, Philo"
41,5,0.7440775778715764,"in ihrer Abhängigkeit von Natur und Gesellschaft Bedeutung gesellschaftlicher Strukturen und Institutionen Mensch als Teil und Gestalter der Natur Kultur als Gestaltung der Welt und des Selbst Begriffsanalyse: Natur und Kultur Bild fü hh lti E t i kl Verstand und Gefühl Fähigkeit zur Reflexion Mensch als Vernunftwesen freier Wille Motive, Affekte und Leidenschaften Rationalität der Gefühle Verhältnis von Geist und",Sachsen,Gym,,2019.0,"Ethik, Philo"
42,3,0.9729405594382274,"klären und mit Lebenssituationen und Einstellungen anderer vergleichen Die Schülerinnen und Schüler können Grundbedingungen verschiedener Perspektiven beispielsweise Alter, physische oder psychische Merkmale, Geschlecht, sexuelle Identität oder Orientierung, Religion, Herkunft, Erfahrungen, Kultur aufzeigen und vergleichen die Beteiligten und Betroffenen in ethisch relevanten Situationen identifizieren und deren Stellenwert darlegen die Interessenlage der Beteiligten und Betroffenen, die zugrundeliegenden Wertevorstellungen und mögliche Wertekonflikte erläutern Argumentationen",BaWü,Gym,,2016.0,"Ethik, Philo"
43,2,0.36631421116358887,"können den Menschen als Kulturwesen beschreiben und sich mit möglichen Auswirkungen auf sein Selbstverständnis zum Beispiel Leiblichkeit, Moralität auseinandersetzen relevante Aspekte des Tier-Mensch-Vergleichs darstellen und reflektieren zum Beispiel Sprache, Moral, Kultur BTV Selbstfindung und Akzeptanz anderer Lebensformen den unterschiedlichen Umgang des Menschen mit Natur und Umwelt unter Berücksichtigung verschiedener Menschenbilder zum Beispiel Prometheus, homo faber, homo oeconomicus, homo symbolicus, Geschöpf Gottes",BaWü,Gym,,2016.0,"Ethik, Philo"
